publishedAt,title,description
2019-06-28,"West Virginia American Water filed an application today with the Public Service Commission of West Virginia, seeking approval of its 2020 infrastructure replacement program and associated Distribution System Improvement Charge .",West Virginia American Water Files 2020 Infrastructure Replacement Plan and Distribution System Improvement Charge
2019-06-28,"American Water Works (AWK) to make $100-million investment toward infrastructure, following the receipt of approved water rates.",American Water Works Receives Rate Case Approval in Kentucky
2019-06-28,American Water Works Company Inc AWK recently announced that its subsidiary Kentucky American Water has received approval for water service rate hike from the Kentucky Public Service Commission which was filed in November 2018 The rates will be effective from Jun 28 2019 The rate,American Water Works Receives Rate Case Approval in Kentucky
2019-07-01,"California American Water has filed an application to set new rates in each of its service areas for 2021 through 2023.  The new rates would take effect January 1, 2021, pending approval by the California Public Utilities Commission.  “Our proposal is driven by the needs of our customers as well as our need to upgrade and maintain our infrastructure,” said Rich Svindland, president of California American Water.",California American Water Applies for New Revenue to Fund Infrastructure and Service Improvements
2019-07-01,"Illinois American Water has acquired the Alton Regional Wastewater System, adding 23,000 new wastewater customers to its base in Southern Illinois. The Alton system also serves the communities of Bethalto and Godfrey.","Illinois American Water adds 23,000 customers with acquisition"
2019-07-01,"Less than a week after acquiring the City of Alton wastewater system, Illinois American Water is investing approximately $750,000 to improve wastewater service to customers.  The work includes replacing approximately 3,200 feet of existing clay sanitary sewer mains with new 6-, 8-, and 10-inch PVC sewer lines.  Karen Cooper, Senior Manager of Field Operations and Production for Illinois American Water’s Southern Division, said this work is part of the company’s commitment to their new wastewater customers.",Illinois American Water Kicks Off Inaugural Investment in the Alton Wastewater System
2019-07-01,InvestorPlace Stock Market News Stock Advice amp Trading Tips Editor s note This story was originally published in September 2018 It has since been updated and republished Utility stocks were supposed to be yesterday s favorite investment The,5 Utility Stocks to Buy for an Extra Durable Portfolio
2019-07-01,For Immediate Release Chicago IL July 1 2019 Stocks in this week s article are Synchrony Financial SYF AMETEK Inc AME Stifel Financial Corp SF Delek US Holdings Inc DK and American Water Works Company Inc AWK 5 Stocks with Strong Sales Growth Worth Investing,"Zacks.com featured highlights include: Synchrony Financial, AMETEK, Stifel Financial, Delek US and American Water Works"
2019-07-01,"Zacks.com featured highlights include: Synchrony Financial, AMETEK, Stifel Financial, Delek US and American Water Works","Zacks.com featured highlights include: Synchrony Financial, AMETEK, Stifel Financial, Delek US and American Water Works"
2019-07-01,American Water Works AWK arm West Virginia American Water filed an application with the Public Service Commission of West Virginia seeking approval of the 2020 infrastructure replacement program and associated Distribution System Improvement Charge DSIC West Virginia American,American Water Arm Seeks Nod for 2020 Infrastructure Upgrade
2019-07-01,"The DSIC proposal by American Water Works' (AWK) arm, on approval by the Public Service Commission of West Virginia, is expected to marginally increase water rates & ensure high-quality services.",American Water Arm Seeks Nod for 2020 Infrastructure Upgrade
2019-07-02,"American Water Works' (AWK) subsidiary California American Water seeks approval for new rates, with an objective of carrying on infrastructure improvement.",American Water's (AWK) Arm Files for New Rates in California
2019-07-02,American Water Works AWK arm California American Water has filed an application with the California Public Service Commission seeking approval to set new rates in each of its service areas from 2021 through 2023 Subject to approval of the commission the new rates will take effect from,American Water's (AWK) Arm Files for New Rates in California
2019-07-02,"New Jersey American Water announced today it has completed its acquisition of the wastewater assets of the Borough of Mount Ephraim, N.J., for approximately $1.4 million.  This municipal-owned sewer system serves approximately 1,800 customers, most of whom already receive water service from New Jersey American Water.  The acquisition was approved by the New Jersey Board of Public Utilities on June 21, 2019.",New Jersey American Water Completes Acquisition of Mount Ephraim Sewer System
2019-07-03,American Water Works Company AWK announced that its subsidiary New Jersey American Water has completed the acquisition of wastewater assets of the Borough of Mount Ephraim NJ for nearly 1 4 million The company signed the agreement to acquire the sewer system on Jan 16 2019 This,American Water's Unit Acquires Mount Ephraim Sewer System
2019-07-03,"American Water's New Jersey arm completed its acquisition of Mount Ephraim's wastewater system, the Camden-based company announced Tuesday.  The $1.4 million deal to purchase the sewer was first announced in January and follows American Water's 2005 acquisition of Mount Ephraim's water system.  “As Mount Ephraim’s water company for more than a decade and a water provider to the area for over 90 years, we are pleased to expand our relationship with residents as their sewer service provider,"" Cheryl Norton, president of New Jersey American Water, said in a statement.",American Water closes deal to buy South Jersey wastewater system
2019-07-03,"American Water Works' (AWK) unit, New Jersey American Water continues to expand operations through acquisitions and provide high-quality services to new customers.",American Water's Unit Acquires Mount Ephraim Sewer System
2019-07-05,"American Water Works (AWK) has definitely stolen the focus among defensives this year. So far, the stock has risen more than 30%.",American Water Works Stands Tall among Its Peers
2019-07-05,Bond yields continued to fall to record lows this week amid growing anxiety about a global economic slowdown.,Bond Yields Fall to Record Lows: Is It Time to Go Defensive?
2019-07-09,Water Utility Industry Outlook Muddy With Aging Assets,Water Utility Industry Outlook Muddy With Aging Assets
2019-07-09,The Zacks 160 Utility Water Supply industry includes companies that are involved in providing drinking water and wastewater services to industrial commercial and residential customer classes The water utilities also provide services to numerous military bases across the United,Water Utility Industry Outlook Muddy With Aging Assets
2019-07-11,Looking at the sectors faring worst as of midday Thursday shares of Utilities companies are underperforming other sectors showing a 0 8 loss Within the sector Pinnacle West Capital Corp Symbol PNW and American Water Works Co Inc Symbol AWK are two large stocks that are lagging,"Thursday Sector Laggards: Utilities, Consumer Products"
2019-07-12,"With temperatures rising across the state, Illinois American Water is reminding customers to use water wisely.  “From keeping hydrated to playing in water sprinklers, as well as running air conditioning and watering lawns, water plays an important role in warm-weather fun and responsibilities.  The following tips from Illinois American Water can help consumers use water more efficiently, plus identify and prevent leaks, a significant source of water waste.","As Temperatures Rise, Illinois American Water Encourages Customers to Use Water Wisely"
2019-07-13,"Is American Water Works Company, Inc. (NYSE:AWK) a good dividend stock? How can we tell? Dividend paying companies...","Here's How We Evaluate American Water Works Company, Inc.'s (NYSE:AWK) Dividend"
2019-07-15,Global Water Resources Inc GWRS will begin trading ex dividend on July 16 2019 A cash dividend payment of 0 024 per share is scheduled to be paid on July 31 2019 Shareholders who purchased GWRS prior to the ex dividend date are eligible for the cash dividend payment This marks the,"Global Water Resources, Inc. (GWRS) Ex-Dividend Date Scheduled for July 16, 2019"
2019-07-16,"Roger Goodson, senior operations manager for Illinois American Water’s Western Division, will now also provide leadership in the company’s Eastern Division of the state, effective July 8, 2019.  In addition to managing operations in Illinois American Water’s Peoria, Pekin and Lincoln Districts, Goodson’s expanded leadership role will include providing oversight in the Champaign County, Pontiac, Sterling and Streator Districts.  Goodson joined Illinois American Water in 2011 as an operations superintendent in Pekin.",Roger Goodson Leadership Role With Illinois American Water Expanded to Include Eastern Division
2019-07-17,"American Water (AWK), the largest publicly traded U.S. water and wastewater utility company, today announced that it has been recognized as a top-scoring company on the Disability Equality Index (DEI), the most comprehensive disability inclusion assessment tool designed and embraced by both business leaders and disability advocates.  This year, 180 businesses participated in the DEI, and American Water’s top score of 100 percent earned the recognition of “Best Places to Work for Disability Inclusion.” The inclusion criteria measured culture and leadership, enterprise-wide access, employment practices, community engagement, and supplier diversity.  “At American Water, we embrace and value the fact that we’re beautifully different, through our varying abilities, strengths, experiences and viewpoints,” said President and CEO Susan Story.",American Water Recognized With Top Score on Disability Equality Index
2019-07-18,"American Water Works Company, Inc. (AWK) announced today that it intends to release its 2019 second quarter financial results after the market closes on Wednesday, July 31, 2019.  Susan Story, president and chief executive officer, Susan Hardwick, executive vice president and chief financial officer, and Walter Lynch, chief operating officer, will host the 2019 second quarter earnings conference call and webcast with investors, analysts and other interested parties on Thursday, August 1, 2019 at 9 a.m. Eastern Daylight Time.  There will be a question and answer session as part of the earnings conference call.","American Water’s 2019 Second Quarter Conference Call Scheduled for August 1, 2019"
2019-07-18,"With temperatures expected to rise across the region, reaching into the 90s this week and weekend, with heat indices above 100, Missouri American Water reminds customers to use water wisely.  “This time of year, people use water in a variety of different ways, from watering gardens and lawns, to swimming and washing cars, and Missouri American Water wants to remind customers to conserve water whenever possible,” said Grant Evitts, vice president of operations for Missouri American Water.  Missouri American Water offers the following tips to help consumers use water more efficiently, plus identify and prevent leaks, a significant source of water waste.",Missouri American Water Reminds Customers to Conserve Water as Temperatures Rise
2019-07-19,For those looking to find strong Utilities stocks it is prudent to search for companies in the group that are outperforming their peers Is American Water Works Company AWK one of those stocks right now By taking a look at the stock s year to date performance in comparison to its,Is American Water Works Company (AWK) Stock Outpacing Its Utilities Peers This Year?
2019-07-19,Fed officials are now going all out to drop hints of more aggressive policy easing New York Fed President John Williams is the latest to say that a rate cut will be a wise strategy at the first signs of an economic downturn Meanwhile the U S economy is at the brink of a slowdown,Fresh Hopes of a Fed Rate Cut Boost These 5 Stocks
2019-07-19,Is (AWK) Outperforming Other Utilities Stocks This Year?,Is American Water Works Company (AWK) Stock Outpacing Its Utilities Peers This Year?
2019-07-19,Dovish remarks from Fed chief John Williams reinforced bets that the central bank would trim interest rates by half a percentage point later this month. This calls for investing in rate-sensitive stocks as well as gold.,Fresh Hopes of a Fed Rate Cut Boost These 5 Stocks
2019-07-22,"The Zacks Analyst Blog Highlights: Atlantic Power, American Water, KB, Kinross Gold and Royal Gold","The Zacks Analyst Blog Highlights: Atlantic Power, American Water, KB, Kinross Gold and Royal Gold"
2019-07-22,"American Water (AWK), the nation’s largest publicly traded water and wastewater utility company, announced today President and Chief Executive Officer Susan Story will participate in the National Association of Regulatory Utility Commissioners’ (NARUC) Summer Policy Summit from July 21-24, 2019, in Indianapolis.  American Water will have a strong presence at the conference with several expert presenters.  On July 23, Cheryl Norton, senior vice president, Eastern Division, and president of New Jersey American Water, will participate in a panel on Safe Drinking Water Act (SDWA) compliance.",American Water CEO Susan Story & SVP Cheryl Norton Set to Speak at 2019 NARUC Summer Policy Summit
2019-07-22,"American Water (AWK), the largest publicly traded U.S. water and wastewater utility company, has named Kathleen O’Hara as vice president of Operations for the Homeowner Services division.  Kathleen joins American Water with impressive success and acumen gained from a number of leadership roles in the home and consumer services industries, and will be based in Naperville, Ill.  The addition of Kathleen to the Homeowner Services team comes following the 2018 acquisition of Pivotal Home Solutions and the subsequent integration and organization of the division to best support growth initiatives.",Kathleen O’Hara Named Vice President of Operations for American Water’s Homeowner Services Division
2019-07-23,For Immediate Release Chicago IL July 22 2019 Zacks com announces the list of stocks featured in the Analyst Blog Every day the Zacks Equity Research analysts discuss the latest news and events impacting stocks and the financial markets Stocks recently featured in the blog,"The Zacks Analyst Blog Highlights: Atlantic Power, American Water, KB, Kinross Gold and Royal Gold"
2019-07-23,"The American Water Charitable Foundation (AWCF) and the Union Sportsmen’s Alliance (USA) are pleased to announce a $300,000 grant in support of their growing partnership and shared commitment to unite the union community in preservation of North America’s outdoor heritage.  “The American Water Charitable Foundation is pleased to continue our support of the Union Sportsmen’s Alliance through a multi-year grant directly benefiting the USA’s all-volunteer Work Boots on the Ground program,” said AWCF Chair Fred Myers.  “Work Boots on the Ground brings union members and American Water employees together to volunteer their time and skills on water-related conservation projects that benefit the communities we serve.","American Water Charitable Foundation Awards $300,000 to Union Sportsmen’s Alliance"
2019-07-24,American Water Works (AWK) doesn't possess the right combination of the two key ingredients for a likely earnings beat in its upcoming report. Get prepared with the key expectations.,American Water Works (AWK) Reports Next Week: Wall Street Expects Earnings Growth
2019-07-24,American Water Works AWK is expected to deliver a year over year increase in earnings on higher revenues when i t report s results for the quarter ended June 2019 This widely known consensus outlook gives a good sense of the company s earnings picture but how the actual results compare,American Water Works (AWK) Reports Next Week: Wall Street Expects Earnings Growth
2019-07-24,"Pennsylvania American Water, a subsidiary of American Water (AWK), announced today that it has acquired the water assets of the Municipal Authority of the Borough of Turbotville and the wastewater assets from the Borough of Turbotville in Northumberland County.","Pennsylvania American Water Expands Footprint with Acquisition of Municipal Water, Wastewater System in Northumberland County"
2019-07-25,American Water Works Company AWK is scheduled to release second quarter 2019 results on Jul 31 after market close In the las t report ed quarter the company recorded a negative earnings surprise of 3 17 Let s see how things are shaping up for this water utility prior to the,What's in Store for American Water's (AWK) Q2 Earnings?
2019-07-25,"In 2018, Illinois American Water partnered with Illinois farmers to apply over 31,000 tons of residuals and biosolids, rather than sending them to a landfill.  In total, 31,448 tons of water treatment residuals and wastewater treatment biosolids from Illinois American Water’s Champaign County, Granite City, Streator and Chicago Metro service areas were applied to agricultural fields across the state.  According to Ryan Schuler, environmental compliance supervisor for Illinois American Water and manager of the residual and biosolid reuse program, the partnership is a best practice supported by the Illinois Environmental Protection Agency (EPA).","Illinois American Water Prevents Over 31,000 Tons of Treatment Byproducts From Entering Landfills Through Farmland Application Program"
2019-07-25,American Water Works' (AWK) Q2 earnings are expected to reflect the benefits from acquisitions and rate increases.,What's in Store for American Water's (AWK) Q2 Earnings?
2019-07-25,"Fourth paragraph, first sentence of quote of release dated July 16, 2019 should read: Roger is a trusted leader at Illinois American Water .",CORRECTING and REPLACING Roger Goodson Leadership Role With Illinois American Water Expanded to Include Eastern Division
2019-07-25,"American Water Works Company, Inc. (AWK), the largest publicly traded U.S. water and wastewater utility company, today announced that Kimberly J. Harris, Patricia L. Kampling and Lloyd M. Yates have been appointed as independent members of the company's board of directors effective July 25, 2019.  ""American Water is thrilled to have Kimberly, Pat and Lloyd join our board of directors,"" said Karl Kurz, chairman of the board of American Water.",American Water Appoints Three New Independent Members to its Board of Directors
2019-07-26,Investors in American Water Works Co Inc Symbol AWK saw new options begin trading this week for the March 2020 expiration One of the key data points that goes into the price an option buyer is willing to pay is the time value so with 238 days until expiration the newly trading,Interesting AWK Put And Call Options For March 2020
2019-07-26,"American Water Works (AWK) has been upgraded to a Zacks Rank 1 (Strong Buy), reflecting growing optimism about the company's earnings prospects. This might drive the stock higher in the near term.",All You Need to Know About American Water Works (AWK) Rating Upgrade to Strong Buy
2019-07-26,Investors might want to bet on American Water Works AWK as it has been recently upgraded to a Zacks Rank 1 Strong Buy This upgrade is essentially a reflection of an upward trend in earnings estimates one of the most powerful forces impacting stock prices A company s changing,All You Need to Know About American Water Works (AWK) Rating Upgrade to Strong Buy
2019-07-26,Cash dividend payable in the third quarter of 2019,American Water Declares Quarterly Dividend
2019-07-29,In recent trading shares of American Water Works Co Inc Symbol AWK have crossed above the average analyst 12 month target price of 114 80 changing hands for 115 09 share When a stock reaches the target an analyst has set the analyst logically has two ways to react downgrade,American Water Works Reaches Analyst Target Price
2019-07-29,Fed is widely expected to trim the fed funds rate range by a quarter points this month on sluggish inflation and trade wars' impact on businesses.,Fed to Cut Rates for the First Time in 10 Years: 4 Must Buys
2019-07-29,The Fed is widely expected to proceed with an interest rate cut by a quarter point this month after second quarter GDP showed marks of a trade war impact on business investments and still sluggish inflation Needless to say rate sensitive stocks usually rise when rates are declining as,Fed to Cut Rates for the First Time in 10 Years: 4 Must Buys
2019-07-29,"After reading American Water Works Company, Inc.'s (NYSE:AWK) most recent earnings announcement (31 March 2019), I...","Does American Water Works Company, Inc.'s (NYSE:AWK) 31% Earnings Growth Reflect The Long-Term Trend?"
2019-07-29,"Illinois American Water President Bruce Hauk was awarded the 2019 Inclusion and Diversity Award by the National Black Chamber of Commerce (NBCC) during its annual conference held last week in Atlanta, Georgia.  NBCC President Harry C. Alford said, “Mr. Hauk’s focus on inclusion and diversity at American Water has played an instrumental role in increasing the company’s partnerships with minority businesses, diverse suppliers and diverse employee candidates.  American Water sees diversity as a vital element in creating an environment where differences are celebrated and contribute to success.",National Black Chamber of Commerce Recognizes Illinois American Water with Inclusion and Diversity Award
2019-07-30,For Immediate Release Chicago IL July 30 2019 Zacks com announces the list of stocks featured in the Analyst Blog Every day the Zacks Equity Research analysts discuss the latest news and events impacting stocks and the financial markets Stocks recently featured in the blog,"The Zacks Analyst Blog Highlights: Atlantic Power, American Water Works, KB Home and Unitil"
2019-07-30,"Female directors made up the majority of American Water's directors before 2018, when the appointment of two men made it a 50-50 split.","American Water's board is majority female, again"
2019-07-30,"The Zacks Analyst Blog Highlights: Atlantic Power, American Water Works, KB Home and Unitil","The Zacks Analyst Blog Highlights: Atlantic Power, American Water Works, KB Home and Unitil"
2019-07-31,The Fed is widely expected to cut benchmark borrowing rates at least modestly for the first time in more than a decade on Jul 31 And that s good news for Wall Street After all markets tend to gain after rate cuts Rate cuts are thus a seasonal buying opportunity with some,Fed Rate Cut Might Perk Things Up for Wall Street: 5 Picks
2019-07-31,"Looking at American Water Works Company, Inc.'s (NYSE:AWK) earnings update in March 2019, it seems that analyst...","American Water Works Company, Inc. (NYSE:AWK): Will The Growth Last?"
2019-07-31,"Since 1990, on average, the S&P 500 has gained 0.16% on the day of a 25-basis-point cut. And the broader benchmark advanced 0.34%, 3.67% and 5.64%, respectively, one month, three months and six months later.",Fed Rate Cut Might Perk Things Up for Wall Street: 5 Picks
2019-07-31,"Illinois American Water is investing over $700,000 to enhance water service to Alton customers. The work includes replacing over 5,500 feet of water main with larger pipe to increase water flow and pressure for improved water quality and fire protection.","Illinois American Water Investing Over $700,000 in Alton Water System; Over 5,500 Feet of Water Main to Be Installed"
2019-07-31,Affirms 2019 Earnings Guidance,American Water Reports Strong Second Quarter 2019 Results
2019-07-31,"American Water Works (AWK) delivered earnings and revenue surprises of 0.00% and -1.62%, respectively, for the quarter ended June 2019. Do the numbers hold clues to what lies ahead for the stock?",American Water Works (AWK) Meets Q2 Earnings Estimates
2019-08-01,As widely expected the Federal Reserve cut interest rates by 25 bps to 2 2 5 in its policy meeting that ended on Jul 31 for the first time since the 2008 financial crisis It also plans to end its process of shrinking the 3 8 trillion balance sheet two months ahead of schedule The,Fed Cuts Rate: Sector ETFs & Stocks Set to Soar
2019-08-01,American Water Works Company AWK posted second quarter 2019 earnings of 94 cents per share in line with the Zacks Consensus Estimate However the bottom line improved 13 3 year over year on the back of contribution generated from infrastructure investment acquisitions and organic,"American Water Works' (AWK) Q2 Earnings In Line, Improve Y/Y"
2019-08-01,American Water Works AWK came out with quarterly earnings of 0 94 per share in line with the Zacks Consensus Estimate This compares to earnings of 0 83 per share a year ago These figures are adjusted for non recurring items A quarter ago it was expected that this water utility would pos,American Water Works (AWK) Meets Q2 Earnings Estimates
2019-08-01,"As widely expected, the Federal Reserve cut interest rates by 25 bps for the first time since the 2008 financial crisis. We have highlighted ETFs & stocks from sectors that are expected to skyrocket on lower rates.",Fed Cuts Rate: Sector ETFs & Stocks Set to Soar
2019-08-01,SJW Group SJW will begin trading ex dividend on August 02 2019 A cash dividend payment of 0 3 per share is scheduled to be paid on September 03 2019 Shareholders who purchased SJW prior to the ex dividend date are eligible for the cash dividend payment This marks the 3rd quarter that,"SJW Group (SJW) Ex-Dividend Date Scheduled for August 02, 2019"
