publishedAt,title,description
2020-06-05,"This market has been on a tear. If, as the old saying goes, bull markets climb a wall of worry, this one has leapt that wall in a single bound.Now, maybe with all the Federal Reserve support and the trillions of dollars in stimulus approved by Congress this will continue.But there are also 40 million people out of work and the economy is in a recession that goes far beyond America's shores.InvestorPlace - Stock Market News, Stock Advice & Trading TipsIf you're an investor looking for opportunity but would also like sleep-at-night safety, or would like to go on holiday without looking at your portfolio every few hours, then utilities are a good place to start.For many electric utilities, they have both regulated and unregulated operations. That means one part of the operation provides a solid foundation of conservative growth. And the other provides opportunity to sell energy at market prices, offering greater growth.  * 7 Hotel Stocks to Buy Before Vacationing Restarts Here are 7 utility stocks keeping the lights on below  * NextEra Energy (NYSE:NEE)  * Dominion Energy (NYSE:D)  * American Water Works (NYSE:AWK)  * Brookfield Infrastructure Partners (NYSE:BIP)  * Algonquin Power & Utilities (NYSE:AQN)  * Ormat Technologies (NYSE:ORA)  * Atlantica Sustainable Technologies (NYSE:AY)These are well-established companies with long records of growth and safety. Between that and their traditionally strong dividend yields, that makes high-quality utilities a must-have for my Growth Investor buy list. Utility Stocks to Buy: NextEra Energy (NEE)Source: madamF / Shutterstock.com This company is a prime example of what I was talking about in the intro. It operates FPL (Florida Power & Light), which is a regulated utility that serves southern Florida.And it is also the largest producer of wind and solar energy in the world.Its regulated business operates in high-growth, densely populated sector of the state, which means solid, reliable returns.And its unregulated business sells renewable energy across the US to other utilities and industry. They can use the renewable energy to offset their carbon emissions and they don't have to get into the renewables business. It's a model that more and more utilities are adopting.Also, renewables are more resilient as climactic events rise.The stock is up 26% in the past year and 7% year to date. The latter figure is bullish given the drop in industrial and commercial demand due to COVID-19 lockdowns. NEE has a 2.2% dividend. You can see why this is among my favorite Elite Dividend Payer stocks for my Growth Investor recommendations. Dominion Energy (D)Source: ying / Shutterstock.com Dominion is one of the biggest utilities on the East Coast. It is the main regulated utility in Virginia as well as parts of the Carolinas. Meanwhile, its natural gas business covers the aforementioned as well as West Virginia, Ohio, Pennsylvania, Georgia, Utah and Wyoming.D has a $72 billion market cap and a rock-solid business in Virginia, where there are significant corporate offices for defense contractors, telecommunications and internet firms. The point being, it has steady strong demand on both the consumer and commercial sides.Its unregulated business leans on its natural gas operations. It's one of a handful of companies that has both extensive natural gas distribution assets as well as an export facility.Exporting natural gas is a huge opportunity, since natural gas prices are triple (or higher) in European and Asian markets. D also has expanding renewable operations in and beyond its core service areas.  * 7 Hotel Stocks to Buy Before Vacationing Restarts The stock is up 12% in the past year, 3% year to date. But it has a generous and rock-solid 4.4% dividend. American Water Works (AWK)Source: Shutterstock AWK's roots go back to 1886 when it was operating as a utility in the US and Canada. And its journey to its current path has been somewhat circuitous but now it operates divisions in more than 46 states and serves 14 million customers.The story of the water business has changed over the years. It used to be that cities, towns or municipalities ran their own water companies. But over the past 3 decades that became increasingly expensive, since this isn't a core competency of many municipal governments.This was the precursor to the rise of water utilities that could operate these water systems for the governments at set rates, like any other utility. The utilities could do this because they could operate at scale and were focused on just one task. This has worked out very well for both AWK and the states it operates in.AWK also has contracts for military bases, which is a reliable source of income. Given the current challenges of water demand for commercial and consumer operations, AWK is in a growth market with a broad reach.The stock is up 13% in the past year and 8% year to date. It also has a 1.7% dividend. And I've got even better growth-and-income plays where that came from. Brookfield Infrastructure Partners (BIP)Source: Shutterstock Brookfield Infrastructure Partners is a Canada-based company with properties around the world. Those properties include utilities, transport, energy and data infrastructure businesses. BIP has been operating for 105 years and is still going strong.Just this year it was in a bidding war with Australia-based Macquarie Infrastructure (NYSE:MIC) for telecom Cincinnati Bell (NYSE:CBB). In the end it lost out to MIC.However, the company has a diverse portfolio of assets, which means it can take advantage of opportunities in a number of different industries, given their economic cycle.The company is structured as a limited partnership, which means stockholders are treated a direct owners, and net income is distributed as a generous dividend. That dividend currently sits at 4.6%.  * 7 Hotel Stocks to Buy Before Vacationing Restarts The stock is up 10% in the past year, despite being off nearly 7% year to date. Algonquin Power & Utilities (AQN)Source: Shutterstock Canadian firm Alqgonquin Power holds an interesting mix of assets. And while its name might not be familiar to most south of the border, AQN has operations in 12 U.S. states under its subsidiary Liberty Utilities.Liberty's operations range from operating sewer companies to gas, water and electric operations in select cities and districts. Many of the properties were acquired from companies looking to spin off smaller operations and those that weren't matching the larger focus of the company.AQN can operate these at smaller scales and still remain profitable. That's the kind of business model I look for in making Growth Investor picks. The company also is very involved in renewable energy efforts in Canada, including hydroelectric projects.AQN delivers an attractive 4.2% dividend and the stock is up 20% in the past 12 months, and 3% year to date. Ormat Technologies (ORA)Source: Shutterstock This unique company started in Israel in the mid-1960s. It developed a proprietary turbine that could convert geothermal or recovered energy (the heat generated by other equipment) into electricity.By the oil crisis in the '70s, the value of self-sufficient, renewable energy resources became a very popular concept.In the decades that followed, ORA installed geothermal systems in Israel, New Zealand, Iceland, Guatemala, Kenya and the U.S. Today, the company is headquartered in Nevada.Most renewable energy headlines go to solar or wind these days, but there is a growing demand for geothermal as well. ORA has a solar division as well, plus a technology that can separate oil from oil sands more efficiently than traditional processes.  * 7 Hotel Stocks to Buy Before Vacationing Restarts While it is an energy company, it doesn't operate as a utility, so its dividend isn't spectacular, sitting at 0.6%. ORA is up 15% in the past year, and off 5% year to date. But its technology is at the heart of where energy generation, and thus utility consumption, is going. Atlantica Sustainable Infrastructure (AY)Source: Shutterstock Atlantica Sustainable is a UK-based firm that owns a diversified portfolio of energy assets around the world.From solar farms in Spain, the US, South Africa and the Sahara, to wind turbines in Peru to electrical grids in Chile, AY has operations that span a variety of sectors in a range of countries.Almost all of its contracts are dollar or euro based, which helps stabilize its income stream. And most projects are under contract for the next decade or longer. This allows the company to look for new projects and show that it can sustain the new opportunity costs.Launched in 2013, the company is relatively new to the game, but its renewables focus certainly makes it a strong play on growth in the overall sector. It has a $2.8 billion market cap, so it's growing well.The stock is up 23% in the past 12 months and 3% in year to date. But it also has a 5.9% dividend, which is certainly a nice kicker.Speaking of income and growth plays…Currently, my Portfolio Grader I used to find Growth Investor stocks is picking up plenty of buys in all kinds of sectors. One that I'm particularly excited about now is helping enable a major upgrade across the telecom industry, across the world. The 5G Buildout Is an Incredible Opportunity for Investors Right NowWithin two years, most cell phones will be 5G enabled and be able to wirelessly handle television streaming. With 5G, we'll have cable modem speeds on any device; no need to plug in. That's a big deal for rural areas … the very same areas that are also key to President Donald Trump's reelection. So, by pushing 5G over the goal line, Trump will deliver a big win for his base -- and strike a blow against Chinese rivals like Huawei Technologies.But big picture, 5G is about much more than trade wars and faster downloads. Because 5G is 100 times faster than 4G, it'll allow your wireless internet devices to work in real time. That advancement is a game changer for tech companies.With the 5G infrastructure market set to grow at an annual rate of 67% over the next 10 years, the entire market will go from $780 million to nearly $48 billion. This buildout is where I see opportunity with 5G stocks now.Cable companies can do their best to fight back with fiber optics … but they can't compete with the convenience of a smartphone, once it's got ultra-fast 5G. That's how my 5G infrastructure play will capture more market share from the broadband cable companies.The stock I'm targeting is enjoying an influx of big money on Wall Street, and it has good fundamentals, too -- making it a &quot;Strong Buy&quot; in my Portfolio Grader system now.Click here to watch my new, free briefing on this extraordinary technology and the opportunity with 5G stocks.When you do, you'll see how to claim a free copy of my investment report, The King of 5G &quot;Turbo Button&quot; Technology, which has full details on this company -- and what makes it such a great buy now.Louis Navellier had an unconventional start, as a grad student who accidentally built a market-beating stock system -- with returns rivaling even Warren Buffett. In his latest feat, Louis discovered the &quot;Master Key&quot; to profiting from the biggest tech revolution of this (or any) generation. Louis Navellier may hold some of the aforementioned securities in one or more of his newsletters. More From InvestorPlace  * Why Everyone Is Investing in 5G All WRONG   * Top Stock Picker Reveals His Next 1,000% Winner   * The 1 Stock All Retirees Must Own   * Look What America's Richest Family Is Investing in Now The post 7 Utility Stocks to Buy Keeping Lights On And Dividends Flowing appeared first on InvestorPlace.",7 Utility Stocks to Buy Keeping Lights On And Dividends Flowing
2020-06-05,American Water Works (AWK) reported earnings 30 days ago. What's next for the stock? We take a look at earnings estimates for some clues.,American Water Works (AWK) Up 9.8% Since Last Earnings Report: Can It Continue?
2020-06-05,"California American Water published the 2019 Consumer Confidence Reports, which show high quality water service throughout its state districts. The annual reports compare California American Water’s water quality with standards established by the U.S. Environmental Protection Agency and the California State Water Resources Control Board, Division of Drinking Water.",Consumer Confidence Reports Show Excellent Water Quality in California
2020-06-08,Students Earn Pennsylvania American Water’s 2020 &quot;Stream of Learning&quot; Scholarships,High-Performing Students Earn Pennsylvania American Water’s 2020 &quot;Stream of Learning&quot; Scholarships
2020-06-09,"Illinois American Water, a subsidiary of American Water Company (NYSE: AWK), has received the J.D. Power award for ranking highest in customer satisfaction among large water utilities in the Midwest according to the J.D. Power 2020 U.S. Water Utility Residential Customer Satisfaction StudySM.",Illinois American Water Ranks #1 in J.D. Power 2020 Water Utility Residential Customer Satisfaction Study in Midwest Large Region
2020-06-10,"The American Water Charitable Foundation and Missouri American Water have partnered to award $25,000 in grants to non-profit organizations across the state helping communities battle the effects of the ongoing health emergency.","American Water Charitable Foundation, Missouri American Water Team Up to Provide $25,000 in Grants to COVID-19 Relief Agencies"
2020-06-11,"American Water (NYSE:AWK), the nation’s largest publicly traded water and wastewater utility company, announced today that Cheryl Norton, senior vice president, Chief Environmental Officer & president of New Jersey American Water, will be speaking at the United States Conference of Mayors, Mayors Water Council. The virtual meeting will take place on Friday, June 12th at 1:30 p.m. EDT.","American Water’s Cheryl Norton to Participate in U.S. Conference of Mayors, Mayors Water Council Panel"
2020-06-11,"American Water (NYSE: AWK), the nation’s largest publicly traded water and wastewater utility company, today announced recipients of the 29th Annual James V. LaFrankie Scholarship Awards. The awards were distributed nationwide to 13 college-bound children of full-time American Water employees who demonstrate an interest in science and water-related industry occupational fields.",American Water Announces Recipients of 2020 James LaFrankie Scholarship Awards
2020-06-12,"Pennsylvania American Water’s latest annual Water Quality Reports, highlighting its excellent drinking water compliance, are now available online.",Annual Water Quality Report Highlights Pennsylvania American Water’s Record of Meeting and Surpassing Drinking Water Standards
2020-06-12,"The latest 13F reporting period has come and gone, and Insider Monkey is again at the forefront when it comes to making use of this gold mine of data. Insider Monkey finished processing 821 13F filings submitted by hedge funds and prominent investors. These filings show these funds' portfolio positions as of March 31st, 2020. […]","Is American Water Works Company, Inc. (AWK) Going to Burn These Hedge Funds?"
2020-06-15,Q1 2020 American Water Works Company Inc Earnings Call,Edited Transcript of AWK.N earnings conference call or presentation 7-May-20 1:00pm GMT
2020-06-15,"In the long-run, does consistent market timing really matter to be a successful investor?","When Does Market Timing Actually Work? - June 15, 2020"
2020-06-15,"American Water’s Homeowner Services division announces $25,000 in donations to two Illinois organizations on behalf of the American Water Charitable Foundation’s community-focused COVID-19 Response Fund. TriCity Family Services and the United Way of Metro Chicago—Chicago Community COVID-19 Response Fund, will each receive $12,500 to support the critical needs of communities most impacted by the pandemic.","American Water’s Homeowner Services and American Water Charitable Foundation provide $25,000 in Local COVID-19 Relief Donations"
2020-06-15,"Illinois American Water is investing over $2.9 million to replace over 9,700 feet, or 1.8 miles, of water main in Pekin’s water system. Much of the water main installed will be increased in size to support water flow and pressure for continued water quality and fire protection.","Illinois American Water Replacing over 9,700 Feet of Water Main in Pekin Water System"
2020-06-16,"Kevin Hillen has been promoted to Senior Operations Manager of the Northern Division, effective June 15. In this role, Hillen provides leadership and oversight to the company’s Chicago Metro and South Beloit Districts, responsibilities he had assumed in an interim capacity since March 2020.",Kevin Hillen named Senior Operations Manager of Northern Division
2020-06-16,American Water (AWK) announces that its unit Illinois American Water is set to invest $2.9 million to upgrade old water mains in Illinois for providing high-quality water services to customers.,American Water (AWK) Arm to Replace Water Mains in Illinois
2020-06-18,"Illinois American Water’s Sterling District is investing approximately $5.9 million to upgrade the local water system. Projects include replacing a high service pump station at the water treatment plant and constructing a new, larger elevated water tank on the north side of town.",Illinois American Water to Invest $5.9 Million in Sterling Water System; High Service Pump Station and Elevated Water Tank Under Construction
2020-06-18,"American Water (NYSE: AWK), the largest publicly-traded U.S. water and wastewater utility company, and the American Water Charitable Foundation, in collaboration with The Story Family Fund, announced today a new partnership with the Jackie Joyner-Kersee Foundation to expand Jackie Joyner-Kersee’s Winning in Life® program. The combined grant of $1 million will expand the program to five economically distressed communities served by American Water.","American Water, American Water Charitable Foundation, in collaboration with The Story Family Fund, Announce New $1 Million Partnership with U.S. Olympic Hero Jackie Joyner-Kersee"
2020-06-19,"American Water Works' (AWK) arm Illinois American Water is set to invest $5.9 million to upgrade the Sterling Water System by constructing a new, larger elevated water tank.",American Water Arm to Invest $5.9M in Sterling Water System
2020-06-22,Pennsylvania American Water Announces 2020 Environmental Grants for Local Watershed Projects,Pennsylvania American Water Announces 2020 Environmental Grants for Local Watershed Projects
2020-06-23,"Illinois American Water is investing over $6.7 million to replace over 22,000 feet, or 4.2 miles, of water main in the local water system. The Grand Boulevard pump station will also be upgraded with energy saving technology.","Illinois American Water Upgrading Local Water System; Replacing over 22,000 Feet of Water Main and Upgrading a Pump Station"
2020-06-24,"American Water Works' (AWK) subsidiary, Illinois American Water is set to invest $6.7 million to replace 4.2 miles of water mains and upgrade distribution pumps in a local water system of Illinois.",American Water Arm to Invest $6.7M in Illinois Water System
2020-06-24,"California American Water has closed its agreement to acquire the operating assets of the Hillview Company to become the new water provider to its approximately 1,500 customers.",California American Water Acquires Hillview Water Company
2020-06-25,"American Water Works (AWK) continues to expand operations in the United States through inorganic ways, while ensuring high-quality services to new customers.",American Water's (AWK) Unit Buys Hillview Water Company
2020-06-29,"West Virginia American Water filed an application today with the Public Service Commission (PSC) of West Virginia, seeking approval of its 2021 infrastructure replacement program and associated Distribution System Improvement Charge (DSIC). The plan includes approximately $50.6 million of investment for infrastructure replacement and system upgrades.",West Virginia American Water Files 2021 Infrastructure Replacement Plan and Distribution System Improvement Charge
2020-06-30,American Water Works' (AWK) unit West Virginia American Water seeks approval from the PSC to make investment in infrastructure and provide high-quality services to customers.,American Water Arms Seeks Nod for Infrastructure Replacement
2020-06-30,Missouri American Water today filed a request with the Missouri Public Service Commission (MoPSC) to review its water and sewer rates following an extensive examination of investments to provide safe and reliable water and sewer service.,Missouri American Water Submits Rate Review Request to Missouri Public Service Commission
2020-07-01,American Water' (AWK) unit Missouri American Water files for a rate hike to recoup the $950-million investment directed toward improving water and sewer infrastructure in Missouri.,American Water (AWK) Arm Files for $950M Investment Recovery
2020-07-02,American Water Works (AWK) strengthens infrastructure via systematic replacement of old pipelines. It plans to invest $8.8-$9.4 billion in the 2020-2024 time period to fortify its infrastructure.,American Water Arm to Invest $2M in Water Line Replacement
2020-07-07,"American Water Resources, a subsidiary of American Water, today announces its partnership with Flo by Moen™ to offer homeowners the all-in-one water leak detection system, Flo by Moen Smart Water Shutoff. Purchasing a Smart Water Shutoff through American Water Resources includes low monthly payment options and installation by an independent, local, licensed plumbing professional from the American Water Resources contractor network. Through this partnership, American Water Resources and Flo by Moen will offer homeowners the tools to detect water leaks within their home’s plumbing, avoid over-usage that can lead to unexpected increases on water bills and conserve freshwater resources that may be wasted due to undetected leaks.",American Water Resources Partners with Flo by Moen to Bring Real-Time Leak Detection System to Homeowners
2020-07-08,"If you want to know who really controls American Water Works Company, Inc. (NYSE:AWK), then you'll have to look at the...","Here's What American Water Works Company, Inc.'s (NYSE:AWK) Shareholder Ownership Structure Looks Like"
2020-07-08,"American Water (NYSE: AWK), the largest publicly traded U.S. water and wastewater utility company, today announced that Samuel Hodges, a doctoral student at the University of Arkansas, has been chosen as the recipient of the American Water Works Association (AWWA) 2020 American Water Scholarship. The scholarship is an annual award of $5,000 presented to a graduate level student to assist with the development of professionals interested in service to the water industry.",AWWA 2020 American Water Scholarship Presented to University of Arkansas Doctoral Student Samuel Hodges
2020-07-08,"American Water's (AWK) unit, American Water Resources enters into a partnership with Flo by Moen to aid customers in detecting water leaks at home and lowering utility bills.",American Water Arm & Flo by Moen Unite to Stop Water Wastage
2020-07-09,Pennsylvania American Water Announces 2020 Art Contest Winners,Top Prizes Awarded to Students in Pennsylvania American Water’s &quot;Protect Our Watersheds&quot; Art Contest
2020-07-10,NextEra makes the list Continue reading...,5 Utilities Outperforming the Market
2020-07-13,At the end of February we announced the arrival of the first US recession since 2009 and we predicted that the market will decline by at least 20% in (see why hell is coming). In these volatile markets we scrutinize hedge fund filings to get a reading on which direction each stock might be going. […],"Did Hedge Funds Make The Right Call On American Water Works Company, Inc. (AWK) ?"
2020-07-14,The American Water Charitable Foundation (AWCF) is excited to announce the recipients of their 2020 Building Better Communities grant program:,"American Water Charitable Foundation and NRPA Award $500,000 For Water-Inspired Play Areas"
2020-07-14,"With temperatures rising across the state, Illinois American Water is reminding customers to use water wisely and avoid water overuse pitfalls that frequently happen this time of year. These tips can help customers save money and alleviate stress on water supplies and infrastructure during summer months.","As Temperatures Rise, Illinois American Water Encourages Customers to Use Water Wisely"
2020-07-15,"American Water (NYSE: AWK), the largest publicly traded U.S. water and wastewater utility company, today announced that it has been recognized as a top-scoring company, for the second consecutive year, on the Disability Equality Index (DEI), the most comprehensive disability inclusion assessment tool designed and embraced by both business leaders and disability advocates.",American Water Recognized With Top Score on Disability Equality Index for Second Consecutive Year
2020-07-17,"American Water (NYSE: AWK), the largest publicly-traded U.S. water and wastewater utility company, announced today that its Contract Services Group, was awarded a $5.1 million contract by the City of Camden to rehabilitate 28 combined sewer regulators.",American Water Awarded $5.1M Contract to Rehabilitate the City of Camden’s Combined Sewer Regulators
2020-07-20,"American Water (NYSE: AWK), the nation’s largest publicly traded water and wastewater utility company, announced today that Melanie Kennedy, senior vice president, Human Resources, will be participating in the NARUC Summer Policy Summit – Subcommittee on Supplier and Workforce Diversity - Rekindling a Dynamic, Diverse, and Resilient Energy Workforce. The webinar will take place today, July 20 at 2:00 p.m. EDT.",American Water’s Melanie Kennedy to Participate at NARUC Summer Policy Summit
