publishedAt,title,description
2018-11-16,American Water&apos;s (AWK) unit is set to acquire the water assets of the Steelton Borough Authority in Dauphin County for $22.5 million.,American Water&apos;s Arm to Acquire Steelton Borough Water System
2018-11-16,American Water Works Company AWK announced that its unit Pennsylvania American Water has entered into an agreement to acquire the water assets of the Steelton Borough Authority in Dauphin County This acquisition will cost 22 5 million and add nearly 2 400 metered residential commercial,American Water's Arm to Acquire Steelton Borough Water System
2018-11-16,"American  Water (AWK), the nation’s largest publicly traded water and  wastewater utility company, has partnered with the Paradigm for Parity®  coalition and announced its commitment to further support inclusion and  diversity efforts across its corporate leadership structure by 2030 as  well as show support for the same actions in corporations across the U.S.  “American Water has long been at the forefront of gender parity in  leadership and board representation, and we will continue to accelerate  our efforts in support of inclusion and diversity across our workforce,”  said President and CEO Susan Story.  American Water’s existing inclusion and diversity efforts have  continuously been directed at fully developing each employee to his or  her fullest potential, eliminating unconscious bias in the workplace,  respecting differences and basing career progress on experience,  business results and performance.",American Water Commits to Furthering Diversity in Leadership
2018-11-19,300 Thanksgiving Turkeys to be Delivered to Local Non-profits,Golden State Water and California American Water Team Up with State Assembly Member Ken Cooley for “Operation Gobble”
2018-11-19,200 Thanksgiving Turkeys to be Delivered to Local Non-profits,Golden State Water and California American Water Team Up with Senator Ted Gaines for “Operation Gobble”
2018-11-19,200 Free Thanksgiving Turkeys to be Delivered to Local Non-profits,California American Water Teams up with State Assemblymember Jim Cooper for “Operation Gobble”
2018-11-20,"With forecasted below-freezing temperatures coming soon, Pennsylvania  American Water today urged homeowners to act now to prevent frozen and  damaged household pipes.  “Although Pennsylvania winters are difficult to predict, we can be sure  that cold weather is coming and we need to prepare our homes and protect  areas susceptible to freezing,” said Pennsylvania American Water Vice  President of Operations Jimmy Sheridan.  Property owners are responsible for maintenance of the water service  line from the curb to the house, as well as any in-home piping.",Pennsylvania American Water Urges Customers to Prepare Now for Cold Weather to Avoid Frozen Pipes
2018-11-20,Funds used by local fire departments for necessary equipment and training,Missouri American Water Awards 28 Fire Fighter Grants to Communities Throughout the State
2018-11-23,Innovative Industrial Properties and American Water Works stocks are bucking the market downturn.,"1 Marijuana Stock and 1 Water Stock at All-Time Highs, as the Market Is Plunging"
2018-11-23,The stock market is taking a beating Since Oct 1 the S amp P 500 and tech heavy Nasdaq indexes are down 8 8 and 13 3 respectively through Nov 21 Many highly valued stocks particularly in the tech space have been hit much harder The market downturn is broad based,"1 Marijuana Stock and 1 Water Stock at All-Time Highs, as the Market Is Plunging"
2018-11-27,"Every investor in American Water Works Company Inc (NYSE:AWK) should be aware of the most powerful shareholder groups. Institutions often own shares in more established companies, while it&#8217;s not unusual<div><a class=""permalink"" href=""https://simplywall.st/news/yahoo-post/do-directors-own-american-water-works-company-inc-nyseawk-shares/"">Read More...</a></div>",Do Directors Own American Water Works Company Inc (NYSE:AWK) Shares?
2018-11-27,"NEW YORK, Nov. 27, 2018 -- In new independent research reports released early this morning, Fundamental Markets released its latest key findings for all current investors,.","Research Report Identifies ITT, Sally Beauty, American Water Works, Laredo Petroleum, H&E Equipment Services, and Horizon Global with Renewed Outlook — Fundamental Analysis, Calculating Forward Movement"
2018-11-28,"Kentucky American Water announced today that it has filed an application  with the Kentucky Public Service Commission (PSC) to adjust its rates  for water service in the communities it serves.  Kentucky American Water’s ongoing infrastructure investments, which will  exceed $100 million in system improvements, are a key reason the rate  increase is needed.",Kentucky American Water Seeks Recovery for Investment of More Than $100 Million in Infrastructure Upgrades
2018-11-29,"American  Water (AWK), the largest publicly traded U.S. water and  wastewater utility company, has been named a finalist in the Corporate  Citizen of the Year category in the 2018 NJBIZ  Business of the Year awards program.",American Water Named Finalist for NJBIZ Corporate Citizen of the Year Award
2018-11-29,Connecticut Water Service Inc CTWS will begin trading ex dividend on November 30 2018 A cash dividend payment of 0 313 per share is scheduled to be paid on December 17 2018 Shareholders who purchased CTWS prior to the ex dividend date are eligible for the cash dividend payment,"Connecticut Water Service, Inc. (CTWS) Ex-Dividend Date Scheduled for November 30, 2018"
2018-11-30,"American Water's (AWK) unit, Kentucky Public, files for a rate hike to recoup $100 million investment to strengthen the water infrastructure.",American Water's (AWK) Kentucky Unit Files for Rate Revision
2018-11-30,A month has gone by since the last earnings report for American Water Works AWK Shares have added about 4 7 in that time frame outperforming the S amp P 500 Will the recent positive trend continue leading up to its next earnings release or is American Water Works due for a pullback,Why Is American Water Works (AWK) Up 4.7% Since Last Earnings Report?
2018-11-30,In trading on Friday the Utilities Select Sector SPDR Fund ETF is outperforming other ETFs up about 1 on the day Components of that ETF showing particular strength include shares of Nextera Energy up about 2 2 and shares of American Water Works up about 1 9 on the day,"Friday's ETF Movers: XLU, OIH"
2018-11-30,In afternoon trading on Friday Utilities stocks are the best performing sector higher by 1 0 Within that group NextEra Energy Inc Symbol NEE and American Water Works Co Inc Symbol AWK are two large stocks leading the way showing a gain of 2 2 and 2 1 respectively Among,"Friday Sector Leaders: Utilities, Industrial"
2018-12-03,In recent trading shares of American Water Works Co Inc Symbol AWK have crossed above the average analyst 12 month target price of 94 60 changing hands for 95 41 share When a stock reaches the target an analyst has set the analyst logically has two ways to react downgrade on,American Water Works Reaches Analyst Target Price
2018-12-03,Is  (AWK) Outperforming Other Utilities Stocks This Year?,Is American Water Works Company (AWK) Outperforming Other Utilities Stocks This Year?
2018-12-03,For those looking to find strong Utilities stocks it is prudent to search for companies in the group that are outperforming their peers Is American Water Works Company AWK one of those stocks right now By taking a look at the stock s year to date performance in comparison to its,Is American Water Works Company (AWK) Outperforming Other Utilities Stocks This Year?
2018-12-03,"As winter quickly approaches and temperatures continue to fall, New  Jersey American Water urges homeowners to take action now to protect  their pipes from frigid winter weather and prevent costly plumbing  repairs.  “The best strategy in combating the cold winter months is a proactive  one,” said Tom Shroba, vice president of Operations for New Jersey  American Water.  New Jersey American Water encourages its customers to take the following  precautions to reduce the risk of freezing pipes that can burst.",New Jersey American Water Urges Customers to Prepare Pipes for Winter Weather
2018-12-04,American States Water Company AWR recently announced that its regulated utility subsidiary Golden State Water Company GSWC and the Public Advocates Office at the California Public Utilities Commission CPUC have agreed to adopt the settlement agreement in connection with the electric,American States Reaches Settlement Agreement in Rate Case
2018-12-04,"&quot;We’ve seen the dark days of Camden, and to be able to see the sun rising and the city breathing life again, it’s a wonderful thing,&quot; said New Jersey Senate President Steve Sweeney.",5 quotes on what American Water&apos;s new HQ means for Camden
2018-12-04,"American States Water (AWR) expects the final rate case decision in 2019 and if approved by the CPUC, the new rates will be effective retroactive on Jan 1, 2018.",American States Reaches Settlement Agreement in Rate Case
2018-12-04,"American  Water (AWK), the nation’s largest publicly traded water and  wastewater utility company, celebrated the official grand opening of its  new headquarters at One Water Street on the Camden Waterfront with  employees, local residents and community members, business and industry  leaders, elected officials and dozens of students from the Camden City  School District.  A $200,000 donation for STEM education was also  announced by the American Water Charitable Foundation during today’s  ceremony.",American Water Celebrates Its New Home in Camden with Grand Opening Ceremony
2018-12-04,California Water Service Group CWT announced that its unit Washington Water Service Washington Water has received a water rate hike approval from Washington Utilities and Transportation Commission effective Dec 1 2018 Per the approval the average residential water customer using,California Water Service's (CWT) Arm Gets Rate Hike Approval
2018-12-04,"California Water Service's (CWT) unit, Washington Water, receives approval to revise water rates. The revision will increase the monthly water bill of average residential water customer to $59.27.",California Water Service's (CWT) Arm Gets Rate Hike Approval
2018-12-04,"American Water opens its new, four-story corporate offices on the Camden Waterfront Tuesday morning.",The one thing you won&apos;t find at American Water&apos;s new HQ
2018-12-05,"Missouri American Water is getting into the sports industry, thanks to a  generous and enterprising employee.  Missouri American Water is proud to announce a donation of $1,500 to  support St. Louis Youth Sports Outreach (STLYSO), founded and led by  company employee Billy Mayhall, following STLYSO’s appearance on the  online documentary show Returning the Favor with Mike Rowe on Dec. 4.","Missouri American Water Proud to Support St. Louis Youth Sports Outreach, Led by Company Employee Billy Mayhall, Following Documentary"
2018-12-06,"R.W. Baird admits water stocks are pricey, but it likes &apos;em anyway.",3 Water Stocks Win Upgrades: Are Any of Them Buys?
2018-12-06,Every day Wall Street analysts upgrade some stocks downgrade others and initiate coverage on a few more But do these analysts even know what they re talking about Today we re taking one high profile Wall Street pick and putting it under the microscope Give R,3 Water Stocks Win Upgrades: Are Any of Them Buys?
2018-12-07,Cash dividend payable in the first quarter 2019,American Water Declares Quarterly Dividend
2018-12-08,InvestorPlace Stock Market News Stock Advice amp Trading Tips Editor s note This story was originally published in September 2018 It has since been updated and republished to reflect the move in utilities While the author s position may have changed the utility stocks,5 Utility Stocks to Buy for an Extra Durable Portfolio
2018-12-11,American Water Works Sees FY19 EPS In Line With View,American Water Works Sees FY19 EPS In Line With View
2018-12-11,"American Water Works Company, Inc. (AWK), the largest publicly  traded U.S. water and wastewater utility company, today announced its  earnings guidance for 2019 and affirmed its earnings guidance range for  2018.  American Water estimates its 2019 earnings to be in the range of $3.54  to $3.64 per diluted share.  “We know that our customers expect safe, clean, reliable and affordable  water services every day, and we do that through focusing on delivering  the best customer experience possible, prudently investing capital for  infrastructure replacement, and being more cost-efficient in our  operations,” said Susan Story, president and CEO of American Water.",American Water Announces 2019 Earnings Guidance
2018-12-12,American Water Works Company Inc AWK announced earnings per share EPS view for 2019 within 3 54 3 64 which represents 9 1 growth from the midpoint of 2018 guided range of 3 27 3 32 American Water Works expects to deliver a five year earnings CAGR in the top half of the 7 10,"American Water Works Gives View, Regulated Assets in Focus"
2018-12-12,"American Water Works (AWK) expects its earnings per share in 2019 to improve from the 2018 level, courtesy of regulated investments and the expansion of service territories via acquisitions.","American Water Works Gives View, Regulated Assets in Focus"
2018-12-12,Global Water Resources Inc GWRS will begin trading ex dividend on December 13 2018 A cash dividend payment of 0 024 per share is scheduled to be paid on December 28 2018 Shareholders who purchased GWRS prior to the ex dividend date are eligible for the cash dividend payment,"Global Water Resources, Inc. (GWRS) Ex-Dividend Date Scheduled for December 13, 2018"
2018-12-13,"The California Public Utilities Commission (CPUC) today approved a  decision in the company’s general rate case for new water and wastewater  rates for customers statewide.  The company’s rate request, which was filed in July 2016, will set rates  through 2020.  “We are extremely proud of our significant level of system investment,  combined with operational efficiency measures and innovative  technologies, to ensure continued water quality, service reliability and  fire protection for the more than 600,000 Californians who depend on us  every day,” said Rich Svindland, President of California American Water.",CPUC Approves California American Water General Rate Case
2018-12-13,"New  Jersey American Water was recognized by the New Jersey Department of  Environmental Protection (DEP) as one of this year’s recipients of the  annual Governor’s Environmental Excellence Awards.  Recipients  were recognized earlier this week at a luncheon held at the New Jersey  State Museum by DEP Commissioner Catherine R. McCabe and First Lady  Tammy Murphy, who also spoke at the event.  In its 19th year, the Governor’s Environmental Excellence  Awards recognize individuals, organizations and companies leading  outstanding environmental initiatives, programs and projects around the  state.",New Jersey American Water Named Recipient of 2018 Governor's Environmental Excellence Award for Innovative Technology
2018-12-15,"While the market driven by short-term sentiment influenced by uncertainty regarding the future of the interest rate environment in the US, declining oil prices and the trade war with China, many smart money investors are keeping their optimism regarding the current bull run, while still hedging many of their long positions. However, as we know, […]","Here is What Hedge Funds Think About American Water Works Company, Inc. (AWK)"
2018-12-17,California Water's (CWT) unit to provide water utility services to the Travis district for the next 50 years.,California Water to Acquire Water Distribution Assets of TAFB
2018-12-17,California Water Service Group s CWT subsidiary California Water Service Cal Water received approval from California Public Utilities Commission CPUC to acquire the water distribution assets of Travis Air Force Base from the U S Department of Defense The decision from the,California Water to Acquire Water Distribution Assets of TAFB
2018-12-18,"Many investors are beginning to focus their funds on companies that follow sustainable business practices and/or are addressing global impact issues, asserts John Eade, analyst with Argus Research.",Argus Research Highlights Six Ways to Play Clean Water
2018-12-18,"HENDERSON, NV / ACCESSWIRE / December 18, 2018 / Today's we're looking at a few penny stocks receiving a lot of attention which in turn creates profit opportunities due to the increased liquidity and volatility. ...",Liquid Stocks to Radar
2018-12-18,"American  Water (AWK), the largest publicly traded U.S. water and  wastewater utility company, and the American Water Charitable Foundation  (AWCF), a 501(c)(3) nonprofit organization created by American Water,  donated $25,000 to LUCY Outreach, a Camden-based organization that  provides services to underserved Camden County youth and young adults,  ages 12 – 25, and their families.  With American Water’s move to Camden, employees were given the  opportunity to make a monetary donation in return for desktop equipment  from their existing offices.","American Water Employees & American Water Charitable Foundation Donate $25,000 to Camden-Based LUCY Outreach"
2018-12-18,"As of late, multiple companies have managed to achieve yearly highs",5 Companies Hit 52-Week Highs
2018-12-19,"Two important questions to ask before you buy American Water Works Company, Inc. (NYSE:AWK) is, how it makes money and how it spends its cash. What is left after investment,

Read More...","American Water Works Company, Inc.’s (NYSE:AWK) Most Important Factor To Consider"
2018-12-20,"American  Water (AWK), the largest publicly traded U.S. water and  wastewater utility company, today announced that it partnered with The  Boys & Girls Club of Camden County and The  Ronald McDonald House of Southern New Jersey to collect and donate  hundreds of toys to these local Camden-based nonprofit organizations.  “All of the toys donated will go to children right here in Camden  where our company’s headquarters is based, so it makes sense that our  employees would want to give back to their own community.  American Water employees were provided a “wish list” of toys for club  members at The  Boys & Girls Club of Camden County and children staying at The  Ronald McDonald House of Southern New Jersey during the month of  December.","American Water Employees Spread Holiday Cheer, Donating Hundreds of Toys to Camden Charities"
2018-12-20,"Missouri American Water completed its acquisition of the Rogue Creek water and wastewater systems on December 14, adding approximately 85 new water and wastewater customers to its more than 460,000 statewide customers.  Customers in Rogue Creek, a mostly a recreational community with higher summer water usage due to its large number of summer residents, is located southwest of St. Louis, about 10 miles north of Potosi.  Customers there have long faced problems with their drinking water.",Missouri American Water Announces Acquisition of Rogue Creek Water and Wastewater Systems
2018-12-21,"Indiana American Water President Deborah Dewey today announced the  company’s acquisition of the Town of Sheridan’s water and wastewater  systems in central Indiana.  The purchase of the system adds more than  2,500 water and wastewater customers to the company’s customer base,  which represents a population of more than 3,000 residents.  “The acquisition of this system will help hold rates down for Sheridan  customers as needed investments are made and also provide access to  operations and capital management water professionals and a number of  customer service options and payment methods,” said Dewey.",Indiana American Water Acquires Sheridan Water and Wastewater Systems in Central Indiana
2018-12-24,American Water Works Company s AWK subsidiary Indiana American Water recently announced the acquisition of the Town of Sheridan s water and wastewater systems in central Indiana for a total purchase consideration of 10 75 million The buyout was approved by the Indiana Utility,American Water Works Arm to Boost Operations Via Acquisition
2018-12-24,"American Water Works' (AWK) unit Indiana American Water to add above 2,500 water and wastewater customers through purchase of the Town of Sheridan's water and wastewater systems in central Indiana.",American Water Works Arm to Boost Operations Via Acquisition
2018-12-25,Looking at the underlying holdings of the ETFs in our coverage universe at ETF Channel we have compared the trading price of each holding against the average analyst 12 month forward target price and computed the weighted average implied analyst target price for the ETF itself For the,The Math Shows RYU Can Go To $96
2018-12-26,"HENDERSON, NV / ACCESSWIRE / December 26, 2018 / Dr. Michael Burry, played rather eccentrically by the actor Christian Bale in the 2016 film, ""The Big Short"" invests in water and the evidence ...",Water Becoming a Valuable Commodity
2018-12-27,We recently issued an updated research report on American States Water Company AWR Estimates for American States Water have been revised upward over the past 60 days Notably the Zacks Consensus Estimate for the company s 2018 and 2019 earnings has moved 0 6 and 3 1 north to 1 73 and,American States Water to Grow on Rate Hike & Long-Term Deals
2018-12-27,"West Virginia American Water announced today the completion of its 2018  construction season, totalling $67 million in water and wastewater  system improvements.  The company spent $23.2 million of its 2018 capital  investments replacing 146,000 feet (more than 27 miles) of aging water  mains through its Distribution System Improvement Charge (DSIC) and  another $27.4 to replace aging fire hydrants, water service lines and  water meters.  The company also invested $12.5 million to upgrade water  treatment processes, equipment, security and technology to comply with  the latest drinking water standards and enhance system reliability and  resilience.",West Virginia American Water Concludes 2018 Construction Projects with $67 Million Invested and 27 Miles of Aging Water Mains Replaced
2018-12-27,Aqua America Inc s WTR North Carolina subsidiary received approval from the North Carolina Utilities Commission for a revenue increase of 2 9 million or 5 2 The rate hike will allow the company to recoup expenses for strengthening its infrastructure and improving the quality of services,Rate Approval to Raise Aqua America's (WTR) Revenues by $2.9M
2018-12-27,Primoris Services Corporation PRIM will begin trading ex dividend on December 28 2018 A cash dividend payment of 0 06 per share is scheduled to be paid on January 15 2019 Shareholders who purchased PRIM prior to the ex dividend date are eligible for the cash dividend payment This,"Primoris Services Corporation (PRIM) Ex-Dividend Date Scheduled for December 28, 2018"
2018-12-27,The York Water Company YORW will begin trading ex dividend on December 28 2018 A cash dividend payment of 0 173 per share is scheduled to be paid on January 15 2019 Shareholders who purchased YORW prior to the ex dividend date are eligible for the cash dividend payment This represents,"The York Water Company (YORW) Ex-Dividend Date Scheduled for December 28, 2018"
2018-12-27,"Aqua America (WTR) receives approval for a rate hike, which will recoup expenses and enable it to continue its investment for strengthening water infrastructure.",Rate Approval to Raise Aqua America's (WTR) Revenues by $2.9M
2018-12-27,American States Water's (AWR) long-term contracts with 11 military bases coupled with new water rate approval to drive its bottom-line performance.,American States Water to Grow on Rate Hike & Long-Term Deals
2018-12-28,Domestic focused Utilities continue to perform steadily as the demand for utility services hardly fluctuate with the vagaries of economy Cost control new electric rates and customer growth continue to help the utility sector 160 maintain operational stability Utility operation is,5 Utility Stocks to Continue Their Winning Streak in 2019
2018-12-28,Earnings estimates for Sempra Energy SRE have been revised upward over the past 30 days reflecting analysts confidence in the stock The Zacks Consensus Estimate for 2018 and 2019 earnings has moved 0 4 and 0 2 north to 5 44 and 6 07 respectively Sempra Energy is a,4 Reasons to Add Sempra Energy (SRE) Stock to Your Portfolio
2018-12-28,Sempra Energy (SRE) assures to earn higher returns for yield-seeking investors on the back of four factors.,4 Reasons to Add Sempra Energy (SRE) Stock to Your Portfolio
2018-12-28,Consolidated Water Co Ltd CWCO will begin trading ex dividend on December 31 2018 A cash dividend payment of 0 085 per share is scheduled to be paid on January 31 2019 Shareholders who purchased CWCO prior to the ex dividend date are eligible for the cash dividend payment This,"Consolidated Water Co. Ltd. (CWCO) Ex-Dividend Date Scheduled for December 31, 2018"
2018-12-28,Preformed Line Products Company PLPC will begin trading ex dividend on December 31 2018 A cash dividend payment of 0 2 per share is scheduled to be paid on January 18 2019 Shareholders who purchased PLPC prior to the ex dividend date are eligible for the cash dividend payment This,"Preformed Line Products Company (PLPC) Ex-Dividend Date Scheduled for December 31, 2018"
2018-12-28,"A bi-partisan proposed infrastructure plan, to be considered when Congress convenes in January, is designed to put people back to work, suggests John Eade, analyst with Argus Research.",Bi-Partisan Bets on an Infrastructure Plan
2018-12-28,Some utilities will continue with their strong performance in 2019 despite rate hikes.,5 Utility Stocks to Continue Their Winning Streak in 2019
