publishedAt,title,description
2018-01-02,"American Water Works Company, Inc. , the largest publicly traded U.S. water and wastewater utility company, has issued a statement related to the Tax Cuts and Jobs Act , and the company’s guidance previously issued on Dec.",American Water Statement on Impact of Tax Cuts and Jobs Act on Prior Guidance
2018-01-02,Toward the end of trading Tuesday the Dow traded up 0 25 percent to 24 779 25 while the NASDAQ climbed 1 24 percent to 6 989 08 The S amp P also rose gaining 0 64 percent to 2 690 83 Leading and Lagging Sectors Tuesday afternoon the basic materials sector proved to be a source,Mid-Afternoon Market Update: Dow Gains 60 Points; Net Element Shares Spike Higher
2018-01-02,In trading on Tuesday insurance brokers shares were relative laggards down on the day by about 1 Helping drag down the group were shares of eHealth EHTH down about 8 5 and shares of Kinsale Capital Group KNSL off about 3 8 on the day Also lagging the market Tuesday are,"Tuesday Sector Laggards: Insurance Brokers, Water Utilities"
2018-01-02,"With arctic weather locked in place across the Commonwealth, Pennsylvania American Water today urged homeowners to act now to prevent frozen and damaged household pipes.","New Year's Icy Blast Reinforces Need to Guard Against Frozen Pipes, Says Pennsylvania American Water"
2018-01-02,Midway through trading Tuesday the Dow traded up 0 17 percent to 24 762 23 while the NASDAQ climbed 1 17 percent to 6 984 41 The S amp P also rose gaining 0 58 percent to 2 689 15 Leading and Lagging Sectors On Tuesday the basic materials sector proved to be a source of,Mid-Day Market Update: NASDAQ Up Over 1%; Merus Shares Plummet
2018-01-02,In afternoon trading on Tuesday Utilities stocks are the worst performing sector showing a 0 9 loss Within that group American Water Works Co Inc Symbol AWK and SCANA Corp Symbol SCG are two large stocks that are lagging showing a loss of 2 8 and 2 2 respectively Among,"Tuesday Sector Laggards: Utilities, Financial"
2018-01-03,"It looks like the subzero temperatures and winter weather are here to stay for a while, so New Jersey American Water is urging homeowners to act now to prevent frozen and damaged household pipes.",Subzero Temperatures & Snow in the Forecast: New Jersey American Water Emphasizes Need to Guard Against Frozen Pipes
2018-01-05,American States Water Company AWR currently draws strength from its sturdy customer base The company provides fresh water wastewater services and electricity to 259 000 customers throughout 10 counties in California It also distributes electricity to nearly 24 000 customers through its,American States Water (AWR) Poised to Gain: Time to Buy?
2018-01-08,"California American Water has launched a new initiative to help customers navigate and better understand the components of their water bills. Starting today, all residential customers on the Monterey Peninsula that have registered an email address with their water account will receive an email notification, including a personalized video of their monthly water bill, along with conservation information....",California American Water Launches Personalized Water Bill Videos
2018-01-08,Outperforming the market shares of Aqua America NYSE WTR rose 31 in 2017 as opposed to the S amp P 500 SNPINDEX GSPC which climbed a not too shabby 19 This comes much to the delight of investors who witnessed a less encouraging 2016 when shares inched a meager 0,"Here's How Aqua America, Inc. Crushed It in 2017"
2018-01-09,"Recognizing the bravery and heroism of the volunteer firefighters and first responders in our communities, New Jersey American Water announces its 2018 grant program for volunteer fire departments and emergency responders located in the company’s service areas.",New Jersey American Water Announces Eighth Annual First Responder Grant Program
2018-01-09,The utility sector is currently undergoing a transition as the primary fuel source coal is being replaced by natural gas and we could notice increased usage of clean energy to produce electricity The new U S administration s coal friendly moves will definitely lead to some of the coal,Utilities' Steady Performance Makes for Safe Investment Choice
2018-01-09,"This high-yielding global infrastructure giant&apos;s water business might be tiny now, but it expects it to be a big growth driver in the coming years.",1 Top Water Stock to Buy Now
2018-01-10,"Zacks Industry Outlook Highlights: American Water Works, NextEra, York Water and CenterPoint","Zacks Industry Outlook Highlights: American Water Works, NextEra, York Water and CenterPoint"
2018-01-10,For Immediate Release Chicago IL January 10 2018 Today Zacks Equity Research discusses the Utilities including American Water Works Company AWK NextEra Energy NEE The York Water Company YORW and CenterPoint Energy CNP Industry Utilities Part 2 Link 160 160 160,"Zacks Industry Outlook Highlights: American Water Works, NextEra, York Water and CenterPoint"
2018-01-10,"This article is a part of InvestorPlace’s Best ETFs for 2018 contest.  James Brumley’s pick for the contest is Powershares Water Resource Portfolio (NASDAQ:PHO).  Water is one of those areas, putting the Powershares Water Resource Portfolio ETF (NASDAQ:PHO) at the top of a short list of ways to tap into this surprisingly lucrative business.",Best ETFs for 2018: Powershares Water Resource Portfolio Is a Pack Leader
2018-01-10,InvestorPlace Stock Market News Stock Advice amp Trading Tips This article is a part of InvestorPlace s Best ETFs for 2018 contest James Brumley s pick for the contest is 160 Powershares Water Resource Portfolio 160 NASDAQ,Best ETFs for 2018: Powershares Water Resource Portfolio Is a Pack Leader
2018-01-11,Global Water Resources Inc GWRS will begin trading ex dividend on January 12 2018 A cash dividend payment of 0 024 per share is scheduled to be paid on January 30 2018 Shareholders who purchased GWRS prior to the ex dividend date are eligible for the cash dividend payment,"Global Water Resources, Inc. (GWRS) Ex-Dividend Date Scheduled for January 12, 2018"
2018-01-12,Toward the end of trading Friday the Dow traded up 0 72 percent to 25 757 70 while the NASDAQ climbed 0 51 percent to 7 248 81 The S amp P also rose gaining 0 49 percent to 2 780 97 Leading and Lagging Sectors Friday afternoon the technology sector proved to be a source,Mid-Afternoon Market Update: Tuniu Gains After Announcing $100M Share Repurchase Program; Aradigm Shares Slide
2018-01-12,Looking at the universe of stocks we cover at Dividend Channel in trading on Friday shares of American Water Works Co Inc Symbol AWK were yielding above the 2 mark based on its quarterly dividend annualized to 1 66 with the stock changing hands as low as 80 57 on the day,AWK Dividend Yield Pushes Past 2%
2018-01-12,Looking at the sectors faring worst as of midday Friday shares of Utilities companies are underperforming other sectors showing a 0 3 loss Within that group American Water Works Co Inc Symbol AWK and Edison International Symbol EIX are two of the day s laggards showing a loss of 4,"Friday Sector Laggards: Utilities, Consumer Products"
2018-01-12,Midway through trading Friday the Dow traded up 0 79 percent to 25 776 71 while the NASDAQ climbed 0 57 percent to 7 252 69 The S amp P also rose gaining 0 49 percent to 2 781 24 Leading and Lagging Sectors On Friday the technology sector proved to be a source of strength for,Mid-Day Market Update: Dow Surges Over 200 Points; AquaBounty Technologies Shares Plummet
2018-01-12,In trading on Friday shares of American Water Works Co Inc Symbol AWK crossed below their 200 day moving average of 82 73 changing hands as low as 81 13 per share American Water Works Co Inc shares are currently trading down about 2 9 on the day The chart below shows the one,AWK Crosses Below Key Moving Average Level
2018-01-12,In trading on Friday shares of American Water Works Co Inc Symbol AWK entered into oversold territory changing hands as low as 81 13 per share We define oversold territory using the Relative Strength Index or RSI which is a technical analysis indicator used to measure momentum on a,American Water Works Stock Getting Very Oversold
2018-01-16,American Water Works Affirms 2017 Adj. EPS Guidance - Quick Facts,American Water Works Affirms 2017 Adj. EPS Guidance - Quick Facts
2018-01-16,"American Water Works Company, Inc. , the largest publicly-traded U.S. water and wastewater utility company, announced in a Form 8-K furnished to the SEC today an update to its previously issued earnings guidance, which includes estimated impacts of the Tax Cuts and Jobs Act .",American Water Affirms 2018 GAAP EPS Guidance Range of $3.22 to $3.32 Per Diluted Share and Long-Term Adjusted EPS Compound Annual Growth Rate of 7 to 10 Percent
2018-01-16,"Water stocks had a good 2017, with the larger water utility stocks, including American Water Works and Aqua America, easily beating the broader market.",The Best Water Stocks of 2017 -- How the 10 Largest Water Utilities Stacked Up
2018-01-16,Water stocks particularly water utility stocks have been having a great run in recent years Despite most of the group pulling back beginning in mid 2016 which we can largely attribute to expectations of rising interest rates water utility stocks turned in a good 2017 Water,The Best Water Stocks of 2017 -- How the 10 Largest Water Utilities Stacked Up
2018-01-16,Looking at the underlying holdings of the ETFs in our coverage universe at ETF Channel we have compared the trading price of each holding against the average analyst 12 month forward target price and computed the weighted average implied analyst target price for the ETF itself For,Implied RYU Analyst Target Price: $93
2018-01-18,"The application process is now open for Illinois American Water’s 2018 Environmental Grant Program. The program supports innovative, community-based environmental projects that improve, restore or protect watersheds through partnerships.",Illinois American Water Announces 2018 Environmental Grant Program
2018-01-19,Connecticut Water Services Inc CTWS continues to strengthen its water infrastructure to deliver safe and potable water to the customers and communities in its service territories The company has invested 17 million in 2017 to replace old and aging pipelines and aims to invest nearly 17,Connecticut Water Continues to Fortify Water Infrastructure
2018-01-19,"Pennsylvania American Water, a subsidiary of American Water , is the largest investor-owned water utility in the state, providing high-quality and reliable water and/or wastewater services to approximately 2.3 million people.",Company Profile for Pennsylvania American Water
2018-01-22,"Moody's Investors Service, (""Moody's"") has changed the rating outlooks to negative from stable for 24 regulated utilities and utility holding companies; and to stable from positive for one utility ...","Mobile (City of) AL, I.D.B. -- Moody's changes outlooks on 25 US regulated utilities primarily impacted by tax reform"
2018-01-23,Looking at the sectors faring best as of midday Tuesday shares of Utilities companies are outperforming other sectors higher by 1 1 Within the sector NextEra Energy Inc Symbol NEE and American Water Works Co Inc Symbol AWK are two of the day s stand outs showing a gain of 1 8,"Tuesday Sector Leaders: Utilities, Financial"
2018-01-24,"American Water , the largest publicly traded U.S. water and wastewater utility company, announced today that applications are now being accepted by its participating state subsidiaries for the company’s 2018 Environmental Grant Program awards.",American Water Accepting Applications for 2018 Environmental Grant Program
2018-01-25,Pennsylvania American Water today announced that applications are being accepted for its 2018 Stream of Learning Scholarship Program to provide financial assistance to high school seniors who are planning to pursue careers in the water and wastewater industry.,Pennsylvania American Water Kicks Off 2018 Stream of Learning Scholarship Program
2018-01-29,"Beth Matthews has been promoted to Director of Engineering for Illinois American Water and Iowa American Water. In her new role, Matthews will manage and coordinate capital investment projects and engineering activities in both states.",Illinois American Water and Iowa American Water Announce New Director of Engineering
2018-01-30,"American States Water Company (AWR) has increased its dividend for the past 50 consecutive years.  In comparison, the Utilities Select Sector SPDR ETF (XLU) is currently trading at a yield of 3.5%.  American States Water raised its dividend by 4%, compounded annually, over the last five years, in line with the industry average.",American States Water’s Stable Dividend Profile
2018-01-30,"As part of an annual maintenance program for its water distribution system, New Jersey American Water will temporarily change the water treatment process from a chloramine residual to free chlorine residual at the company’s Raritan-Millstone and Canal Road Surface Water Treatment plants.",New Jersey American Water Implements Temporary Treatment Changes in Water Treatment Plants Serving Central and Northern Parts of the State
2018-01-31,"The CEO of America's largest water utility warned that a federal push to streamline permits for infrastructure projects could stymie stronger water quality standards.  ""We've got to make sure we maintain water quality standards and actually in some cases increase them,"" American Water Works Company Inc CEO Susan Story said in an interview with Reuters on Wednesday.  Trump's plan to create $1.5 trillion of infrastructure investment is meant to boost the nation's crumbling roads, bridges, transit, airports, water and other infrastructure.","In push to cut permits, U.S. must still protect water quality - CEO"
2018-01-31,The water utility&apos;s guidance hints at good things to come.,Will 2018 Be American Water Works&apos; Best Year Yet?
2018-02-01,"Next week, Illinois American Water will begin installing almost two miles of water main to upgrade Godfrey’s water distribution system. This investment of $1.6 million includes upgrading water main to 8-inch and 12-inch water main.",Illinois American Water to Invest $1.6 million to Upgrade Nearly Two Miles of Water Main in Godfrey
2018-02-01,"Less than a year after acquiring the Village of Sadorus water system, Illinois American Water is investing approximately $1.2 million to upgrade Sadorus’ water distribution system. The project, which is currently under design, includes installing about three miles of water main to connect Sadorus to Illinois American Water’s Champaign County water distribution system.",Illinois American Water to Invest $1.2 million in Sadorus Water System
2018-02-01,"Recognizing that no one should go without the essential service of safe, reliable water, California American Water has launched a new hardship assistance program to provide relief for its most financially burdened customers.",California American Water Partners with United Way to Offer Financial Assistance Program
2018-02-01,"American Water , the largest publicly traded U.S. water and wastewater utility company, announced today that they have been awarded the 2017 Environmental Business Journal Business Achievement Award – Renewable Energy for their innovative geothermal system at William L.",American Water Geothermal System Receives 2017 EBJ Business Achievement Award
2018-02-01,"New Jersey American Water is accepting applications for green project funding through its Environmental Grant Program. The program offers funding up to $10,000 for qualifying innovative, community-based environmental projects that improve, restore or protect watersheds, surface water and/or groundwater supplies throughout the company’s service areas.",New Jersey American Water Accepting Applications for 2018 Environmental Grant Program
2018-02-01,American Water Works NYSE AWK one of the largest publicly traded water utilities in the United States is a boring company And that s a good thing when it comes to trying to figure out what the future holds for this key provider of water and wastewater services In 2018,What to Expect From American Water Works in 2018
2018-02-01,Feb.01 -- American Water Works CEO Susan Story discusses the United States' aging water infrastructure and why private industry is part of the answer to bring it up to date. She speaks with David Westin on &quot;Bloomberg Daybreak: Americas.&quot;,American Water Works CEO Says Water Infrastructure Needs $1T Investment
2018-02-01,"It should be more of the same in 2018 for American Water Works, which is a good thing for investors",What to Expect From American Water Works in 2018
2018-02-01,Last year was an excellent one for American Water Works NYSE AWK Shares rose 26 4 which crushed the market s return since the S amp P 500 only gained 19 4 Several factors drove that strong performance including solid earnings growth of about 7 and a 10 increase,Will 2018 Be American Water Works' Best Year Yet?
2018-02-02,"Shares of American Water Works Company Inc (NYSE:AWK) will begin trading ex-dividend in 3 days. To qualify for the dividend check of $0.42 per share, investors must have owned theRead More...","Only 3 Days Left To Cash In On American Water Works Company Inc (NYSE:AWK) Dividend, Is It Worth Buying?"
2018-02-02,"New Jersey American Water, a subsidiary of American Water, is the largest investor-owned water utility in the state, providing high quality and reliable water and/or wastewater services to approximately 2.7 million people.",Company Profile for New Jersey American Water
2018-02-02,Looking at the universe of stocks we cover at Dividend Channel on 2 6 18 Sirius XM Holdings Inc Symbol SIRI Sonic Corp Symbol SONC and American Water Works Co Inc Symbol AWK will all trade ex dividend for their respective upcoming dividends Sirius XM Holdings Inc will pay,"Ex-Dividend Reminder: Sirius XM Holdings, Sonic and American Water Works"
2018-02-05,In trading on Monday shares of American Water Works Co Inc Symbol AWK entered into oversold territory changing hands as low as 78 61 per share We define oversold territory using the Relative Strength Index or RSI which is a technical analysis indicator used to measure momentum on a,AWK Stock Crowded With Sellers
2018-02-05,"LONDON, UK / ACCESSWIRE / February 05, 2018 / Active-Investors has a free review on American Water Works Co., Inc. (NYSE: AWK) following the Company's announcement that it will begin trading ex-dividend ...","Ex-Dividend Alert: American Water Works Has Raised Dividend for 9 Years in a Row; Will Trade Ex-Dividend on February 06, 2018"
2018-02-05,American Water Works AWK will begin trading ex dividend on February 06 2018 A cash dividend payment of 0 415 per share is scheduled to be paid on March 01 2018 Shareholders who purchased AWK prior to the ex dividend date are eligible for the cash dividend payment This marks the,"American Water Works (AWK) Ex-Dividend Date Scheduled for February 06, 2018"
2018-02-05,"Pennsylvania American Water announced today that entries are now being accepted for its 16th Annual “Protect Our Watersheds” Art Contest. All fourth-, fifth-, and sixth-grade students in schools served by Pennsylvania American Water are eligible, as well as individual students who live in the company’s service area.","Ready, Set, Color: Now Accepting Entries in Pennsylvania American Water’s “Protect Our Watersheds” Art Contest"
2018-02-06,"New Jersey American Water today announced the start of water main replacement projects in its service areas in Burlington and Camden counties to improve service reliability, prevent water outages and enhance fire protection.",New Jersey American Water Investing Over $4.2 Million in Burlington and Camden Counties
2018-02-06,Forget short-term trading. These three dividend payers are built for the long haul.,3 Dividend Stocks That Should Pay You the Rest of Your Life
2018-02-07,"American Water Works Company, Inc. , the largest publicly traded U.S. water and wastewater utility company, announced today it was named as one of the 100 Most Sustainable Companies by Barron’s Magazine.",American Water Named One of the 100 Most Sustainable Companies
2018-02-07,"American Water Works Company, Inc. announced today that it intends to release its 2017 fourth quarter and year-end financial results after the market closes on Tuesday, Feb.","American Water’s 2017 Fourth Quarter, Year-End Conference Call Scheduled for February 21, 2018"
2018-02-07,Artesian Resources Corporation ARTNA will begin trading ex dividend on February 08 2018 A cash dividend payment of 0 235 per share is scheduled to be paid on February 23 2018 Shareholders who purchased ARTNA prior to the ex dividend date are eligible for the cash dividend payment,"Artesian Resources Corporation (ARTNA) Ex-Dividend Date Scheduled for February 08, 2018"
2018-02-07,"NEW YORK, Feb. 07, 2018-- In new independent research reports released early this morning, Fundamental Markets released its latest key findings for all current investors, traders, and shareholders of Sunstone ...","etailed Research: Economic Perspectives on Sunstone Hotel Investors, Cinemark, STORE Capital, USA Technologies, Parker Drilling, and American Water Works — What Drives Growth in Today's Competitive Landscape"
2018-02-08,SJW Group SJW will begin trading ex dividend on February 09 2018 A cash dividend payment of 0 28 per share is scheduled to be paid on March 01 2018 Shareholders who purchased SJW prior to the ex dividend date are eligible for the cash dividend payment This represents an 64 71,"SJW Group (SJW) Ex-Dividend Date Scheduled for February 09, 2018"
2018-02-08,California Water Service Group Holding CWT will begin trading ex dividend on February 09 2018 A cash dividend payment of 0 188 per share is scheduled to be paid on February 23 2018 Shareholders who purchased CWT prior to the ex dividend date are eligible for the cash dividend,"California Water  Service Group Holding (CWT) Ex-Dividend Date Scheduled for February 09, 2018"
2018-02-08,"Jim Cramer rattles off his take on callers' favorite stocks, including the stock of Hess.",Cramer's lightning round: Here's my playbook if you want to invest in oil
2018-02-09,"Jim Cramer rattles off his take on callers' favorite stocks, including the stock of Hess.",Cramer's lightning round: Here's my playbook if you want ...
2018-02-12,Global Water Resources Inc GWRS will begin trading ex dividend on February 13 2018 A cash dividend payment of 0 024 per share is scheduled to be paid on February 28 2018 Shareholders who purchased GWRS prior to the ex dividend date are eligible for the cash dividend payment This,"Global Water Resources, Inc. (GWRS) Ex-Dividend Date Scheduled for February 13, 2018"
2018-02-13,American States Water Company AWR will begin trading ex dividend on February 14 2018 A cash dividend payment of 0 255 per share is scheduled to be paid on March 01 2018 Shareholders who purchased AWR prior to the ex dividend date are eligible for the cash dividend payment This marks,"American States Water Company (AWR) Ex-Dividend Date Scheduled for February 14, 2018"
2018-02-13,Middlesex Water Company MSEX will begin trading ex dividend on February 14 2018 A cash dividend payment of 0 224 per share is scheduled to be paid on March 01 2018 Shareholders who purchased MSEX prior to the ex dividend date are eligible for the cash dividend payment This represents,"Middlesex Water Company (MSEX) Ex-Dividend Date Scheduled for February 14, 2018"
2018-02-14,Aqua America Inc WTR will begin trading ex dividend on February 15 2018 A cash dividend payment of 0 205 per share is scheduled to be paid on March 01 2018 Shareholders who purchased WTR prior to the ex dividend date are eligible for the cash dividend payment This marks the 3rd,"Aqua America, Inc. (WTR) Ex-Dividend Date Scheduled for February 15, 2018"
2018-02-14,"American Water Works Company, Inc. , the largest publicly traded U.S. water and wastewater utility company, today announced that Jeffrey N. Edwards and Admiral James Stavridis, U.S.",American Water Appoints Two New Independent Members to the Board of Directors
2018-02-16,InvestorPlace Stock Market News Stock Advice amp Trading Tips Dividend Aristocrats those companies that have improved their payouts annually for 50 years or more have a mixed reputation Sure they re great for dividend growth but the likes of The Coca Cola Co NYSE KO,5 Dividend Growth Stocks Powered by Unstoppable Megatrends
2018-02-16,American Water Works Company AWK is scheduled to report fourth quarter 2017 results after the market closes on Feb 20 Last quarter the company s earnings were in line with the Zacks Consensus Estimate Let s see how things are shaping up for the quarter Factors to Consider,American Water Works (AWK) Q4 Earnings: What's in the Offing?
2018-02-16,Looking at the underlying holdings of the ETFs in our coverage universe at ETF Channel we have compared the trading price of each holding against the average analyst 12 month forward target price and computed the weighted average implied analyst target price for the ETF itself For the,VONE's Underlying Holdings Could Mean 10% Gain Potential
2018-02-16,American Water Works (AWK) is likely to benefit from acquisitions and organic assets as it reports fourth-quarter earnings.,American Water Works (AWK) Q4 Earnings: What&apos;s in the Offing?
2018-02-18,Dividend Aristocrats – those companies that have improved their payouts annually for 50 years or more – have a mixed reputation.,5 Dividend Growers That Are About to Erupt
2018-02-20,American Water Works (NYSE: AWK ) announces its next round of earnings Tuesday. Here is Benzinga's everything-that-matters guide for today's Q4 earnings announcement. Earnings and Revenue Analysts expect ...,American Water Works Q4 Earnings Preview
