publishedAt,title,description
2021-06-12,"Unfortunately, a large proportion of the 100 most widely held stocks in Robinhood investors' brokerage accounts aren't the kind that will allow their owners to rest easy for years as time works its growth magic.  The second is optionality -- in other words, that the company has multiple ways in which it could grow.  Amazon.com (NASDAQ: AMZN), the ninth most popular stock on Robinhood, has both of those attributes in spades.",3 Popular Robinhood Stocks to Buy and Never Sell
2021-06-12,Learn how these on-demand entertainment giants have already changed the way we consume entertainment.,"Economics of Hulu, Netflix, Redbox and Blockbuster"
2021-06-12,"""In the Heights"" will test the theatrical comeback following the success of ""A Quiet Place II.""",'In the Heights' makes splashy debut amid rising box office optimism —  but ticket sales still a question
2021-06-13,"At Insider Monkey, we pore over the filings of nearly 866 top investment firms every quarter, a process we have now completed for the latest reporting period. The data we’ve gathered as a result gives us access to a wealth of collective knowledge based on these firms’ portfolio holdings as of March 31st. In this […]",Hedge Funds Aren’t Crazy About The Walt Disney Company (DIS) Anymore
2021-06-14,The trading platform's young traders love some blue chips that they may want to hold for a long time.,3 Robinhood Stocks to Buy and Hold Forever
2021-06-14,"Fully vaccinated visitors to Walt Disney Co's U.S. theme parks will not be required to wear face masks in most areas starting on Tuesday, the company said, as the country's COVID-19 cases continue to decline.  The new policy applies to guests at Walt Disney World in Orlando, Florida, and the Disneyland Resort in Anaheim, California.  Disney will not require proof of immunization, the company said in a blog post.",Vaccinated visitors to Disney's U.S. parks can ditch face masks in most areas
2021-06-15,"Walt Disney (DIS) closed at $175.86 in the latest trading session, marking a -1.3% move from the prior day.",Walt Disney (DIS) Dips More Than Broader Markets: What You Should Know
2021-06-15,"The U.S. housing market is on fire lately, so many investors are wondering the best ways to play it.  In this Fool Live video clip, recorded on June 7, Fool.com contributor Matt Frankel, CFP, and Industry Focus host Jason Moser discuss three excellent ways to invest in housing right now.  You have some REITs, you have some homebuilders, you have companies like Latch that make technology for houses.",3 Great Housing Stocks for 2021 and Beyond
2021-06-15,"Amid a pandemic that hobbled Disney's operations, streaming video has been a bright spot for the entertainment giant.",Will Disney Join the 200 Million Subscriber Club in 2021?
2021-06-15,"Ease in mandates and protocols might aid demand for theme parks and cruises, thereby driving Disney's (DIS) Parks, Experiences & Products segment growth in the rest of 2021.",Are Disney's (DIS) Parks & Cruises Heading for Brighter Days?
2021-06-15,"Wondering how to pick strong, market-beating stocks for your investment portfolio? Look no further than the Zacks Focus List.",Walt Disney (DIS) Boasts Earnings & Price Momentum: Should You Buy?
2021-06-15,The media giant's theme parks on both coasts are getting closer to returning to normal operations.,Disney World and Disneyland Loosen Pandemic Restrictions Today
2021-06-16,"Above: The Beachbody Company recently announced BOD Interactive (BODi), Beachbody’s new live interactive content subscription offering, launching in September. IPO Edge and The Palm Beach Hedge Fund Association will host a live fireside chat with senior executives at Forest Road Acquisition Corp. (NYSE: FRX) and The Beachbody Company Group, LLC to discuss their merger on Thursday, June […]","Join Live Fireside with Beachbody CEO, CFO, Forest Road Acquisition Corp. to Discuss Merger Thursday at 1 ET"
2021-06-16,"The end of the operating day has been somewhat of a buzzkill at Disney's (NYSE: DIS) Florida theme parks since they reopened 11 months ago, but that's about to change.  In the latest sign that things are getting back to normal at Disney World, the company has announced it will resume nightly fireworks shows at the Magic Kingdom and EPCOT starting July 1.",The Sky's the Limit at Disney World and Disneyland Next Month
2021-06-16,WWE sees strong ticket sales as it gears up to return to live touring.,WWE sees strong ticket sales as it gets back to live touring: Stephanie McMahon
2021-06-16,"Warren Buffett once famously claimed his favorite holding period for a stock was ""forever"".  Here are three stocks in my portfolio that check all three boxes: Disney (NYSE: DIS), Amazon (NASDAQ: AMZN), and ASML Holding (NASDAQ: ASML).  Disney has repeatedly tested my patience over the years, especially with the costly expansion of its streaming platforms and the shutdown of movie theaters and theme parks during the pandemic.",3 Stocks I'll Hold Forever
2021-06-16,"This surprising move will initially spark comparisons to Disney and Amazon, but the company's real inspiration probably comes from China.",Do Netflix's Retail Ambitions Make Any Sense?
2021-06-16,"There are now well more than a handful of premium direct-to-consumer streaming options for American consumers.  Consumers canceled 20% of their subscriptions in the last six months of the year, up from 15% in 2019 (when there wasn't a raging pandemic).  There's really only one big reason consumers sign up for or cancel a subscription: content.",The Next Battle in the Streaming Wars: Churn
2021-06-17,"Walt  Disney  Company (NYSE:DIS) got a price target boost from Guggenheim on trends that point to better recovery and higher spending at parks.  Analyst Michael Morris raised the price target to $215 from $210 with consumer trends pointing to a steeper parks recovery trajectory, StreetInsider reported.  ""The state of California has allowed Disneyland to return to full capacity as of 6/15 and Disneyland Paris is scheduled to re-open on 6/17,"" Morris wrote in a note.",Disney's Parks Seeing Steeper Recovery: Guggenheim
2021-06-17,Robinhood users don't just favor meme stocks; there are also some great long-term holdings in the list of top 100 names.,3 Robinhood Stocks to Buy in June
2021-06-17,"Consumers now expect more from their streaming platforms, and some don't feel like they're getting it.","Streaming's Easy-Growth Days Are Over, Apple and Netflix Face Greatest Risk"
2021-06-17,"Above: The Beachbody Company recently announced BOD Interactive (BODi), Beachbody’s new live interactive content subscription offering, launching in September. IPO Edge and The Palm Beach Hedge Fund Association hosted a live fireside chat with senior executives at Forest Road Acquisition Corp. (NYSE: FRX) and The Beachbody Company Group, LLC to discuss their merger on Thursday, June 17 […]","Replay: Live Fireside with Beachbody CEO, CFO, Forest Road Acquisition Corp. to Discuss Merger"
2021-06-18,"A slight miss in Disney+ subscribers disappointed investors, but that's missing the forest for the trees.","Disney's Reopening Is On Track, But What's Up With the Stock?"
2021-06-18,"Fox (NASDAQ: FOX)(NASDAQ: FOXA) is arguably best known for its news business, but its sports network has a big following, too.  Fox's recent sports history is a bit messy and convoluted, but it's important to understand what's at stake.  Following Fox's media assets sale to Disney in 2019, as a condition of the acquisition, Disney sold the Fox regional sports networks (RSNs) it acquired to Sinclair Broadcast Group.",Will a FanDuel and Fox Partnership Be a Sports Betting Powerhouse?
2021-06-18,"Roku, Inc. (ROKU) and TCL Electronics collaborate to launch TCL Roku TV models in the U.K.",ROKU Partners With TCL to Launch New TV models in the U.K.
2021-06-18,"Julie Hyman breaks down Friday's business headlines, including: JPMorgan, UBS, and Wells Fargo celebrating Juneteenth after congress passes a bill making it a federal holiday, Naomi Osaka pulls out of Wimbledon but says she will participate in the Olympics, and Snapchat getting rid of their speed filter after safety campaigners believed the filter encouraged reckless driving.","Big banks celebrating Juneteenth, Osaka pulls out of Wimbledon, Snapchat cancels speed filter"
2021-06-18,"In this article we discuss the 10 best spring stocks to buy now. If you want to skip our detailed analysis of these companies, go directly to the 5 Best Spring Stocks to Buy Now. Market experts had expected the spring of 2021 to be a welcome one for the economy with the COVID-19 vaccine […]",10 Best Spring Stocks to Buy Now
2021-06-18,"Wolfgang Puck, Chef & Restaurateur, joins Yahoo Finance to discuss NYC and California relaxing COVID-19 guidelines, the impact on the restaurant industry, and Wolfgang Puck’s upcoming Disney+ documentary.","Wolfgang Puck on restaurant recovery: ’Waiters make $120,000 a year but I can’t find them’"
2021-06-19,"In this article, we discuss the 10 best growth stocks to buy right now based on billionaire growth investor Philippe Laffont’s Q1 portfolio. If you want to skip our detailed analysis of these stocks, go directly to the 5 Best Growth Stocks to Buy Right Now. Philippe Laffont, the billionaire who runs New York-based hedge […]",10 Best Growth Stocks to Buy Right Now
2021-06-19,"Of note, the state of California has allowed Disneyland to return to full capacity as of June 15, and Disneyland Paris is scheduled to reopen on June 17.  The company has a strong balance sheet, with net cash of about $450 million.",Disney Stock Looks Set to Get a Boost From a Quicker Reopening
2021-06-20,The subscription economy has exploded in recent years to include everything from streaming services to tech solutions; could it now transform the auto industry?,The Death Of Car Ownership: This $30 Trillion Trend Could Kill The Auto Industry
2021-06-21,"Plus, best-selling author Daniel Kahneman shares insights from his new book, ""Noise: A Flaw in Human Judgment.""",Inflation Fears and Stock Market News
2021-06-21,"For investors in Disney (DIS), most of the focus this past year has been on the company’s success in its newfound streaming business. However, when diving into Disney, it’s important to look at the entirety of the picture of this media and entertainment conglomerate. This is a company with a world-class portfolio of IP that has found a way to monetize its brands to an extent that’s generally not seen with other companies of this size. Indeed, long-term investors who have bought and held Disney f",Not Just Streaming: Disney Showing Promise in Multiple Streams
2021-06-21,Disney and Dave & Buster's took steps forward even when the pandemic forced them to take a step back.,2 Stocks That Will Be Better Than They Were Before the Pandemic
2021-06-21,"Yahoo Sports Reporter, Vincent Goodwill, joins Yahoo Finance to discuss Trae Young and the Hawks dismantling of the 76ers process, as well as which team has the best chance to win the NBA title with Myles Udland.","Hawks soar past 76ers to the ECF, NBA title up for grabs"
2021-06-21,"ANAHEIM, Calif., Jun 21, 2021--Today, Seattle Seahawks quarterback Russell Wilson was revealed and celebrated as one of ‘Earth’s Mightiest Athletes,’ a new collective of sports superstars that embody the positive characteristics of Earth’s Mightiest Heroes—The Avengers. ‘Earth’s Mightiest Athletes’ aims to acknowledge and honor sports champions making positive change, recognizing their outstanding achievements on the playing field and their super-powered community service.",Russell Wilson Named One of ‘Earth’s Mightiest Athletes’ for Philanthropic Efforts Helping Youth
2021-06-21,"(Bloomberg) -- Steven Spielberg, the father of the modern movie blockbuster, signed a multiyear deal to provide films for Netflix Inc., promising a stream of new pictures for the online video leader.The multifilm agreement with Amblin Partners builds on an existing relationship, the parties said Monday in a statement. They’ve already teamed up on last year’s “The Trial of the Chicago 7” and the Leonard Bernstein biopic “Maestro,” which is in preproduction. Terms of the deal weren’t disclosed.Net",Netflix Signs Multiyear Deal for Films From Steven Spielberg
2021-06-21,"Walt Disney (DIS) closed at $173.97 in the latest trading session, marking a +0.9% move from the prior day.",Walt Disney (DIS) Gains But Lags Market: What You Should Know
2021-06-22,"The MGM deal, which would greatly expand content on the Amazon Prime Video streaming platform with the James Bond franchise and TV fare like ""The Handmaid's Tale,"" will fall under the purview of the FTC and its new chair, Lina Khan, according to a Wall Street Journal report Tuesday.",FTC to review Amazon’s planned $8.45 billion purchase of MGM: report
2021-06-22,The world's most-visited theme park resort has unveiled some of its plans for its upcoming 18-month-long 50th birthday celebration.,"Just Take My Money, Disney World"
2021-06-22,"Disney and Macy's are probably thanking their lucky stars that business is recovering, but are they ready to restart dividends?",Disney or Macy's: Which Is Closer to Restarting Dividend Payments?
2021-06-22,"Before there was Gordon Ramsay, Anthony Bourdain and Emeril Lagasse, there was Wolfgang Puck.",Wolfgang Puck reveals troubled childhood in Disney+ documentary
2021-06-22,"Netflix (NASDAQ: NFLX) has seen a massive increase in competition for consumer's couch time over the last couple of years. Media giants like Walt Disney (NYSE: DIS) have invested billions in direct-to-consumer streaming services new and old, while longtime-rival Amazon (NASDAQ: AMZN) also made a step-up in its streaming-content investment in 2020.",Netflix Could Raise Prices Again Soon
2021-06-22,"The latest Marvel series is off to a great start, as management aims to more than double Disney+ streaming subscribers over the next few years.","""Loki"" Is Breaking Records for Disney+: Here's Why It Matters"
2021-06-22,"Jim Cramer looks at some pandemic success stories and gauges how well they'll do as the economy reopens. Don't discount these stocks with staying power, he says.","Shutdown Stocks, Reopening Winners: Thor, Take-Two, Disney"
2021-06-22,"Jim Cramer and Katherine Ross are discussing where the workers have gone, Nvidia, Ford, the airlines, and more.","Watch: Jim Cramer on Torchlight, Nvidia, Ford, Markets Tuesday"
2021-06-22,"Jim Cramer and Katherine Ross are discussing where the workers have gone, Nvidia, Ford, the airlines, and more.","LIVE: Jim Cramer on Torchlight, Nvidia, Ford, Markets Tuesday"
2021-06-22,"Walt Disney's (NYSE: DIS) illustrious history has made it one of today's most popular blue-chip stocks.  The House of Mouse has been delighting its customers for decades and earning their loyalty.  Every year, millions of families descend on Disney theme parks around the world.",Here's Why Disney Will Still Be a Blue Chip Stock 10 Years From Now
2021-06-23,"AMC Entertainment (NYSE: AMC) is counting on movie studios bringing blockbusters to the big screen this summer to get moviegoers back into theater seats.  It may not be AMC's fault this is happening, but it doesn't bode well for the company and its investors.  Memorial Day was the hoped-for start of the recovery as it has historically held an important place in cinema as the start of the summer blockbuster season.",AMC's New Problem: Not Enough People Are Returning to Theaters
2021-06-23,"The Federal Trade Commission will review  (AMZN) planned takeover of the Hollywood studio MGM.  The regulator’s new chair, Lina Khan, has been critical of the online retailer’s size and influence.  Amazon announced the $8.5 billion equity and debt deal last month to boost its video streaming capabilities as it competes with  (NFLX) and  (DIS) MGM’s library includes the James Bond film franchise and television shows such as The Handmaid’s Tale and Vikings.",New Antitrust Regulator to Review Amazon’s MGM Deal
2021-06-23,"In this video, I talk about three reasons Disney (NYSE: DIS) is a must-buy and a stock to own forever.  With the parks reopening at close to full capacity, you can expect a great third quarter from Disney.  With summer around the corner, we can expect Disney's parks to be full almost every day.",Disney: The One Stock I Am Buying and Holding Forever
2021-06-23,"Actor Harrison Ford injured his shoulder while rehearsing for a fight scene for a new ""Indiana Jones"" movie, Walt Disney Co said on Wednesday.  Production of the fifth ""Indiana Jones"" film will continue while ""the appropriate course of treatment is evaluated"" for the 78-year-old actor, Disney said in a statement.  Disney currently plans for it to debut in July 2022.",Harrison Ford injures shoulder on set of new 'Indiana Jones' movie
2021-06-23,"Actor Harrison Ford injured his shoulder while rehearsing for a fight scene for a new ""Indiana Jones"" movie, Walt Disney Co said on Wednesday.  Production of the fifth ""Indiana Jones"" film will continue while ""the appropriate course of treatment is evaluated"" for the 78-year-old actor, Disney said in a statement.  Disney currently plans for it to debut in July 2022.",UPDATE 1-Harrison Ford injures shoulder on set of new 'Indiana Jones' movie
2021-06-24,ViacomCBS (VIAC) announces leadership restructuring for its streaming content to boost audience growth and engagement across genres and markets.,ViacomCBS (VIAC) Reorganizes Businesses to Focus on Streaming
2021-06-24,You'll pay $220 for a lightsaber and $30 for a ride-enhancing web-slinging accessory -- and like it.,Disneyland and Disney World Are More Brilliant Than Greedy
2021-06-24,"After a solid year of gains in 2020, Walt Disney's (NYSE: DIS) stock price is on a choppy path in 2021.  Interestingly, Disney's business was in a holding pattern in 2020, waiting for governments to get control of the coronavirus.  All of Disney's theme parks are open.",Could Disney Stock Be Worth $200 by Year End?
2021-06-24,"Bank of America (NYSE: BAC) CEO Brian Moynihan recently said that consumer spending is 20% higher in June than it was before the COVID-19 pandemic.  Pent-up demand is translating into a big jump in spending, and in this Fool Live video clip, recorded on June 14, Fool.com contributor Matt Frankel, CFP, and Industry Focus host Jason Moser discuss some potential winners.  Jason Moser: Bank of America CEO Brian Moynihan has noted that consumer spending is 20% higher this year than 2019.",Consumer Spending Is Up 20% From 2019 Levels -- Here's How to Invest
2021-06-24,"Netflix (NASDAQ: NFLX) remains the leader in the industry, surpassing 200 million subscribers as of last year.  What does Amblin Entertainment do for Netflix?  Amblin Entertainment might sound familiar to readers who enjoy watching films, and that's because it is mega-director Steven Spielberg's entertainment company, producing films such as Jaws and Indiana Jones.",Can This Be a Game-Changer for Netflix?
2021-06-24,"ViacomCBS and Roku are both in the spotlight on a report that Comcast is pondering a bid for one of the companies, even as Comcast calls it ""pure speculation.""",Comcast Says 'Pure Speculation' It's Mulling Bids for ViacomCBS or Roku
2021-06-24,"The market is laser focused on growth at Disney+, but the potential growth at the theme parks is getting overlooked.","Even After Disney's Growth, Here's Why It Still Looks Cheap"
2021-06-25,By Dhirendra Tripathi,Netflix Gains As Credit Suisse Upgrades To Outperform
2021-06-25,"There are few stocks that are as well positioned to benefit from both the stay-at-home economy of the past year and a half and the reopening as Walt Disney (NYSE: DIS).  In this Fool Live clip, recorded on June 14, Fool.com contributor Toby Bordelon explains why.  Toby Bordelon: We're heading out, we're having fun and I think one company that's going to benefit from that is Disney.",1 of the Best Reopening Stocks You Can Buy
2021-06-25,Bloomberg Intelligence Senior Media Analyst Geetha Ranganathan joins Yahoo Finance's Alexandra Canal to break down the latest box office expectations surrounding the new 'Fast and Furious' film.,'F9' looks to rev up box office as strategist warns industry 'not out of the woods yet'
2021-06-26,"The latest installment of the ""Fast and Furious"" franchise is widely expected to rev up the domestic box office after lukewarm showings from ""Cruella"" and ""In the Heights.""",'Fast and Furious' set to rev up box office as 'pervasive' streaming keeps fans at home
2021-06-26,"In this article, we discuss the 10 stocks to buy to profit from post-COVID economic recovery. If you want to skip our detailed analysis of these stocks, go directly to the 5 Stocks to Buy to Profit from Post-COVID Economic Recovery. Inflation fears and a cryptocurrency slump in recent weeks have hit some of the […]",10 Stocks to Buy to Profit from Post-COVID Economic Recovery
2021-06-27,"In order to help you find stocks that will help you breeze through retirement financially, three Motley Fool contributors are recommending three dividend-paying stocks that can be solid additions to your retirement portfolio.  Eric Volkman (Consolidated Edison): One of the sturdiest dividend stocks on the scene is Consolidated Edison (NYSE: ED), the long-standing utility that supplies power and natural gas to New York City and its environs.  Dividend raises from Con Ed, as New Yorkers like to call it, are so reliable, the company is a Dividend Aristocrat -- one of only a clutch of S&P 500 index stocks that have lifted their payouts at least once annually for a minimum of 25 years in a row.",3 Best Dividend Stocks for Retirement
2021-06-27,"As the economy rebounds and stimulus checks reach families, these two companies should see even greater demand for their services.",2 Stocks That Could Benefit From Biden's Stimulus Plan
2021-06-28,"Walt Disney Co postponed its first test cruise since the onset of the global coronavirus pandemic after COVID-19 tests  provided inconsistent results for five crew members, the company said on Monday.  Several cruise lines have planned to resume voyages from the United States after many months.  Last weekend, Royal Caribbean Group's Celebrity Edge became the first vessel from a major operator to sail from a U.S. port.",UPDATE 2-Disney delays test cruise over inconsistent COVID-19 results
2021-06-28,"Walt Disney (DIS) closed the most recent trading day at $176.57, moving -1% from the previous trading session.",Walt Disney (DIS) Stock Sinks As Market Gains: What You Should Know
2021-06-28,"(Bloomberg) -- Cruise stocks fell after industry leader Carnival Corp. announced an additional stock sale and Walt Disney Co. delayed a trial sailing.Carnival is selling as much as $500 million in stock, according to a filing Monday, with proceeds earmarked for the repurchase of its Carnival Plc shares and for general corporate purposes. The shares fell 7% to $26.15 at the close in New York, the biggest decline since March.Other operators lost ground in sympathy, with Royal Caribbean Cruises Ltd",Cruise Shares Tumble; Disney Delays Tuesday’s Trial Sailing
2021-06-28,"Walt Disney Co's cruise division said on Monday it had postponed its first test cruise since the onset of the pandemic after a few volunteers showed inconsistent COVID-19 test results.  Several cruise lines have planned to resume voyages from the United States after many months, with Royal Caribbean Group's Celebrity Edge last weekend becoming the first vessel from a major operator to sail from a U.S. port.  Disney Cruise Line did not say when it would next commence sailing of the ship.",UPDATE 1-Disney delays test cruise on 'inconsistent' COVID-19 test results
2021-06-28,"Apple (AAPL) is producing its first-ever French original series, Liaison, which will have a mixture of both English and French dialogues.",Apple (AAPL) Expands Apple TV+ Content With First French Show
2021-06-28,"Olympic American track and field athlete, Kerron Clement, joins Yahoo Finance to discuss the impact of COVID on the Tokyo Olympics, how new shoe technology is changing the track & field landscape, and Nike’s monopoly on the track and field events at the Olympics.",Olympian Kerron Clement describes hardships facing track and field athletes
2021-06-28,"The Walt Disney Company ( NYSE:DIS ), is one of the biggest entertainment conglomerates. It has a massive number of subsidiaries which operate in two broad segments. The first one is Disney media and entertainment, which accounts for the majority of revenues after the pandemic. The other is Disney parks, experiences and products.",Walt Disney (NYSE:DIS) Needs to Boost Returns on Capital Employed
2021-06-28,"Several cruise lines have planned to resume voyages from the United States after many months.  Last weekend, Royal Caribbean Group's Celebrity Edge became the first vessel from a major operator to sail from a U.S. port.  The Disney Dream had been scheduled to set sail on Tuesday.",Disney delays test cruise over inconsistent COVID-19 results
2021-06-28,"People are starting to take vacations again, but business travel and group events haven't made much of a comeback.  Matt Frankel: In a normal year those numbers would be terrible.  There's leisure travel, and then there's business and group travel, pretty much all of that 61% occupancy is leisure travel right now.",1 Travel Stock That Could Have Tremendous Upside in 2021 and Beyond
2021-06-29,"""F9"" is raising the bar for other summer tentpoles, most notably Marvel's ""Black Widow.""",'Black Widow' may outdo 'F9' as streaming turns box office into 'Wild West'
