publishedAt,title,description
2021-08-24,"At the pandemic onset, The Walt Disney Company (NYSE: DIS) was forced to lock the turnstiles at its theme parks.  As parks are reopening, The House of Mouse is announcing new programs that are pleasing some and irking others, depending on if you think Disney is making parks accommodate guests at a wider range income levels or if you think it is trying to extract more money from visitors.  One change it made was to cancel the previous annual pass program at Disney parks in California.","Disney's New Price Policies Inclusive, or Greedy?"
2021-08-24,Bet on companies with deep economic moats -- or the ability to maintain competitive advantages over the long term.  Walt Disney (NYSE: DIS) fits the bill.  Walt Disney is several businesses rolled into one.,Here's My Top Growth Stock to Buy Right Now
2021-08-25,"We also chat with Julia Galef about her book, ""The Scout Mindset: Why Some People See Things Clearly and Others Don't.""","Earnings Roundup: Disney, Airbnb, eBay, and More"
2021-08-25,"JAKKS Pacific (JAKK) is poised to benefit from solid international footprint, focus on innovation and collaborations with popular brands.",JAKKS Pacific (JAKK) Rallies 160% YTD: Will the Momentum Stay?
2021-08-25,"What, exactly, is Hulu? For years, its core brand identity in a nutshell has been: Watch the TV you know and love, streamed over the internet. Right now, analysts say, Hulu’s biggest advantage in the streaming wars is that it serves up most of the scripted programming released on broadcast networks. Yes, it has thrown […]",Hulu’s Looming Content Crisis Underscores Need for Original Hits
2021-08-25,"In the past few weeks, more employers announced plans to mandate COVID-19 vaccinations for workers who report to in-person offices.  The government-run U.S. Equal Employment Opportunity Commission has stated it is legal under federal law for companies to require their workers to get the COVID-19 vaccine, with a few exceptions related to other health complications, pregnancy and religious beliefs.","Goldman Sachs, McDonald’s, tell employees to get vaccinated before coming back to work"
2021-08-25,"The historically potent summer season has been a wash, as false starts, the surge of the delta variant, and political wrangling have kept sailings in check for Carnival (NYSE: CCL) (NYSE: CUK), Royal Caribbean (NYSE: RCL), Norwegian Cruise Line Holdings (NYSE: NCLH), and Walt Disney (NYSE: DIS).  The Centers for Disease Control and Prevention updated its guidance for cruise passengers late last week.","1 More Curve for Carnival, Royal Caribbean, Norwegian Cruise Line, and Disney"
2021-08-25,"(Bloomberg) -- Vaccine mandates are beginning a march across the U.S., constricting the places that people who have shunned the shots can work, shop and play.A day after the federal Food and Drug Administration approved the Pfizer BioNTech vaccine, institutions central to their regions announced tougher -- perhaps bellwether -- rules. In New York, a city driven by finance, Goldman Sachs Group Inc. required bankers to prove they’d been vaccinated. In football-crazed Baton Rouge, Louisiana State U","Get Shots or Get Out, U.S. Employers Are Telling Workers"
2021-08-25,"In this article we will take a look at the 10 stocks that crushed earnings expectations. You can skip our detailed analysis of these companies, and go directly to the 5 Stocks that Crushed Earnings Expectations. Most of the big-cap U.S. stocks have already released their financial results for the second quarter. Currently, we are […]",10 Stocks that Crushed Earnings Expectations
2021-08-26,"Life is changing for some of the world’s most highly paid people, and you’ve got to wonder: Who’s coming out ahead?",Hollywood stars vs. CEOs: Who’s getting the better deal on pay?
2021-08-26,"GLENDALE, Calif., August 26, 2021--ELLE and Disney join forces to present ‘Modern Heroines’ as part of global ""Ultimate Princess Celebration.""","ELLE and Disney Join Forces to Present ‘Modern Heroines’ as Part of Global ""Ultimate Princess Celebration"""
2021-08-26,"With the delta variant of COVID-19 spreading around the world and prolonging the pain of the pandemic, it feels a little like Walt Disney (NYSE: DIS) is back in a sort of no man's land all over again.  COVID-19 continues to alter consumer activity, and in-person experiences -- what was once Disney's marquee segment -- may not be the same again for a long time.  In fact, Disney has severely underperformed the S&P 500 since the start of 2020 (thanks, in no small part, to the stock's 2% decline so far this year compared to a nearly 20% gain for the index).",Should You Buy Disney Stock In Spite of Delta Variant Concerns?
2021-08-26,"As part of Disney's ""Ultimate Princess Celebration,"" ELLE Magazine and Walt Disney Co (NYSE: DIS) announced it's honoring 14 real-life heroes and heroines who embody the courage and kindness of the beloved Disney Princess characters, who continue to inspire people worldwide, regardless of age. ""Though each Disney Princess is unique with their own story of trials and triumphs, they all embody the characteristics of courage and kindness and continue to inspire fans of all ages worldwide,"" said Mel","Thinking About Buying Stock Or Options In Disney, Lululemon Or Express?"
2021-08-27,"There are a bunch of different streaming services out there that consumers can pick from today.  Top choices include AT&T's (NYSE: T) HBO Max, Amazon Prime Video, and Walt Disney's (NYSE: DIS) Disney+.  Let's find out how vital Netflix's first-mover advantage is in the highly competitive streaming market.",This Is the Single Most Important Aspect of Netflix's Dominance
2021-08-27,"Shortly after Amazon Inc. (NASDAQ: AMZN) revealed it is purchasing the studio MGM Holdings Inc (OTC: MGMB) for $8.45 billion including debt, Reese Witherspoon's media business, Hello Sunshine, has been sold to a firm backed by private-equity giant Blackstone Group Inc. with the goal to build an independent entertainment company for Hollywood's streaming era. After having received several offers, including one from the tech titan itself Apple Inc (NASDAQ: AAPL), Hello Sunshine will be entrusted t",Streaming Is Reshaping Hollywood Storytelling
2021-08-27,"One of the most common questions traders have about stocks is “Why Is It Moving?” That’s why Benzinga created the Why Is It Moving, or WIIM, feature in Benzinga Pro. WIIMs are a one-sentence description as to why a stock is moving. Analysts and brokerage firms often use ratings when they issue stock recommendations to stock traders. Analysts arrive at stock ratings by researching public financial statements, communicating with executives and customers and following industry trends. Deutsche Bank","Thinking About Buying Stock Or Options In Disney, Blink Charging Or Dave & Buster's?"
2021-08-27,"YouTube has a different operating model than the other streaming giants. Still, it's competing for people's attention during leisure time.",Alphabet Paid YouTube Creators $30 Billion Over 3 Years; What That Could Mean for Netflix and Disney
2021-08-27,"American Campus Communities (NYSE: ACC) is seeing its business rebound quite strongly compared with last year, but believe it or not, the company's college housing properties might not even be the most exciting part of the business.  In this Fool Live video clip, recorded on Aug. 17, Millionacres real estate investment trust analyst Matt Frankel, CFP, and editor Deidre Woollard discuss a massive project American Campus Communities is currently building and why it's such a big deal.  Matthew Frankel: I drove by their Disney (NYSE: DIS) project last week.",1 Big Reason American Campus Communities Is Worth a Closer Look
2021-08-27,The two store-in-a-store announcements come on the heels of excellent quarterly results for both retailers.,Toys R Us in Macy's or Disney Shops in Target: Which Will Have the Bigger Impact?
2021-08-27,"Walt Disney's (NYSE: DIS) ongoing experiment with the dual release of some of its films in theaters and on its Disney+ streaming service seems to be working, at least for Disney.  To be sure, the decision has irked movie theater operators like AMC Entertainment Group because it violates long-held deals regarding theater-only release windows and hurts theater revenue.  In its most recent quarterly report, Disney highlighted that premier access sales of Cruella bolstered revenue at Disney+.","$125 Million in Disney+ Sales for ""Black Widow"" Bolsters Switch-to-Streaming Argument"
2021-08-28,Some investors are eagerly awaiting for The House of Mouse to start returning cash to shareholders again.,Could Disney Restart Its Dividend Next Quarter?
2021-08-28,"Target (NYSE: TGT) preps for the holidays by tripling the number of Disney (NYSE: DIS) shops inside its stores.  The activist investor battle between Starboard Value and Box escalates.  In this episode of MarketFoolery, Jason Moser analyzes those stories, as well as the ""War On Cash"" drama that broke out at WWE's (NYSE: WWE) SummerSlam event in Las Vegas.",Is Target's Disney Maneuver the Future of Malls?
2021-08-28,"In 2020, we saw the birth of ""meme stocks"": businesses in dire straits that nevertheless garnered significant retail investor interest.  Movie theater chain AMC Entertainment (NYSE: AMC) is among them with shares up over 600% in the past year.  Here are three warning signs that should have AMC investors rethinking their position.",3 Reasons to Sell AMC Stock
2021-08-28,"The House of Mouse is gaining streaming customers quickly, but investors need to look at the details to get the whole picture.",Netflix Dominates Disney+ on This Must-See Figure
2021-08-29,"The last two decades have been great for this trio, but you'll be even more impressed with what they do in the next two.",3 Top Stocks You Can Buy and Hold for the Next 20 Years
2021-08-30,By Geoffrey Smith,Wall Street Opens Mixed as Eyes Turn to Jobs Report; Dow Down 15 Pts
2021-08-30,"T-Mobile US Inc. faces stiff competition in the wireless market that could further slow its share gains, according to KeyBanc Capital Markets analyst Brandon Nispel. He downgraded T-Mobile's stock to sector weight from overweight Sunday, in a note titled ""Just Another Carrier."" In Nispel's view, the cable industry could be the biggest share gainer in the wireless market, and he expects cable operators to continue winning share. As for T-Mobile, he worries that ""the postpaid to prepaid migration",T-Mobile stock gets a downgrade amid competitive concerns
2021-08-30,"New annual passes are finally coming back to Walt Disney's (NYSE: DIS) flagship Florida resort.  Disney World announced on Monday morning that it will start selling annual passes again on Sept. 8, in time for the park's 18-month celebration of the resort turning 50 that kicks off in October.  Disney mentioned four weeks ago -- when it reintroduced annual passes for Disneyland in California -- that it would be providing details later this month on the revised program to resume sales next month.",Annual Passes Are Back at Disney World
2021-08-30,"At the pandemic's onset, marketers reined in their ad spending as the direction of world economies was uncertain.  Admittedly, these metrics are more relevant to digital advertising on phones, tablets, and computers.",Advertising Is Getting Expensive: Why That's Good News for Disney Stock
2021-08-30,Entertainment behemoth Disney may lean on sports betting platforms to provide advertising revenue for ESPN as it transitions to a streaming future.,Disney (DIS) Explores Deals With Sports Betting Platforms
2021-08-30,"In this article, we discuss the 15 stocks Mario Gabelli is dumping. If you want to skip our detailed analysis of these stocks, go directly to Mario Gabelli is Dumping These 5 Stocks. Mario Gabelli, a Wall Street veteran who manages more than $11.7 billion in assets through GAMCO Investors, has over the years developed […]",Mario Gabelli is Dumping These 15 Stocks
2021-08-30,"There are a number of ways to analyze a company such as Walt Disney (NYSE:DIS), and picking the right approach is not always straight forward. When complexity overwhelms us, we tend to resort to short-term strategies and use mental shortcuts. One of these strategies is to follow what other investors are doing. In this article, we will focus on following the money of 2 investor groups: Insiders and institutions.",There are Two Main Reasons why Disney's (NYSE:DIS) Insider Transactions are Disappointing
2021-08-30,"Benchmarks closed higher on Friday with the S&P 500 and Nasdaq hitting fresh all-time highs after Federal Reserve Chair Jerome Powell assured that they might taper bond purchases this year, but interest rate hikes are still far away.","Stock Market News for Aug 30, 2021"
2021-08-31,"Walt Disney Co said on Tuesday that content from its streaming service Hotstar — home to India's IPL cricket tournament and original shows like ""Aarya"" — will migrate to its ESPN+ and Hulu streaming platforms in the United States.  Disney, which has 174 million paying customers across its four streaming services, is looking to slowly consolidate its content into a Disney Bundle, which includes ESPN+, Hulu, Disney+ and more than 100,000 movies, TV episodes as well as sports events.","UPDATE 1-Disney to move Hotstar content to Hulu, ESPN+ in U.S."
2021-08-31,"The stock market keeps hitting news highs, but many shares that took off in the wild ride of 2020 are now falling back to earth.  Corrections can look scary to investors, but if you pick companies with strong fundamentals and a solid long-term outlook, they may well provide a better journey ahead.  Airbnb (NASDAQ: ABNB), Walt Disney (NYSE: DIS), and Home Depot (NYSE: HD) are all trading below their all-time highs as the market becomes more subdued.",3 Stocks Off Their Highs to Buy Right Now
2021-08-31,"(Reuters) -Walt Disney Co said on Tuesday that content from its streaming service Hotstar — home to India's IPL cricket tournament and original shows like ""Aarya"" — will migrate to its ESPN+ and Hulu streaming platforms in the United States.  Disney, which has 174 million paying customers across its four streaming services, is looking to slowly consolidate its content into a Disney Bundle, which includes ESPN+, Hulu, Disney+ and more than 100,000 movies, TV episodes as well as sports events.","Disney to move Hotstar content to Hulu, ESPN+ in U.S"
2021-08-31,"Walt Disney Co said on Tuesday that content from its streaming service Hotstar, home to India's IPL cricket tournament and original shows like ""Aarya"", will migrate to its ESPN+ and Hulu streaming platforms in the United States.  Disney, which has 174 million paying customers across its four streaming services, is looking to slowly consolidate its content into a Disney Bundle, which includes ESPN+, Hulu, Disney+ and more than 100,000 movies, TV episodes as well as sports events.","Disney to move Hotstar content to Hulu, ESPN+ in U.S."
2021-08-31,"Disney is taking a new step to streamline its streaming portfolio: The media company plans to phase out the Hotstar U.S. service — which provides live cricket and South Asian programming to American audiences — over the next year. Instead, Disney will take the sports and entertainment programming in Hotstar and repackage it into ESPN […]","Disney to Phase Out Hotstar U.S. Streaming Service, Fold Programming Into Hulu and ESPN Plus"
2021-08-31,"The top theme park operator is reportedly going through a lull in attendance, but it's all about to change.",Disney World Won't Be Quiet for Long
2021-08-31,"Walt Disney World is set to resume selling annual passes, but the new slate of offerings will come without some key perks that used to sweeten the deal for many travelers.  Although Walt Disney World  (DIS)  reopened last summer, the House of Mouse has not been selling annual passes since then, owing to the operational challenges posed by the COVID-19 pandemic.  The four tiers of passes, which vary based on price and eligibility, will be sold beginning Sept. 8.",Walt Disney World unveils new annual passes — with higher prices and fewer perks
2021-08-31,"Today's video focuses on Disney (NYSE:DIS), Tesla (NASDAQ:TSLA), Paysafe (NYSE:PSFE), and Spotify (NYSE:SPOT). These four companies are the ones I have on my potential buying list due to recent stock price movements and news.",I'm Watching These 4 Stocks This Week for Potential Buying Opportunities
2021-08-31,"One of the communal aspects that has made investing and trading a type of social experience for younger investors has been the use of the Robinhood (NASDAQ: HOOD) brokerage app.  Robinhood's list of the 100 most popular stocks on its app has been around since early in its launch.  It may not have been the company's strategy prior to the pandemic, but Walt Disney (NYSE: DIS) has used the unusual circumstances of the last 18 months to remake itself.",3 Robinhood Stocks Investors Can't Get Enough Of
2021-08-31,"Once upon a time, Disney's (NYSE: DIS) parks and experiences segment was its main revenue driver.  Disney consolidated the parks and experiences segment with products in 2018, and out of four segments, it provided the largest portion of total sales for the years 2017, 2018, and 2019.",Will Disney's Parks Ever Be Important Again?
2021-08-31,By Dhirendra Tripathi,Disney Gains as It Launches Star+ Streaming Service in Latin America
2021-09-01,"The cruise boat industry is fighting Gov. Ron DeSantis's ban of vaccine mandates, insisting its passenger prove vaccination.",Florida’s Covid Resurgence Threatens Tourism Industry
2021-09-01,"A new Marvel movie, the return of Disney World annual passes, and a new ""Star Wars"" series on Disney+ will play starring roles this month.",3 Dates for Disney Stock Investors to Circle in September
2021-09-01,"Finding strong, market-beating stocks with a positive earnings outlook becomes easier with the Focus List, a top feature of the Zacks Premium portfolio service.",Walt Disney (DIS) Boasts Earnings & Price Momentum: Should You Buy?
2021-09-01,"Marvel's next big-screen superhero spectacle, ""Shang-Chi and the Legend of the Ten Rings,"" opens Friday, aiming to thrill audiences while breaking Hollywood barriers with a predominantly Asian cast.  The movie's stars said the film follows the path blazed by ""Black Panther,"" the 2018 Marvel Studios movies starring the late Chadwick Boseman and a predominantly African-American cast that became a global blockbuster.  Walt Disney Co is sending ""Shang-Chi"" exclusively to theaters.",Asian-led 'Shang-Chi' battles for glory in Marvel's film universe
2021-09-01,"Nat Schindler, Bank of America Senior Internet, Digital Media Analyst joins Yahoo Finance’s Alexandra Canal and the Yahoo Finance Live panel to discuss the latest news from Netflix.",These are the three most important shows for Netflix: Analyst
2021-09-01,"Disney (DIS) is planning to phase out the U.S. operations of Hotstar, its streaming service aimed at the South Asian diaspora.",Disney (DIS) to Shutter Hotstar US by Late 2022
2021-09-02,"Locast, a service that streamed local TV for free in about three dozen U.S. cities, suspended its operations Thursday after losses in court against the broadcast industry.",Free TV service Locast suspends operations after legal defeat
2021-09-02,"Locast said on Thursday it had suspended all operations, days after a Manhattan federal court knocked out an important defense for the over-the-air streaming service against copyright infringement claims brought by the four major U.S. television networks.  Even though Locast is a nonprofit, it makes too much money from user payments to be exempt from Walt Disney Co unit ABC, CBS, Comcast's NBC and Fox's claims under part of the law that protects non-profits retransmitting copyrighted works, U.S. District Judge Louis Stanton ruled https://www.reuters.com/legal/transactional/locast-loses-key-defense-against-major-networks-copyright-claims-2021-09-01 Tuesday.  ""As a nonprofit, Locast was designed to operate in accordance with the strict letter of the law, but in response to the court's recent rulings, we are hereby suspending operations, effective immediately,"" the company said in a statement on Thursday.",TV streamer Locast halts operations after losing key ruling in fight with networks
2021-09-02,"August was another great month for the stock market, with indexes hitting fresh highs.  The Dow Jones Industrial Average (DJINDICES: ^DJI) has now gained roughly 16% so far in 2021 and several of its members, including Microsoft and American Express, are up over 30% so far.  On the other hand, a few of the Dow's 30 components are flat or even down slightly as we approach the final quarter of the year.",3 Flagging Dow Giants to Buy Today
2021-09-02,"In a streaming world where content is king, Netflix will rely on its heavy hitters in order to compete.",Netflix's 3 'most important' shows as content wars with Disney/Apple/HBO heat up
2021-09-03,"Chinese authorities have not cleared Marvel's ""Shang-Chi and the Legend of the Ten Rings.""",Don’t Expect a Big Opening Weekend for Marvel’s ‘Shang-Chi.’ Disney May Have a China Problem.
2021-09-03,"Walt Disney (NYSE: DIS) entered the fray in the streaming wars in earnest in November of 2019 with the launch of Disney+.  What's more, Disney+ is still in expansion mode.  On Aug. 31, the company added several Latin American countries to its active markets list.",Disney+ Launches in Latin America: What That Could Mean for Disney Stock
2021-09-03,Fox (FOXA) reported earnings 30 days ago. What's next for the stock? We take a look at earnings estimates for some clues.,Fox (FOXA) Down 0.1% Since Last Earnings Report: Can It Rebound?
2021-09-03,"After 2020 led to more streaming service signups than ever before, many competitors in the streaming wars are focused just as much on subscriber retention as they are on gaining new subscribers.  Indeed, subscriber churn can make or break quarterly net subscriber addition numbers for an established service like Netflix (NASDAQ: NFLX), Amazon (NASDAQ: AMZN) Prime, Walt Disney's (NYSE: DIS) Disney+ and Hulu, or AT&T's (NYSE: T) HBO Max.",Why the Streaming Leaders Are Staying on Top
2021-09-03,"Halloween is eight weeks away, but don't tell Universal Studios theme park operator Comcast (NASDAQ: CMCSA) that it's too early to go creepy for cash.  With locals clamoring for stuff to do (and now a new rival getting in on the scare maze), it's all treats and hopefully no tricks for Comcast's Universal Orlando resort.",Disney World's Top Rival Is Ready to Cash In on Halloween
2021-09-03,"In this article, we are going to list the 16 most valuable entertainment companies in the world. You can skip our detailed analysis of the entertainment industry, and go directly to the 5 Most Valuable Entertainment Companies in the World. Despite being one of the most valuable industries in the world, the global entertainment and […]",16 Most Valuable Entertainment Companies in the World
2021-09-04,Theaters are still 'cautiously optimistic' after more film delays hit the 2021 fall schedule.,"Theaters 'roll with the punches' in face of 'Top Gun' delay, 'Shang Chi' debut"
2021-09-05,"The stock market continues to set new records, despite threats to the economy, because the Federal Reserve has kept its easy-money policies at full throttle.  Although Fed Chairman Jerome Powell has signaled that interest rates will need to start rising by 2023, they will still be at historically rock-bottom rates, which suggests there's plenty more upside in stocks for a long time to come.  Growth stock investors should find market conditions ripe for further gains, and investing in Zynga (NASDAQ: ZNGA), Coty (NYSE: COTY), and Disney (NYSE: DIS) will let them capitalize on the opportunity.","Got $2,000? 3 Top Growth Stocks to Buy in September"
2021-09-05,"On what's traditionally one of the sleepiest weekends at the movies, the Marvel film “Shang-Chi and the Legend of the Ten Rings"" smashed the record for Labor Day openings with an estimated $71.4 million in ticket sales, giving a box office reeling from the recent coronavirus surge a huge lift heading into the fall season.",Marvel’s ‘Shang-Chi’ smashes Labor Day box-office records
2021-09-06,"Television aggregator Roku Inc said on Monday it would launch its streaming players in Germany later this year, its second big European rollout, seeking to capitalize on a pandemic-driven shift towards watching more video on demand.  Roku will offer content from local partners Seven.One Entertainment Group, RTL Deutschland and Comcast Corp's Sky Deutschland, as well as big names Netflix Inc, Amazon.com Inc's Amazon Prime and Walt Disney Co's Disney+.",CORRECTED-TV aggregator Roku to launch its players in Germany
2021-09-07,"Another month, another Disney/Marvel Studios superhero movie, and another slate of Hollywood records obliterated. But with a star character...","Marvel's ""Shang-Chi and the Legend of the Ten Rings"" Smashes Labor Day Box Office Records"
2021-09-07,By Dhirendra Tripathi,AMC Gains as Marvel’s Shang-Chi Makes Labor Day Weekend Records
2021-09-07,"It's been a largely forgettable two years for the multiplex industry, but we finally hit a new high-water mark in ticket sales over the holiday weekend.  Disney's (NYSE: DIS) Shang-Chi and the Legend of the Ten Rings rang up an estimated $90 million in box-office receipts over the extended Labor Day weekend, a new record for U.S. exhibitors in that particular four-day holiday.  A multiplex-friendly distribution plan is also benefiting AMC Entertainment Holdings (NYSE: AMC) and its younger rivals.","Did ""Shang-Chi"" Just Save AMC Stock?"
