publishedAt,title,description
2021-11-10,"Some of the stocks that may grab investor focus today are: Wall Street expects Performance Food Group Company (NYSE: PFGC) to report quarterly earnings at $0.42 per share on revenue of $10.12 billion before the opening bell. Performance Food shares fell 1% to $45.90 in after-hours trading. Coinbase Global, Inc. (NASDAQ: COIN) reported downbeat revenue for its third quarter. Given a softer crypto backdrop during Q3 however, global crypto spot trading volumes declined 37% in Q3 as compared to Q2,","5 Stocks To Watch For November 10, 2021"
2021-11-10,"The stock market continues to hit new highs, but some growth stocks have not participated in the rally this year.  Here's why they believe in fuboTV (NYSE: FUBO), CuriosityStream (NASDAQ: CURI), and DraftKings (NASDAQ: DKNG).  John Ballard (fuboTV): The displacement of traditional TV with streaming video services will no doubt provide outsize rewards for investors who choose the right stocks.",3 Supercharged Growth Stocks Worth Taking a Chance on
2021-11-10,"Accumulation is rising after a successful test at range support, raising odds for a rapid advance into the mid-180s.",Walt Disney Could Rally into Year’s End
2021-11-10,"The popular streaming service turns 2 on Friday, and the media giant is celebrating up and down its ecosystem.","Disney+ Day: Deals and Park Perks and NFTs, Oh, My!"
2021-11-10,The platform's young traders do tend to favor trendy stocks. But they also love a few solid blue chips that investors may want to buy now and hold for a long time.,3 Robinhood Stocks That Are Great Long-Term Picks
2021-11-10,By Geoffrey Smith,"Inflation, Rivian IPO, Jobless Claims - What's Moving Markets"
2021-11-10,Yahoo Finance's Emily McCormick previews Disney earnings.,Disney earnings: What to expect
2021-11-10,"Walt Disney Co (NYSE: DIS) is set to announce its fiscal fourth-quarter financial results after Wednesday's close. ""I think the price of Disney right now is a price that if you don't own it, this is a good spot at which to own it,"" Cerity Partners' Jim Lebenthal said Wednesday on CNBC. Lebenthal thinks prospective investors can buy the stock ahead of earnings because he doesn't expect the stock to move much on the report. ""Disney is a long-term hold for me. I think it's a fabulous company, but t",Why Jim Lebenthal Thinks This Upcoming Catalyst (Not Earnings) Could Move Disney
2021-11-10,"NVIDIA VP Deepu Talla joins Yahoo Finance Live to discuss NVIDIA Omniverse and Jetson platforms, highlighting edge AI, embedded and robotics technologies shaping the future.",Nvidia GM of embedded and edge computing details latest advancements in robotics and virtual worlds
2021-11-10,"Media and entertainment conglomerate Disney will report fiscal fourth-quarter earnings on Wednesday, as its latest Marvel installment ""Eternals"" disappoints at the box office.  It also launched a promotion to boost Disney+ subscriber growth.  Disney stock lost a fraction early Tuesday.",Disney Earnings Due Amid Travel Tailwind; Dow Giant Offers Disney+ Discount
2021-11-10,"Wall Street ended the session in negative territory on Wednesday as investor risk appetitive was curbed by surging consumer prices, which stoked worries of a protracted wave of hot inflation.  All three major U.S. stock indexes lost ground, extending their losses throughout the trading day and adding to Tuesday's sell-off which snapped the S&P 500's and Nasdaq's eight-session runs of all-time closing highs.  ""It's not surprising that after what was truly a historic run for the market to take a pause,"" said Ross Mayfield, investment strategy analyst at Baird in Louisville, Kentucky.",US STOCKS-Wall Street closes lower as economic data raises long-term inflation threat
2021-11-10,"BURBANK, Calif., November 10, 2021--The Walt Disney Company (NYSE: DIS) today reported earnings for its fourth quarter and fiscal year ended October 2, 2021. Diluted earnings per share (EPS) from continuing operations for the quarter was income of $0.09 compared to a loss of $0.39 in the prior-year quarter. Excluding certain items(1), diluted EPS for the quarter was income of $0.37 compared to a loss of $0.20 in the prior-year quarter. Diluted EPS from continuing operations for the year ended Oc",The Walt Disney Company Reports Fourth Quarter and Full Year Earnings for Fiscal 2021
2021-11-10,Yahoo Finance's Emily McCormick analyzes Disney's shift to focus more on their streaming service Disney+ as they had a slowdown in subscribers,Disney earnings preview: Investors focus on Disney+ subscribers
2021-11-11,"Stocks were mixed midday, as the Nasdaq rallied but Dow Jones industrials slipped on Disney earnings. The Rivian IPO raced higher.","Dow Jones Slips On Disney Earnings, But Nasdaq Rebounds As Rivian Races Ahead"
2021-11-11,CFRA Analyst Tuna Amobi breaks down Disney's Q4 earnings as the giant faces decelerating numbers in its Disney + streaming subscriptions while theme park revenues have doubled since last year.,"Disney+ subscriber numbers were 'a little spooky,' analyst says"
2021-11-11,The entertainment behemoth is in the midst of a milestone celebration that may lure more visitors to Orlando.,Disney theme parks division nearly doubles fiscal Q4 2021 revenue
2021-11-11,Yahoo Finance's Zack Guzman and Emily McCormick break down how Disney stock is faring after disappointing earnings results.,"Disney stock takes a hit, down more than 7% in early trading after earnings miss"
2021-11-11,"U.S. stocks trade mostly higher, led by technology stocks, which took the market south Wednesday after red-hot inflation data sent Treasury yields soaring.","Disney’s slump weighs on Dow, but tech sector leads broader market higher after inflation-fueled dip"
2021-11-11,The country's leading multiplex operator offers up its third-quarter results after Monday's close.,AMC's Partnership With Disney This Weekend Is Brilliant
2021-11-11,"Disney shares are down 8% in heavy trading, extending a selloff that started yesterday after the media conglom posted weaker than expected earnings and streaming data for the September quarter. The dip in the shares, changing hands at about $161, is weighing on the broader market. Disney is one of only 30 highly selective, heavyweight […]",Disney Shares Extend Losses; Investors Fret Over Streaming Growth As Disney+ Turns Two
2021-11-11,The stock is trying to settle below the $160 level.,Why Disney Stock Is Down By 8% Today
2021-11-11,"Growth in the Disney+ streaming service helped Walt Disney's business navigate the pandemic, but it is now causing investors to bail.",Why Disney+ Became a Minus for the Stock Today
2021-11-11,"Walt Disney Co (NYSE: DIS) is trading lower Thursday after the company announced weak fiscal fourth-quarter financial results. What Happened: Disney reported quarterly adjusted earnings of 37 cents, which came in below the estimate of 44 cents. The company reported quarterly revenue of $18.53 billion, which beat the estimate of $16.26 billion. Disney+ paid subscribers totaled 118.1 million, up from 73.7 million year-over-year. See Also: Quick Take Technical Analysis: Walt Disney Co Why It Matter",Why Pete Najarian Bought Disney Stock This Morning
2021-11-11,By Yasin Ebrahim,"S&P 500 Ekes Out Win as Materials Gain, Tech Finds Footing After Selloff"
2021-11-11,"Disney dragged on the Dow Jones today, Freeport McMoRan scored a breakout, and new issues Rivian shook up the EV space.","Dow Jones Slumps, Nasdaq Rallies As EVs, Chips, China Names Climb; Disney Stock Takes A Tumble"
2021-11-11,"Technology stocks enjoyed a relief rally Thursday amid the bond market's off day, but the Dow couldn't escape the effects of a weak Disney report.",Stock Market Today: Dour Disney Results Drag Down the Dow
2021-11-11,"The S&P 500 and the Nasdaq inched higher on Thursday, with chipmakers helping the indexes resume their climb after hotter-than-expected inflation reports dampened investor sentiment and halted a streak of record closing highs.  Walt Disney Co, falling in the wake of a disappointing earnings report, dragged the Dow into the red.","US STOCKS-S&P 500, Nasdaq resume their advances; Disney drags on Dow"
2021-11-11,Disney shares are falling after the company reported disappointing earnings that included a slowdown in Disney Plus subscriber growth numbers.,Disney (DIS) Falls After Disappointing Earnings Report
2021-11-11,"A surge in international visitors to the United States may not benefit Disney and Universal theme parks in the country until next year, since early arrivals will focus on family reunions and holiday trips will need planning.  While domestic footfall rose in the parks operated by Walt Disney Co and Comcast Corp, capacity constraints, rising costs and fewer international travelers visits to its U.S. parks weighed on profits.","Disney, Universal parks may see no immediate cheer as international visitors return"
2021-11-11,The Dow Jones Industrial Average turned lower in today's stock market while the Nasdaq moved higher after Wednesday's difficult market losses.,"Dow Jones Trades Lower, Weighed Down By Disney Stock; Tech Stocks Recover From Earlier Week's Losses"
2021-11-11,"The S&P 500 ended essentially flat on Thursday, with chipmakers helping push the Nasdaq into positive territory in a subdued Veterans Day session, the day after hotter-than-expected inflation reports dampened investor sentiment and halted a streak of record closing highs.  Walt Disney Co, falling in the wake of a disappointing earnings report, dragged the Dow into the red.  The bond market was closed in observance of Veterans Day, and in the absence of economic data and with third-quarter earnings season winding down, there were few catalysts to move markets in either direction.",US STOCKS-S&P closes little changed as chips boost Nasdaq in muted holiday trading
2021-11-11,"Earnings and revenue both came in below Wall Street consensus estimates for the company’s fiscal fourth quarter, but trends were heading in the right direction.",Disney Stock Is Dropping After a Tough Quarter. Investors Should Focus on the Big Picture.
2021-11-11,Variety Intelligence Platform Media Analyst & Correspondent Heidi Chung joins Yahoo Finance Live to break down the major takeaways from Disney's earnings and its shift to focus on streaming platform Disney+.,Disney+ growth is CEO Bob Chapek’s ‘major test’: Analyst
2021-11-11,"U.S. stocks traded mostly higher Thursday, led by technology shares, after a jump in bond yields in response to inflation data on Wednesday took the market down.","U.S. stocks end mostly higher as tech shares recover, but Disney fall weighs on Dow"
2021-11-11,"The S&P 500 ended only nominally higher on Thursday, with chipmakers helping push the Nasdaq into green territory in a muted Veterans Day session, the day after hotter-than-expected inflation reports dampened investor sentiment and halted a streak of record closing highs.  Walt Disney Co, falling in the wake of a disappointing earnings report, dragged the Dow into the red.",US STOCKS-S&P closes little changed as chips boost Nasdaq in subdued holiday trading
2021-11-11,"Media and entertainment conglomerate Disney reported worse-than-expected fiscal fourth-quarter earnings late Wednesday, as Disney+ streaming subscriptions came up weak.  The delta Covid wave took a toll on Disney over the summer.  Estimates: FactSet analysts saw Disney earnings of 52 cents a share, swinging from a loss of 20 cents in the year-ago quarter.","Disney Stock Tumbles After Earnings, Disney+ Subscriber Miss"
2021-11-11,The Dow Jones fell as Disney earnings weighed. Tesla stock stalled after Elon Musk stock sale details emerged. Rivian stock exploded.,Dow Jones Lags As Disney Dives; Rivian Stock Explodes; Tesla Falls After Elon Musk Does This
2021-11-11,"The blue-chip index sank to session lows at the close, -0.44%, and back below 36K once again.","Markets Mixed, Dow Down 3 Straight Days; RIDE Reports Q3"
2021-11-11,"Port Canaveral is cautiously optimistic about the potential for cruise activity in the coming year.  At the Central Florida seaport's State of the Port event on Nov. 10, it said it expects to see 779 cruise ships with the potential of a 6.6 million passenger capacity in 2022.  In comparison, Port Canaveral welcomed 689 chips with the total passenger capacity of 5 million — yet actually 4.7 million traveled in 2019.","Port Canaveral expects to welcome more cruise ships, fewer passengers in 2022"
2021-11-11,The stock market rebounded Thursday morning as EV stocks helped get buyers back out. Rivian extended its outstanding IPO rally.,"Indexes Bounce As Rivian Extends Rally, EV Stocks, Small Caps Climb"
2021-11-11,"Yahoo Finance's Jared Blikre joins the Live show to run down the positive earnings for Dillard's and SoFi, while Bumble and Beyond Meat are experiencing misses.","Stocks on the move: Dillard's and SoFi pop on earnings, Bumble having worst day since IPO"
2021-11-11,"Disney shares sank as much as 9% in early trading Thursday after the media conglomerate posted earnings that missed Wall Street expectations and revealed a significant slowdown for its flagship Disney Plus streaming service. Disney Plus hit 118.1 million for the quarter ended Oct. 2, up just 2.1 million over the prior period and a […]",Disney Stock Slumps After Streaming Growth Stalls
2021-11-11,"Disney's (DIS) fourth-quarter fiscal 2021 results reflect strength in Media and Entertainment Distribution, and Parks, Experiences and Products segments.","Disney (DIS) Q4 Earnings Miss Estimates, Revenues Rise Y/Y"
2021-11-11,"Mickey Mouse is poised to venture into the metaverse.  Walt Disney CEO Bob Chapek said the entertainment conglomerate is preparing to make the technological leap into a virtual reality world first imagined by science fiction writers.  It is a popular destination these days, ever since Facebook CEO Mark Zuckerberg announced the future of his company would be devoted to creating a robust, three-dimensional environment where users’ digital avatars would work, hang out and pursue their hobbies.",Disney wants to become the happiest place in the metaverse
2021-11-11,"Growth led Wednesday's market retreat, despite Tesla's bounce and Rivian's IPO debut. Affirm spiked late.","Dow Jones Futures: Market Rally Skids Despite Solid Rivian Debut; Tesla Discloses Musk Sale, Affirm Spikes"
2021-11-11,By Dhirendra Tripathi,Disney Tumbles 5% as Q4 Streaming User Growth Falls Short
2021-11-11,Stocks edge higher amid inflation concerns; Elon Musk sells 5 billion Tesla shares; Disney posts weakest streaming gains in two years; Beyond Meat tumbles on weak sales forecast and Rivian's market value tops $100 billion following the world's biggest IPO.,"Stocks Rebound, Musk Sells Tesla Shares, Beyond Meat Plunges, Rivian Leaps - 5 Things You Must Know"
2021-11-11,"Disappointing growth for its signature Disney+ streaming service, as well as weaker-than-expected fourth quarter earnings, has Disney stock trading in the red Thursday.","Disney Stock Slumps On Slowing Disney+ Subscriber Growth, Weak Q4 Earnings"
2021-11-11,Wall Street is looking to shrug-off yesterday's hotter-than-expected October inflation reading Thursday as bond markets go quiet on Veteran's Day and stock market bulls focus on earnings and growth.,"Tesla, Disney, Rivian, Beyond Meat Active, Dow Futures Gain After Inflation Shock - Stock Market Live"
2021-11-11,By Peter Nurse,"Disney, Beyond Meat, Bumble Fall Premarket; Affirm Rises"
2021-11-11,"Thank you for standing by, and welcome to The Walt Disney Company's fiscal full year and fourth quarter 2021 financial results.  It's my pleasure to welcome everyone to The Walt Disney Company's fourth quarter 2021 earnings call.  Joining me remotely today are Bob Chapek, Disney's chief executive officer, and Christine McCarthy, senior executive vice president and chief financial officer.",Walt Disney (DIS) Q4 2021 Earnings Call Transcript
2021-11-11,"Some of the stocks that may grab investor focus today are: Wall Street expects Tapestry, Inc. (NYSE: TPR) to report quarterly earnings at $0.70 per share on revenue of $1.44 billion before the opening bell. Tapestry shares rose 1.5% to $43.25 in after-hours trading. The Walt Disney Company (NYSE: DIS) reported weaker-than-expected earnings for its fiscal fourth quarter. Disney saw its average revenue per user decline again for Disney+ to $4.12, down 9% year-over-year, with a higher number of Hot","5 Stocks To Watch For November 11, 2021"
2021-11-11,"Pre-open movers U.S. stock futures traded higher in early pre-market trade after recording sharp losses in the prior session. Investors are awaiting earnings results from Tapestry, Inc. (NYSE: TPR), Flowers Foods, Inc. (NYSE: FLO) and Sally Beauty Holdings, Inc. (NYSE: SBH). Futures for the Dow Jones Industrial Average climbed 52 points to 36,044.00 while the Standard & Poor’s 500 index futures rose 16.50 points to 4,658.50. Futures for the Nasdaq 100 index climbed 96.25 points to 16,076.75. The",A Peek Into The Markets: US Stock Futures Up Following Wednesday's Plunge
2021-11-11,"U.S. stock futures pointed to some gains ahead for Wall Street, led by technology stocks, which led the market south on Wednesday after bruising inflation data.","Wall Street stocks poised for a modest rebound, led by battered tech sector"
2021-11-11,"(Bloomberg) -- Netflix Inc. is close to overtaking Walt Disney Co. in market value for the first time since last year, after the amusement park owner’s earnings stoked concerns about slowing subscriber growth in its streaming business.Most Read from BloombergWhy Hong Kong Is Building Apartments the Size of Parking SpacesFarmers Take on ‘Post-Apocalyptic’ Food CrisisDo Prisons Deserve a Second Chance?Greece’s Popular Islands Are Crowded — With PlasticA 25% advance since the end of July has booste",Netflix’s  Is Closing In on Disney Again In Terms of Market Value
2021-11-11,Wall Street is looking to shrug-off yesterday's hotter-than-expected October inflation reading Thursday as bond markets go quiet on Veteran's Day and stock market bulls focus on earnings and growth.,"Tesla, Rivian, Paysafe Active; Disney Pulls Dow Lower - Stock Market Live"
2021-11-11,"Media and entertainment conglomerate Disney reported worse-than-expected fiscal fourth-quarter earnings on Wednesday, as Disney+ streaming subscriptions came up weak.  Disney stock fell solidly early Thursday.  The delta Covid wave took a toll on Disney over the summer.","Disney Stock Sinks After Earnings, Disney+ Subscriber Miss"
2021-11-11,"Walt Disney's latest film ""Encanto"" celebrates Colombia's diversity, its people, and its music, and sends a message about overcoming challenges, said singer and composer Carlos Vives.  Encanto helps rehabilitate the image of Colombia - usually associated in Hollywood with drug trafficking and violence - said Vives, who sang the movie's title song.  ""(Encanto) has the magic of Disney's animations - which always seek to rescue the human values of diversity and of the richness of our people.","Disney's Encanto celebrates Colombia's diversity, says musician Carlos Vives"
2021-11-11,"U.S. stocks trade mostly higher, led by technology stocks, which took the market south Wednesday after red-hot inflation data sent Treasury yields soaring.","Disney’s stock slump weighs on Dow, but tech sector leads the broader market higher after inflation-fueled dip"
2021-11-11,Billions of dollars of profits from Disney's long-standing businsses are needed to support the relatively new video streaming operation in its growth phase.,Disney Stock Is Slumping Because Streaming and Theme Parks Are Both Struggling
2021-11-11,"U.S. stocks open mostly higher Thursday morning, spearheaded by a rebound in technology shares, which had led the market south Wednesday after red-hot inflation data sent Treasury yields soaring. The bond market was closed in observance of Veterans Day but stocks remain open as usual. However, poor quarterly results from Walt Disney & Co. , which reported results late Wednesday, were weighing on the blue-chip index. The Dow Jones Industrial Average was down 72 points, or 0.2%, at 35,993; the S&P","Dow slips below 36,000 as Disney's stock skids over 7% lower but broader stock market aims for Thursday turnaround"
2021-11-11,Disney missed earnings on Wednesday after falling short on subscriber growth. Yahoo Finance's Brian Sozzi has the details.,"Disney misses in Q4, streaming growth decelerates"
2021-11-11,"The media giant delivers mixed quarterly results, but everyone's focusing on the Disney+ subscriber shortfall.",When Will Disney Stock Be About More Than Just Disney+?
2021-11-11,"(Bloomberg) -- Netflix Inc. overtook Walt Disney Co. in market value for the first time since last year, after the amusement park owner’s earnings stoked concerns about slowing subscriber growth in its streaming business.Most Read from BloombergWhy Hong Kong Is Building Apartments the Size of Parking SpacesFarmers Take on ‘Post-Apocalyptic’ Food CrisisGreece’s Popular Islands Are Crowded — With PlasticDo Prisons Deserve a Second Chance?A 27% advance since the end of July has boosted Netflix’s ma",Netflix Is Closing In on Disney Again In Terms of Market Value
2021-11-11,"The Walt Disney Co (NYSE: DIS) is trading lower Thursday after the company announced worse-than-expected fiscal fourth-quarter financial results. Disney reported quarterly adjusted earnings of 37 cents, which came in below the estimate of 44 cents. The company reported quarterly revenue of $18.53 billion, which beat the estimate of $16.26 billion. Disney+ paid subscribers totaled 118.1 million, up from 73.7 million year-over-year. The stock may be trading lower as a result of slowing Disney+ sub",Why Disney Shares Are Falling Today
2021-11-11,Futures signal a modest market rally. Rivian is rising after a solid IPO debut. Affirm skyrocketed. Elon Musk sold Tesla stock.,"Dow Jones Futures Point To Market Rally; Musk Sells $5 Billion In Tesla Stock, Rivian Rises Again, Affirm Spikes"
2021-11-11,"Bear with us. That was basically the message from Disney CEO Bob Chapek as he sought to allay Wall Street anxiety about a sharp decline in growth at streaming service Disney+. The service added just 2.1 million subscribers during the fiscal fourth quarter, reaching 118.1 million. “We’re real pleased with where we’re sitting, but again, […]","Disney CEO Bob Chapek Looks To Head Off Disney+ Angst By Touting 2022 Global Spread, Preschool Push"
2021-11-11,"The S&P 500 and Nasdaq rebounded on Thursday from two days of inflation-driven selloff, but losses in Walt Disney due to slowing subscriber growth in its streaming video service weighed on the Dow.  A record-breaking rally in Wall Street's main indexes had come to an end earlier this week as recent inflation reports suggested that the current spike in prices will take longer to cool amid snarled global supply chains.  But Arthur Hogan, chief market strategist at National Securities in New York, said investors were able to look beyond the near term as ""we just have more demand than supply.""","S&P 500, Nasdaq rise after inflation-led rout; Disney weighs on Dow"
2021-11-11,"U.S. stock futures point to modest to slight gains for Wall Street, led by technology stocks, which led the market south Wednesday after red-hot inflation data sent Treasury yields soaring.","Wall Street stocks aim for rebound, led by tech sector after withering Wednesday trade"
2021-11-12,"Movie buffs in the United States are back in theaters as the pandemic eases, but it is not clear if a sizeable chunk of the audience - families - might be just as happy watching from the comfort and safety of their homes.  The offer of new movies at home in the safety of living rooms may trump any clamor for the big screens, an issue Walt Disney Co is addressing by shortening the time between blockbusters' release in theaters and on Disney+ streaming.  Disney obviously has an incredibly bright future.","Theaters reopen, but Disney cautious on families returning to big screens"
2021-11-12,Yahoo Finance's Alexandra Canal breaks down the latest developments in the streaming wars.,All eyes on 'Squid' Game season 2 as the battle for streaming subscribers intensifies
2021-11-12,Here are seven major companies whose stocks moved on the week’s news.,"General Electric, Tesla, Disney: Stocks That Defined the Week"
2021-11-12,"Jon Christian, Founding Partner of OnPrem Solution Partners, joins Yahoo Finance to discuss subscriber growth for Disney+, competition in streaming, and pricing power of streaming platforms.",Here are the advantages in favor of Disney amid the competitive streaming space
2021-11-12,"After a couple-day pullback and a snooze-fest session on Thursday, stocks started to find some bullish life on Friday. We’ll see if that can continue into next week. Speaking of which, let’s look at a few top stock trades for Monday. Top Stock Trades for Monday No. 1: Ethereum (ETH-USD) Click to EnlargeSource: Chart courtesy of TrendSpider As we look at the cryptocurrency market, it was another good week. Ethereum (CCC:ETH-USD) hit another new all-time high, but the gains have been much more mea","4 Top Stock Trades for Monday: Ethereum, GOOGL, DIS, SHOP"
2021-11-12,Investors continue to vote with their wallets that Disney's results were underwhelming this week.,"Disney Stock Selloff Continues, But Dow Jones Still Adds 181 Points"
2021-11-12,"Disney's disappointing fourth-quarter fiscal 2021 earnings results might hurt ETFs, especially those with the largest allocation to this media and entertainment conglomerate.",How Are Disney (DIS) ETFs Reacting to Q4 Earnings?
