publishedAt,title,description
2021-05-13,"All three major U.S. stock indexes notched solid gains, with the Nasdaq, weighed by Tesla Inc, picking up the rear.  Recent economic data has prompted inflation fears as scarcity of both materials and workers threatens to send prices surging in the face of a demand boom.  ""If this is a footrace, supply chains are still tying their shoes,"" said David Carter, chief investment officer at Lenox Wealth Advisors in New York.",US STOCKS-Wall Street closes higher in 'buy the dip' session
2021-05-13,"Walt Disney added 8.7 million Disney+ subscribers in its fiscal second quarter, and its parks segment logged an operating loss as the company faces an economy trying to emerge from the Covid-19 pandemic.",Disney Adds Fewer Streaming Subscribers Than Hoped; Revenue Falls Short
2021-05-13,"Disney CEO Bob Chapek said today’s decision by the Centers from Disease Control to dramatically adjust its guidance on masks for fully vaccinated adults is “very big news for us.” Speaking during the media giant’s quarterly earnings call with analysts, Chapek hailed the updated scientific view that vaccinated people can abandon masks in most indoor […]",Disney CEO Bob Chapek Says Dramatic Shift In CDC Mask Guidance Is “Very Big News”; Interest In Visiting Disney World Back At 2019 Levels
2021-05-13,The Walt Disney Company (DIS) shares are down more than 4% in late trading on a big earnings beat for its fiscal Q2.,Markets Bounce Back; Disney+ Misses on Subscriber Numbers
2021-05-13,"The Disney+ streaming service added about 9 million subscribers in the latest quarter, while analysts had been forecasting more than 14 million adds.",Disney Earnings Beat Overshadowed by Disney+ Disappointment. What It Means for the Stock.
2021-05-13,"The Disney+ streaming service added about 9 million subscribers in the latest quarter, while analysts had been forecasting more than 14 million adds.",Disney+ Missed a High Bar to Start 2021. It’s Hitting Disney Stock.
2021-05-13,"Disney reported mixed fiscal second-quarter earnings late Thursday, while growth in streaming subscribers disappointed.","Disney Stock Falls On Mixed Earnings, Weak Streaming Gains"
2021-05-13,"Disney has revealed a slowdown in people signing up for its internet TV service in a sign that households are shifting their attention away from streaming as the pandemic eases. The entertainment giant said that Disney Plus subscribers had risen by 8.7m in the first three months of the year, a marked drop from the 21.2m at the end of 2020. Its US-focused streaming services, ESPN+ and Hulu, also saw slowing growth. The figures are the latest indication that the streaming boom of the last year, which saw the likes of Disney and Netflix sign up tens of millions of new subscribers, is fading. It came despite the success of the Marvel miniseries WandaVision, which premiered during the quarter. Netflix said last month that it had lost subscribers in March, and predicted its slowest quarterly growth ever in the upcoming quarter three months.",Disney Plus growth slows as streaming fatigue hits
2021-05-13,"Disney's (DIS) fiscal Q2 earnings exceeded analyst expectations, but revenue missed. Disney+ subscribers also fell below analyst forecasts.",Disney Earnings: What Happened with DIS
2021-05-13,"The Walt Disney Company (NYSE: DIS) today reported earnings for its second fiscal quarter ended April 3, 2021. Diluted earnings per share (EPS) from continuing operations for the quarter increased to $0.50 from $0.26 in the prior-year quarter. Excluding certain items(1), diluted EPS for the quarter increased 32% to $0.79 from $0.60 in the prior-year quarter. EPS from continuing operations for the six months ended April 3, 2021 decreased 64% to $0.52 from $1.43 in the prior-year period. Excluding certain items(1), EPS for the six months decreased 48% to $1.11 from $2.13 in the prior-year period. Results for the quarter and six months ended April 3, 2021 were adversely impacted by the novel coronavirus (COVID-19). The most significant impact was at the Disney Parks, Experiences and Products segment where since late in the second quarter of fiscal 2020, our parks and resorts have been closed or operating at significantly reduced capacity and our cruise ship sailings have been suspended.",The Walt Disney Company Reports Second Quarter and Six Months Earnings for Fiscal 2021
2021-05-13,"Top Stock Reports for Mastercard, Home Depot & Walt Disney","Top Stock Reports for Mastercard, Home Depot & Walt Disney"
2021-05-13,"Disney reported fiscal second-quarter results after market close, with Wall Street set to closely monitor the entertainment giant's growth in streaming and recovery in its parks businesses as pandemic-era restrictions begin to lift.",Disney Q2 revenue misses estimates as Disney+ subscribers fall short
2021-05-13,"The jets kept firing for Disney Plus, which reached 103.6 million subscribers worldwide as of April 3, the company reported — although the growth was not as torrid as Wall Street hoped. The Mouse House’s flagship streaming service packed on 8.7 million global customers in the most recent quarter (up from 94.9 million at the […]","Disney Plus Hits 103.6 Million Subscribers as Rapid Growth Slows, ESPN Plus Perks Up"
2021-05-13,"Disney revenue slid 13% in the fiscal second quarter, the company reported Thursday, but earnings per share nearly doubled, beating Wall Street expectations. Streaming once again was the main highlight of the financial report, but growth of Disney+ moderated significantly during the period. It reached 103.6 million global subscribers, up from 94 million as of […]",Disney Streaming Growth Slows As Company Has Mixed Quarterly Report
2021-05-13,"Disney (DIS) delivered earnings and revenue surprises of 172.41% and -2.55%, respectively, for the quarter ended March 2021. Do the numbers hold clues to what lies ahead for the stock?",Walt Disney (DIS) Tops Q2 Earnings Estimates
2021-05-13,"Stocks traded higher on Thursday, with investors digesting the latest stronger-than-expected print on the labor market's recovery, while still eyeing spiking prices that could throttle the recovery. George Ball, Sanders Morris Harris CEO and Sam Stovall, CFRA Chief Investment Strategist joined Yahoo Finance Live to discuss.","Market Recap: Thursday, May 13"
2021-05-13,"The Walt Disney Co. blew away earnings expectations with a Thursday report, but shares still fell in late trading as the pandemic-fueled growth of its streaming services slowed down.","Disney earnings blow away estimates as theme parks return, but streaming slowdown sends stock lower"
2021-05-13,"Walt Disney Co. added 8.7 million Disney+ subscribers in its fiscal second quarter, and its parks segment logged an operating loss as the company faces an economy trying to emerge from the Covid-19 pandemic.",Disney Adds Fewer-Than-Expected Disney+ Subscribers; Revenue Falls Short
2021-05-14,"Heavy is the head that wears The Crown.  Once a scrappy upstart of the TV industry, Netflix has become the king of streaming with 208m subscribers — nearly half of the world’s total excluding China.  Three of the old media groups that Netflix sought to dethrone — Disney, HBO and ViacomCBS — all grew their streaming services more quickly in the first three months of this year, fuelling investors’ fears that Netflix must keep pouring billions into new shows to entice viewers or risk losing its momentum.",Netflix outpaced by the old media companies it sought to dethrone
2021-05-14,"Walt Disney Co. benefitted big over the past year as it shifted its narrative toward streaming video, but now comes the flip side of that equation.",Disney streaming slowdown puts long-term goals into focus
2021-05-14,"On Thursday, Disney announced that it had added fewer than 4 million subscribers to its Disney+ platform, missing estimates. Julie Hyman, Myles Udland, and Brian Sozzi talk with Rich Greenfield of LightShed Partners about the company’s disappointing subscriber miss and the future of streaming.",Breaking down Disney's mixed Q2 results
2021-05-14,Stocks are sharply higher Friday but are still on track to post weekly declines. Retail sales were unchanged in April.,"Stocks Extend Gains; Dow Up 400 Points or 1.2%, Nasdaq Up 2.5%"
2021-05-14,S&P 500 gains 1.22%,US Indexes Rebound for Higher Close Thursday
2021-05-14,"The Dow Jones Industrial Average rallied 300 points, as Disney dived 5% on earnings. Tesla stock is looking to rebound from a critical support level.",Dow Jones Rallies As Disney Dives On Earnings; Tesla Looks To Rebound From Key Support
2021-05-14,The stock made an attempt to settle below the $170 level.,Why Shares Of Disney Are Down By 4% Today?
2021-05-14,"Tim Nollen, Macquarie Media Tech Analyst joins the Yahoo Finance Live panel to discuss Disney’s latest earnings report.",Disney posts Q2 revenue miss as Disney+ subscribers fall short
2021-05-14,"Spotify (NYSE: SPOT) has drawn comparisons to Netflix on multiple occasions, particularly as the streaming-media company invests in podcast content.  Spotify's latest investment is the exclusive rights to Dax Shepherd's Armchair Expert, which follows its deal last year with Joe Rogan.  The move to build up a library of exclusive and highly differentiated content rights, even at significant costs, echoes Netflix's shift in strategy around 2012.",Spotify's Quickly Following in Netflix's Footsteps
2021-05-14,"Wall Street's major indexes are set for their steepest weekly drop since February after stronger-than-expected inflation data, signs of labor shortage and higher commodity prices this week raised bets the Federal Reserve would have to pare back its crisis level support.",US STOCKS-Wall St extends recovery at end of volatile week
2021-05-14,By Yasin Ebrahim,"S&P 500 Ends Week in Red Despite Signs Tech, Value Can Co-Exist"
2021-05-14,"The stock market moved higher on Friday, continuing the previous day's rebound from weakness earlier in the week.  Earnings reports continued to come out, and the news from delivery specialist DoorDash (NYSE: DASH) led to big gains for the stock.  Shares of DoorDash jumped almost 20% Friday morning.","DoorDash Delights, Disney Disappoints as Stock Markets Surge Again"
2021-05-14,Stocks end sharply higher Friday but still posted weekly declines. Retail sales were unchanged in April.,"Stocks Close Higher; Dow Up 360 Points or 1.1%, Nasdaq Up 2.3%"
2021-05-14,"According to at least one analyst, the weak Disney+ subscriber additions were the key catalyst for Wall Street's negative reaction to Disney's Q2 results.","Disney shares slide, company is 'in the middle of a recovery'"
2021-05-14,"For Disney Plus, maybe getting the first 100 million subscribers was the easy part. Shares of Disney were down 2.6% in midday trading Friday, after the media company missed revenue estimates for the first three months of 2021 and reported a net gain of 8.7 million Disney Plus subs — some 6 million fewer than […]",Disney Plus Decelerates: Investors Assess the Streamer’s Road Ahead
2021-05-14,"The Dow Jones Industrial Average rose in today's market, recovering more of its losses from earlier this week. The tech-heavy Nasdaq led on the upside.",Dow Jones Rises As Nasdaq Leads Market; Disney Stock Falls On Earnings While Airbnb Rises
2021-05-14,"All three major U.S. indexes built on Thursday's gains, in which the S&P 500 saw its biggest one-day percentage bump in over a month.  Of those, 87% have beaten consensus estimates, according to Refinitiv IBES.","US STOCKS-Wall Street extends rally, but sets course for weekly loss"
2021-05-14,Disney's top executive says the Centers for Disease Control and Prevention's decision to ease up mask-wearing requirements for fully vaccinated people is “very big news for us.”,Here’s how the CDC’s new mask guidance could affect Disney parks
2021-05-14,"U.S. stock indexes climbed Friday afternoon as investors took a weaker-than-expected reading of April retail sales in stride, shaking off a tumultuous week that has been marked by growing inflation fears.","U.S. stocks jump, even as retail sales data weaker than expected"
2021-05-14,Walt Disney is a standout underperformer on an otherwise ebullient day for stocks Friday. Investors are fixated on what comes next for Disney+.,Disney Stock Is the Biggest Loser in the Dow on Friday. Here’s Why.
2021-05-14,Walt Disney (NYSE: DIS) had a lot to prove heading into Thursday afternoon's fiscal second-quarter report.  The knee-jerk reaction is to blame weaker-than-expected growth in Disney+ subscribers for the rare top-line miss.  It's a bigger story than growth slowing at Disney+ that held the House of Mouse back this time.,Disney's Miss Was Better -- and Worse -- Than You Think
2021-05-14,"U.S. stocks closed higher Friday as investors took a weaker-than-expected reading of April retail sales in stride, shaking off a tumultuous week that has been marked by growing inflation fears. But the sharp gains weren’t weren’t large enough to reverse weekly losses.","U.S. stocks jump Friday, but are still down for the week"
2021-05-14,"Coronavirus-related closures were expected to weigh heavily on Disney's parks and resorts business.  Disney's stock price pulled back on Friday.  Fortunately, Disney+ has emerged as a powerful growth driver for the media conglomerate during the COVID-19 crisis.",Why Disney Stock Fell Today
2021-05-14,"After a slippery couple of days, stocks regained their footing on Thursday and continued that momentum on Friday. With that in mind, let’s look at a few top stock trades for next week. Top Stock Trades for Monday No. 1: Coinbase (COIN) Click to EnlargeSource: Chart courtesy of TrendSpider Coinbase (NASDAQ:COIN) started off higher on the day, but ended up falling about 2.5% after reporting earnings. This is certainly not how investors were hoping the stock’s public debut would go over the last month. Shares rallied to the 10-day moving average and failed to reclaim it. In fact, this measure acted as resistance. Keep that in mind going forward, as this level needs to be reclaimed.InvestorPlace - Stock Market News, Stock Advice & Trading Tips If it’s reclaimed in the semi-near future, see if the 21-day moving average can be reclaimed next. That will bring up a test of the $300 level. On the downside, keep a close eye on the $250 mark. A few weeks ago, I said that level was a buy, as it’s the reference price that was set before Coinbase came public. However, we have already got our $50-plus bounce in the stock. 10 Dividend Aristocrat Stocks for Your Reliability Short List Now we watch. If it acts as support again, traders should be able to get a nice bounce. However, if it breaks it could trigger more selling pressure. Top Stock Trades for Monday No. 2: Airbnb (ABNB) Click to EnlargeSource: Chart courtesy of TrendSpider Despite a strong day in the markets, Airbnb (NASDAQ:ABNB) is not exactly tearing it up after earnings. In fact, we have an inside day in the stock, which is highly surprising. I bet the premium sellers weren’t banking on that calm of a reaction from the stock. In any regard, let’s see if ABNB stock can take out its two-day high here near $142.25. Above quickly puts the $145 area in play, which has been resistance this week. Above that, and the 10-day moving average is in play. Above $150, and perhaps we see $165 and the 21-week moving average. On the downside, however, keep an eye on this week’s low at $131.28. A daily close below this mark could put $121 to $125 in play, the post-earnings low range. Top Stock Trades for Monday No. 3: Farfetch (FTCH) Click to EnlargeSource: Chart courtesy of TrendSpider I really like Farfetch (NYSE:FTCH) for the long term. Like most growth stocks though, Farfetch has been struggling. Shares dipped in Thursday’s after-hours trading on earnings, but investors weren’t having it today, jamming it higher by more than 12% on Friday. Despite the rally, the stock is struggling with the 10-day and 50-week moving averages. Notice the stock remains in a downtrend. If it can get above these marks, it puts the 21-day and 200-day moving averages in play, as well as channel resistance. Above that, and who knows — $50 wouldn’t be out of the question. 7 Fitness Stocks Hoping to Take Peloton's Crown A break of $40 on the downside could put the pre-earnings low back in play. Top Trades for Monday No. 4: Disney (DIS) Click to EnlargeSource: Chart courtesy of TrendSpider The House of Mouse isn’t getting too many cheers after earnings, with Disney (NYSE:DIS) stock down about 2.6% on the day. However, it is hammering off the session low nicely — not that you can tell by the weekly chart above. The stock broke below the April low earlier this week. That was a warning to bulls who are trading this name (not investing in it). The stock was also below the 10-week and 21-week moving averages. Although good earnings could have easily rectified the situation, the setup was not all that encouraging coming into the report. Again, that doesn’t mean Disney couldn’t have popped — just look at what FTCH stock did — but that short-term traders had several reasons not be involved with this one on the long side. In any regard, it’s bouncing even before testing into that $167 to $170 area. Let’s see if it can reclaim some of the levels we mentioned above. If they continue to act as resistance, it’s worth remaining cautious on this one. Below $167 could put the 10-month and 200-day moving averages in play, as well as $153. On the date of publication, Bret Kenwell held a long position in FTCH. The opinions expressed in this article are those of the writer, subject to the InvestorPlace.com Publishing Guidelines. Bret Kenwell is the manager and author of Future Blue Chips and is on Twitter @BretKenwell. More From InvestorPlace Stock Prodigy Who Found NIO at $2… Says Buy THIS Now It doesn’t matter if you have $500 in savings or $5 million. Do this now. Top Stock Picker Reveals His Next Potential 500% Winner The post 4 Top Stock Trades for Monday: COIN, ABNB, FTCH, DIS appeared first on InvestorPlace.","4 Top Stock Trades for Monday: COIN, ABNB, FTCH, DIS"
2021-05-14,"(Bloomberg) -- Walt Disney Co. tumbled the most in almost 11 months Friday after saying it attracted fewer streaming customers than expected last quarter, stoking fears that a key engine of the century-old company’s transformation may be losing some momentum.The entertainment giant on Thursday reported 103.6 million Disney+ customers at the end of last quarter, shy of the 110.3 million projected in the Bloomberg Consensus. The shares fell as much as 5.4% in New York trading Friday, the biggest decline since June 24.The results marked a rare stumble for Disney+, which has enjoyed explosive growth over the past year and a half, elating investors along the way. After its launch in November 2019, the service quickly became a formidable rival to Netflix Inc. and provided a contrast to pandemic-fueled declines in other Disney businesses.But in recent months, a lack of new programming made it harder for Disney to lure as many subscribers as hoped. Production delays caused by Covid-19 have taken a toll on the company, along with other streaming services. Netflix also posted disappointing subscriber numbers last quarter, citing a dearth of programming.“We met the expectations that we’ve set for ourselves,” Chief Executive Officer Bob Chapek said on Bloomberg Television. “We added 30 million subscribers in the first two quarters. We’re happy with where we ended up and think we have a great road paved to the guidance we gave in December” of as many as 260 million subscribers globally by the end of 2024.Disney also announced new deals with Major League Baseball and Spain’s LaLiga soccer league, the latest in a series of sports-programming deals by the media giant. Quarterly profit came in ahead of Wall Street projections. Excluding some items, Disney’s earnings rose to 79 cents a share, compared with a 32-cent average estimate. But sales fell to $15.6 billion, missing estimates of $15.9 billion for the period ended April 3.The company’s streaming revenue per subscriber also declined last quarter, falling 29% to $3.99 a month due to the launch of a less-expensive service in India.Traditional TVDisney’s traditional TV business, meanwhile, posted a profit of $2.85 billion -- a 15% increase from the same period last year. Higher affiliate fees and lower programming costs countered a drop in advertising. But the company also said operating income in the division will shrink this quarter because of a $1.2 billion increase in programming and production costs at ESPN.With Disney’s parks now reopened everywhere but Paris, that unit, a lucrative one in good times, will be more of a focus for investors. The business lost $406 million in the quarter.The U.S. government’s decision Thursday to relax masking guidelines could hasten the turnaround for the division.“We think it’s going to make for a much more comfortable experience this summer in the heat and humidity of Walt Disney World in Orlando,” Chapek said.The movie studio generated $312 million in profit, in a quarter where the company’s newest animated film, “Raya and the Last Dragon,” was released online to Disney+ customers for an additional $30 fee, as well as in theaters. Two other pictures, “Black Widow” and “Jungle Cruise,” will have similar hybrid releases in July.But Disney is getting back to exclusive theatrical releases -- its strength before the pandemic. “Free Guy” and “Shang-Chi and the Legend of the Ten Rings” will both play in theaters for 45 days before going online, Chapek said.Shorter WindowTheater chains have been eagerly waiting for big studios to embrace cinemas again, and they’ve had to make some compromises. The 45-day window is still far shorter than the three months that theaters used to enjoy.Disney shares fell as low as $168.78 Friday, their lowest price since Feb. 1. The shares were down 1.6% this year through the close Thursday in New York.Even with the shortfall in new subscribers, Disney+ has been “way more successful than anyone thought,” said Markus Hansen, an analyst at Vontobel Quality Growth.What Bloomberg Intelligence Says“The streaming user shortfall ... at Disney+ is a glitch in the grand scheme of Disney’s overall investment thesis that will bring back the focus to the company’s legacy businesses, notably its theme parks and film studios. ... Disney’s parks can rebound quickly on pent-up demand, an easing of Covid-19 mandates and pandemic-induced cost efficiencies.”--Geetha Ranganathan, media analystClick here to read the research.And its expansion globally remains in its early stages. Disney+ is set to launch in Malaysia on June 1 and Thailand on June 30. A Star+-branded Latin American service is due Aug. 31.“Disney still has room to run,” Hansen said.Disney also said that subscriptions picked up in the latter part of the quarter and that it’s nearly back to full production for film and TV. More Marvel and Star Wars shows are coming, building on the success of “WandaVision,” “The Mandalorian” and “The Falcon and the Winter Soldier.”“We’re spending a lot of money across our variety of franchises in order to create the content that’s going to keep consumers coming back,” Chapek said on a conference call with investors. That will drive subscriptions and improve “our engagement growing across all of our platforms.”For more articles like this, please visit us at bloomberg.comSubscribe now to stay ahead with the most trusted business news source.©2021 Bloomberg L.P.",Disney Falls Most in 11 Months After Streaming Growth Falters
2021-05-14,"What happened A day after AMC Entertainment Holdings (NYSE: AMC) stock soared 24%, investors are bidding shares up again on Friday. Shares initially jumped more than 8% today before paring some of those gains.",Why AMC Entertainment Stock Jumped Again Friday
2021-05-14,"All three major U.S. indexes extended Thursday's gains, which saw S&P 500 notch its biggest one-day percentage bump in over a month.  ""Today 'everything is going up day' because everyone is buying,"" said Chuck Carlson, senior vice president at Wealthspire Advisors, in New York.  Those big swings were stoked by economic data, which fanned concerns that near-term price spikes could translate into long-term inflation, despite assurances to the contrary from the U.S. Federal Reserve.",US STOCKS-Wall Street ends volatile week sharply higher
2021-05-14,Big tech names rallied as stocks rebounded Friday despite weak April retail sales data. A mixed Q2 from Disney held back the Dow Jones today.,"Dow Jones Today, Stocks Rally On Covid Unmasking; Moderna Leads Rebound; Disney Tumbles On Earnings"
2021-05-14,"U.S. stocks rose on Friday with broad-based gains as investors looked to economic recovery prospects after worries about a prolonged period of inflation sparked a volatile week of trading.  Futures pared some gains after data showed U.S. retail sales unexpectedly stalled in April, as a boost from stimulus checks faded.",US STOCKS-Wall St extends recovery at the end of volatile week
2021-05-14,"Walt Disney’s ESPN network has acquired US broadcasting rights to Spain’s La Liga with a new eight-season contract that escalates bidding wars for American media rights to European football.  The new deal severs an existing contract between La Liga and Qatar-based beIN Sports, which agreed to carry the Spanish football league in the US until 2024.",ESPN wins US broadcast rights to Spain’s La Liga
