publishedAt,title,description
2018-11-12,"Carter Worth, Cornerstone Macro, on quality bear-market stocks to buy. With CNBC's Joe Kernen and the Fast Money traders, Pete Najarian, Steve Grasso, Brian Kelly and Tim Seymour.",Chartmaster says amid the market sell-off these are the b...
2018-11-14,"Assessing Ecolab Inc&#8217;s (NYSE:ECL) performance as a company requires looking at more than just a years&#8217; earnings data. Below, I will run you through a simple sense check to build<div><a class=""permalink"" href=""https://simplywall.st/news/yahoo-post/did-ecolab-incs-nyseecl-recent-earnings-growth-beat-the-trend/"">Read More...</a></div>",Did Ecolab Inc’s (NYSE:ECL) Recent Earnings Growth Beat The Trend?
2018-11-16,"Ecolab Inc. Chief Financial Officer Daniel J. Schmechel will address financial analysts at the Citi Basic Materials Conference on Tuesday, November 27, 2018, in New York. Ecolab will host a live webcast of Mr.","Ecolab Schedules Webcast of Industry Conference for November 27, 2018"
2018-11-21,Looking today at week over week shares outstanding changes among the universe of ETFs covered at ETF Channel one standout is the Materials Select Sector SPDR Fund Symbol XLB where we have detected an approximate 288 6 million dollar outflow that s a 6 9 decrease week over week,"Notable ETF Outflow Detected - XLB, DWDP, LIN, ECL"
2018-11-23,One metric shows lots of pent-up potential in American shale acreage. It could create a huge growth opportunity for oil-field services companies.,"8,545 Reasons to Closely Watch These 2 Oil Stocks in 2019"
2018-11-28,Air Products amp Chemicals Inc Symbol APD has been named to the Dividend Channel S A F E 25 list signifying a stock with above average DividendRank statistics including a strong 2 8 yield as well as a superb track record of at least two decades of dividend growth according,Why Air Products & Chemicals is a Top 25 SAFE Dividend Stock (APD)
2018-11-29,A month has gone by since the last earnings report for Ecolab ECL Shares have added about 2 in that time frame outperforming the S amp P 500 Will the recent positive trend continue leading up to its next earnings release or is Ecolab due for a pullback Before we dive into how investors,Ecolab (ECL) Up 2% Since Last Earnings Report: Can It Continue?
2018-11-30,Looking today at week over week shares outstanding changes among the universe of ETFs covered at ETF Channel one standout is the Materials Select Sector SPDR Fund Symbol XLB where we have detected an approximate 149 7 million dollar inflow that s a 3 8 increase week over week,"XLB, DWDP, LIN, ECL: Large Inflows Detected at ETF"
2018-11-30,"NEW YORK, Nov. 30, 2018 -- In new independent research reports released early this morning, Market Source Research released its latest key findings for all current investors,.","Analysis: Positioning to Benefit within News Corporation, DURECT, Ecolab, MiX Telematics, Ship Finance International, and BCE — Research Highlights Growth, Revenue, and Consolidated Results"
2018-11-30,"Bioquell Plc, Ecolab Reach Agreement On Terms Of Recommended Cash Offer","Bioquell Plc, Ecolab Reach Agreement On Terms Of Recommended Cash Offer"
2018-11-30,"Ecolab Inc., the global leader in water, hygiene and energy technologies  and services, has made an offer to acquire Bioquell PLC (BQE.L), a  leading provider of hydrogen peroxide vapor bio-decontamination systems  and services for the life sciences and healthcare industries.  Headquartered in Andover, U.K., Bioquell’s 2017 sales were approximately  £29 million ($37 million).  Bioquell’s innovative bio-decontamination and isolator technologies and  services help ensure residue-free surface decontamination in cleanrooms  and research and development labs at biotech start-ups, pharmaceutical  manufacturers and Fortune 500 companies, and in patient rooms at  hospitals in more than 50 countries.",Ecolab Offers to Acquire Bioquell PLC
2018-12-03,Ecolab (ECL) to leverage on Bioquell's innovative bio-decontamination and isolator platforms for residue-free surface decontamination.,Ecolab to Buy Bioquell for Healthcare & Life Sciences' Growth
2018-12-03,Ecolab Inc ECL recently announced that it will acquire Bioquell PLC to enhance offerings for life sciences and healthcare environments The transaction is expected to close by the first quarter of 2019 Per the terms of the deal Bioquell shareholders will receive 590 pence per share after,Ecolab to Buy Bioquell for Healthcare & Life Sciences' Growth
2018-12-03,Wall Street closed firmly higher on Friday on investor's hopes of a possible truce in the eight-month old trade conflict between the United States and China,"Stock Market News For Dec 3, 2018"
2018-12-03,Wall Street closed firmly higher on Friday on investor s hopes of a possible truce in the eight month old trade conflict between the United States and China U S President Donald Trump and Chinese President Xi Jinping were scheduled to meet for a dinner on the sidelines of the G 20 summit,"Stock Market News For Dec 3, 2018"
2018-12-05,27th CONSECUTIVE ANNUAL CASH DIVIDEND RATE INCREASE,Ecolab Increases Cash Dividend 12%
2018-12-05,"HENDERSON, NV / ACCESSWIRE / December 5, 2018 / Here are several ways to play water scarcity. Today we are highlighting: OriginClear, Inc. (OCLN), The Alkaline Water Company, Inc. (WTER), Aqua America ...",Water Plays That Could Get the Profits Flowing
2018-12-05,Ecolab To Acquire UK-based Cleaning Solutions Provider Holchem Group,Ecolab To Acquire UK-based Cleaning Solutions Provider Holchem Group
2018-12-05,"Ecolab Inc. the global leader in water, hygiene and energy technologies and services, has acquired Holchem Group Limited, a U.K.-based supplier of hygiene and cleaning products and services for the food and beverage, foodservice and hospitality industries.",Ecolab to Acquire Cleaning Solutions Provider Holchem
2018-12-06,American Tower AMT declared its quarterly cash distribution of 0 84 per share on shares of the Company s common stock The distribution is payable on January 14 2019 to such stockholders of record at the close of business on December 27 2018 CME Group CME declared its,"Daily Dividend Report: AMT, CME, ECL, WPC, PHM"
2018-12-07,Ecolab Inc ECL recently announced that it will acquire Holchem Group Limited to enhance food safety standards and boost the Food amp Beverage and Nalco Water units in Europe However the buyout is yet to be cleared by the Competition and Markets Authority which is expected to take place,Ecolab to Boost Food Safety Standards With Holchem Buyout
2018-12-10,Ecolab Inc NYSE:ECL,See what the IHS Markit Score report has to say about Ecolab Inc.
2018-12-10,Looking today at week over week shares outstanding changes among the universe of ETFs covered at ETF Channel one standout is the Materials Select Sector SPDR Fund Symbol XLB where we have detected an approximate 207 6 million dollar outflow that s a 5 3 decrease week over week,Materials Select Sector SPDR Fund Experiences Big Outflow
2018-12-11,"To the fullest extent permitted by law, IHS Markit disclaims any responsibility or liability, whether in contract, tort (including, without limitation, negligence), equity or otherwise, for any loss or damage arising from any reliance on or the use of this material in any way.  Please view the full legal disclaimer and methodology information on pages 2-3 of the full report.",See what the IHS Markit Score report has to say about Ecolab Inc.
2018-12-12,"World-class money managers like Ken Griffin and Barry Rosenstein only invest their wealthy clients’ money after undertaking a rigorous examination of any potential stock. They are particularly successful in this regard when it comes to small-cap stocks, which their peerless research gives them a big information advantage on when it comes to judging their worth. […]",Do Hedge Funds Love Ecolab Inc. (ECL)?
2018-12-13,"To the fullest extent permitted by law, IHS Markit disclaims any responsibility or liability, whether in contract, tort (including, without limitation, negligence), equity or otherwise, for any loss or damage arising from any reliance on or the use of this material in any way.  Please view the full legal disclaimer and methodology information on pages 2-3 of the full report.",See what the IHS Markit Score report has to say about Ecolab Inc.
2018-12-14,"While expansions by major employers like Publix, FedEx and HAECO garner the most attention, you'll be surprised at the number of other companies that have added jobs in 2018.","(PHOTOS) The year in jobs: Expansions, hiring reveal robust growth for Triad"
2018-12-14,Ecolab Inc ECL will begin trading ex dividend on December 17 2018 A cash dividend payment of 0 46 per share is scheduled to be paid on January 15 2019 Shareholders who purchased ECL prior to the ex dividend date are eligible for the cash dividend payment This represents an 12,"Ecolab Inc. (ECL) Ex-Dividend Date Scheduled for December 17, 2018"
2018-12-18,"James Brumley’s pick is the Invesco Water Resources ETF (NASDAQ:PHO).  All in all, the Invesco Water Resources ETF (NASDAQ:PHO) got 2018 started on a solid enough foot.  A. O. Smith (NYSE:AOS) gets a big chunk of the blame, down 30% year to date.",Best ETFs for 2019: The Water Shortage Problem Isn’t Going Away
2018-12-18,InvestorPlace Stock Market News Stock Advice amp Trading Tips Editor s Note This article is part of InvestorPlace com s Best ETFs for 2019 contest James Brumley s pick is the 160 Invesco Water Resources ETF NASDAQ PHO All in,Best ETFs for 2019: The Water Shortage Problem Isn’t Going Away
2018-12-18,"Ecolab Inc., the global leader in water, hygiene and energy technologies  and services that protect people and vital resources, has signed an  agreement to support Clearway Energy Group’s 419-megawatt (MW) wind  farm, Mesquite Star, in Fisher County, Texas.  Construction of the  Mesquite Star wind farm is scheduled to begin in the first half of 2019.",Ecolab Investing in Renewable Power Project with Clearway Energy Group
2018-12-18,"Alorica and Fresh Market – made the list of worst places to work was Triad Business Journal's most popular story with digital and social audiences.  This year, an articles about the $30 billion sale of Rockwell Collins to United Technologies earned the most page views on our website – at least as of today.  Published Sept. 18, the article reported that Rockwell Collins was selling some business segments to mitigate antitrust concerns as the company inched closer to being bought by United Technologies Corp. for $30 billion.",The 15 most clicked Triad Business Journal stories of 2018
2018-12-18,"Many investors are beginning to focus their funds on companies that follow sustainable business practices and/or are addressing global impact issues, asserts John Eade, analyst with Argus Research.",Argus Research Highlights Six Ways to Play Clean Water
2018-12-18,"Alorica and Fresh Market – made the list of worst places to work was Triad Business Journal's most popular story with digital and social audiences.  This year, an articles about the $30 billion sale of Rockwell Collins to United Technologies earned the most page views on our website – at least as of today.  Published Sept. 18, the article reported that Rockwell Collins was selling some business segments to mitigate antitrust concerns as the company inched closer to being bought by United Technologies Corp. for $30 billion.",(PHOTOS) The 15 most clicked Triad Business Journal stories of 2018
2018-12-19,Looking today at week over week shares outstanding changes among the universe of ETFs covered at ETF Channel one standout is the Materials Select Sector SPDR Fund Symbol XLB where we have detected an approximate 271 2 million dollar inflow that s a 7 4 increase week over week,"Noteworthy ETF Inflows: XLB, DWDP, LIN, ECL"
2018-12-19,In trading on Wednesday shares of Ecolab Inc Symbol ECL crossed below their 200 day moving average of 147 37 changing hands as low as 146 45 per share Ecolab Inc shares are currently trading off about 1 2 on the day The chart below shows the one year performance of ECL shares versus,Ecolab (ECL) Shares Cross Below 200 DMA
2018-12-20,Ecolab Inc NYSE:ECL,See what the IHS Markit Score report has to say about Ecolab Inc.
2018-12-20,Wednesday December 19 2018 The Zacks Research Daily presents the best research output of our analyst team Today s Research Daily features new research reports on 16 major stocks including Eli Lilly and Company LLY Mitsubishi UFJ Financial Group Inc MUFG and Thermo Fisher,"Top Analyst Reports for Eli Lilly, Mitsubishi UFJ & Thermo Fisher"
2018-12-20,"The Zacks Analyst Blog Highlights: Eli Lilly, Mitsubishi UFJ, Thermo Fisher, Oracle and Ecolab","The Zacks Analyst Blog Highlights: Eli Lilly, Mitsubishi UFJ, Thermo Fisher, Oracle and Ecolab"
2018-12-20,For Immediate Release Chicago IL December 20 2018 Zacks com announces the list of stocks featured in the Analyst Blog Every day the Zacks Equity Research analysts discuss the latest news and events impacting stocks and the financial markets Stocks recently featured in the blog include,"The Zacks Analyst Blog Highlights: Eli Lilly, Mitsubishi UFJ, Thermo Fisher, Oracle and Ecolab"
2018-12-20,Legendary investor Warren Buffett advises to be fearful when others are greedy and be greedy when others are fearful One way we can try to measure the level of fear in a given stock is through a technical analysis indicator called the Relative Strength Index or RSI which measures momentum on,Ecolab is Now Oversold (ECL)
2018-12-21,"DALLAS , Dec. 21, 2018 /PRNewswire/ -- Swank Capital, LLC, and Cushing ® Asset Management, LP, announce today the upcoming rebalancing of The Cushing ® Energy Supply Chain Index (the ""Index"") ...",Cushing® Asset Management and Swank Capital Announce Rebalancing of The Cushing® Energy Supply Chain Index
2018-12-26,"HENDERSON, NV / ACCESSWIRE / December 26, 2018 / Dr. Michael Burry, played rather eccentrically by the actor Christian Bale in the 2016 film, ""The Big Short"" invests in water and the evidence ...",Water Becoming a Valuable Commodity
2018-12-27,Investors in Ecolab Inc Symbol ECL saw new options become available today for the February 2019 expiration At Stock Options Channel our YieldBoost formula has looked up and down the ECL options chain for the new February 2019 contracts and identified one put and one call contract,February 2019 Options Now Available For Ecolab (ECL)
2018-12-28,Ecolab Inc ECL recently entered into an agreement with Clearway Energy Group to support its 419 megawatt MW wind farm Mesquite Star in Fisher County Texas through a virtual power purchase deal For investors notice construction of the Mesquite Star wind farm will begin in the first,Ecolab Inks Deal With Clearway for Renewable Power Project
2018-12-28,Ecolab's (ECL) virtual power purchase agreement with Clearway is part of a broader trend among corporate buyers. This will cover the company???s annual domestic energy use completely.,Ecolab Inks Deal With Clearway for Renewable Power Project
2018-12-30,"Stocks of companies active in the water sector are looking oversold given the strong fundamental outlook for the sector, Boenning & Scattergood said Thursday.","Water stocks are a bargain for 2019 after selloff, analyst says"
2019-01-02,"HENDERSON, NV / ACCESSWIRE / January 2, 2019 / Around 700 million people in 43 countries suffer today from water scarcity. By 2025, 1.8 billion people will be living in countries or regions with absolute ...",Water Scarcity Stocks for 2019
2019-01-04,"NEW YORK, Jan. 04, 2019 -- In new independent research reports released early this morning, Fundamental Markets released its latest key findings for all current investors,.","Investor Expectations to Drive Momentum within Ecolab, Arrow Electronics, Keysight Technologies, Myriad Genetics, Bristow Group, and IRSA Inversiones Y Representaciones S.A — Discovering Underlying Factors of Influence"
2019-01-09,"# Ecolab Inc

### NYSE:ECL

View full report here!

## Summary

  * ETFs holding this stock are seeing positive inflows 
  * Bearish sentiment is low 
  * Economic output for the sector is expanding but at a slower rate



## Bearish sentiment

Short interest | Positive

Short interest is low for ECL with fewer than 5% of shares on loan. The last change in the short interest score occurred more than 1 month ago and implies that there has been little change in sentiment among investors who seek to profit from falling equity prices.

## Money flow

ETF/Index ownership | Positive

ETF activity is positive. Over the last month, growth of ETFs holding ECL is favorable, with net inflows of $23.48 billion. This is among the highest net inflows seen over the last one-year and the rate of additional inflows appears to be increasing.

## Economic sentiment

PMI by IHS Markit | Negative

According to the latest IHS Markit Purchasing Managers' Index (PMI) data, output in the Industrials sector is rising. The rate of growth is weak relative to the trend shown over the past year, however, and is easing.

## Credit worthiness

Credit default swap

CDS data is not available for this security.

Please send all inquiries related to the report to score@ihsmarkit.com.

Charts and report PDFs will only be available for 30 days after publishing.

This document has been produced for information purposes only and is not to be relied upon or as construed as investment advice. To the fullest extent permitted by law, IHS Markit disclaims any responsibility or liability, whether in contract, tort (including, without limitation, negligence), equity or otherwise, for any loss or damage arising from any reliance on or the use of this material in any way. Please view the full legal disclaimer and methodology information on pages 2-3 of the full report.",See what the IHS Markit Score report has to say about Ecolab Inc.
2019-01-10,"Top Research Reports for Morgan Stanley, Intuitive Surgical & Colgate-Palmolive","Top Research Reports for Morgan Stanley, Intuitive Surgical & Colgate-Palmolive"
2019-01-10,Thursday January 10 2019 The Zacks Research Daily presents the best research output of our analyst team Today s Research Daily features new research reports on 16 major stocks Morgan Stanley MS Intuitive Surgical Inc ISRG and Colgate Palmolive Company CL These research,"Top Research Reports for Morgan Stanley, Intuitive Surgical & Colgate-Palmolive"
2019-01-14,Looking today at week over week shares outstanding changes among the universe of ETFs covered at ETF Channel one standout is the Materials Select Sector SPDR Fund Symbol XLB where we have detected an approximate 167 3 million dollar inflow that s a 4 4 increase week over week,"XLB, LIN, ECL, APD: Large Inflows Detected at ETF"
2019-01-14,"Ecolab will host a live webcast of its fourth quarter earnings conference call to discuss 2018 fourth quarter results and future earnings guidance. A news release containing fourth quarter results and future earnings guidance is expected to be issued before market open on February 19, 2019.",Ecolab Schedules Webcast and Conference Call on February 19
2019-01-16,"Ecolab Inc. announced today that it has closed on its previously announced acquisition of Bioquell PLC , a leading provider of hydrogen peroxide vapor bio-decontamination systems and services for the life sciences and healthcare industries.",Ecolab Closes on Purchase of Bioquell
2019-01-16,"Top Analyst Reports for Procter & Gamble, NVIDIA & Bristol-Myers","Top Analyst Reports for Procter & Gamble, NVIDIA & Bristol-Myers"
2019-01-17,"Ecolab has bought the British manufacturer Bioquell PLC for $178 million, the company announced this week. This follows the court approval of the takeover, which was announced on Monday. It's Ecolab's second high-profile purchase in as many months.",Ecolab closes on British company Bioquell for $178 million
2019-01-17,"It is not uncommon to see companies perform well in the years after insiders buy shares. On the other hand, we'd be remiss not to mention that insider sales have

Read More...",Need To Know: Ecolab Inc. (NYSE:ECL) Insiders Have Been Selling Shares
2019-01-17,"The Zacks Analyst Blog Highlights: Procter & Gamble, NVIDIA, Bristol-Myers, Deere and Ecolab","The Zacks Analyst Blog Highlights: Procter & Gamble, NVIDIA, Bristol-Myers, Deere and Ecolab"
2019-01-17,"# Ecolab Inc

### NYSE:ECL

View full report here!

## Summary

  * Bearish sentiment is low 
  * Economic output for the sector is expanding but at a slower rate



## Bearish sentiment

Short interest | Positive

Short interest is low for ECL with fewer than 5% of shares on loan. The last change in the short interest score occurred more than 1 month ago and implies that there has been little change in sentiment among investors who seek to profit from falling equity prices.

## Money flow

ETF/Index ownership | Neutral

ETF activity is neutral. The net inflows of $9.93 billion over the last one-month into ETFs that hold ECL are not among the highest of the last year and have been slowing.

## Economic sentiment

PMI by IHS Markit | Negative

According to the latest IHS Markit Purchasing Managers' Index (PMI) data, output in the Industrials sector is rising. The rate of growth is weak relative to the trend shown over the past year, however, and is easing.

## Credit worthiness

Credit default swap

CDS data is not available for this security.

Please send all inquiries related to the report to score@ihsmarkit.com.

Charts and report PDFs will only be available for 30 days after publishing.

This document has been produced for information purposes only and is not to be relied upon or as construed as investment advice. To the fullest extent permitted by law, IHS Markit disclaims any responsibility or liability, whether in contract, tort (including, without limitation, negligence), equity or otherwise, for any loss or damage arising from any reliance on or the use of this material in any way. Please view the full legal disclaimer and methodology information on pages 2-3 of the full report.",See what the IHS Markit Score report has to say about Ecolab Inc.
2019-01-22,"# Ecolab Inc

### NYSE:ECL

View full report here!

## Summary

  * ETFs holding this stock are seeing positive inflows but are weakening 
  * Bearish sentiment is low 
  * Economic output for the sector is expanding but at a slower rate



## Bearish sentiment

Short interest | Positive

Short interest is low for ECL with fewer than 5% of shares on loan. The last change in the short interest score occurred more than 1 month ago and implies that there has been little change in sentiment among investors who seek to profit from falling equity prices.

## Money flow

ETF/Index ownership | Negative

ETF activity is negative and may be weakening. The net inflows of $1.69 billion over the last one-month into ETFs that hold ECL are among the lowest of the last year and appear to be slowing.

## Economic sentiment

PMI by IHS Markit | Negative

According to the latest IHS Markit Purchasing Managers' Index (PMI) data, output in the Industrials sector is rising. The rate of growth is weak relative to the trend shown over the past year, however, and is easing.

## Credit worthiness

Credit default swap

CDS data is not available for this security.

Please send all inquiries related to the report to score@ihsmarkit.com.

Charts and report PDFs will only be available for 30 days after publishing.

This document has been produced for information purposes only and is not to be relied upon or as construed as investment advice. To the fullest extent permitted by law, IHS Markit disclaims any responsibility or liability, whether in contract, tort (including, without limitation, negligence), equity or otherwise, for any loss or damage arising from any reliance on or the use of this material in any way. Please view the full legal disclaimer and methodology information on pages 2-3 of the full report.",See what the IHS Markit Score report has to say about Ecolab Inc.
2019-01-23,Looking today at week over week shares outstanding changes among the universe of ETFs covered at ETF Channel one standout is the Materials Select Sector SPDR Fund Symbol XLB where we have detected an approximate 100 3 million dollar inflow that s a 2 5 increase week over week,"Notable ETF Inflow Detected - XLB, LIN, ECL, APD"
2019-01-31,Looking today at week over week shares outstanding changes among the universe of ETFs covered at ETF Channel one standout is the Materials Select Sector SPDR Fund Symbol XLB where we have detected an approximate 186 9 million dollar outflow that s a 4 5 decrease week over week,Materials Select Sector SPDR Fund Experiences Big Outflow
2019-02-04,Ecolab will host a live webcast of its conference call to discuss the planned spin off of its upstream energy business as well as to discuss Ecolab’s preliminary 2018 fourth quarter results and 2019 earnings guidance.,Ecolab Schedules Webcast and Conference Call on February 5
2019-02-04,"Ecolab Inc. is announcing it plans to spin off its Upstream energy  businesses as a stand-alone publicly-traded company.  The Upstream Energy  business currently operates within Ecolab’s Energy segment and consists  of the Oil Field Chemicals production business and the WellChem drilling  and well completion chemistry business.  Ecolab plans to retain the  Downstream business, which serves refineries and petrochemical plants.","Ecolab Announces Plan to Spin off Its Upstream Energy Business as an Independent Public Company; Expects Fourth Quarter 2018 Diluted EPS of $1.48, with Adjusted Diluted EPS of $1.54; Forecasts 10%-14% Full Year 2019 Adjusted EPS Growth"
2019-02-04,Ecolab Plans To Spin Off Its Upstream Energy Business By Mid-year 2020,Ecolab Plans To Spin Off Its Upstream Energy Business By Mid-year 2020
