publishedAt,title,description
2021-02-17,"Shares of Ecolab dropped 4.1% on Tuesday, after the company, which provides water, hygiene, and energy technologies and services, reported lower-than-expected 4Q results, primarily due to the COVID-19 pandemic. Ecolab’s (ECL) 4Q earnings of $1.23 per share missed analysts' estimates of $1.25 and declined 15% year-over-year. The company said, “The adjusted EPS decrease reflects COVID-19 related volume declines, unfavorable business mix and investments in the business which together more than offset cost savings, favorable pricing and lower variable compensation.” However, earnings improved sequentially. The company’s 4Q revenues declined 6% to $3.07 billion and lagged the Street's estimates of $3.11 billion. Ecolab's healthcare & life sciences segment saw 23% revenue growth in 4Q, while its industrial, institutional & specialty and other segment declined year-over-year. Ecolab CEO Christophe Beck said, “Our underlying business continued its sequential improvement as sales trends remained stable and operating income further improved, driven by new business and customer penetration gains, along with continued pricing and lower costs.” Beck expects COVID-19 to continue to impact its end markets in 2021. Though he expects a recovery in the global end markets from the second quarter of 2021, he still believes that “it will take several quarters to fully realize a new normal.” However, he added that “our strengthened business will deliver full year 2021 earnings above 2019 results from continuing operations, with the first quarter year-on-year percentage decline showing modest sequential improvement from the fourth quarter and the remaining quarters of 2021 showing strong year-on-year growth.” (See Ecolab stock analysis on TipRanks). Following the earnings results, Oppenheimer analyst Scott Schneeberger maintained a Hold rating on the stock. The analyst said, “Ecolab's 4Q20 adjusted EPS from continuing operations of $1.23 (-15% year/year) compared to our estimate/consensus of $1.26/$1.25, respectively.” Overall, the rest of the Street has a cautiously optimistic outlook on the stock with a Moderate Buy consensus rating based on 3 Buys, 4 Holds, and 1 Sell. The average analyst price target of $224.33 implies upside potential of about 6.4% to current levels. Shares have gained 2.7% over the past year. The TipRanks’ stock investors tool shows that investors currently have a Very Negative stance on ECL. Related News:RingCentral’s 2021 Guidance Tops Estimates After 4Q BeatIPG Photonics Posts Profit In Fourth Quarter; Shares GainDenny’s 4Q Revenues Miss Estimates Due To COVID-19 Pandemic More recent articles from Smarter Analyst: Wednesday’s Pre-Market: Here’s What You Need To Know Before The Market Opens Nurix Says FDA Approves New Drug Application For Leukemia Trial; Street Is Bullish Exact Sciences Falls 4% On Larger-Than-Feared 4Q Loss RingCentral’s 2021 Guidance Tops Estimates After 4Q Beat",Ecolab Dips 4.1% As COVID-19 Dented 4Q Profit
2021-02-17,"Ecolab Inc., the global leader in water, food safety and infection prevention solutions and services, has expanded its Ecolab Science Certified™ program to include six leading food retail partners. Ingles Markets, Brookshire’s Food & Pharmacy, CUB Foods, Coborn’s, Bristol Farms and Lazy Acres are the latest partners to commit to rigorous cleaning protocols, training and audits that will earn the official Ecolab Science Certified seal, helping give consumers confidence as they look to the future.","Leading Food Retailers Join the Ecolab Science Certified™ Program, Committing to a Higher Level of Cleanliness"
2021-02-17,"Over the past three months, shares of Ecolab (NYSE:ECL) decreased by 1.41%. Before we understand the importance of debt, let us look at how much debt Ecolab has. Ecolab's Debt Based on Ecolab's balance sheet as of October 30, 2020, long-term debt is at $6.67 billion and current debt is at $247.30 million, amounting to $6.92 billion in total debt. Adjusted for $1.03 billion in cash-equivalents, the company's net debt is at $5.88 billion. Let's define some of the terms we used in the paragraph above. Current debt is the portion of a company's debt which is due within 1 year, while long-term debt is the portion due in more than 1 year. Cash equivalents include cash and any liquid securities with maturity periods of 90 days or less. Total debt equals current debt plus long-term debt minus cash equivalents. Investors look at the debt-ratio to understand how much financial leverage a company has. Ecolab has $18.10 billion in total assets, therefore making the debt-ratio 0.38. As a rule of thumb, a debt-ratio more than one indicates that a considerable portion of debt is funded by assets. A higher debt-ratio can also imply that the company might be putting itself at risk for default, if interest rates were to increase. However, debt-ratios vary widely across different industries. A debt ratio of 35% might be higher for one industry and normal for another. Why Investors Look At Debt? Besides equity, debt is an important factor in the capital structure of a company, and contributes to its growth. Due to its lower financing cost compared to equity, it becomes an attractive option for executives trying to raise capital. However, interest-payment obligations can have an adverse impact on the cash-flow of the company. Equity owners can keep excess profit, generated from the debt capital, when companies use the debt capital for its business operations. Looking for stocks with low debt-to-equity ratios? Check out Benzinga Pro, a market research platform which provides investors with near-instantaneous access to dozens of stock metrics - including debt-to-equity ratio. Click here to learn more. See more from BenzingaClick here for options trades from BenzingaRecap: Ecolab Q4 EarningsEarnings Scheduled For February 16, 2021© 2021 Benzinga.com. Benzinga does not provide investment advice. All rights reserved.",Ecolab's Debt Insights
2021-02-18,"In this article we discuss Bill Gates’ Most Recent Investments. If you want to skip our detailed discussion of the history and investments of the Bill & Melinda Gates Foundation Trust, go directly to Bill Gates’ 5 Most Recent Investments. The Bill & Melinda Gates Foundation was launched in 2000 by the American billionaire, philanthropist […]",Bill Gates’ Most Recent Investments
2021-02-20,These companies account for some of the largest positions in the Bill & Melinda Gates Foundation Trust's portfolio.,Bill Gates Owns These 3 Stocks: Should You?
2021-02-23,"Ecolab Inc., the global leader in water, hygiene and infection prevention solutions and services that protect people and vital resources, has again been recognized as one of the World’s Most Ethical Companies by the Ethisphere Institute, a global leader in defining and advancing the standards of ethical business practices. Ecolab has been named one of the World’s Most Ethical Companies every year since the list’s inception in 2007.",Ecolab Named One of World’s Most Ethical Companies for 15th Consecutive Year
2021-02-25,"The board of directors of Ecolab Inc. today declared a regular quarterly cash dividend of $0.48 per common share, to be paid April 15, 2021, to shareholders of record at the close of business on March 16, 2021.",Ecolab Declares Regular Dividend
2021-03-01,"In 2020, Ecolab continued its long-standing commitment to supporting communities through more than $23 million in contributions.",Ecolab Contributes More Than $23 Million to Communities In 2020
2021-03-03,"Ecolab Inc. President and CEO Christophe Beck will address financial analysts virtually at the G.research Specialty Chemicals Conference on Thursday, March 11, 2021. Ecolab will offer a live webcast of Mr. Beck’s presentation. Details for the webcast are as follows:","Ecolab Schedules Webcast of Industry Conference for March 11, 2021"
2021-03-04,"Ecolab Inc. President and CEO Christophe Beck will address financial analysts virtually at the G.research Specialty Chemicals Conference on Thursday, March 11, 2021. Ecolab will offer a live webcast of Mr. Beck’s presentation. Updated details for the webcast are as follows:","Ecolab Updates Scheduled Webcast of Industry Conference for March 11, 2021"
2021-03-06,"All businesses have been affected by the COVID-19 pandemic.  With that, we asked some of our contributors which pandemic underperformers are set to boom as the economy reopens.  Scott Levine (Ecolab): Of the many stocks that have suffered over the past year, one I have a close eye on is Ecolab.","With the Economy Reopening, Here Are 3 Pandemic Underperformers Set to Boom"
2021-03-08,"If companies pass on rising costs to customers, that would make inflation more widespread and would have serous implications for stocks.",Companies Are Feeling the Inflation Pinch. What to Watch Next.
2021-03-11,"PAUL, MN / ACCESSWIRE / March 11, 2021 /Ecolab commented on the effects of the recent winter freeze in Texas and the Gulf Coast region as well as the resulting short-term business disruptions, saying that excluding this one-time event, the prior outlook for 2021 earnings to exceed 2019's earnings per share from continuing operations remains unchanged. Christophe Beck, Ecolab's President and Chief Executive Officer said, ""As outlined in our recent fourth quarter 2020 earnings release, we continue to expect strong year-on-year earnings per share growth in 2021 as the developing recovery in our Institutional division is complemented by continued growth in the balance of our businesses, benefiting from our new business wins, product and service innovation, pricing, and investments in new hygiene and digital technologies.",Ecolab Comments on Effects of Texas/Gulf Coast Winter Freeze
2021-03-12,Every investor in Ecolab Inc. ( NYSE:ECL ) should be aware of the most powerful shareholder groups. Institutions often...,How Many Ecolab Inc. (NYSE:ECL) Shares Do Institutions Own?
2021-03-18,"Texas Roadhouse is implementing science-based solutions to help address pandemic concerns by advancing cleaner, safer practices and building customer confidenceST. PAUL, Minn., March 18, 2021 (GLOBE NEWSWIRE) -- Ecolab Inc., the global leader in water, hygiene and infection prevention solutions and services, is pleased to announce that Texas Roadhouse has earned the Ecolab Science Certified™ seal at more than 600 restaurants in 49 states. The seal signifies Texas Roadhouse’s commitment to rigorous, science-based cleaning protocols, training and audits that build both guest and employee confidence. Texas Roadhouse, one of the nation’s fastest growing casual restaurant groups, was the most popular chain restaurant in America during the pandemic, according to marketing research company Top Data. “We are proud we were the first restaurant company in 2020 to commit to the Ecolab Science Certified program, and now are honored to have the seal at our restaurants across the U.S.,” said Kent Taylor, CEO of Texas Roadhouse. “Ecolab’s expertise in the industry and science-based program, combined with our operators’ passion for helping keep our employees and guests safe, enhances our ongoing goal of providing a higher level of cleanliness in our restaurants.” Texas Roadhouse joins other leading restaurants, hotels and retailers in advancing cleaner, safer practices through the Ecolab Science Certified program. This comprehensive program combines hospital disinfectants and food-contact sanitizers approved for use during the COVID-19 pandemic with public health and food safety training and periodic auditing. “Through Ecolab Science Certified, foodservice and hospitality companies like Texas Roadhouse can help address concerns about the pandemic by advancing cleaner, safer practices,” said Mike Johannsen, executive vice president and general manager of Ecolab’s Global Institutional business. “Texas Roadhouse takes great care in delivering a heightened level of cleanliness for their guests and employees, continuing to demonstrate their leadership through the Ecolab Science Certified program. We look forward to continuing our long-standing partnership, working together to build diner confidence as Texas Roadhouse puts our scientific expertise to work.” The program was informed by proprietary research1 that showed 66% of restaurant customers said they feel “extremely” or “very safe” knowing a restaurant is cleaned with hospital disinfectants*. The research also found that consumers feel safer knowing that an external, independent Ecolab auditor – particularly one with expertise cleaning and disinfecting hospitals – has audited a facility’s cleaning practices. And even after a vaccine is distributed, Ecolab’s research showed that 95% of consumers surveyed want to see as much or more cleaning and sanitation practices at the places they eat, stay and shop.2 In restaurants, hotels, grocery stores and other businesses, the key elements of the Ecolab Science Certified program include: Create clean through hospital disinfectants and food-contact sanitizers approved by the U.S. Environmental Protection Agency (EPA) for use against the COVID-19 virus and other emerging pathogens, and elevated hygiene standards and protocols informed by the U.S. Centers for Disease Control and Prevention (CDC) guidelines. Check clean through detailed public health and food safety training and periodic auditing by highly trained Ecolab specialists to determine whether program elements are being followed. Help consumers see and believe clean through front-of-house cleaning and disinfecting procedures and the Ecolab Science Certified seal, a visible sign of commitment that a location is advancing cleaner, safer practices. The program is grounded in Ecolab’s decades of experience helping keep hospitals, restaurants, hotels and other businesses clean, and its partnerships with many of the world’s leading foodservice and hospitality brands, including Texas Roadhouse. For more information about the Ecolab Science Certified program, visit www.sciencecertified.com. To learn more about Texas Roadhouse and their commitment to advancing cleaner, safer practices, go to www.texasroadhouse.com. About EcolabA trusted partner at nearly three million customer locations, Ecolab (ECL) is the global leader in water, hygiene and infection prevention solutions and services. With annual sales of $12 billion and more than 44,000 associates, Ecolab delivers comprehensive solutions, data-driven insights and personalized service to advance food safety, maintain clean and safe environments, optimize water and energy use, and improve operational efficiencies and sustainability for customers in the food, healthcare, hospitality and industrial markets in more than 170 countries around the world. www.ecolab.com Follow us on LinkedIn @Ecolab, Twitter @Ecolab, Instagram @Ecolab_Inc and Facebook @Ecolab. About Texas RoadhouseTexas Roadhouse is a casual dining concept that first opened in 1993 and today has grown to over 620 restaurants system-wide in 49 states and 10 foreign countries. For more information, please visit www.texasroadhouse.com. Contacts:Mesa Denny, Ecolab+1 651 250 4724mediarelations@ecolab.com Travis Doster, Texas Roadhouse +1 502 638 5457Travis.Doster@texasroadhouse.com March 18, 2021 (ECL-P) 1Ecolab proprietary consumer research conducted May 2020.*The term “hospital-grade disinfectants” were used in the research conducted May 2020.2Ecolab proprietary research conducted January 2021.","Texas Roadhouse Earns the Ecolab Science Certified™ Seal Nationwide at More Than 600 Restaurants, Demonstrating Commitment to Higher Level of Cleanliness"
2021-03-18,Ecolab (ECL) reported earnings 30 days ago. What's next for the stock? We take a look at earnings estimates for some clues.,Why Is Ecolab (ECL) Up 0.2% Since Last Earnings Report?
2021-03-22,"New tool to help companies close gap between freshwater supply and demand, now at an all-time highST. PAUL, Minn., March 22, 2021 (GLOBE NEWSWIRE) -- Today, on World Water Day, Ecolab Inc., the global leader in water, hygiene and infection prevention solutions and services, launched an enhanced version of its Smart Water Navigator. The free online tool helps businesses understand the value of water in their operations and take action to achieve corporate water goals. This enhanced tool comes at a time when rising industrial water use continues to contribute to the world’s growing water stress and scarcity challenges. According to the World Resources Institute (WRI), the world will experience a 56% freshwater shortfall by 2030 if nothing changes, an increase from the 40% shortfall projected by the U.N. in 2015. “This is an important time for industry to start closing the widening gap between freshwater supply and demand through smart water management,” said Ecolab President and CEO Christophe Beck. “We developed the Ecolab Smart Water Navigator to help businesses develop comprehensive, context-based plans and to better engage and support the teams responsible for driving smart water management.” A need for increased urgency around corporate water actionTo better understand the state of corporate water management and how companies can more effectively advance their water management goals, in February 2021 Ecolab and sustainability news research organization GreenBiz surveyed 93 companies with revenues of at least $1 billion. The survey underscored the need for increased urgency around water action within organizations, with only 38% of respondents stating that water is a strategic corporate initiative that is proactively managed across their operations. At the same time, S&P Global reports that corporate water use progress is currently insufficient to prevent the projected freshwater gap. Identifying opportunities to advance corporate water goalsWhile water targets and goals are typically set by sustainability and corporate responsibility teams, 95% of respondents in the Ecolab-GreenBiz survey said that facility-level teams are responsible for achieving these targets, which may contribute to the disconnect between water intention and action. Only 54% of survey respondents currently utilized advanced measurement tools to track progressAnd 45% said they felt their organization’s water would be better managed and targets would be more easily achieved if they utilized such tools. “Despite a growing understanding of our world’s worsening water crisis, companies are not making water management a priority,” said Ecolab Senior Vice President of Corporate Sustainability Emilio Tenuta. “Tools that help enable facilities to better measure water use are key to driving action, which is why we enhanced the Ecolab Smart Water Navigator.” Helping enable local water actionThe enhanced Ecolab Smart Water Navigator supports users who are just beginning to identify baseline water use as well as those who are ready to track year-over-year performance. The tool delivers an automated analysis of water use that allows users to set informed, context-based goals that consider the water basin health in surrounding communities and environments. New features include benchmarking across a portfolio of facilities and the ability to identify water withdrawal targets and risks and evaluate performance over time. The Ecolab Smart Water Navigator, first introduced in 2019, supports Ecolab’s broader mission to help industry reuse, recycle and reduce water, supporting resilient operations and healthy communities. Ecolab’s water stewardship efforts focus on identifying and supporting equitable and sustainable water use, and partnerships, like its founding membership in the Water Resilience Coalition, an industry-driven initiative, of the United Nations Global Compact’s CEO Water Mandate. To learn more about the Ecolab Smart Water Navigator, go to smartwaternavigator.com. For more information about Ecolab’s water management expertise, visit ecolab.com. About EcolabA trusted partner at nearly three million customer locations, Ecolab (ECL) is the global leader in water, hygiene and infection prevention solutions and services. With annual sales of $12 billion and more than 44,000 associates, Ecolab delivers comprehensive solutions, data-driven insights and personalized service to advance food safety, maintain clean and safe environments, optimize water and energy use, and improve operational efficiencies and sustainability for customers in the food, healthcare, hospitality and industrial markets in more than 170 countries around the world. www.ecolab.com Follow us on LinkedIn @Ecolab, Twitter @Ecolab, Instagram @Ecolab_Inc and Facebook @Ecolab. Contact:Amy Hahn651-250-4724MediaRelations@Ecolab.com March 22, 2021 (ECL-C)",Ecolab Releases Enhanced Smart Water Navigator to Help Companies Advance Water Quantity and Quality Goals
2021-03-23,"PAUL, MN / ACCESSWIRE / March 23, 2021 / Ecolab will host a live webcast of its first quarter earnings conference call to discuss 2021 first quarter results. A news release containing first quarter results is expected to be issued before market open on April 27, 2021.",Ecolab Schedules Webcast and Conference Call on April 27
2021-03-24,"While the market driven by short-term sentiment influenced by the accommodative interest rate environment in the US, virus news and stimulus spending, many smart money investors are starting to get cautious towards the current bull run since March and hedging or reducing many of their long positions. Some fund managers are betting on Dow hitting […]",Is Ecolab (ECL) Stock A Buy or Sell?
2021-03-29,Ecolab's (ECL) smart tool is expected to bridge the widening gap between freshwater supply and demand via efficient water management.,Ecolab (ECL) Unveils Its Enhanced Smart Water Navigator
2021-03-29,ICL vs. ECL: Which Stock Is the Better Value Option?,ICL vs. ECL: Which Stock Should Value Investors Buy Now?
2021-03-31,"Ecolab (ECL) continues to gain traction for a solid product portfolio and cost-efficiency program. However, segmental weakness is worrisome.",Here's Why You Should Hold on to Ecolab (ECL) Stock for Now
2021-03-31,"Ecolab Inc., the global leader in water, hygiene and infection prevention solutions and services, has added a new on-demand digital training solution to its industry-leading Operating Room (OR) Program. The elevated OR program, called Ecolab OR Program Reinforced, is a comprehensive solution that now includes a digital training element to help hospitals improve the quality and consistency of clean for this critical care area.",Ecolab Introduces New Digital Training Solution to Improve Operating Room Cleanliness and Turnaround Time
2021-04-07,"When you buy and hold a stock for the long term, you definitely want it to provide a positive return. Furthermore...",Update: Ecolab (NYSE:ECL) Stock Gained 96% In The Last Five Years
2021-04-14,ICL vs. ECL: Which Stock Is the Better Value Option?,ICL vs. ECL: Which Stock Is the Better Value Option?
2021-04-19,"In this article, we will discuss Bill Gates’ stock portfolio strategy and extensively review his top 10 high dividend stocks. You can skip our comprehensive analysis of Bill Gates’ history and his hedge fund performance and see Bill Gates’ Top 5 High Dividend Stocks. The world’s fourth-richest person and Microsoft Corporation founder Bill Gates have […]",Bill Gates’ Top 10 High Dividend Stocks
2021-04-19,"Wall Street is surprisingly high on a new cleaning stock.  Diversey, founded in 1923, was once part of  (SEE) (SEE), which sold the unit to private equity firm Bain Capital in 2017 for about $3.2 billion.  Bain cut costs, improved margins, and brought the company public again this past month.","Wall Street Is Very High on This Cleaning Stock, Predicting 40% Gains"
2021-04-20,"Diversey, founded in 1923, was once part of  (SEE) (SEE), which sold the unit to private equity firm Bain Capital in 2017 for about $3.2 billion.  Bain cut costs, improved margins, and brought the company public again this past month.  Despite weak trading out of the gate, Wall Street almost uniformly recommends buying Diversey stock.",This Cleaning Stock Is Loved by Analysts. Why They Say It Could Gain 40%.
2021-04-20,The solid trend for materials ETFs is likely to continue as Q1 earnings unfold.,Materials Sector to Rejoice in Q1 Earnings: ETFs to Play
2021-04-22,Ecolab's (ECL) first-quarter results are likely to reflect strength in the Global Healthcare and Life Sciences segment.,Ecolab (ECL) to Report Q1 Earnings: What's in the Offing?
2021-04-22,"In this episode of Motley Fool Money, host Chris Hill is joined by Motley Fool analysts Ron Gross and Emily Flippen to discuss Microsoft's (NASDAQ: MSFT) acquisition of Nuance Communications (NASDAQ: NUAN) in a $16 billion deal.  To catch full episodes of all The Motley Fool's free podcasts, check out our podcast center.",Microsoft’s Big Deal and Coinbase’s Big Debut
