publishedAt,title,description
2019-10-07,"Ecolab Inc.  said Monday it &quot;strongly disagrees&quot; with a decision by the U.K. Competition and Markets Authority (CMA) that its acquisition of Holchem would stifle competition and lead to higher prices and lower quality for customers in the food and beverage industry. The CMA has ordered Ecolab to divest Holchem, a cleaning products business that Ecolab acquired in late 2018. &quot;We strongly believe that the UK market would remain highly competitive following the merger and are disappointed with the CMA's findings,&quot; Ecolab Chief Executive Douglas Baker said in a statement. &quot;We are reviewing the full report provided by the CMA in detail and will carefully consider our options and next steps,&quot; the CEO said. Holchem supplies cleaning products to the foodservice, beverage and hospitality industries in the UK and Ireland. It had sales of about $56 million at the time of the deal. Ecolab shares were not yet active premarket, but have gained 32% in 2019, while the S&P 500  has gained 18%.","Ecolab 'strongly disagrees' with UK CMA ruling that it must divest Holchem, mulls next steps"
2019-10-07,The addition of Gallay Medical is likely to boost Ecolab's (ECL) Healthcare offerings.,Ecolab's (ECL) Gallay Medical Buyout to Boost Healthcare Arm
2019-10-07,"The United Kingdom’s Competition and Markets Authority (CMA) announced the results of its review of the merger of Ecolab and Holchem, a UK-based cleaning products business Ecolab acquired in late 2018.  The CMA concluded that the merger may result in a substantial lessening of competition in the UK and could lead to an increase in prices, as well as a lowering of the quality of products and/or service for customers in the food and beverage industry in the UK.",Ecolab to Review the UK Competition and Markets Authority’s Decision to Oppose Ecolab’s Previously Announced Holchem Acquisition
2019-10-09,PQG vs. ECL: Which Stock Is the Better Value Option?,PQG or ECL: Which Is the Better Value Stock Right Now?
2019-10-09,"How do we determine whether Ecolab Inc. (NYSE:ECL) makes for a good investment at the moment? We analyze the sentiment of a select group of the very best investors in the world, who spend immense amounts of time and resources studying companies. They may not always be right (no one is), but data shows that […]",Hedge Funds Are Undecided About Ecolab Inc. (ECL)
2019-10-11,Stock pickers are generally looking for stocks that will outperform the broader market. And while active stock picking...,The Ecolab (NYSE:ECL) Share Price Is Up 83% And Shareholders Are Holding On
2019-10-14,"Ecolab (ECL) continues to gain from robust product portfolio and strong international presence. However, forex remains a woe.",Here's Why You Should Retain Ecolab (ECL) Stock For Now
2019-10-23,Positive developments in the Global Industrial unit are expected to have driven Ecolab's (ECL) Q3 results.,Can Global Industrial Unit Drive Ecolab's (ECL) Q3 Earnings?
2019-10-24,Helping hospitals protect patients against an emerging public health threat,Ecolab’s OxyCide™ Daily Disinfectant Cleaner Receives U.S. EPA Candida Auris Claim
2019-10-28,Many investors are still learning about the various metrics that can be useful when analysing a stock. This article is...,Is Ecolab Inc.'s (NYSE:ECL) ROE Of 18% Impressive?
2019-10-28,"Ecolab (NYSE: ECL ) announces its next round of earnings this Tuesday, October 29. Here is Benzinga's everything-that-matters guide for the Q3 earnings announcement. Earnings and Revenue Wall Street analysts ...",Ecolab's Q3 Earnings Outlook
2019-10-28,"Ecolab Inc. President and Chief Operating Officer Christophe Beck will address financial analysts at the Baird 2019 Global Industrial Conference on Tuesday, November 5 in Chicago. Ecolab will offer a live webcast of Mr.","Ecolab Schedules Webcast of Industry Conference for November 5, 2019"
2019-10-29,Ecolab Inc. :,"Ecolab Third Quarter Reported Diluted EPS $1.59; Adjusted Diluted EPS $1.71, +12%; 2019 Adjusted Diluted EPS Forecast Narrowed to $5.80 to $5.90, +10% to 12% From Previous $5.80 to $6.00 Range"
2019-10-29,"Ecolab (ECL) delivered earnings and revenue surprises of -0.58% and -1.77%, respectively, for the quarter ended September 2019. Do the numbers hold clues to what lies ahead for the stock?",Ecolab (ECL) Misses Q3 Earnings and Revenue Estimates
2019-10-29,Global Industrial unit aid Ecolab's (ECL) Q3 results; 2019 EPS view slashed.,Ecolab (ECL) Earnings and Revenues Miss Estimates in Q3
2019-10-31,Q3 2019 Ecolab Inc Earnings Call,Edited Transcript of ECL earnings conference call or presentation 29-Oct-19 5:00pm GMT
2019-11-05,Near-Term Prospects Gloomy for Specialty Chemical Stocks,Near-Term Prospects Gloomy for Specialty Chemical Stocks
2019-11-07,Minnesota’s business leaders were by a large margin backing U.S. Sen. Amy Klobuchar (D-Minn.) in the early stages of 2020 presidential election.,Minnesota business execs place the most — and biggest — bets on Klobuchar for president
2019-11-12,"Announcement of Periodic Review: Moody's announces completion of a periodic review of ratings of Ecolab Inc.  New York, November 12, 2019 -- Moody's Investors Service (""Moody's"") has completed a periodic review of the ratings of Ecolab Inc. and other ratings that are associated with the same analytical unit.  The review was conducted through a portfolio review in which Moody's reassessed the appropriateness of the ratings in the context of the relevant principal methodology(ies), recent developments, and a comparison of the financial and operating profile to similarly rated peers.",Ecolab Lux 1 S.A R.L. -- Moody's announces completion of a periodic review of ratings of Ecolab Inc.
2019-11-18,This article is written for those who want to get better at using price to earnings ratios (P/E ratios). We'll show...,Should You Be Tempted To Sell Ecolab Inc. (NYSE:ECL) Because Of Its P/E Ratio?
2019-11-19,Firms' largest sales of the 3rd quarter Continue reading...,"Mairs and Power Sells UPS, Abbott Labs"
2019-11-20,More investors registered for the SRI Conference in Colorado Springs while sustainable funds are receiving bigger chunks of money and competition is heating up among data providers.,Sustainable Funds Set to See a ‘Tsunami’ of New Capital
2019-11-20,"The materials sector includes companies engaged in the discovery, development, and processing of raw materials, which are used across many other sectors and industries.  Materials stocks include manufacturers of products as varied as plastic, fertilizer, paper, concrete, metals, and more.  Some prominent names in the materials sector include Dupont de Nemours Inc. (DD), Ecolab Inc. (ECL), and Dow Inc. (DOW).",Top Materials Stocks for December 2019
2019-11-26,A perfect business based on numbers Continue reading...,Urbem's 'Wonderful Business' Series: Rollins
2019-11-26,"Ecolab Inc. Executive Vice President and President Global Industrial Darrell Brown will address financial analysts at the Citi 2019 Basic Materials Conference on Tuesday, December 3 in New York.","Ecolab Schedules Webcast of Industry Conference for December 3, 2019"
2019-11-28,Ecolab (ECL) reported earnings 30 days ago. What's next for the stock? We take a look at earnings estimates for some clues.,Ecolab (ECL) Down 3.5% Since Last Earnings Report: Can It Rebound?
2019-12-03,"&quot;Since 2006, value stocks (IVE vs IVW) have underperformed 11 of the 13 calendar years and when they beat growth, it wasn't by much. Cumulatively, through this week, it has been a 122% differential (up 52% for value vs up 174% for growth). This appears to be the longest and most severe drought for value […]",Hedge Funds Have Never Been This Bullish On Ecolab Inc. (ECL)
2019-12-04,"The Board of Directors of Ecolab Inc. declared a 2% increase in the company’s quarterly cash dividend to $0.47 per common share, to be paid January 15, 2020, to shareholders of record at the close of business on December 17, 2019. This increase results in a new indicated annual cash dividend of $1.88 per share in 2020 and represents Ecolab’s 28th consecutive annual dividend rate increase.",Ecolab Increases Cash Dividend 2%
2019-12-05,"Ecolab Inc., the global leader in water, hygiene and energy technologies and services, today announced that it will align its operations and supply chain to the U.N. Global Compact’s Business Ambition for 1.5⁰C, and will work to reduce its carbon emissions by half by 2030 and to net-zero by 2050. The company is committed to doing its part in limiting the rise of global temperatures to 1.5 degrees Celsius (2.7 F) or less above pre-industrial levels, the limit deemed necessary by the U.N. to avoid the worst consequences of climate change.",Ecolab Joins the U.N. Global Compact’s Business Ambition For 1.5⁰C
2019-12-05,"&quot;Climate change demands urgent action, and it's absolutely critical that we accelerate our efforts to mitigate its impact,&quot; Ecolab CEO Doug Baker Jr. said in a statement.","Ecolab says it will adopt U.N. climate goals, be carbon neutral by 2050"
2019-12-09,Ecolab (ECL) slashes 2019 EPS view owing to foreign exchange headwinds.,Here's Why You Should Hold on to Ecolab (ECL) Stock for Now
2019-12-10,"""The problems that you're trying to fix change over time,"" observed Ryan Hanson, vice president of North American logistics for Ecolab, a St. Paul, Minnesota-headquartered conglomerate with annual sales of $15 billion and operations in 170 countries.  A former logistics director for Amazon.com, Inc. (NASDAQ: AMZN) and Target Corporation (NYSE: TGT), Hanson now oversees the warehousing and movement of Ecolab chemicals and equipment across North America.  The company started its journey seeking to improve freight payment processes and is now on a path to leverage data analytics to solve broader logistics challenges.",Data Cleansing Key To Optimizing Logistics
2019-12-13,"Moody's Investors Service (""Moody's"") affirmed the ratings on Ecolab Inc.'s senior unsecured notes at Baa1 but changed the outlook on the ratings to positive from stable.  The change in outlook reflects Ecolab's strong track record of growing and improving the portfolio through M&A activity and organic growth, while maintaining a strong balance sheet with only occasional deviations from the company's net leverage targets.  The positive outlook also reflects good scale, strong and consistent free cash flow and relatively strong and stable EBITDA margins, which should expand modestly after the pending separation of the upstream energy business.",ECOLAB NL 11 B.V. -- Moody's changes Ecolab's outlook to positive
2019-12-19,Ecolab Inc. said Thursday it will merge a $2.4 billion business that sells chemicals to the oil industry with Texas-based Apergy Corp.,Ecolab will merge 'upstream' business with Apergy in $4.4B deal
2019-12-19,"Oil and gas drilling services company Apergy Corp.  announced Thursday a deal in which it will combine with Ecolab Inc.'s  upstream energy business, in a deal that values that upstream business at about $4.4 billion. Under terms of the deal, Apergy will issue 127 million shares to Ecolab shareholders, which based on Wednesday's stock closing price of $30.67 would be valued at $3.90 billion. Apergy will also assume debt of about $492 million. Ecolab shareholders will own about 62% of the combined company and Apergy shareholders will own 38%. Expected synergies from the deal are an annualized $75 million within 24 months of closing. Shares of both Apergy and Ecolab were still inactive in premarket trading. Apergy's stock has gained 13% year to date and Ecolab shares have climbed 26%, while the S&P 500 has advanced 27%.",Apergy to combine with Ecolab's upstream energy business in a deal valued at $4.4 bln
2019-12-19,"Apergy Corporation (&quot;Apergy&quot;) (NYSE: APY) and Ecolab Inc. (&quot;Ecolab&quot;) (NYSE: ECL) today announced that their Boards of Directors have approved a definitive agreement pursuant to which Ecolab will separate the Upstream Energy business of Nalco Champion (which is being renamed ChampionX) and simultaneously combine it with Apergy in a tax-free transaction, creating a scaled, global leader in production-optimization solutions (the &quot;Combined Company&quot;).","Apergy to Combine With Ecolab’s Upstream Energy Business in a Tax-Free Transaction, Creating a Global Leader in Production-Optimization Solutions"
2019-12-19,"Global leader for life of field production optimization solutions, including artificial lift equipment, chemical solutions, and digital technologies, offering customers.","Apergy to Combine with Ecolab’s Upstream Energy Business in a Tax-Free Transaction, Creating a Global Leader in Production-Optimization Solutions"
2019-12-20,"Moody's Investors Service, (""Moody's"") placed all ratings of Apergy Corporation (Apergy) on review for upgrade, including its Ba3 Corporate Family Rating (CFR), Ba3-PD Probability of Default Rating (PDR), Ba1 senior secured credit facility rating, and B1 senior unsecured notes rating.",Apergy Corporation -- Moody's reviews Apergy's ratings for upgrade
2019-12-20,The Woodlands-based spinoff of the upstream business of Illinois-based manufacturer Dover Corp. will merge with the upstream energy business of a Sugar Land-based division that Minnesota-based Ecolab Inc. (NYSE: ECL) created in 2013.,Houston-area upstream services businesses to combine in $4.4B deal
2019-12-25,"It has been a fantastic year for equity investors as Donald Trump pressured Federal Reserve to reduce interest rates and finalized the first leg of a trade deal with China. If you were a passive index fund investor, you had seen gains of 31% in your equity portfolio in 2019. However, if you were an […]",2019 Review: Most Favored Hedge Fund Stocks vs. Ecolab Inc. (ECL)
2020-01-07,"Doug Baker has been the CEO of Ecolab Inc. (NYSE:ECL) since 2004. First, this article will compare CEO compensation...",How Much is Ecolab Inc.'s (NYSE:ECL) CEO Getting Paid?
2020-01-09,"Ecolab Inc. the global leader in water, food safety and hygiene technologies and services, has reached an agreement to acquire CID Lines, a leading global provider of livestock biosecurity and hygiene solutions.",Ecolab to Acquire Global Livestock Biosecurity and Hygiene Provider CID Lines
2020-01-09,"Terms of the deal were not disclosed; CID Lines had sales of $113 million in 2019, and has over 250 employees.",Ecolab to add over 250 employees with purchase of Belgian farm hygiene firm
2020-01-10,Sector ETF report for FMAT,Should You Invest in the Fidelity MSCI Materials Index ETF (FMAT)?
2020-01-14,"Ecolab will host a live webcast of its fourth quarter earnings conference call to discuss 2019 fourth quarter results and future earnings guidance. A news release containing fourth quarter results and future earnings guidance is expected to be issued before market open on Feb. 18, 2020.",Ecolab Schedules Webcast and Conference Call on February 18
2020-01-14,Vodafone makes the list Continue reading...,6 Stocks Trading With Low Price-Sales Ratios
2020-01-17,"In a week in which BlackRock swore off coal stocks, attention is growing on companies that meet so-called environmental, social and governance criteria.","ESG stocks aren’t in a bubble, for now"
2020-01-20,"Ecolab Inc. (""Ecolab"") and Ecolab U.S. 2 Inc. (""Ecolab Offeror"") announce that, further to the completion of Ecolab Offeror's recommended cash offer for Bioquell PLC, which was implemented by means of a Court-sanctioned scheme of arrangement under Part 26 of the Companies Act 2006, and which became effective on 16 January 2019, Ecolab and Ecolab Offeror have duly confirmed in writing to The Panel on Takeovers and Mergers in accordance with the requirements of Rule 19.6(c) of the Code that Ecolab and Ecolab Offeror have complied with their post-offer statements of intention made pursuant to Rules 2.7(c)(iv) and 24.2 of the Code, as originally detailed in the announcement of 30 November 2018 and the scheme document published on 18 December 2018.",Rule 19.6(c) confirmation with respect to stated post-offer intentions with regard to Bioquell Limited (formerly Bioquell PLC)
2020-01-21,"Ecolab Inc., the global leader in water, food safety and public health technologies and services, has been named to Bloomberg’s 2020 Gender-Equality Index (GEI). The GEI tracks the financial performance of public companies committed to supporting gender equality through policy development, representation and transparency. Ecolab is one of 325 companies across 50 industries to be included in the 2020 index.",Ecolab Named to Bloomberg Gender-Equality Index
2020-01-23,"Ecolab Inc., the global leader in water, food safety and public health technologies and services, today announced that Elizabeth Simermeyer has been promoted to executive vice president and president, Global Healthcare and Life Sciences group.",Ecolab Names Elizabeth Simermeyer Executive Vice President and President of Global Healthcare and Life Sciences Group
2020-01-27,"Ecolab Inc., the global leader in water, food safety and public health technologies and services, today announced that Gail Peterson has been promoted to senior vice president of Global Marketing and Communications.",Ecolab Names Gail Peterson Senior Vice President of Global Marketing and Communications
2020-01-29,"Ecolab Inc., the global leader in water, food safety and public health technologies and services, today announced that Emilio Tenuta has been promoted to senior vice president of Sustainability.",Ecolab Names Emilio Tenuta Senior Vice President of Sustainability
2020-01-30,"Ecolab Inc., the global leader in water, food safety and public health technologies and services, has updated key data within its Water Risk Monetizer tool to reflect current water trends. The tool, which enables businesses to factor current and future water risks into business strategy, is increasingly being used by companies as they plan action steps to support sustainable growth.",Ecolab's Water Risk Monetizer Updates Global Water Data to Reflect Current Trends
2020-02-03,Some thoughts on the candidacy Continue reading...,Warren Buffett's 20-Slot Rule
2020-02-03,Today we're going to take a look at the well-established Ecolab Inc. (NYSE:ECL). The company's stock saw its share...,Is Now The Time To Look At Buying Ecolab Inc. (NYSE:ECL)?
2020-02-03,Sector ETF report for FMAT,Should You Invest in the Fidelity MSCI Materials Index ETF (FMAT)?
2020-02-06,"Ecolab Inc., the global leader in water, food safety and public health technologies and services, has been named to the Water Security List, with an A rating by CDP, the nonprofit global environmental disclosure platform. This year’s CDP Water Security A List recognized 71 companies globally for their sustainable water management initiatives.",Ecolab Named to CDP Water Security A List for Sustainable Water Management
2020-02-06,"Ecolab Inc., the global leader in water, food safety and health technologies and services, has introduced Eco-Flex™ Teat Dip, an effective and affordable udder care solution for dairy cows that helps prevent infection, improve teat health and support milk quality.",Ecolab Launches Innovative Eco-Flex™ Non-Iodine Teat Dip
2020-02-10,The Eco-Flex Teat Dip launch is likely to expand Ecolab's (ECL) Food & Beverage product portfolio.,Ecolab's Eco-Flex Teat Dip to Boost Food & Beverage Segment
2020-02-11,Ecolab (ECL) doesn't possess the right combination of the two key ingredients for a likely earnings beat in its upcoming report. Get prepared with the key expectations.,Ecolab (ECL) Reports Next Week: Wall Street Expects Earnings Growth
2020-02-12,Ecolab's (ECL) Q4 results are likely to reflect strength in core Global Industrial unit.,Global Industrial Unit to Drive Ecolab's (ECL) Q4 Earnings
2020-02-15,"While the moderate 2020 Democrats finished behind Bernie Sanders in New Hampshire, presidential hopefuls Amy Klobuchar, Pete Buttigieg and Joe Biden are winning over S&P 500 CEOs, as the execs vote for them with their wallets.",Not one S&P 500 CEO is donating to Bernie Sanders or Elizabeth Warren
2020-02-18,Ecolab Inc. (NYSE: ECL):,"Ecolab Fourth Quarter Reported Diluted EPS $1.47; Adjusted Diluted EPS $1.66, +8% ; 2020 Adjusted Diluted EPS Forecast $6.33 to $6.53, +9% To 12%"
2020-02-18,Strength in the Global Industrial arm drives Ecolab's (ECL) Q4 results.,Ecolab (ECL) Earnings and Revenues Miss Estimates in Q4
2020-02-20,"Ecolab Inc. (NYSE:ECL) last week reported its latest annual results, which makes it a good time for investors to dive...",Ecolab Inc. Just Released Its Annual Results And Analysts Are Updating Their Estimates
2020-02-20,"The number of new COVID-19 cases appeared to taper off on Thursday morning; however, that may be due to another change in how China’s Hubei Province is counting cases.","Coronavirus update: 75,748 cases, 2,129 deaths, Norwegian Cruise and Ecolab expect hit to EPS"
2020-02-24,Q4 2019 Ecolab Inc Earnings Call,Edited Transcript of ECL earnings conference call or presentation 18-Feb-20 6:00pm GMT
2020-02-25,"Ecolab Inc., the global leader in water, food safety and public health technologies and services, has again been recognized as one of the World’s Most Ethical Companies by the Ethisphere Institute, a global leader in defining and advancing the standards of ethical business practices. Ecolab has been named one of the World’s Most Ethical Companies every year since the list’s inception in 2007.",Ecolab Named One of the World’s Most Ethical Companies for 14th Consecutive Year
2020-02-26,"As the food industry rapidly evolves towards a healthier and more sustainable future, the commercial laundry industry is challenged with fighting tougher stains from ingredients such as unsaturated liquid vegetable oils and effectively cleaning polyester blends, while minimizing water and energy use.",Ecolab's PolyVantage™ Program for Commercial Laundries Conquers Food Oil Stain Challenges on Polyester Linens
2020-02-27,"The board of directors of Ecolab Inc. today declared a regular quarterly cash dividend of $0.47 per common share, to be paid April 15, 2020, to shareholders of record at the close of business on March 17, 2020.",Ecolab Declares Regular Dividend
2020-03-11,"Regular readers will know that we love our dividends at Simply Wall St, which is why it's exciting to see Ecolab Inc...","Ecolab Inc. (NYSE:ECL) Looks Like A Good Stock, And It's Going Ex-Dividend Soon"
2020-03-12,The coronavirus pandemic likely to disrupt the first-quarter performances of players in the MedTech space.,Coronavirus to Weigh on These 4 Medical Stocks' Q1 Show
2020-03-16,"We hate to say this but, we told you so. On February 27th we published an article with the title Recession is Imminent: We Need A Travel Ban NOW and predicted a US recession when the S&P 500 Index was trading at the 3150 level. We also told you to short the market and buy […]",Hedge Funds Have Never Been This Bullish On Ecolab Inc. (ECL)
2020-03-18,"Ecolab Inc. confirmed today its first quarter 2020 adjusted diluted earnings per share guidance range of $1.05 to $1.13, an increase of 2% to 10% compared with $1.03 earned a year ago, with this forecast including an estimated unfavorable $0.05 per share impact from the effects of the COVID-19 pandemic.",Ecolab Confirms First Quarter Guidance
2020-03-19,Ecolab (ECL) reported earnings 30 days ago. What's next for the stock? We take a look at earnings estimates for some clues.,Why Is Ecolab (ECL) Down 25.6% Since Last Earnings Report?
2020-03-24,"Ecolab will host a live webcast and conference call to supplement its March 18, 2020 news release and discuss business perspectives regarding the COVID-19 pandemic.",Ecolab Schedules Webcast and Conference Call for March 25
2020-03-26,Kay Chemical Co. has ramped up production 10-fold to meet demand for critical products such as hand sanitizer and other disinfectants amid COVID-19 crisis.,Triad sanitizer maker staying in the fight against COVID-19
2020-03-31,"It hasn't been the best quarter for Ecolab Inc. (NYSE:ECL) shareholders, since the share price has fallen 16% in that...",Investors Who Bought Ecolab (NYSE:ECL) Shares Five Years Ago Are Now Up 41%
2020-04-02,"Ecolab will host a live webcast of its first quarter earnings conference call to discuss 2020 first quarter results. A news release containing first quarter results is expected to be issued before market open on April 28, 2020.",Ecolab Schedules Webcast and Conference Call on April 28
2020-04-15,"In response to the COVID-19 pandemic, Ecolab, the global leader in water, food safety and infection prevention technologies and services, has donated more than $1.7 million in financial contributions and in-kind product donations to support organizations and individuals in need.",Ecolab Contributes $1.7 Million in Financial Support and In-Kind Product Donations to COVID-19 Response
2020-04-17,"Ecolab today announced that due to public health precautions limiting in-person gatherings during the coronavirus (COVID-19) outbreak and to support the health and well-being of our stockholders and associates, the format of the 2020 Annual Meeting of Stockholders has been changed to a virtual-only meeting, instead of an in-person meeting. As previously announced, the Annual Meeting will be held on Thursday, May 7, 2020 at 9:30 a.m., Central Time. Stockholders will not be able to attend the Annual Meeting in person.",Ecolab Provides Additional Information Regarding Its 2020 Annual Meeting of Stockholders Due to Coronavirus Precautions
2020-04-18,Today I will take a look at Ecolab Inc.'s (NYSE:ECL) most recent earnings update (31 December 2019) and compare these...,Should You Be Happy With Ecolab Inc.'s (NYSE:ECL) 9.1% Earnings Growth?
