publishedAt,title,description
2019-05-13,Top Energy StocksTop Energy Stocks XOM 1 38 XOM 1 38 CVX 1 43 CVX 1 43 COP 1 39 COP 1 39 SLB 4 35 SLB 4 35 OXY 2 26 OXY 2 26 Energy stocks have turned sharply lower with the NYSE Energy Sector Index falling over 1 7 while shares of energy companies in the S amp P 500 were,"Energy Sector Update for 05/13/2019: EQNR,RDS.A,RDS.B,SHLX,HON"
2019-05-21,Top Energy StocksTop Energy Stocks XOM 0 40 XOM 0 40 CVX 0 55 CVX 0 55 COP 1 63 COP 1 63 SLB 1 00 SLB 1 00 OXY 0 06 OXY 0 06 Energy stocks added slightly to their prior gains this afternoon with the NYSE Energy Sector Index climbing nearly 1 0 while shares of energy companies,"Energy Sector Update for 05/21/2019: GMLP,PNRG,GLNG,RDS.A,RDS.B"
2019-05-21,InvestorPlace Stock Market News Stock Advice amp Trading Tips Equity markets spiked up in the first four months of 2019 pricing in a possible trade deal resolution between the U S and China However on May 5 investors woke up to the reality that the U S was not happy with the,3 Dividend Stocks to Buy for a Portfolio That’s Built to Last
2019-05-21,Top Energy StocksTop Energy Stocks XOM 0 48 XOM 0 48 CVX 0 64 CVX 0 64 COP 1 64 COP 1 64 SLB 1 43 SLB 1 43 OXY 0 07 OXY 0 07 Energy stocks were rising with the NYSE Energy Sector Index climbing nearly 0 9 while shares of energy companies in the S amp P 500 were up more than 1 2,"Energy Sector Update for 05/21/2019: PNRG,GLNG,RDS.A,RDS.B"
2019-05-24,Updates with price move EIA OECD reports Updates with price move EIA OECD reports Oil prices recorded their steepest weekly slump this year as concern grew that the trade row between the US and China would escalate endangering global demand for crude and as inventories unexpectedly,"Energy Sector Update for 05/24/2019: BHGE, XOM, CVX, RDS.A, RDS.B, BP, E, COP, TOT, PBR, PBR.A, EC, SLB, HAL, NOV, SPN"
2019-05-31,Updates with the price move EIA report and general market commentary from the first paragraph Updates with the price move EIA report and general market commentary from the first paragraph Crude headed for the second week of declines in May as President Donald Trump s threats to,"Energy Sector Update for 05/31/2019: BHGE, XOM, CVX, RDS.A, RDS.B, BP, E, COP, TOT, PBR, PBR.A, EC, SLB, HAL, NOV, SPN"
2019-06-05,BP plc BP recently announced its decision to divest Gulf of Suez oil concessions in Egypt to an upstream energy firm Dragon Oil The value of the transaction has not been disclosed yet With the divestment the British energy giant is planning to focus on gas reserves located off the coast,BP to Redirect Focus From Oil Assets in Egypt to Gas Reserves
2019-06-07,Updates with the price move the EIA and Goldman Sachs reports and general market commentary from the first paragraph Updates with the price move the EIA and Goldman Sachs reports and general market commentary from the first paragraph Crude jumped on Friday as the market expected a,"Energy Sector Update for 06/07/2019: BHGE, XOM, CVX, RDS.A, RDS.B, BP, E, COP, TOT, PBR, PBR.A, EC, SLB, HAL, NOV, SPN"
2019-06-14,Updates with the price move and EIA Goldman Sachs IEA reports from the first paragraph Updates with the price move and EIA Goldman Sachs IEA reports from the first paragraph Crude oil fell this week after the International Energy Agency projected slower than expected growth in demand in,"Energy Sector Update for 06/14/2019: BHGE, XOM, CVX, RDS.A, RDS.B, BP, E, COP, TOT, PBR, PBR.A, EC, SLB, HAL, NOV, SPN"
2019-06-21,Crude ended the week higher with prices increasing sharply after Iran downed a US surveillance drone on Thursday and while tensions eased after the US called off its retaliatory response against Tehran because it did not want the move to be disproportionate the geopolitical environment,"Energy Sector Update for 06/21/2019: XOM, CVX, RDS.A, RDS.B, BP, E, COP, TOT, PBR, PBR.A, EC, SLB, HAL, NOV, SPN"
2019-06-28,Updates with the price move EIA report DailyFX comment and general market commentary from the first paragraph Updates with the price move EIA report DailyFX comment and general market commentary from the first paragraph US crude fluctuated on Friday but ended the week slightly,"Energy Sector Update for 06/28/2019: BHGE, XOM, CVX, RDS.A, RDS.B, BP, E, COP, TOT, PBR, PBR.A, EC, SLB, HAL, NOV, SPN"
2019-07-05,Oil prices fell this week after weekly crude supplies shrank significantly less than expected in the US While prices rose on Friday gains were measured as a US jobs report sparked a rally in the dollar and German industrial orders fell far more than expected in May Oil prices fell this week,"Energy Sector Update for 07/05/2019: XOM, CVX, RDS.A, RDS.B, BP, E, COP, TOT, PBR, PBR.A, EC, SLB, HAL, NOV, SPN, BHGE"
2019-07-12,Updates with the price move EIA Swissquote IEA reports and general market commentary from the first paragraph Updates with the price move EIA Swissquote IEA reports and general market commentary from the first paragraph Crude was little changed on Friday after touching its highest level,"Energy Sector Update for 07/12/2019: BHGE, XOM, CVX, RDS.A, RDS.B, BP, E, COP, TOT, PBR, PBR.A, EC, SLB, HAL, NOV, SPN"
2019-07-26,Crude headed slightly higher this week as a steeper than expected drop in inventories in the US added to tensions in Iran which was the third biggest oil producer in the Organization for Petroleum Exporting Countries OPEC prior to re imposition of US sanctions late last year Crude,"Energy Sector Update for 07/26/2019: BHGE, XOM, CVX, RDS.A, RDS.B, BP, E, COP, TOT, PBR, PBR.A, EC, SLB, HAL, NOV, SPN"
2019-07-30,Royal Dutch Shell RDS A RDS B is up 8 9 YTD outperforming the oil and gas integrated market by almost 4 The global oil giant will repor t earnings for fiscal Q2 on Thursday August 1 before the market opens Let s take a look at the company and what to expect from its upcoming,Royal Dutch Shell to Report Earnings Thursday Morning: Should You Buy?
2019-08-02,Updates with the price move EIA report and general market commentary from the first paragraph Updates with the price move EIA report and general market commentary from the first paragraph Crude which bounced on Friday after recording its steepest daily slump in more than four years,"Energy Sector Update for 08/02/2019: BHGE, XOM, CVX, RDS.A, RDS.B, BP, E, COP, TOT, PBR, PBR.A, EC, SLB, HAL, NOV, SPN"
2019-08-09,Updates with the price move IEA Goldman reports and general market commentary from the first paragraph Updates with the price move IEA Goldman reports and general market commentary from the first paragraph Crude jumped on Friday on speculation Saudi Arabia was working behind the scenes,"Energy Sector Update for 08/09/2019: BHGE, XOM, CVX, RDS.A, RDS.B, BP, E, COP, TOT, PBR, PBR.A, EC, SLB, HAL, NOV, SPN"
2019-08-16,Updates with the price move OPEC EIA reports and general market commentary from the first paragraph Updates with the price move OPEC EIA reports and general market commentary from the first paragraph Crude prices rose on Friday as sentiment improved across asset classes from talks,"Energy Sector Update for 08/16/2019: BHGE, XOM, CVX, RDS.A, RDS.B, BP, E, COP, TOT, PBR, PBR.A, EC, SLB, HAL, NOV, SPN"
2019-08-19,Top Energy Stocks Top Energy Stocks XOM 1 04 XOM 1 04 CVX 1 03 CVX 1 03 COP 2 39 COP 2 39 SLB 2 35 SLB 2 35 OXY 0 75 OXY 0 75 Energy heavyweights were gaining in Monday s pre market trading West Texas Intermediate crude oil for September delivery was up 0 97 at 55,"Energy Sector Update for 08/19/2019: EQM, RDS.A, RDS.B, HUSA, XOM, CVX, COP, SLB, OXY"
2019-08-20,In trading on Tuesday shares of Royal Dutch Shell plc Symbol RDS B entered into oversold territory changing hands as low as 55 40 per share We define oversold territory using the Relative Strength Index or RSI which is a technical analysis indicator used to measure momentum on a scale,Royal Dutch Shell (RDS.B) Shares Enter Oversold Territory
2019-08-22,Top Energy Stocks Top Energy Stocks XOM 0 42 XOM 0 42 CVX 0 36 CVX 0 36 COP FlatCOP Flat SLB FlatSLB Flat OXY 0 53 OXY 0 53 Energy majors were flat to higher pre bell Thursday West Texas Intermediate crude oil for October delivery was up 0 76 at 56 44 per barrel at the,"Energy Sector Update for 08/22/2019: INT, RDS.A, RDS.B, FTI, XOM, CVX, COP, SLB, OXY"
2019-08-23,Crude slumped on Friday with August setting for the second month of declines after President Donald Trump hit out hard against China which unveiled early on Friday additional tariffs on 75 billion of goods imported from the US cementing fears that the trade war was pushing the global,"Energy Sector Update for 08/23/2019: BHGE, XOM, CVX, RDS.A, RDS.B, BP, E, COP, TOT, PBR, PBR.A, EC, SLB, HAL, NOV, SPN"
2019-08-30,Updates with EIA report Hurricane Dorian upgrade and general market commentary from the first paragraph Updates with EIA report Hurricane Dorian upgrade and general market commentary from the first paragraph Crude slumped on Friday as analysts cut their price forecast to a 16 month low,"Energy Sector Update for 08/30/2019: XOM, CVX, RDS.A, RDS.B, BP, E, COP, TOT, PBR, PBR.A, EC, SLB, HAL, NOV, SPN, BHGE"
2019-09-06,Crude fluctuated on Friday as a closely watched survey showed average daily output from the Organization of Petroleum Exporting Countries OPEC increased in August but oil was still headed higher for the week in which the US and China agreed to restart stalled trade talks Crude fluctuated,"Energy Sector Update for 09/06/2019: BHGE, XOM, CVX, RDS.A, RDS.B, BP, E, COP, TOT, PBR, PBR.A, EC, SLB, HAL, NOV, SPNE"
2020-08-14,"(Updates with the price move, EIA/Commerzbank reports, and general market commentary from the first paragraph.)","Energy Sector Update for 08/14/2020: BKR, XOM, CVX, RDS.A, RDS.B, BP, E, COP, TOT, PBR, PBR.A, EC, SLB, HAL, NOV, SPN"
2020-08-21,"(Updates with price move, analyst reports and general market commentary from the first paragraph.)","Energy Sector Update for 08/21/2020: BKR, XOM, CVX, RDS.A, RDS.B, BP, E, COP, TOT, PBR, PBR.A, EC, SLB, HAL, NOV, SPN"
2020-08-22,"The oil patch has been a tough place for dividend investors in recent years. Oil price crashes in 2014 and earlier this year took many payouts down with them. Because of that, many income investors have given up on the sector.",3 Top Oil Stocks With Dividends You Can Count On
2020-08-22,"The energy transition is well under way as renewable electricity capacity continues to grow around the world. Unbeknownst to many is the role that oil and gas companies are playing in this transition, a handful of which have recently upped the ante considerably.",Can These 3 Oil Giants Turn Into Renewable Energy Stocks?
2020-08-23,,"Tesla Tops $2,000 a Share, Is Now Worth More Than ExxonMobil, Shell, and BP Combined"
2020-08-24,"It's been a horrible earnings season for most top oil and gas companies. Oil supermajors ExxonMobil, Chevron, and BP all did worse than expected in Q2 2020 as low oil prices forced drastic spending cuts and the coronavirus pandemic destroyed demand.",Why Royal Dutch Shell Outperformed Expectations in Q2 2020
2020-08-29,"Integrated energy giant BP (NYSE: BP) has a huge 5.8% dividend yield and is making big plans to shift its business with the times. On the surface, that sounds like pretty good news all around. But there's more to understand here when you dig into the details a little bit. Here a",Is BP Stock a Buy?
2020-09-11,ExxonMobil's (NYSE: XOM) troubles don't seem to be ending. Rising debt levels and mega capital spending plans in an unfavorable oil price environment led to a steep fall in the stock's price over the past few years. Its removal from the Dow Jones Industrial Average Index has fur,3 Reasons Not to Sell ExxonMobil Stock
2020-09-14,"InvestorPlace - Stock Market News, Stock Advice & Trading Tips",Buy the Dip in Exxon Mobil Stock Before It Climbs Back to $45
2020-09-16,"Despite the recent sell-off and the ongoing impact of the COVID-19 pandemic on the broader economy, the stock market's rebound from its March lows has been a pleasant surprise for most investors. Not so much for shareholders of ExxonMobil (NYSE: XOM) and Royal Dutch Shell (NYSE:",Better Buy: ExxonMobil vs. Royal Dutch Shell
2020-09-16,"Shares of oil majors have been tumbling as investors grapple with lower oil prices and question the long-term future of oil and gas. The sell-off has been particularly bad for Royal Dutch Shell (NYSE: RDS.A) (NYSE: RDS.B), which has lost over half its value so far this year.",Is Royal Dutch Shell Stock a Buy?
2020-09-17,"If you're looking for a way to grow your money, the stock market is a good option. Stocks have historically produced one of the best returns of any asset class, a trend that should continue.","Where to Invest $5,000 Right Now"
2020-10-05,"InvestorPlace - Stock Market News, Stock Advice & Trading Tips",Has Exxon Mobil Become A Value Trap?
2020-10-05,"According to leaked documents first reported on by Bloomberg, oil giant ExxonMobil (NYSE: XOM) plans to increase carbon dioxide emissions over the next five years by 17%, more than the current emissions of the entire country of Greece.",Leaked Documents Reveal ExxonMobil Plans to Increase Carbon Emissions 17% by 2025
2020-10-07,"In this episode of MarketFoolery, Chris Hill chats with Motley Fool analyst Maria Gallagher about the latest headlines from Wall Street. They talk about layoffs, especially with regards to Disney (NYSE: DIS), and Nikola (NASDAQ: NKLA) deal negotiations. Also, a new company is co",Why the Nikola Deal Is in Flux
