publishedAt,title,description
2018-01-05,2018-01-05	2018-01-05 13:15:01	SHW	The Sherwin-Williams Company	5 Construction Stocks to Buy Ahead of Q4 Earnings	It will be prudent to invest in these construction stocks that are benefitting from the positive market dynamics and are expected to report a significant uptick this earnings season.	https://finance.yahoo.com/news/5-construction-stocks-buy-ahead-131501072.html?.tsrc=rss,2018-01-05	2018-01-05 13:15:01	SHW	The Sherwin-Williams Company	5 Construction Stocks to Buy Ahead of Q4 Earnings	It will be prudent to invest in these construction stocks that are benefitting from the positive market dynamics and are expected to report a significant uptick this earnings season.	https://finance.yahoo.com/news/5-construction-stocks-buy-ahead-131501072.html?.tsrc=rss
2018-01-05,2018-01-05	2018-01-05 15:14:17	SHW	The Sherwin-Williams Company	5 Construction Stocks to Buy Ahead of Q4 Earnings	With the official start to the Q4 earnings season less than two weeks away let s take a look at how the construction sector is placed in this upbeat market The construction sector has been stable through 2017 on sustainable growth despite multiple challenges Spending on construction was	http://articlefeeds.nasdaq.com/~r/nasdaq/symbols/~3/YyrpLpJuQ5M/5-construction-stocks-to-buy-ahead-of-q4-earnings-cm900803,2018-01-05	2018-01-05 15:14:17	SHW	The Sherwin-Williams Company	5 Construction Stocks to Buy Ahead of Q4 Earnings	With the official start to the Q4 earnings season less than two weeks away let s take a look at how the construction sector is placed in this upbeat market The construction sector has been stable through 2017 on sustainable growth despite multiple challenges Spending on construction was	http://articlefeeds.nasdaq.com/~r/nasdaq/symbols/~3/YyrpLpJuQ5M/5-construction-stocks-to-buy-ahead-of-q4-earnings-cm900803
2018-01-08,2018-01-08	2018-01-08 15:07:22	SHW	The Sherwin-Williams Company	Sherwin-Williams Reaches Analyst Target Price	In recent trading shares of Sherwin Williams Co Symbol SHW have crossed above the average analyst 12 month target price of 420 71 changing hands for 421 66 share When a stock reaches the target an analyst has set the analyst logically has two ways to react downgrade on valuation	http://articlefeeds.nasdaq.com/~r/nasdaq/symbols/~3/LOi8JQzHVZY/sherwin-williams-reaches-analyst-target-price-cm901678,2018-01-08	2018-01-08 15:07:22	SHW	The Sherwin-Williams Company	Sherwin-Williams Reaches Analyst Target Price	In recent trading shares of Sherwin Williams Co Symbol SHW have crossed above the average analyst 12 month target price of 420 71 changing hands for 421 66 share When a stock reaches the target an analyst has set the analyst logically has two ways to react downgrade on valuation	http://articlefeeds.nasdaq.com/~r/nasdaq/symbols/~3/LOi8JQzHVZY/sherwin-williams-reaches-analyst-target-price-cm901678
2018-01-10,2018-01-10	2018-01-10 15:18:25	SHW	The Sherwin-Williams Company	Will RPM International’s Dividend Yield Be Steady?	RPM International&apos;s Dividend Yield at the Beginning of 2018RPM International’s dividend yield	http://finance.yahoo.com/r/103127c3-c9ca-348e-9639-df4d3ca5e968/will-rpm-internationals-dividend-yield-steady?utm_source=yahoo&utm_medium=feed&yptr=yahoo&.tsrc=rss,2018-01-10	2018-01-10 15:18:25	SHW	The Sherwin-Williams Company	Will RPM International’s Dividend Yield Be Steady?	RPM International&apos;s Dividend Yield at the Beginning of 2018RPM International’s dividend yield	http://finance.yahoo.com/r/103127c3-c9ca-348e-9639-df4d3ca5e968/will-rpm-internationals-dividend-yield-steady?utm_source=yahoo&utm_medium=feed&yptr=yahoo&.tsrc=rss
2018-01-11,2018-01-11	2018-01-11 13:01:24	SHW	The Sherwin-Williams Company	See what the IHS Markit Score report has to say about Sherwin-Williams Co.	Sherwin-Williams Co NYSE:SHW	https://finance.yahoo.com/news/see-ihs-markit-score-report-130124398.html?.tsrc=rss,2018-01-11	2018-01-11 13:01:24	SHW	The Sherwin-Williams Company	See what the IHS Markit Score report has to say about Sherwin-Williams Co.	Sherwin-Williams Co NYSE:SHW	https://finance.yahoo.com/news/see-ihs-markit-score-report-130124398.html?.tsrc=rss
2018-01-12,2018-01-12	2018-01-12 12:35:28	SHW	The Sherwin-Williams Company	PPG Industries: Stock Performance since Its 3Q17 Earnings	PPG Industries in 4Q17: How Will 2017 End?PPG Industries’ 4Q17 earnings	http://finance.yahoo.com/r/1572beb4-2414-35de-8b09-0d733682f79a/ppg-industries-stock-performance-since-3q17-earnings?utm_source=yahoo&utm_medium=feed&yptr=yahoo&.tsrc=rss,2018-01-12	2018-01-12 12:35:28	SHW	The Sherwin-Williams Company	PPG Industries: Stock Performance since Its 3Q17 Earnings	PPG Industries in 4Q17: How Will 2017 End?PPG Industries’ 4Q17 earnings	http://finance.yahoo.com/r/1572beb4-2414-35de-8b09-0d733682f79a/ppg-industries-stock-performance-since-3q17-earnings?utm_source=yahoo&utm_medium=feed&yptr=yahoo&.tsrc=rss
2018-01-15,2018-01-15	2018-01-15 12:49:12	SHW	The Sherwin-Williams Company	Sherwin-Williams Hits New 52-Week High: What&apos;s Driving It?	Upbeat prospects stemming from the Valspar buyout are contributing to a rally in Sherwin-Williams&apos; (SHW) shares.	https://finance.yahoo.com/news/sherwin-williams-hits-52-week-124912606.html?.tsrc=rss,2018-01-15	2018-01-15 12:49:12	SHW	The Sherwin-Williams Company	Sherwin-Williams Hits New 52-Week High: What&apos;s Driving It?	Upbeat prospects stemming from the Valspar buyout are contributing to a rally in Sherwin-Williams&apos; (SHW) shares.	https://finance.yahoo.com/news/sherwin-williams-hits-52-week-124912606.html?.tsrc=rss
2018-01-15,2018-01-15	2018-01-15 15:12:18	SHW	The Sherwin-Williams Company	Sherwin-Williams Hits New 52-Week High: What's Driving It?	Shares of The Sherwin Williams Company SHW scaled a fresh 52 week high of 433 90 on Jan 12 before eventually closing the day at 432 84 Sherwin Williams has a market cap of roughly 40 5 billion Average volume of shares traded in the last three months is around 457 1K The company has	http://articlefeeds.nasdaq.com/~r/nasdaq/symbols/~3/eRfXmrBrrc0/sherwin-williams-hits-new-52-week-high-whats-driving-it-cm905301,2018-01-15	2018-01-15 15:12:18	SHW	The Sherwin-Williams Company	Sherwin-Williams Hits New 52-Week High: What's Driving It?	Shares of The Sherwin Williams Company SHW scaled a fresh 52 week high of 433 90 on Jan 12 before eventually closing the day at 432 84 Sherwin Williams has a market cap of roughly 40 5 billion Average volume of shares traded in the last three months is around 457 1K The company has	http://articlefeeds.nasdaq.com/~r/nasdaq/symbols/~3/eRfXmrBrrc0/sherwin-williams-hits-new-52-week-high-whats-driving-it-cm905301
2018-01-15,2018-01-15	2018-01-15 12:33:02	SHW	The Sherwin-Williams Company	PPG Industries: Short Interest before Its 4Q17 Earnings	PPG Industries in 4Q17: How Will 2017 End?	http://finance.yahoo.com/r/647af35b-e404-3461-9807-b809bbe15850/ppg-industries-short-interest-4q17-earnings?utm_source=yahoo&utm_medium=feed&yptr=yahoo&.tsrc=rss,2018-01-15	2018-01-15 12:33:02	SHW	The Sherwin-Williams Company	PPG Industries: Short Interest before Its 4Q17 Earnings	PPG Industries in 4Q17: How Will 2017 End?	http://finance.yahoo.com/r/647af35b-e404-3461-9807-b809bbe15850/ppg-industries-short-interest-4q17-earnings?utm_source=yahoo&utm_medium=feed&yptr=yahoo&.tsrc=rss
2018-01-15,2018-01-15	2018-01-15 15:12:18	SHW	The Sherwin-Williams Company	Sherwin-Williams Hits New 52-Week High: What's Driving It?	Shares of The Sherwin Williams Company SHW scaled a fresh 52 week high of 433 90 on Jan 12 before eventually closing the day at 432 84 Sherwin Williams has a market cap of roughly 40 5 billion Average volume of shares traded in the last three months is around 457 1K The company has	http://articlefeeds.nasdaq.com/~r/nasdaq/symbols/~3/MF0tb1gi4-A/sherwin-williams-hits-new-52-week-high-whats-driving-it-cm905301,2018-01-15	2018-01-15 15:12:18	SHW	The Sherwin-Williams Company	Sherwin-Williams Hits New 52-Week High: What's Driving It?	Shares of The Sherwin Williams Company SHW scaled a fresh 52 week high of 433 90 on Jan 12 before eventually closing the day at 432 84 Sherwin Williams has a market cap of roughly 40 5 billion Average volume of shares traded in the last three months is around 457 1K The company has	http://articlefeeds.nasdaq.com/~r/nasdaq/symbols/~3/MF0tb1gi4-A/sherwin-williams-hits-new-52-week-high-whats-driving-it-cm905301
2018-01-18,2018-01-18	2018-01-18 02:06:22	SHW	The Sherwin-Williams Company	Forget Blockchain: Invest in Old-School Winners Instead	0 30 Warren Buffett Thoughts On Cyptocurrency 4 15 Emerging Technology Boom or Bust 8 30 Buffett s 3 Ways The Market Could Keep Rising 11 45 How To Play The Market Like Buffett 15 15 Tracey s Top Picks Old School Winners	http://articlefeeds.nasdaq.com/~r/nasdaq/symbols/~3/X3DNUOS_76Y/forget-blockchain-invest-in-old-school-winners-instead-cm906823,2018-01-18	2018-01-18 02:06:22	SHW	The Sherwin-Williams Company	Forget Blockchain: Invest in Old-School Winners Instead	0 30 Warren Buffett Thoughts On Cyptocurrency 4 15 Emerging Technology Boom or Bust 8 30 Buffett s 3 Ways The Market Could Keep Rising 11 45 How To Play The Market Like Buffett 15 15 Tracey s Top Picks Old School Winners	http://articlefeeds.nasdaq.com/~r/nasdaq/symbols/~3/X3DNUOS_76Y/forget-blockchain-invest-in-old-school-winners-instead-cm906823
2018-01-18,2018-01-18	2018-01-18 02:06:22	SHW	The Sherwin-Williams Company	Forget Blockchain: Invest in Old-School Winners Instead	0 30 Warren Buffett Thoughts On Cyptocurrency 4 15 Emerging Technology Boom or Bust 8 30 Buffett s 3 Ways The Market Could Keep Rising 11 45 How To Play The Market Like Buffett 15 15 Tracey s Top Picks Old School Winners	http://articlefeeds.nasdaq.com/~r/nasdaq/symbols/~3/G2ocVvKvc9s/forget-blockchain-invest-in-old-school-winners-instead-cm906823,2018-01-18	2018-01-18 02:06:22	SHW	The Sherwin-Williams Company	Forget Blockchain: Invest in Old-School Winners Instead	0 30 Warren Buffett Thoughts On Cyptocurrency 4 15 Emerging Technology Boom or Bust 8 30 Buffett s 3 Ways The Market Could Keep Rising 11 45 How To Play The Market Like Buffett 15 15 Tracey s Top Picks Old School Winners	http://articlefeeds.nasdaq.com/~r/nasdaq/symbols/~3/G2ocVvKvc9s/forget-blockchain-invest-in-old-school-winners-instead-cm906823
2018-01-19,2018-01-19	2018-01-19 13:01:37	SHW	The Sherwin-Williams Company	See what the IHS Markit Score report has to say about Sherwin-Williams Co.	Sherwin-Williams Co NYSE:SHW	https://finance.yahoo.com/news/see-ihs-markit-score-report-130137986.html?.tsrc=rss,2018-01-19	2018-01-19 13:01:37	SHW	The Sherwin-Williams Company	See what the IHS Markit Score report has to say about Sherwin-Williams Co.	Sherwin-Williams Co NYSE:SHW	https://finance.yahoo.com/news/see-ihs-markit-score-report-130137986.html?.tsrc=rss
2018-01-22,2018-01-22	2018-01-22 12:06:12	SHW	The Sherwin-Williams Company	What&apos;s in Store for Sherwin-Williams (SHW) in Q4 Earnings?	Synergies of the Valspar acquisition and cost-control initiatives are expected to benefit Sherwin-Williams (SHW) this earnings season.	https://finance.yahoo.com/news/apos-store-sherwin-williams-shw-120612469.html?.tsrc=rss,2018-01-22	2018-01-22 12:06:12	SHW	The Sherwin-Williams Company	What&apos;s in Store for Sherwin-Williams (SHW) in Q4 Earnings?	Synergies of the Valspar acquisition and cost-control initiatives are expected to benefit Sherwin-Williams (SHW) this earnings season.	https://finance.yahoo.com/news/apos-store-sherwin-williams-shw-120612469.html?.tsrc=rss
2018-01-22,2018-01-22	2018-01-22 14:08:48	SHW	The Sherwin-Williams Company	What's in Store for Sherwin-Williams (SHW) in Q4 Earnings?	The Sherwin Williams Company SHW is set to release fourth quarter 2017 results ahead of the bell on Jan 25 In the last quarter the paints and coatings company reported a positive earnings surprise of 1 06 by posting adjusted earnings of 4 75 per share which surpassed the Zacks	http://articlefeeds.nasdaq.com/~r/nasdaq/symbols/~3/ZwC9aR3C7g8/whats-in-store-for-sherwin-williams-shw-in-q4-earnings-cm908278,2018-01-22	2018-01-22 14:08:48	SHW	The Sherwin-Williams Company	What's in Store for Sherwin-Williams (SHW) in Q4 Earnings?	The Sherwin Williams Company SHW is set to release fourth quarter 2017 results ahead of the bell on Jan 25 In the last quarter the paints and coatings company reported a positive earnings surprise of 1 06 by posting adjusted earnings of 4 75 per share which surpassed the Zacks	http://articlefeeds.nasdaq.com/~r/nasdaq/symbols/~3/ZwC9aR3C7g8/whats-in-store-for-sherwin-williams-shw-in-q4-earnings-cm908278
2018-01-22,2018-01-22	2018-01-22 14:08:48	SHW	The Sherwin-Williams Company	What's in Store for Sherwin-Williams (SHW) in Q4 Earnings?	The Sherwin Williams Company SHW is set to release fourth quarter 2017 results ahead of the bell on Jan 25 In the last quarter the paints and coatings company reported a positive earnings surprise of 1 06 by posting adjusted earnings of 4 75 per share which surpassed the Zacks	http://articlefeeds.nasdaq.com/~r/nasdaq/symbols/~3/3ud4ywPDOuI/whats-in-store-for-sherwin-williams-shw-in-q4-earnings-cm908278,2018-01-22	2018-01-22 14:08:48	SHW	The Sherwin-Williams Company	What's in Store for Sherwin-Williams (SHW) in Q4 Earnings?	The Sherwin Williams Company SHW is set to release fourth quarter 2017 results ahead of the bell on Jan 25 In the last quarter the paints and coatings company reported a positive earnings surprise of 1 06 by posting adjusted earnings of 4 75 per share which surpassed the Zacks	http://articlefeeds.nasdaq.com/~r/nasdaq/symbols/~3/3ud4ywPDOuI/whats-in-store-for-sherwin-williams-shw-in-q4-earnings-cm908278
2018-01-22,2018-01-22	2018-01-22 14:47:03	SHW	The Sherwin-Williams Company	PPG Industries Stock Soars as 4Q17 Revenue Beats Estimates	PPG Industries’ 4Q17 Earnings Give Its Stock a BoostPPG’s 4Q17 revenue beats estimates	http://finance.yahoo.com/r/8a99809d-aa26-3f38-be6c-aa7e83975c3d/ppg-industries-stock-soars-4q17-revenue-beats-estimates?utm_source=yahoo&utm_medium=feed&yptr=yahoo&.tsrc=rss,2018-01-22	2018-01-22 14:47:03	SHW	The Sherwin-Williams Company	PPG Industries Stock Soars as 4Q17 Revenue Beats Estimates	PPG Industries’ 4Q17 Earnings Give Its Stock a BoostPPG’s 4Q17 revenue beats estimates	http://finance.yahoo.com/r/8a99809d-aa26-3f38-be6c-aa7e83975c3d/ppg-industries-stock-soars-4q17-revenue-beats-estimates?utm_source=yahoo&utm_medium=feed&yptr=yahoo&.tsrc=rss
2018-01-23,2018-01-23	2018-01-23 01:07:02	SHW	The Sherwin-Williams Company	Validea's Top Five Basic Materials Stocks Based On Warren Buffett - 1/22/2018	The following are the top rated Basic Materials stocks according to Validea s Patient Investor model based on the published strategy of Warren Buffett This strategy seeks out firms with long term predictable profitability and low debt that trade at reasonable valuations The following are	http://articlefeeds.nasdaq.com/~r/nasdaq/symbols/~3/YyoKxhcd0jo/valideas-top-five-basic-materials-stocks-based-on-warren-buffett-1222018-cm908990,2018-01-23	2018-01-23 01:07:02	SHW	The Sherwin-Williams Company	Validea's Top Five Basic Materials Stocks Based On Warren Buffett - 1/22/2018	The following are the top rated Basic Materials stocks according to Validea s Patient Investor model based on the published strategy of Warren Buffett This strategy seeks out firms with long term predictable profitability and low debt that trade at reasonable valuations The following are	http://articlefeeds.nasdaq.com/~r/nasdaq/symbols/~3/YyoKxhcd0jo/valideas-top-five-basic-materials-stocks-based-on-warren-buffett-1222018-cm908990
2018-01-23,2018-01-23	2018-01-23 01:07:02	SHW	The Sherwin-Williams Company	Validea's Top Five Basic Materials Stocks Based On Warren Buffett - 1/22/2018	The following are the top rated Basic Materials stocks according to Validea s Patient Investor model based on the published strategy of Warren Buffett This strategy seeks out firms with long term predictable profitability and low debt that trade at reasonable valuations The following are	http://articlefeeds.nasdaq.com/~r/nasdaq/symbols/~3/34JJg_QEdK8/valideas-top-five-basic-materials-stocks-based-on-warren-buffett-1222018-cm908990,2018-01-23	2018-01-23 01:07:02	SHW	The Sherwin-Williams Company	Validea's Top Five Basic Materials Stocks Based On Warren Buffett - 1/22/2018	The following are the top rated Basic Materials stocks according to Validea s Patient Investor model based on the published strategy of Warren Buffett This strategy seeks out firms with long term predictable profitability and low debt that trade at reasonable valuations The following are	http://articlefeeds.nasdaq.com/~r/nasdaq/symbols/~3/34JJg_QEdK8/valideas-top-five-basic-materials-stocks-based-on-warren-buffett-1222018-cm908990
2018-01-24,2018-01-24	2018-01-24 13:01:02	SHW	The Sherwin-Williams Company	See what the IHS Markit Score report has to say about Sherwin-Williams Co.	Sherwin-Williams Co NYSE:SHW	https://finance.yahoo.com/news/see-ihs-markit-score-report-130102040.html?.tsrc=rss,2018-01-24	2018-01-24 13:01:02	SHW	The Sherwin-Williams Company	See what the IHS Markit Score report has to say about Sherwin-Williams Co.	Sherwin-Williams Co NYSE:SHW	https://finance.yahoo.com/news/see-ihs-markit-score-report-130102040.html?.tsrc=rss
2018-01-25,2018-01-25	2018-01-25 23:01:04	SHW	The Sherwin-Williams Company	4 Stocks to Invest in the Third Industrial Revolution	InvestorPlace Stock Market News Stock Advice amp Trading Tips It s been a heck of a year for the stock market or at least the first three weeks of it and I think it s only just getting started There are a lot of spectacular stocks out there right now but what I m	http://articlefeeds.nasdaq.com/~r/nasdaq/symbols/~3/q8POo9UzSG4/4-stocks-to-invest-in-the-third-industrial-revolution-cm911295,2018-01-25	2018-01-25 23:01:04	SHW	The Sherwin-Williams Company	4 Stocks to Invest in the Third Industrial Revolution	InvestorPlace Stock Market News Stock Advice amp Trading Tips It s been a heck of a year for the stock market or at least the first three weeks of it and I think it s only just getting started There are a lot of spectacular stocks out there right now but what I m	http://articlefeeds.nasdaq.com/~r/nasdaq/symbols/~3/q8POo9UzSG4/4-stocks-to-invest-in-the-third-industrial-revolution-cm911295
2018-01-25,2018-01-25	2018-01-25 23:01:04	SHW	The Sherwin-Williams Company	4 Stocks to Invest in the Third Industrial Revolution	InvestorPlace Stock Market News Stock Advice amp Trading Tips It s been a heck of a year for the stock market or at least the first three weeks of it and I think it s only just getting started There are a lot of spectacular stocks out there right now but what I m	http://articlefeeds.nasdaq.com/~r/nasdaq/symbols/~3/0zoPTSRd8NQ/4-stocks-to-invest-in-the-third-industrial-revolution-cm911295,2018-01-25	2018-01-25 23:01:04	SHW	The Sherwin-Williams Company	4 Stocks to Invest in the Third Industrial Revolution	InvestorPlace Stock Market News Stock Advice amp Trading Tips It s been a heck of a year for the stock market or at least the first three weeks of it and I think it s only just getting started There are a lot of spectacular stocks out there right now but what I m	http://articlefeeds.nasdaq.com/~r/nasdaq/symbols/~3/0zoPTSRd8NQ/4-stocks-to-invest-in-the-third-industrial-revolution-cm911295
2018-01-25,2018-01-25	2018-01-25 14:13:00	SHW	The Sherwin-Williams Company	Tax Reform Paints a Pretty Picture at Sherwin-Williams	Find out what the paint company sees ahead for 2018.	https://finance.yahoo.com/news/tax-reform-paints-pretty-picture-141300956.html?.tsrc=rss,2018-01-25	2018-01-25 14:13:00	SHW	The Sherwin-Williams Company	Tax Reform Paints a Pretty Picture at Sherwin-Williams	Find out what the paint company sees ahead for 2018.	https://finance.yahoo.com/news/tax-reform-paints-pretty-picture-141300956.html?.tsrc=rss
2018-01-25,2018-01-25	2018-01-25 10:00:00	SHW	The Sherwin-Williams Company	Sherwin-Williams Q4 17 Earnings Conference Call At 11:00 AM ET''	Sherwin-Williams Q4 17 Earnings Conference Call At 11:00 AM ET''	http://articlefeeds.nasdaq.com/~r/nasdaq/symbols/~3/hNa3N1X9bRA/sherwinwilliams-q4-17-earnings-conference-call-at-1100-am-et-20180125-00853,2018-01-25	2018-01-25 10:00:00	SHW	The Sherwin-Williams Company	Sherwin-Williams Q4 17 Earnings Conference Call At 11:00 AM ET''	Sherwin-Williams Q4 17 Earnings Conference Call At 11:00 AM ET''	http://articlefeeds.nasdaq.com/~r/nasdaq/symbols/~3/hNa3N1X9bRA/sherwinwilliams-q4-17-earnings-conference-call-at-1100-am-et-20180125-00853
2018-01-25,2018-01-25	2018-01-25 07:17:00	SHW	The Sherwin-Williams Company	Sherwin-Williams Issues Q1 & FY18 Guidance - Quick Facts	Sherwin-Williams Issues Q1 & FY18 Guidance - Quick Facts	http://articlefeeds.nasdaq.com/~r/nasdaq/symbols/~3/idm9Pnwas1Y/sherwinwilliams-issues-q1--fy18-guidance--quick-facts-20180125-00356,2018-01-25	2018-01-25 07:17:00	SHW	The Sherwin-Williams Company	Sherwin-Williams Issues Q1 & FY18 Guidance - Quick Facts	Sherwin-Williams Issues Q1 & FY18 Guidance - Quick Facts	http://articlefeeds.nasdaq.com/~r/nasdaq/symbols/~3/idm9Pnwas1Y/sherwinwilliams-issues-q1--fy18-guidance--quick-facts-20180125-00356
2018-01-25,2018-01-25	2018-01-25 07:09:00	SHW	The Sherwin-Williams Company	Sherwin-Williams Co Q4 Profit Advances	Sherwin-Williams Co Q4 Profit Advances	http://articlefeeds.nasdaq.com/~r/nasdaq/symbols/~3/ewnwkoK6dwo/sherwinwilliams-co-q4-profit-advances-20180125-00349,2018-01-25	2018-01-25 07:09:00	SHW	The Sherwin-Williams Company	Sherwin-Williams Co Q4 Profit Advances	Sherwin-Williams Co Q4 Profit Advances	http://articlefeeds.nasdaq.com/~r/nasdaq/symbols/~3/ewnwkoK6dwo/sherwinwilliams-co-q4-profit-advances-20180125-00349
2018-01-25,2018-01-25	2018-01-25 07:09:00	SHW	The Sherwin-Williams Company	Sherwin-Williams Co Q4 Profit Advances	Sherwin-Williams Co Q4 Profit Advances	http://articlefeeds.nasdaq.com/~r/nasdaq/symbols/~3/1l552kyfCzw/sherwinwilliams-co-q4-profit-advances-20180125-00349,2018-01-25	2018-01-25 07:09:00	SHW	The Sherwin-Williams Company	Sherwin-Williams Co Q4 Profit Advances	Sherwin-Williams Co Q4 Profit Advances	http://articlefeeds.nasdaq.com/~r/nasdaq/symbols/~3/1l552kyfCzw/sherwinwilliams-co-q4-profit-advances-20180125-00349
2018-01-25,2018-01-25	2018-01-25 10:00:00	SHW	The Sherwin-Williams Company	Sherwin-Williams Q4 17 Earnings Conference Call At 11:00 AM ET''	Sherwin-Williams Q4 17 Earnings Conference Call At 11:00 AM ET''	http://articlefeeds.nasdaq.com/~r/nasdaq/symbols/~3/5-N3gJrrvos/sherwinwilliams-q4-17-earnings-conference-call-at-1100-am-et-20180125-00853,2018-01-25	2018-01-25 10:00:00	SHW	The Sherwin-Williams Company	Sherwin-Williams Q4 17 Earnings Conference Call At 11:00 AM ET''	Sherwin-Williams Q4 17 Earnings Conference Call At 11:00 AM ET''	http://articlefeeds.nasdaq.com/~r/nasdaq/symbols/~3/5-N3gJrrvos/sherwinwilliams-q4-17-earnings-conference-call-at-1100-am-et-20180125-00853
2018-01-25,2018-01-25	2018-01-25 07:17:00	SHW	The Sherwin-Williams Company	Sherwin-Williams Issues Q1 & FY18 Guidance - Quick Facts	Sherwin-Williams Issues Q1 & FY18 Guidance - Quick Facts	http://articlefeeds.nasdaq.com/~r/nasdaq/symbols/~3/PFisRA-U4o0/sherwinwilliams-issues-q1--fy18-guidance--quick-facts-20180125-00356,2018-01-25	2018-01-25 07:17:00	SHW	The Sherwin-Williams Company	Sherwin-Williams Issues Q1 & FY18 Guidance - Quick Facts	Sherwin-Williams Issues Q1 & FY18 Guidance - Quick Facts	http://articlefeeds.nasdaq.com/~r/nasdaq/symbols/~3/PFisRA-U4o0/sherwinwilliams-issues-q1--fy18-guidance--quick-facts-20180125-00356
2018-01-31,2018-01-31	2018-01-31 02:01:00	SHW	The Sherwin-Williams Company	Better Stock: Home Depot (HD) vs. Sherwin-Williams (SHW)	Which of these home-improvement specialists is the best buy now?	https://finance.yahoo.com/news/better-stock-home-depot-hd-020100870.html?.tsrc=rss,2018-01-31	2018-01-31 02:01:00	SHW	The Sherwin-Williams Company	Better Stock: Home Depot (HD) vs. Sherwin-Williams (SHW)	Which of these home-improvement specialists is the best buy now?	https://finance.yahoo.com/news/better-stock-home-depot-hd-020100870.html?.tsrc=rss
2018-01-31,2018-01-31	2018-01-31 03:43:40	SHW	The Sherwin-Williams Company	Better Stock: Home Depot (HD) vs. Sherwin-Williams (SHW)	Home Depot NYSE HD and Sherwin Williams NYSE SHW can help you improve the value of your home But they may be even better at helping you to increase the value of your stock portfolio With their shares surging 200 and 158 respectively over the past five years Home	http://articlefeeds.nasdaq.com/~r/nasdaq/symbols/~3/CClFEIESR0I/better-stock-home-depot-hd-vs-sherwin-williams-shw-cm913484,2018-01-31	2018-01-31 03:43:40	SHW	The Sherwin-Williams Company	Better Stock: Home Depot (HD) vs. Sherwin-Williams (SHW)	Home Depot NYSE HD and Sherwin Williams NYSE SHW can help you improve the value of your home But they may be even better at helping you to increase the value of your stock portfolio With their shares surging 200 and 158 respectively over the past five years Home	http://articlefeeds.nasdaq.com/~r/nasdaq/symbols/~3/CClFEIESR0I/better-stock-home-depot-hd-vs-sherwin-williams-shw-cm913484
