2021-01-19,中信建投：半导体板块高景气度将继续维持 涨价趋势或将进一步蔓延,Wind
2021-01-19,调整投资节奏，基金经理慎对市场“躁动”,Wind
2021-01-18,芯片板块成抱团新方向？基金经理：市场还会轮动！,中证报
2021-01-18,我国集成电路产量加速增长 封测龙头盈利能力有望持续提升丨牛熊眼,第一财经
2021-01-18,公告精选：王府井筹划吸并首商股份；韦尔股份等公司业绩大幅预增,e公司
2021-01-18,2700亿巨头强势封涨停，净利最高暴增5倍！,中国基金报
2021-01-18,韦尔股份2020年净利预增426%至534%,上证报
2021-01-18,韦尔股份(603501.SH)预计2020年度归母净利润同比增长426.17%到533.55%,智通财经
2021-01-18,韦尔股份：预计2020年净利同比增长426.17%-533.55%,格隆汇
2021-01-18,韦尔股份涨停股价创新高，2020年业绩大幅预增,第一财经
2021-01-18,55岁中国芯片首富，捐出200亿：建一所理工大学,猎云网
2021-01-18,涨停复盘 | 多点开花 个股普涨 宜宾纸业收获9连板,第一财经
2021-01-18,韦尔股份：2020年度净利润预增426.17%到533.55%,e公司
2021-01-18,韦尔股份：2020净利增加19.84亿-24.84亿 同比增426.17%-533.55%,新浪
2021-01-18,韦尔股份：预计2020年净利润同比将增加19.84亿-24.84亿元,36氪
2021-01-18,涨停板解密：化工股迎涨停潮！（1月18日）,Wind
2021-01-18,1月18日晚间重要行业研究汇总(附股),中金在线
2021-01-18,电子行业周报：台积电资本开支超预期 面板价格上行板块业绩亮眼,华安证券
2021-01-18,科技硬件周报：投资人关注台积电业绩,新浪
2021-01-18,半导体板块发力走高 韦尔股份一度涨停再创新高,证券时报网
2021-01-18,芯片ETF大涨超6%，今年以来累计涨幅超18%,Wind
2021-01-18,电子半导体板块持续走高，韦尔股份涨停，成交额超37亿元,Wind
2021-01-18,芯片股大爆发！千亿资金狂买这类股，新抱团来了？,中国基金报
2021-01-18,1.8万亿新资金抱团，新宠是谁？,上证报
2021-01-18,光学行业深度追踪系列第25期(2020年12月)：2020多重因素扰动 2021光学加速升级,新浪
2021-01-18,A股异动|韦尔股份(603501.SH)涨超9%创历史新高市值超2700亿元,格隆汇
2021-01-18,半导体概念股直线攀升，思瑞浦涨超10%,Wind
2021-01-18,台积电2020Q4业绩解读及2021Q1展望,吉森电子研究
2021-01-18,抱团股走向关键时点，多家机构发警示，内外资仍在抢筹,券商中国
2021-01-17,安信研究|晨会在线20210119,安信证券研究
2021-01-15,晚间重要公告2021年1月15日星期五,Wind
2021-01-15,韦尔股份(603501.SH)：股东青岛融通累计减持1880.72万股持股降至5%以下 减持股份,格隆汇
2021-01-15,"韦尔股份现2笔大宗交易 共成交5,239.80万元",新浪
2021-01-15,韦尔股份：青岛融通累计减持公司2.16%股权 减持股份,e公司
2021-01-15,韦尔股份:股东青岛融通累计减持公司1881万股 占总股本的2.1677% 减持股份,新浪
2021-01-15,韦尔股份：青岛融通减持2.1677%股份 减持股份,Wind
2021-01-15,华龙内参2021年第10期 总第841期(电子版)：指数跌 个股涨,新浪
2021-01-15,A股异动 | 韦尔股份(603501.SH)涨6.48% 股价再创历史新高,格隆汇
2021-01-15,汽车芯片短缺 概念股已涨飞！2021年科技股最大的方向是智能汽车,红周刊
2021-01-15,高端制造集体提速,南方财经网
2021-01-14,图像传感器严重短缺，龙头厂商大幅提价,Wind
2021-01-14,韦尔股份(603501.SH)：减持期届满2名董事合计减持135.5万股 减持股份,格隆汇
2021-01-14,出口型企业黑马频出，“双冠王”实至名归,Wind
2021-01-14,解盘：题材股反弹，光刻胶、IDC、摄像头、高铁领涨,Wind
2021-01-14,半导体板块拉升，韦尔股份、中芯国际-U、三安光电、卓胜微、中微公司等普涨,Wind
2021-01-14,【行情】半导体板块开盘走高，晶方科技大涨6%，三环集团、韦尔股份、南大光电、圣邦股份走高,金十数据
2021-01-13,芯片行业前景一片大好,Ofweek
2021-01-13,金融产品交易量跟踪报告,新浪
2021-01-13,A股公司纷纷亮相CES，消费电子产业有望迎来新发展周期,Wind
2021-01-12,“高级倒爷”变身中国芯片首富，背后是谁的力量？,华夏时报
2021-01-12,"韦尔股份现4笔大宗交易 共成交13,148.20万元",新浪
2021-01-12,风向真的变了，涨到极致股东减持意愿也降低？,Wind
2021-01-12,电子周报：智能车步入新时代 汽车电子迎来高速成长期,新浪
2021-01-12,电子行业周报：荣耀5G新机发布 面板价格继续上行,华安证券
2021-01-12,【银河晨报】1.12丨1季度CPI仍然负增长—2020年12月通胀点评,中国银河证券研究
2021-01-12,什么信号？A股创开年最大跌幅，抱团更向龙头集中,证券时报网
2021-01-11,半导体龙头再创历史新高，市值逼近中芯国际！光学赛道高景气，持续高增长股曝光,证券时报网
2021-01-11,"韦尔股份现6笔大宗交易 共成交15,816.56万元",新浪
2021-01-11,电子行业周报：面板价格涨势不休 苹果月度数据上佳,新浪
2021-01-11,汽车芯片“告急”！韦尔股份等概念股应声大涨,环球老虎财经
2021-01-11,A股收盘综述：上证指数跌1.08%，新能源、白酒、资源板块集体回调,Wind
2021-01-11,重磅突发！百度宣布重大决定，龙头股秒板，超5万手大单封死涨停,证券时报网
2021-01-11,半导体股集体走强韦尔股份、三安光电创历史新高,格隆汇
2021-01-11,解盘：人气略有回升，半导体设备、稀土、摄像头、汽车领涨,Wind
2021-01-11,A股午盘综述：上证指数跌0.23%，半导体、汽车、石化板块走强,Wind
2021-01-11,半导体板块走势活跃，涨价潮蔓延，行业景气度持续向上,证券时报网
2021-01-11,比亚迪、海康、三一、长城、药明康德、万华化学等明星股市值均刷新历史新高,Wind
2021-01-11,芯片短缺，全球五大车企同时告急，相关概念股应声大涨,第一财经
2021-01-11,芯片短缺催生行情，芯片板块今早大幅走强,Wind
2021-01-11,韦尔股份涨超8%再创新高，市值突破2500亿元,Wind
2021-01-11,【行情】半导体板块走高，铜峰电子封板，韦尔股份涨5%，全志科技、扬杰科技、兆易创新、华润微、士兰微跟涨,金十数据
2021-01-11,北向资金一周动向盘点：放大量，战略性调仓,Wind
2021-01-11,固态电池大事件，续航超1000公里！蔚来重磅发布150度电池包,证券时报网
2021-01-10,电子行业周报：SEMI上调全球半导体材料市场预测 我国将超越韩国位居全球第二,新浪
2021-01-08,韦尔股份：董事、高级管理人员减持0.09%股份 减持股份,Wind
2021-01-08,韦尔股份：控股股东虞仁荣累计减持600万股，占公司总股本的0.69% 减持股份,Wind
2021-01-08,韦尔股份(603501.SH)：副总经理纪刚减持数量过半累计减持80万股 减持股份,格隆汇
2021-01-08,韦尔股份(603501.SH)：控股股东减持数过半累计减持600万股 减持股份,格隆汇
2021-01-08,韦尔股份旗下豪威科技发布4000万像素智能手机图像传感器,格隆汇
2021-01-08,2020年11月中国消费电子行业月报：光学升级拐点 品牌格局重塑,新浪
2021-01-07,半导体芯日报|基金经理：新能源光伏至少有10倍空间 半导体也一样,新浪
2021-01-07,预计业绩会大幅增长的科技股,证券导报
2021-01-07,北向资金动向盘点：重手卖出食品饮料、医药,Wind
2021-01-07,北向资金大幅抛售白酒股，却增持这一板块（附股）,21世纪经济报道
2021-01-06,北向资金合计净流入2.36亿元，韦尔股份、中国平安、中国中免净买入额居前,重庆商报
2021-01-06,"韦尔股份现2笔大宗交易 共成交5,048.61万元",新浪
2021-01-06,北向资金净买入2.36亿元韦尔股份获净买入3.95亿元,格隆汇
2021-01-06,北向资金今日净买入2.36亿元，白酒股持续遭减仓,Wind
2021-01-06,解盘：成交量放大，军工、基建、乳业、高端装备领涨,Wind
2021-01-06,芯片股局部活跃，韦尔股份、中芯国际-U、中微公司、寒武纪-U走强,Wind
2021-01-06,快讯：半导体板块走高 韦尔股份大涨5%,新浪
2021-01-06,【行情】半导体板块走高，韦尔股份大涨5%，中芯国际涨4%，沪硅产业、卓胜微、长电科技等走高,金十数据
2021-01-06,半导体行业又掀涨价潮 机构看好5大主线（附股）,科创板日报
2021-01-06,半导体新年涨价潮至：多家上市公司发函提价，产业链连锁反应加剧,Wind
2021-01-06,中证报头版：成交续破万亿，春季行情分化特征凸显,Wind
2021-01-05,韦尔股份(603501.SH)：控股股东一致行动人虞小荣累计减持58.88万股减持计划实施完成 拟减持股份,格隆汇
2021-01-05,韦尔股份：控股股东一致行动人累计减持0.07%公司股份 减持股份,Wind
2021-01-05,"韦尔股份现4笔大宗交易 共成交11,013.99万元",新浪
2021-01-05,涨停板解密：食品饮料板块火爆引领市场（1月5日）,Wind
2021-01-05,半导体板块发力拉升 韦尔股份晶方科技等涨停,证券时报网
2021-01-05,韦尔股份股价创新高，融资客抢先加仓,证券时报网
2021-01-05,芯片板块拉升，闻泰科技、韦尔股份、紫光国微领涨,Wind
2021-01-05,32股获券商买入评级，成都银行目标涨幅达52.91%,Wind
2021-01-04,电子行业周报：电子板块2020年度行情回顾及2021年投资展望,国海证券
2021-01-04,电子行业-半导体：厉兵秣马 迈入“芯”征程,新浪
2021-01-04,电子行业周报：面板维持上涨 半导体产能紧张依旧,华安证券
2021-01-04,上海韦尔半导体股份有限公司 公开发行可转换公司债券发行结果公告,中证报
2021-01-03,韦尔股份(603501)：OV64B重塑非旗舰手机主摄CIS格局,广发证券
2021-01-01,2021年券商看好的十大板块,Wind
2020-12-31,一份研报引爆牛市？至少25只个股评级被调高，来看名单,券商中国
2020-12-29,韦尔股份(603501.SH)可转债网上中签结果出炉：中签号共625516个,格隆汇
2020-12-29,35股获券商买入评级 华宇软件目标涨幅达93.41%,Wind
2020-12-28,转债申购结果：韦尔股份转债公布中签率,中财网
2020-12-28,年报行情提前预热，两大特征提前锁定98只黑马,Wind
2020-12-28,电子周报：快充和激光雷达步入快车道 半导体景气度高昂,新浪
2020-12-28,电子行业周报：小米11取消标配充电头 关注快充投资机遇,新浪
2020-12-28,韦尔股份(603501)：发行可转债建设RW产线 提升竞争力,广发证券
2020-12-28,传京东方12月已向iPhone 12产品供货OLED面板,Ofweek
2020-12-28,5股获买入评级 最新:潍柴动力,中财网
2020-12-27,【民生研究】周观点汇总：关注景气度触底而估值承压的板块投资机会,MS研究
2020-12-27,【中信建投电子|刘双锋&雷鸣团队】周报：安卓新机密集发布，光学升级仍为主要趋势；晶圆产能供不应求将持续至21H1,中信建投电子研究
2020-12-25,电子行业2021年投资策略报告：经济复苏创新驱动 电子行业景气上行,新浪
2020-12-25,韦尔股份(603501)公司点评：转债募资封测后道 强化CIS龙头地位,新浪
2020-12-24,韦尔转债投资价值分析：CMOS图像传感器芯片设计领先企业,新浪
2020-12-24,韦尔股份拟公开发行24.4亿元可转债，加码CMOS图像传感器,搜狐
2020-12-24,力芯微：净利润水分大 关联交易释而不清,新浪
2020-12-24,韦尔股份(603501)：发行可转债 加大布局CMOS研发及晶圆封测,新浪
2020-12-24,“拟大比例减持+业绩堪忧股”名单来了 拟减持股份,证券时报网
2020-12-24,银河证券：国产替代将是电子行业的重要旋律 看好半导体产业链保持较高景气度,证券时报网
2020-12-24,【银河晨报】12.24丨电子：以日本为鉴，看中国电子行业未来之路,中国银河证券研究
2020-12-23,韦尔股份(603501.SH)拟公开发行24.4亿元可转换公司债券,智通财经
2020-12-23,他山之石系列：以日本为鉴 看中国电子行业未来之路,新浪
2020-12-23,韦尔股份(603501.SH)拟发行24.4亿元可转债初始转股价222.83元/股,格隆汇
2020-12-23,【兴证固收·转债】CMOS图像传感器芯片设计领先企业——韦尔转债投资价值分析,兴证固收研究
2020-12-23,IOT深度追踪系列第11期(2020年11月)：年末大促IOT需求整体旺盛 AIRPODSMAX供需仍趋紧,新浪
2020-12-22,光学行业深度追踪系列第24期：安卓端AP芯片缺货为短期扰动 苹果端拉货动能持续,新浪
2020-12-22,方正证券：汽车半导体研究框架,方正证券
2020-12-22,芯片股整体疲软，立昂微、韦尔股份、富瀚微、卓胜微领跌,Wind
2020-12-22,电子行业周报：功率半导体板块投资机会解析,国海证券
2020-12-21,【研报掘金】中芯国际被列入实体清单叠加税务优惠 半导体国产替代有望加速,证券时报网
2020-12-21,电子行业周报：面板继续上行 政策精准扶持晶圆制造,华安证券
2020-12-19,半导体深度报告：三大周期再度共振，开启上行周期,新浪
2020-12-19,力芯微：净利润水分大 关联交易释而不清,证券市场周刊
2020-12-18,"韦尔股份现1笔大宗交易 共成交1,064.40万元",新浪
2020-12-18,芯片关键技术获重大突破！集成电路全名单出炉,证券时报网
2020-12-17,韦尔董事长虞仁荣捐资200多亿元在宁波建设一所新型研究型大学,新浪
2020-12-17,韦尔股份近期遭多次减持 青岛融通已再减持903万股 减持股份,GPLP犀牛财经
2020-12-17,轰动网络！芯片首富岀手，捐资200亿筹建“宁波版西湖大学”，教育界频现产业资本,证券时报网
2020-12-16,韦尔股份现1笔大宗交易 共成交217.00万元,新浪
2020-12-15,韦尔股份现1笔大宗交易 共成交214.00万元,新浪
2020-12-15,斯达半导、新洁能闪崩跌停拖累半导体板块，中芯国际-U、韦尔股份等大跌,Wind
2020-12-15,电子元器件周报：电子元器件涨价趋势蔓延 行业景气度维持上行,新浪
2020-12-15,电子周报：部分芯片缺货影响镜头放量 半导体芯芯向荣,新浪
2020-12-15,2020年十大减持王曝光 药明康德套现金额居首 减持股份,投资快报
2020-12-14,韦尔股份(603501.SH)遭主要股东青岛融通减持902.96万股 减持股份,智通财经
2020-12-14,电子投资新机遇：新时代、新格局,新浪
2020-12-14,韦尔股份(603501.SH)：控股股东虞仁荣质押700万股,格隆汇
2020-12-14,"韦尔股份现3笔大宗交易 共成交6,053.90万元",新浪
2020-12-14,韦尔股份(603501.SH)：股东青岛融通减持比例达1.0456% 减持股份,格隆汇
2020-12-14,韦尔股份：青岛融通累计减持比例达总股本1.0456% 减持股份,Wind
2020-12-14,12月新增近300笔上市公司减持计划，呈现四大特征,Wind
2020-12-14,电子行业周报：面板价格维持上涨 半导体产能紧张持续,华安证券
2020-12-14,A股早报2020年12月14日星期一,Wind
2020-12-14,【银河电子】2021年度策略：新时代、新格局、电子投资新机遇,中国银河证券研究
2020-12-14,“缺芯”再度蔓延，有人在操纵产业链？大资金在筹划跑路了,e公司
2020-12-12,A股离奇一幕：尾盘砸盘多只大蓝筹，扫货茅台工行,Wind
2020-12-12,A股离奇一幕：尾盘砸盘多只大蓝筹，同时扫货茅台工行,Wind
2020-12-12,汽车缺“芯”背后：危机真实存在，影响相对有限,证券时报
2020-12-11,"韦尔股份现2笔大宗交易 共成交21,590.00万元",新浪
2020-12-11,北向资金今日净卖出39.68亿元，洋河股份等3股净卖出额创历史新高,Wind
2020-12-11,什么情况？权重股收盘集合竞价频现亿元大单进出,Wind
2020-12-11,融资客青睐10股，城市传媒买入占比高达38.05%,Wind
2020-12-11,韦尔股份(603501)点评：受益汽车智能化发展 深度布局车载CIS,新浪
2020-12-11,近三日净买入超120亿元 北向资金准备过年？,21世纪经济报道
2020-12-11,2股获买入评级 最新:韦尔股份,中财网
2020-12-11,上证早知道│北向资金持续加仓，3个交易日净买入超120亿元；上市公司密集披露股权回购预案,中国证券网
2020-12-11,北向资金动向盘点：再度试水周期类,Wind
2020-12-11,北向资金3天加仓120亿元 部分科技股获青睐,上证报
2020-12-10,晚间要闻2020年12月10日星期四,Wind
2020-12-10,韦尔股份发生31笔大宗交易合计成交3.18亿元,证券时报网
2020-12-10,"韦尔股份现31笔大宗交易 共成交31,775.30万元",新浪
2020-12-10,北向资金今日净流入15亿元，净卖出五粮液5.78亿元,第一财经
2020-12-10,北向资金今日净买入15.22亿元，贵州茅台连续6日获净买入,Wind
2020-12-10,韦尔股份(603501.SH)：控股股东一致行动人解押4083.9009万股,格隆汇
2020-12-10,半导体行业将迎拐点？机构称未来3-5年仍是投资主线丨牛熊眼,第一财经
2020-12-10,【行情】半导体板块继续走强，斯达半导逼近涨停，韦尔股份、立昂微涨超7%，思瑞浦、新洁能、华润微等个股涨逾5%,金十数据
2020-12-10,【行情】半导体板块大涨，韦尔股份大涨9%，斯达半导、立昂微、新洁能等跟涨,金十数据
2020-12-09,苹果发布AirPods Max 这些概念股有望站上风口丨牛熊眼,第一财经
2020-12-09,30倍芯片龙头遭大举套现，年内减持近50亿元！苹果新耳机来了，售价4399元，TWS概念飙涨（附股） 减持股份,证券时报
2020-12-09,30倍芯片龙头遭大举套现 苹果新耳机引爆TWS概念股,证券时报
2020-12-09,2021科技行业展望：需求回暖上升 格局稳中有变,新浪
2020-12-09,贝壳投研：国产替代的千亿赛道，为什么说射频芯片的春风来了？,新浪
2020-12-09,韦尔股份：两位大股东因业务发展，拟减持不超过863.56万股 拟减持股份,资本邦
2020-12-09,上市公司正负面新闻2020年12月9日星期三,Wind
2020-12-08,业绩暴增半导体股走势分化 这只10倍大牛股已累跌14%,第一财经
2020-12-08,晚间公告热点追踪：芯片龙头频遭大股东减持 锂业巨头引战解围,新浪
2020-12-08,晚间重要公告2020年12月8日星期二,Wind
2020-12-08,韦尔股份：俩股东拟合计减持不超1% 拟减持股份,格隆汇
2020-12-08,韦尔股份：贾渊合计减持0.0397%公司股份 减持股份,Wind
2020-12-08,韦尔股份(603501.SH)：华清银杏及华清龙芯拟合计减持不超863.56万股 拟减持股份,格隆汇
2020-12-08,韦尔股份：华清银杏、华清龙芯拟减持不超过总股本1% 拟减持股份,Wind
2020-12-08,韦尔股份(603501.SH)：董事贾渊累计减持34.25万股 减持数量过半 减持股份,格隆汇
2020-12-08,一个交易日差距缩小7%！基金年度冠军悬念又来了,Wind
2020-12-08,电子行业周报：半导体设备板块中华峰测控何以走出独立行情,国海证券
2020-12-08,国际芯片巨头率先大抬价 六大受益股他来了,证券时报
2020-12-07,电子行业周报：半导体近期涨价梳理,新浪
2020-12-07,"韦尔股份现1笔大宗交易 共成交10,000.00万元",新浪
2020-12-07,电子(半导体)行业点评报告：半导体产业链格局优化 国产设备空间大,新浪
2020-12-07,半导体缺货全链涨价芯片巨头股价新高A股相关概念股逆市跟涨,财华社
2020-12-07,【东吴电子王平阳团队】半导体周报：半导体近期涨价梳理,东吴电子研究
2020-12-07,电子行业周报：全球半导体周期再次启动 苹果备货超预期,新浪
2020-12-07,北向资金一周动向盘点：净买245亿元，攻防兼备,Wind
2020-12-06,【华西电子孙远峰团队—半导设备】半导体产业链格局优化，国产设备空间大,远峰电子
2020-12-06,招商策略：年底值得关注的两大产业趋势变化,招商策略研究
2020-12-06,粤开策略：回测十年寻规律，跨年行情或开启,粤开崇利论市
2020-12-05,北向资金连续5周净买入，金额创近21周新高；这些行业与个股被大幅增持（附股）,21世纪经济报道
2020-12-04,"韦尔股份现1笔大宗交易 共成交1,817.01万元",新浪
2020-12-03,韦尔股份一月内现多次减持：控股股东套现18亿，大股东锁定期后“闪电”离场 减持股份,华夏时报
2020-12-03,策略月报-2020年12月投资策略：跨年行情徐徐展开 积极布局均衡配置,新浪
2020-12-03,北向资金动向盘点：休整，减仓两大方向,Wind
2020-12-03,沪指摸高，北向资金却终结四天净买入！大幅卖出这些个股（名单）,21世纪经济报道
2020-12-02,"韦尔股份现2笔大宗交易 共成交12,119.60万元",新浪
2020-12-02,半导体板块午后继续走强 瑞丰光电涨12.41%,证券时报网
2020-12-02,【行情】芯片板块午后拉升，中芯国际-U、韦尔股份、闻泰科技、兆易创新、沪硅产业-U普涨,金十数据
2020-12-02,芯片板块午后拉升，中芯国际-U、韦尔股份、闻泰科技、兆易创新普涨,Wind
2020-12-01,韦尔股份(603501)：高端产品加速布局 受益小像素趋势,新浪
2020-12-01,指数成份股调整折射经济转型升级，增强股市“晴雨表”功能,Wind
2020-11-30,【华西电子孙远峰团队-持续推荐CIS*首推韦尔】高端产品加速布局，受益小像素趋势,远峰电子
2020-11-30,韦尔股份现2笔大宗交易均为折价成交,证券时报网
2020-11-30,"韦尔股份现2笔大宗交易 共成交3,672.77万元",新浪
2020-11-30,电子(半导体)行业点评报告：半导体材料需求看涨 联动晶圆产能扩张,新浪
2020-11-30,大象起舞，上证50创2008年2月以来新高,Wind
2020-11-30,半导体板块拉升，北京君正、韦尔股份直线冲高,Wind
2020-11-30,小K播早报！科创板股票或明年纳入沪深港通股票范围零跑汽车或明年登陆科创板,科创板日报
2020-11-29,【华西电子孙远峰团队-半导材料&晶圆扩张】半导体材料需求看涨，联动晶圆产能扩张,远峰电子
2020-11-29,半年度指数成分调整对资本市场影响点评：指数成分新增科创板标的 科创板互联互通箭在弦上,新浪
2020-11-29,深度*行业*电子行业2021年度策略：掘金高景气板块 把握涨价行情,新浪
2020-11-29,下周49只股解禁 这只食品小白马近80亿市值将解禁意外涨停 解禁,金融界
2020-11-29,韦尔股份等热门概念股下周将解禁 解禁,证券时报网
2020-11-29,近80亿市值将解禁，这只食品小白马意外涨停 解禁,证券时报
2020-11-29,近80亿市值将解禁 这只股却涨停！这些股下周解禁 解禁,证券时报
2020-11-28,下周705亿市值限售股解禁，环比增加95.31% 解禁,Wind
2020-11-27,韦尔股份股东减持计划已实施完成 拟减持股份,上证报
2020-11-27,韦尔股份：持股5%以上非第一大股东合计减持1%股份 减持股份,Wind
2020-11-27,韦尔股份(603501.SH)：华清银杏、华清龙芯减持完毕合计减持1%股份 减持股份,格隆汇
2020-11-27,韦尔股份：华清银杏、华清龙芯、华清博广合计减持1.03%股份 减持股份,Wind
2020-11-27,高盛：A股明年回报16%，尤其看好人民币升值潜力,券商中国
2020-11-26,A股资讯晨报,新浪
2020-11-25,"韦尔股份现2笔大宗交易 共成交2,747.28万元",新浪
2020-11-25,可转债周报：周期主线清晰 把握节奏,渤海证券
2020-11-25,电子(半导体)行业：晶圆制造&封测双看涨 产业链条景气传导向上,新浪
2020-11-24,中兴通讯被问询，要求说明本次募集配套资金的必要性 问询,Wind
2020-11-24,"韦尔股份现15笔大宗交易 共成交10,269.92万元",新浪
2020-11-24,韦尔股份(603501)跟踪报告之四：48M王者归来 64M君临天下,光大证券
2020-11-24,半导体将现涨价潮？8英寸产能持续紧张 长期供需矛盾背后原因有二,科创板日报
2020-11-24,A股早报2020年11月24日星期二,Wind
2020-11-23,晚间重要公告2020年11月23日星期一,Wind
2020-11-23,韦尔股份(603501.SH)：约1980.45万股限制性股票11月30日解禁 解禁,格隆汇
2020-11-23,韦尔股份：调整杭州豪芯的出资架构,Wind
2020-11-22,A股百家半导体厂商平均获政府补贴5500万，前10家公司合计获政府补贴37.4亿,搜狐
2020-11-22,电子元件行业周报：从M1芯片读苹果生态的野望,新浪
2020-11-21,上市公司正负面新闻2020年11月21日星期六,Wind
2020-11-21,韦尔股份控股股东虞仁荣拟减持不超过900万股 拟减持股份,中国经济网
2020-11-20,晚间重要公告2020年11月20日星期五,Wind
2020-11-20,又发减持公告！韦尔股份实控人拟减持900万股，最高套现或超18亿元 拟减持股份,环球老虎财经
2020-11-20,"韦尔股份现1笔大宗交易 共成交3,816.80万元",新浪
2020-11-20,韦尔股份(603501.SH)：控股股东拟减持不超1.0422%股份 拟减持股份,格隆汇
2020-11-20,韦尔股份：控股股东拟减持不超过总股本1.0422% 拟减持股份,Wind
2020-11-19,【华西电子-IC WORD纪要（下）半导体材料国产化自主创新路径】,远峰电子
2020-11-19,策略专题报告：冰火两重天的市场 机会何在？,西南证券
2020-11-19,上证吹响冲锋号，再不突破，股民就要疯了！,新浪
2020-11-19,"韦尔股份现18笔大宗交易 共成交17,349.79万元",新浪
2020-11-18,韦尔股份(603501.SH)：公开发行可转债申请获中国证监会核准,格隆汇
2020-11-18,【热点报告——股指期货】2020年12月主要规模指数成分股调整预测,东证衍生品研究院
