2021-07-01,信达证券维持韦尔股份买入评级：击碎市场疑虑，开启全新成长周期,每日经济新闻
2021-07-01,业绩大幅增长！除了预增800倍，还有这些亮点,Wind
2021-07-01,韦尔股份(603501)公司点评：业绩持续高增 多技术生态平台潜力巨大,新浪
2021-07-01,韦尔股份(603501)2021H1预增点评：业绩环比持续增长 逆势增长方显龙头本色,新浪
2021-07-01,599家公司预告上半年业绩 67.45%报喜,证券之星
2021-07-01,融资客青睐15股，江苏舜天买入占比高达42.27%,Wind
2021-07-01,民生证券维持韦尔股份推荐评级：业绩环比持续增长，逆势增长方显龙头本色,每日经济新闻
2021-07-01,华西证券维持韦尔股份买入评级：Q2环比继续高增长，战略重点布局汽车半导体,每日经济新闻
2021-07-01,电子｜半导体持续重点推荐，消费电子看好下半年苹果链高确定性：2021年三季度投资策略,中信证券研究
2021-07-01,国联证券维持韦尔股份增持评级：手机/汽车驱动业绩高增长，打造IC设计龙头,每日经济新闻
2021-07-01,小K播早报！乘联会：芯片问题或在9月解决热景生物、恩捷股份等公司半年报预喜,财联社
2021-07-01,韦尔股份6月30日现2笔大宗交易,证券时报网
2021-07-01,业绩大爆发！除了预增800倍还有这些亮点,中国基金报
2021-07-01,每日财报|通威股份上半年预计净利近30亿 韦尔股份大增1.26倍,每日财报
2021-07-01,多个行业景气度高企，龙头公司纷纷“预喜”半年报,Wind
2021-06-30,"【华西电子孙远峰团队—持续坚定推荐韦尔股份】Q2环比继续高增长,战略重点布局汽车半导体",远峰电子
2021-06-30,天然气价格上涨，IPv6产业链市场规模扩大丨明日主题前瞻,第一财经
2021-06-30,晚间重要公告2021年6月30日星期三,Wind
2021-06-30,晚间公告｜6月30日这些公告有看头,第一财经
2021-06-30,通信电子行业景气数据跟踪报告之六(2021年6月)：电动汽车浪潮开启 全球半导体龙头业绩靓丽,光大证券
2021-06-30,预增！韦尔股份：预计2021年上半年净利润同比增加126.41%～146.78%,每日经济新闻
2021-06-30,韦尔股份：上半年净利同比预增126%-147%,e公司
2021-06-30,韦尔股份：预计上半年净利润同比增加126.41%-146.78%,Wind
2021-06-30,韦尔股份今日大宗交易成交15万股，成交价312.34元折价3.0%,Wind
2021-06-30,电子行业6月动态报告：行业景气向上 关注消费电子、LED等领域投资机会,新浪
2021-06-30,【最全】2021年集成电路行业上市公司全方位对比(附业务布局、业绩对比、业务规划等),前瞻研究院
2021-06-30,基于透支久期与盈利增速视角的择股策略：核心资产分化下的投资机会挖掘,新浪
2021-06-29,主力抛售超级热门股！卖出超15亿…… 股票卖空,Wind
2021-06-29,射频芯片龙头卓胜微两年涨近32倍，模组品类扩张能否支撑长期成长？,第一财经
2021-06-29,主力动向｜55股主力买入超亿元！隆基股份、通威股份、英科医疗、阳光电源、韦尔股份位居前五！,上游新闻
2021-06-29,全球新能源及无人驾驶行业跟踪周报：蔚来ET7碳化硅电驱C样件下线 QUANERGY计划SPAC上市,新浪
2021-06-29,半导体行业跟踪：缺货潮未见缓解迹象 Q2持续高景气度,新浪
2021-06-29,电子行业周报：半导体行业景气度继续上行,新浪
2021-06-28,深度*行业*半导体行业周报：国内半导体多点开花 但龙头开启平台化趋势,新浪
2021-06-28,韦尔股份：可转债自2021年7月5日起开始转股,每日经济新闻
2021-06-28,韦尔股份(603501.SH):“韦尔转债”7月5日起开始转股,格隆汇
2021-06-28,电子行业周报：消费电子受到广泛关注,新浪
2021-06-28,"韦尔股份现1笔大宗交易 共成交1,435.60万元",新浪
2021-06-28,北向资金今日净卖出40.55亿元，中远海控、宁德时代净卖出额居前,Wind
2021-06-28,电子行业每周市场动态追踪：看好半导体的短中长期大逻辑 消费电子迎布局时点,新浪
2021-06-25,韦尔股份今日大宗交易成交20万股，成交价287.7元折价3.0%,Wind
2021-06-25,"韦尔股份现4笔大宗交易 共成交5,754.00万元",新浪
2021-06-25,北上资金本周200亿扫货，顺周期王者归来，A股稳了？,Wind
2021-06-25,东亚早八点：CIS龙头再起航｜6月25日,新浪
2021-06-24,韦尔股份大宗交易成交10.00万股成交额2840.00万元,证券时报网
2021-06-24,"韦尔股份现1笔大宗交易 共成交2,840.00万元",新浪
2021-06-24,韦尔股份今日大宗交易成交10万股，成交价284.0元折价1.72%,Wind
2021-06-24,北向资金今日再度净买入30.97亿元，新能源概念股受资金抢筹,Wind
2021-06-24,继续套现！韦尔股份控股股东再次减持韦尔转债 减持股份,证券之星
2021-06-24,韦尔股份(603501.SH)：控股股东及其一致行动人再次减持韦尔转债244万张 减持股份,格隆汇
2021-06-24,韦尔股份：控股股东减持公司可转换公司债券 减持股份,Wind
2021-06-24,上海区域股市周报：ST沪科跌18.57%跌幅第一 韦尔股份跌出板块市值6强,每日经济新闻
2021-06-24,该警惕了？芯片板块暴涨重回历史高位 券商齐喊买入 但有人借道ETF出逃190亿元,每日经济新闻
2021-06-24,北向资金动向盘点：重手加仓“电子”,Wind
2021-06-24,北向资金净买入额创近一个月新高，大幅增持电子元件板块（附股）,21世纪经济报道
2021-06-23,韦尔股份(603501.SH)：2020年度权益分派10派3.15元股权登记日6月29日,格隆汇
2021-06-23,韦尔股份(603501.SH)拟每股派0.315元 6月30日分红,智通财经
2021-06-23,散户看懵了！芯片暴涨重回历史高位！券商齐声高喊买入，但场内机构却已借ETF出逃190亿元,每日经济新闻
2021-06-23,北向资金 | 合计净流入81.99亿元，药明康德、美的集团、韦尔股份净买入居前,上游新闻
2021-06-23,"韦尔股份现2笔大宗交易 共成交2,415.70万元",新浪
2021-06-23,韦尔股份今日大宗交易成交8.50万股，成交价284.2元折价3.0%,Wind
2021-06-23,北向资金近82亿资金大幅加码A股，药明康德净买入近8亿元,Wind
2021-06-23,韦尔股份：将“韦尔转债”转股价格由222.83元/股下修至222.52元/股,Wind
2021-06-23,半导体持续爆发茅台黯然6连阴，发生了什么？,Wind
2021-06-23,半导体板块批量涨停，利好消息都在这里了,Wind
2021-06-23,缺芯行情持续发酵，芯片ETF涨超5%，成交破10亿,Wind
2021-06-23,上证综指连续三天走高，午盘收涨0.46%，报3573.61点。韦尔股份对指,新浪
2021-06-23,芯片概念股强势拉升，阿石创国科微涨停，韦尔股份等大涨,证券时报网
2021-06-23,A股异动 | 获券商扎堆唱好 韦尔股份(603501.SH)大涨超7%,格隆汇
2021-06-23,获多家券商“强推”股价还要上涨30%韦尔股份值得吗？,证券之星
2021-06-23,五日龙虎榜追踪 机构抢筹这45股,证券之星
2021-06-23,33股获券商买入评级，韦尔股份目标涨幅达39.79%,Wind
2021-06-23,中信证券：韦尔股份当前估值处于低位维持“买入”评级,财联社
2021-06-23,中信证券：韦尔股份中长期手机、汽车领域竞争力将提升，持续推荐,Wind
2021-06-22,韦尔股份(603501)跟踪点评：估值低位 料中长期手机、汽车领域竞争力将提升 持续推荐,新浪
2021-06-22,深度*行业*半导体行业周报：长期看数字化叠加芯片安全 短期看芯片缺货加速国产化,新浪
2021-06-22,晶方科技(603005)：全球CIS晶圆级封装细分赛道龙头 业绩持续高增长,新浪
2021-06-22,电子行业2021年中期策略报告：半导体最风采 ARVR迎加速拐点,新浪
2021-06-22,资金流向分析,新浪
2021-06-22,商络电子：未来公司将通过内生增长和外延扩张两种方式以实现公司业绩的不断提升及业务领域的拓展,Wind
2021-06-22,电子行业周报：行业景气度上升叠加消息面利好 半导体行业持续上行,新浪
2021-06-22,电子元件：AR 下一个蓝海,新浪
2021-06-22,机构资金最近入驻这些股,证券之星
2021-06-22,中国银河维持电子行业推荐评级：行业复苏叠加MiniLED爆发LED将迎来新一轮景气周期,每日经济新闻
2021-06-22,【银河电子傅楚雄/王恺】行业周报丨行业复苏叠加Mini LED爆发，LED将迎来新一轮景气周期,中国银河证券研究
2021-06-22,东亚早八点：半导体供应链或再现涨价｜6月23日,新浪
2021-06-21,电子行业：万物互联 光学感知先行,新浪
2021-06-21,CINNO Research：2020年智能手机TFT-LCD驱动芯片需求量达14亿颗，大陆本土企业全球市占率超12%,智通财经
2021-06-21,芯片概念股大涨韦尔股份却大跌 营收增长靠并购 债务压力加大 盈利能力下降,GPLP犀牛财经
2021-06-21,机构砸盘韦尔股份 游资打板露笑科技｜龙虎榜,第一财经
2021-06-21,电子行业周报：我们为什么强烈推荐核心半导体设备和材料,国海证券
2021-06-21,A股早报2021年6月21日星期一,Wind
2021-06-21,A股融资融券日报：两融余额增加35.34亿元（6月18日）,Wind
2021-06-21,华西证券维持韦尔股份买入评级：深耕手机主摄CIS，汽车/安防领域谋高增长,每日经济新闻
2021-06-21,国海证券：缺芯”大背景下，半导体核心设备和材料企业将充分受益,证券时报网
2021-06-20,半导体、芯片连续“霸屏”A股，“第三代”概念热炒之风需警惕,第一财经
2021-06-20,韦尔股份之后又一芯片黑马来了：格科微登陆科创板 它还要自建晶圆厂,每日经济新闻
2021-06-20,【华西电子孙远峰团队—持续推荐韦尔股份】深耕手机主摄CIS，汽车/安防领域谋高增长,远峰电子
2021-06-19,【银河周知】关注汽车、新能源、电子等高景气行业的投资机会,中国银河证券研究
2021-06-19,千亿东鹏饮料开启疯狂模式 鸿蒙概念股思特奇上涨乏力,财富动力网
2021-06-19,永太科技补涨机构齐抄底 方新侠2.5亿加仓士兰微,财富动力网
2021-06-18,【18日资金线路图】做多情绪被点燃？科技股接连获资金关注！韦尔股份遭机构大肆甩卖 资产异常,证券时报
2021-06-18,主力资金抢筹半导体芯片股,大众证券报
2021-06-18,电子设备、仪器和元件周报：种植业的“人造太阳”：LED产业链再成长,新浪
2021-06-18,韦尔股份龙虎榜数据（6月18日）,Wind
2021-06-18,一根阳线看持仓：除了诺安成长，还有这些基金重仓半导体芯片股,财联社
2021-06-18,龙虎榜机构疯狂出货16亿，2400亿科技龙头韦尔股份怎么了？,中金在线
2021-06-18,半导体板块大涨，龙头股韦尔股份却放量大跌，谁在抛售？ 连续下跌,第一财经
2021-06-18,机构今日买入这13股，卖出韦尔股份6.17亿元丨龙虎榜,第一财经
2021-06-18,最新龙虎榜动向：2.43亿资金抢筹天赐材料，4.25亿资金出逃韦尔股份（名单）,21世纪经济报道
2021-06-18,韦尔股份大跌近8%沪股通卖出5.23亿元 连续下跌,第一财经
2021-06-18,"财联社6月18日讯，韦尔股份今日放量大跌7.83%，龙虎榜数据显示，沪股通买入4.68亿元并卖出5.23亿元，四机构合计卖出11.18亿元，两机构合计买入5.01亿元。
连续下跌",财联社
2021-06-18,韦尔股份放量大跌近8%，机构卖出超11亿元,Wind
2021-06-18,A股资金流向（6月18日）：新能源车龙头获抢筹，白酒股遭抛售,Wind
2021-06-18,光学行业深度追踪系列第30期(2021年5月)：终端需求阶段下滑 看好Q3苹果端光学拉货,新浪
2021-06-18,力压“蔡经理”，单日净值涨超9%，比诺安成长更牛的基金出现了,证券之星
2021-06-18,什么情况？半导体大涨上热搜 大白马韦尔股份却暴跌 连续下跌,证券之星
2021-06-18,天弘中证电子ETF(159997)：科技核心 价值底部,新浪
2021-06-18,又一行业集体涨价！龙头股价大涨20%，板块嗨了,Wind
2021-06-18,上证50跌幅扩大至1%，贵州茅台跌超3%,Wind
2021-06-18,芯片股出现分化，韦尔股份跌近5%,Wind
2021-06-17,海运、半导体板块大爆发！7张图看清市场表现、业绩和风险情况,Wind
2021-06-16,电子行业周报：继续强调半导体投资主线 产能为王+IOT芯机遇,新浪
2021-06-16,资金流向分析,新浪
2021-06-16,模拟芯片价格17年来首涨黄金赛道坡长雪厚国产化时代到来,财联社
2021-06-16,【银河电子】2021年中期策略丨拥抱变革，汽车电子初露峥嵘,中国银河证券研究
2021-06-16,周三证券 | 科技阵营火热 VR生态圈吸睛,金融投资报
2021-06-15,韦尔股份：控股股东减持公司600万股 减持股份,Wind
2021-06-15,韦尔股份(603501.SH)：减持期满控股股东虞仁荣累计减持600万股 减持股份,格隆汇
2021-06-15,申侃智联双周行第二期：硬件预埋下的投资机会解析：摄像头及激光雷达篇,新浪
2021-06-15,热度将比肩“鸿蒙”？，华为5G+AR峰会即将召开,Wind
2021-06-15,电子行业2021年中期策略：国产化继续是行业主线 看好元器件和半导体设备,新浪
2021-06-15,电子行业每周市场动态追踪：华为鸿蒙OS 2操作系统落地 有望助推AIOT产业加速发展,新浪
2021-06-13,5178点6周年 最牛白酒飙17倍！乐视、信威惨烈退市 退市,中国基金报
2021-06-13,"沧桑剧变！5178点6周年，A股“换了人间”！中石油跌落一哥，茅台暴涨890%称王，最牛白酒飙17倍！乐视、信威、康得新惨烈退市
退市",中国基金报
2021-06-13,5178点6周年，个股剧烈分化，茅台涨890%称王,Wind
2021-06-11,百元股数量达163只，一日增加5只,证券时报网
2021-06-10,八大券商主题策略：国产软件进入新的景气周期？华为产业链受益公司名单曝光,中金在线
2021-06-10,资金流向分析,新浪
2021-06-10,韦尔股份控股股东虞仁荣264万股股份解除质押,中国经济网
2021-06-09,韦尔股份：控股股东部分股权解除质押,发布易
2021-06-09,浦东新区A股资本版图：123家上市公司，市值超4万亿，生物医药占上海半壁江山,时代周报
2021-06-09,韦尔股份(603501.SH)控股股东虞仁荣解质264万股,智通财经
2021-06-09,半导体景气风向标：旺季将至 景气持续,新浪
2021-06-09,陆股通周监控第86期：宽松预期继续 增配科技成长,新浪
2021-06-08,"上海本地股掀涨停潮,聪明钱加速抢筹，四主线布局浦东“这盘棋”",时代财经
2021-06-08,英飞凌跃居全球汽车半导体第一行业增量空间广阔国内厂商登上舞台,财联社
2021-06-08,电子行业周报：鸿蒙引领IOT芯机遇,新浪
2021-06-08,两市百元股数量达159只，科创板股票占38.36%,证券时报网
2021-06-08,中证报：四万亿风口呼之欲出，超高清视频千帆竞渡,Wind
2021-06-07,科技硬件行业周报：国内封测再迎机遇,新浪
2021-06-07,北向资金净卖出额创近一个月新高，宁德时代遭大幅抛售超14亿元,Wind
2021-06-07,电子元件：鸿蒙OS2.0发布 AIOT发展加速,新浪
2021-06-07,电子行业周报：疫情影响全球封测产能 大陆企业供应链国产化趋势加快,新浪
2021-06-07,通信电子行业景气数据跟踪报告之五：全球与国内龙头的靓丽业绩持续印证半导体高景气度,光大证券
2021-06-07,半导体板块飙涨，有芯片价格涨至5倍，行业供需格局或仍趋紧丨牛熊眼,第一财经
2021-06-07,16股获券商买入评级，中芯国际目标涨幅达49.26%,Wind
2021-06-07,券商晨会观点速递,第一财经
2021-06-07,北上资金连续8周净买入，高成长行业龙头受追捧,Wind
2021-06-05,北向资金扫货A股88.88亿，却出逃恒瑞医药18亿、长春高新7亿，医药股怎么了？,21世纪经济报道
2021-06-04,传媒&通信行业“数字未来”系列一：元宇宙 未来数字绿洲入口已打开,华安证券
2021-06-04,资金流向分析,新浪
2021-06-03,韦尔股份(603501)：CCC小模组大作为,广发证券
2021-06-03,北向资金今日净买入15.21亿元，二线白酒股获追捧,Wind
2021-06-03,上海韦尔半导体：公司主要受限资产情况 资产查封,Wind
2021-06-03,25股受青睐，北向资金增持额超亿元,证券之星
2021-06-03,每日理财观察：富时罗素季度调整结果公布,Wind
2021-06-03,北向资金净卖出20.14亿元 这些行业和个股被抛售最多 股票卖空,21世纪经济报道
2021-06-03,港股盘前必读：港股印花税由0.1%提高至0.13%将于8月1日生效,Wind
2021-06-02,【半导体投资日报】涨价持续演绎，芯片设计、功率半导体市场空间广阔,新浪
2021-06-02,富时罗素季度调整结果公布，速看新增剔除A股标的全名单,Wind
2021-06-02,韦尔股份大宗交易成交1445.30万元,证券时报网
2021-06-02,北向资金今日净流出20.14亿元 大幅净买入韦尔股份3.61亿元,中金在线
2021-06-02,富时中国A50指数将纳入金龙鱼、智飞生物， 剔除恒力石化、中公教育,Wind
2021-06-02,富时罗素季度指数变更：金龙鱼及智飞生物获纳入富时中国A50指数,Wind
2021-06-02,韦尔股份今日大宗交易成交5万股，成交价289.06元折价3.0%,Wind
2021-06-02,北向资金今日净卖出20.14亿元，恒瑞医药净卖出额创历史新高,Wind
2021-06-02,券商判势｜6月关注“聪明钱”青睐板块,搜狐
2021-06-02,6月2日晚间重要行业研究汇总(附股),中金在线
2021-06-02,VR、汽车电子行业景气持续,财富动力网
2021-06-02,银河证券：5G终端及汽车电动化需求旺盛推动下，电子行业盈利端将维持快速增长,证券时报网
2021-06-02,北向资金抛售白酒股，买入这些行业和个股（名单）,21世纪经济报道
2021-06-02,电子行业景气持续，关注VR、汽车电子等高成长领域,银河证券
2021-06-02,晶圆厂资本开支上行，关注设备和材料国产化机会,招商证券
2021-06-02,东吴证券：当前半导体市场的供需紧张关系依旧维持,证券时报网
2021-06-01,"韦尔股份现1笔大宗交易 共成交2,919.70万元",新浪
2021-06-01,韦尔股份今日大宗交易成交10万股，成交价291.97元折价3.0%,Wind
2021-06-01,电子行业：行业景气持续 关注VR、汽车电子等高成长领域,新浪
2021-06-01,芯片股持续活跃机构看好这些个股,第一财经
2021-06-01,2021年中国集成电路设计行业市场现状与竞争格局分析 华为海思半导体领先国内发展,前瞻研究院
2021-05-31,沪港通十大成交活跃股排名（5月31日）,Wind
2021-05-31,北向资金再度大幅净买入超52亿元，东方雨虹净买入额创历史新高,Wind
2021-05-31,5月31日晚间重要行业研究汇总(附股),中金在线
2021-05-31,电子行业周报：三大角度分析LCD面板能否变成弱周期行业？,国海证券
2021-05-31,"海通证券：韦尔股份(603501.SH)高像素摄像头加速渗透+CIS 高景气,目标价298.80-348.60 元，给予“优于大市”评级",智通财经
2021-05-31,韦尔股份大涨,新浪
2021-05-31,电子周观点：自动驾驶提升算力需求 SOC芯片是主要增量市场,新浪
2021-05-31,电子行业周报：半导体景气持续业绩确定 面板价格保持上升,华安证券
2021-05-31,芯片股逐渐活跃，韦尔股份、中兴通讯、北方华创、兆易创新、华润微等纷纷上扬,Wind
2021-05-31,21股获券商买入评级，东鹏饮料目标涨幅达197.86%,Wind
2021-05-30,板块拾金|一天一个样！新能源、半导体、金融...轮动市到底看谁？策略收好！,第一财经
2021-05-30,半导体行业报告：5G持续落地+国产替代加速 看好前瞻布局射频前端滤波器核心技术相关标的,新浪
2021-05-28,【银河晨报】5.28丨电子：硬件、生态持续升级，VR设备有望加速渗透,中国银河证券研究
2021-05-27,【半导体投资日报】看好半导体国产化进程，材料和设备都还有很大的提升空间，关注细分行业增量,新浪
2021-05-27,明星基金扎堆重仓股：大举增持+超跌滞涨股仅6只,Wind
2021-05-27,从外资近期净流入和持仓风格变化角度：目前依然是核心资产牛市的延续而非普涨牛市,新浪
2021-05-26,上海区域股市周报：新增2家上市公司 38家机构调研泰坦科技,每日经济新闻
2021-05-26,【银河电子傅楚雄/王恺】行业周报丨硬件、生态持续升级，VR设备有望加速渗透,中国银河证券研究
2021-05-26,【民生证券研究院】晨会纪要20210526,MS研究
2021-05-26,电子元器件周报：大尺寸面板周期属性有望弱化 半导体硅片厂商同比增速提速,新浪
2021-05-25,牛人重仓｜262家基金持有8607万股，蔡嵩松、朱少醒、葛兰重仓投入！这只CMOS概念股牛在哪儿？,每日经济新闻
2021-05-25,"韦尔股份现2笔大宗交易 共成交2,848.15万元",新浪
2021-05-25,韦尔股份今日大宗交易成交5万股，成交价286.29元折价3.0%,Wind
2021-05-25,电子行业：建议关注AR／VR产业链投资机会,新浪
2021-05-25,【重磅深度】汽车半导体（PPT版）：大变革时代，汽车半导体站上历史的进程,吉森电子研究
2021-05-25,【天风Morning Call】晨会集萃20210525,天风研究
2021-05-24,5月24日晚间重要行业研究汇总(附股),中金在线
2021-05-24,全球新能源及无人驾驶行业跟踪周报：福特与SK创新合资 理想ONE将搭载地平线双“征程3”,新浪
2021-05-24,电子行业周报：荣耀复苏 大基金减持 减持股份,新浪
2021-05-24,科技硬件行业周报：AR新进展广受关注,新浪
2021-05-24,中国银河--电子行业：硬件、生态持续升级，VR设备有望加速渗透【行业研究】,金融界股吧
2021-05-24,会议纪要：民生证券研究周观点,新浪
2021-05-22,【银河周知】看好大宗商品和消费相关行业的投资机会,中国银河证券研究
2021-05-22,【民生周末重点推荐】首席看电子：业绩增长强劲，电子行业景气延续——电子行业2020年报和2021一季报总结,MS研究
2021-05-22,【晨观方正】宏观/银行/海外·互联网/科技&电子/医药/交运/机械 20210522,新浪
2021-05-21,光大证券--半导体4月跟踪报告：半导体2020及21Q1业绩靓丽，景气高企【行业研究】,金融界股吧
2021-05-21,【牛人重仓】韦尔股份:牛人重仓绩优股今年来融资余额增仓50%以上，今日资金流入-880.83万元，北向资金持股5216.47万股，融资余额245951.61万元；前3个交易日，北向资金增持-12.67万股，融资额增加10480.65万元，主力资金净流入3380.86万元,每日经济新闻
2021-05-20,光学行业深度追踪系列第29期(2021年4月)：4月份数据环比下行 关注疫情、缺货以及终端需求影响,新浪
2021-05-19,银河电子周观点：功率半导体景气度向上 国内厂商扩产趋势明显,新浪
2021-05-19,资金抢筹！虚拟现实迎涨停潮，产业空间几何,Wind
2021-05-19,汽车电子行业系列报告之感知篇：多传感器时代 融合之路正开启,新浪
2021-05-18,一季度集成电路产业销售额同增18% 草甘膦价格年涨幅接近翻番丨明日主题前瞻,第一财经
2021-05-18,银河证券：5G终端及汽车电动化需求旺盛，电子行业盈利端将加速增长,证券时报网
2021-05-18,全球新能源及无人驾驶行业跟踪周报：现代起亚计划于美国投资74亿美元 智加科技将SPAC上市,新浪
2021-05-17,再被教育！零容忍发威，违规公司风险监控,Wind
2021-05-17,5月17日晚间重要行业研究汇总(附股),中金在线
2021-05-16,【民生研究】周观点汇总：疫情和就业数据只是扰动，发达国家经济复苏趋势没有改变,新浪
2021-05-15,【银河周知】看好金融和科技相关行业价值回归的投资机会,中国银河证券研究
2021-05-15,韦尔股份：领先推出0.61u产品,财富动力网
2021-05-14,私募大佬狗咬狗，韦尔股份套路深,新浪
2021-05-13,电子行业2020年年报暨2021年一季报总结：淡季不淡 高景气下电子行业表现亮眼,新浪
2021-05-13,科技硬件周报(5/1)：A股年报季收官 苹果业绩会广受关注,新浪
2021-05-13,半导体年报&Q1总结：中短期看量价齐升 中长期看需求和格局,新浪
2021-05-13,韦尔股份现1笔大宗交易 共成交280.69万元,新浪
2021-05-13,韦尔股份今日大宗交易成交1.06万股，成交价264.8元溢价0.0%,Wind
2021-05-13,电子行业2021年中期策略：大变局下的电子行业新机遇,新浪
2021-05-13,电子行业2020年报和2021一季报总结：业绩增长强劲 电子行业景气延续,新浪
2021-05-13,大跌背后，CIS龙头韦尔股份不香了？ 连续下跌,创业邦
2021-05-12,韦尔股份(603501)：0.61微米产品全球首发 引领CIS行业创新,新浪
2021-05-12,国盛证券维持韦尔股份买入评级：全球首发.61微米高分辨率CIS，高效研发转换行业领先,每日经济新闻
2021-05-12,电子行业4月动态报告：半导体景气度向上 华为引领汽车智能化,新浪
2021-05-12,华西证券维持韦尔股份买入评级：0.61微米产品全球首发，引领CIS行业创新,每日经济新闻
2021-05-12,电子行业：FY20&1Q21业绩回顾和持仓分析,新浪
2021-05-11,信息披露违规 上海证监局对韦尔股份出具警示函 金融监管处罚,中证网
2021-05-11,银河证券：2021年电子行业盈利端将加速增长，维持行业“推荐”评级,证券时报网
2021-05-11,砺石商业评论：闻泰科技的进击之路,新浪
2021-05-11,天风研究 | 2020年报·2021一季报总结,天风研究
