2020-09-08,"韦尔股份现5笔大宗交易 共成交6,438.21万元",新浪
2020-09-08,A股收盘综述：创业板全天成交额首超沪市，创业板综指收涨1.2%个股继续爆炒,Wind
2020-09-08,【A股午盘综述】创业板综指半日跌0.61%，成交额1971亿元再超上证指数,Wind
2020-09-08,闻泰科技盘中闪崩，半导体产业板块跌幅继续扩大,Wind
2020-09-08,36股获券商买入评级，奥来德目标涨幅达44.58%,Wind
2020-09-07,"韦尔股份现3笔大宗交易 共成交2,623.53万元",新浪
2020-09-07,韦尔股份(603501)：股权激励彰显公司信心 看好豪威CIS持续发展,新浪
2020-09-07,电子元器件周报：科技限制不改半导体行业景气度向上 第三代半导体可望政策支持力道加大,新浪
2020-09-07,韦尔股份(603501)：股权激励计划彰显发展信心 CIS龙头有望持续受益光学黄金赛道,新浪
2020-09-07,TWS耳机板块调整，立讯精密、韦尔股份、歌尔股份、紫光国微、兆易创新普跌,Wind
2020-09-07,韦尔股份(603501.SH)拟推1000万份股票期权与限制性股票激励计划,格隆汇
2020-09-07,上市公司正负面新闻2020年9月7日星期一,Wind
2020-09-07,韦尔股份与实控人共同成立杭州豪芯，将参与投资半导体公司IPO战略配售,搜狐
2020-09-06,晚间重要公告2020年9月6日星期日,Wind
2020-09-06,电子行业每周市场动态追踪：持续看好行业Q3表现 中美科技分叉倒逼长期发展,新浪
2020-09-06,A股市场策略周报：风格切换之辩：大音希声,新浪
2020-09-04,韦尔股份发生12笔大宗交易合计成交2.35亿元,证券时报网
2020-09-04,韦尔股份：将与关联方虞仁荣共同投资设立杭州豪芯,Wind
2020-09-04,集成电路企业上半年业绩“亮眼”,中国电子报
2020-09-04,A股早报2020年9月4日星期五,Wind
2020-09-04,一款“热搜”基金非理性追逐：爆款基金的“投资陷阱”？,21世纪经济报道
2020-09-03,千亿芯片龙头逼近涨停 超跌高增长科技龙头名单来了,上游新闻
2020-09-03,"韦尔股份现7笔大宗交易 共成交40,181.67万元",新浪
2020-09-03,突发，6000亿酱油跌近7%，片仔癀巨震15%！千亿芯片龙头逼近涨停，超跌高增长科技龙头来了,证券时报网
2020-09-03,集成电路企业上半年财报盘点，好消息满满！,电子信息产业网
2020-09-03,韦尔股份(603501.SH)：与关联方共同投设杭州豪芯已完成工商备案手续,格隆汇
2020-09-03,港股盘前必读：香港证监会将撤销对私人开放式基金型公司施加的所有投资限制,Wind
2020-09-03,创业板再度演绎传奇，5股纳入富时中国A50指数,Wind
2020-09-03,龙头股回调名单来了 这六大企业股业绩亮眼,证券时报
2020-09-02,富时中国A50新纳入、剔除各5只A股，9月18日收盘后生效,第一财经
2020-09-02,万华化学等5只A股被纳入富时中国A50指数,Wind
2020-09-02,"韦尔股份现2笔大宗交易 共成交12,138.61万元",新浪
2020-09-02,龙头股回调名单来了！千亿芯片龙头股价腰折 市值大跌近900亿 连续下跌,证券时报
2020-09-02,芯片板块表现疲软，中芯国际-U、韦尔股份等普跌,Wind
2020-09-01,"韦尔股份现2笔大宗交易 共成交10,967.60万元",新浪
2020-09-01,电子行业周报：苹果产业链持续向好 半导体韧性依旧,新浪
2020-09-01,A股早报2020年9月1日星期二,Wind
2020-09-01,61家半导体公司中报“交卷”：超六成业绩增长，两家营收逾百亿,Wind
2020-09-01,61家半导体公司中报“交卷”超六成业绩增长两家营收逾百亿,证券时报
2020-08-31,韦尔股份现20笔大宗交易总成交金额4.04亿元,证券时报网
2020-08-31,"韦尔股份现20笔大宗交易 共成交40,351.27万元",新浪
2020-08-31,32家集成电路公司研发投入比超8.5% 4家市值超千亿10家股价年内翻倍,长江商报
2020-08-31,东北证券【周末要闻】你关心的都在这里,东北证券金融世界
2020-08-31,国产替代“芯”势力崛起,上证报
2020-08-31,内循环带来更多机遇卡脖子产业逆势升级,证券时报
2020-08-30,下周操盘攻略：芯片龙头股千亿级解禁,Wind
2020-08-30,韦尔股份下周解禁市值达千亿 解禁,证券时报网
2020-08-30,下周解禁股名单来了！涨超20倍芯片龙头将迎千亿规模解禁 解禁,证券时报
2020-08-30,警惕！涨超20倍的芯片龙头迎千亿规模解禁，4股解禁股占比超50% 解禁,证券时报网
2020-08-29,5万亿板块盛宴！华为鸿蒙2.0即将亮相，受益股名单曝光,中国基金报
2020-08-29,华为鸿蒙2.0即将亮相，受益股名单曝光,Wind
2020-08-29,下周1690亿市值限售股解禁，环比增加271.18% 解禁,Wind
2020-08-28,韦尔股份158亿并购助扣非净利劲增60倍 上市三年股价涨23倍虞仁荣持股市值480亿,长江商报
2020-08-27,业绩爆棚！中芯国际能带着芯片产业链一起飞吗？,上证报
2020-08-27,电子行业行业深度：模拟IC黄金赛道 本土配套渐入佳境,新浪
2020-08-27,加码研发成主流 硬科技公司领衔创新受青睐,上证报
2020-08-26,韦尔股份(603501.SH)控股股东解押9900万股,格隆汇
2020-08-26,全球芯片巨头透露重磅信息，3纳米芯片预计明年问世！,证券时报
2020-08-26,全球芯片巨头透露重磅信息，3纳米芯片预计明年问世！A股芯片龙头创新低，这些绩优股砸出“深坑”,证券时报网
2020-08-26,A股异动丨韦尔股份(603501.SH)跌5.44% 占公司总股本70.24%的限售股8月31日解禁 解禁,格隆汇
2020-08-26,芯片股大多疲软，韦尔股份再跌超3%,Wind
2020-08-26,【电子】韦尔股份：CIS持续升级，盈利能力提升明显,中银证券研究
2020-08-26,A股最励志芯片股：17亿撬动379亿并购，市值飙50倍,新财富
2020-08-25,A股收盘综述：创业板综指放量收升1.31%，43只创业板股涨幅超10%,Wind
2020-08-25,A股午盘综述：创业板综指午盘涨1.25%，喝白酒炒创业板成为市场主线,Wind
2020-08-25,北向资金动向盘点：加仓行业龙头；“消费”摇摆不定,Wind
2020-08-25,上市公司正负面新闻2020年8月25日星期二,Wind
2020-08-24,韦尔股份：占总股本70%限售股8月31日上市流通 解禁,e公司
2020-08-24,韦尔股份(603501.SH)：约6.0655亿股限售股将解禁 解禁,格隆汇
2020-08-24,韦尔股份：占总股本70.24%限售股将于8月31日上市流通 解禁,Wind
2020-08-24,涨价主题风起云涌，下个风口是谁？,Wind
2020-08-24,【行情】半导体板块下挫，圣邦股份跌8%，晓程科技、沪硅产业、力合微、芯朋微、韦尔股份纷纷走弱,金十数据
2020-08-24,半导体板块跌超1%，韦尔股份跌超5%,Wind
2020-08-24,【财报智读】韦尔股份：并表推动业绩增长，拟发转债扩产补流,面包财经
2020-08-23,科技硬件周报：投资人关注半导体板块调整与中报业绩,新浪
2020-08-23,[加急]8月最大解禁潮来袭 韦尔股份领衔 昭衍新药、长亮科技跻身十倍股 解禁,金融界
2020-08-22,电子行业周报：关注中报披露 拥抱高确定性核心标的,华安证券
2020-08-21,韦尔股份(603501)半年报点评：高端产品进展顺利 市场份额有望进一步提高,新浪
2020-08-21,韦尔股份上半年净利暴增1206%,国际电子商情
2020-08-21,关注解禁数据 把握个股最佳投资机会,巨丰财经
2020-08-21,韦尔股份(603501)：业绩高速增长 产品持续升级,新浪
2020-08-21,韦尔股份(603501)：H1业绩符合预期 国内CIS龙头加速成长,国海证券
2020-08-21,韦尔股份(603501)：业绩符合预期 期待下半年产能及新品落地,新浪
2020-08-21,韦尔股份(603501)：CIS产品结构优化持续推动业绩增长,新浪
2020-08-21,【国元电子】韦尔股份：业绩大幅提升，高像素助力新增长,茂飞电子研究
2020-08-21,歌尔股份、韦尔股份、分众传媒集体大幅高开，受益于中报业绩利好,Wind
2020-08-21,猛增12倍！千亿芯片龙头业绩亮了 高增长的科技股名单曝光,中证网
2020-08-21,A股早报2020年8月21日星期五,Wind
2020-08-21,上半年净利润大增1200%，韦尔股份营收再创新高！,Ofweek
2020-08-21,韦尔股份(603501)：光学行业持续景气拉动豪威高成长,新浪
2020-08-21,新亮点已现，超百家三季报业绩预告抢先看,Wind
2020-08-21,千亿芯片龙头业绩亮了，高增长的科技股名单曝光，两只龙头股价已回撤超20%,证券时报
2020-08-20,【金财富早知道】2020-08-21,赢家之星
2020-08-20,韦尔股份(603501)点评报告：高像素CIS蓄势待发 设计业务做大做强,新浪
2020-08-20,韦尔股份净利同增12倍，并购而成的“光学龙头”能走多远？,环球老虎财经
2020-08-20,【华西电子孙远峰团队-持续推荐韦尔股份】高像素CIS蓄势待发，设计业务做大做强,远峰电子
2020-08-20,韦尔股份上半年净利同比增逾十二倍,中国证券网
2020-08-20,韦尔股份上半年净利增长超1200%，国产替代下客户发展有明显突破,21世纪经济报道
2020-08-20,8月20日晚间上市公司十大重磅公告,巨丰财经
2020-08-20,韦尔股份上半年净利同比增12倍，股价3年暴涨逾25倍丨热公司,第一财经
2020-08-20,大捷！韦尔股份：2020年半年度净利润约9.90亿元，同比增加1206.17%,每日经济新闻
2020-08-20,韦尔股份(603501.SH)：上半年净利同比升1206.17%至9.9亿元,格隆汇
2020-08-20,芯片板块表现疲软，韦尔股份、北方华创、汇顶科技、景嘉微大跌,Wind
2020-08-20,紫光国微(002049)2020年半年报点评：20H1和20Q3业绩大增 中国特种芯片之王步入快速成长通道,光大证券
2020-08-20,受益于整体行业景气度提升，芯片产业将继续保持高速发展,Wind
2020-08-20,北向资金动向盘点：增持公用事业、房地产，再度重手减持食品饮料,Wind
2020-08-19,IOT行业深度追踪系列之七：部分销售转回线下+年中大促结束 IOT产品线上销售环比下滑,新浪
2020-08-19,布局产业链？韦尔股份联手实控人成立芯片产业股权投资公司，股价大涨近5%,21世纪经济报道
2020-08-19,韦尔股份大涨近6%！拟投资成立豪芯股权投资合伙企业,金融界
2020-08-19,芯片股局部活跃，韦尔股份大涨超6%,Wind
2020-08-19,CIS芯片产能严重短缺相关概念股有望受益,证券时报
2020-08-18,中芯国际产业链机会深度剖析：SMIC生态圈，重构“芯”阵列,新浪
2020-08-18,晚间重要公告2020年8月18日星期二,Wind
2020-08-18,韦尔股份(603501.SH)联手控股股东成立半导体产业股权投资公司,格隆汇
2020-08-18,韦尔股份：控股股东虞仁荣质押约6000万股,每日经济新闻
2020-08-18,韦尔股份：与实控人共同投资设立企业 挖掘芯片、半导体产业链上下游投资机会,e公司
2020-08-18,大市值芯片股整体表现不振，中芯国际-U、中兴通讯、韦尔股份、中微公司等普跌,Wind
2020-08-12,韦尔股份(603501.SH)公开发行可转债申请获中国证监会受理,格隆汇
2020-08-12,盘点小米（1810.HK）十周年“黑科技”和小米产业链受益股,格隆汇
2020-08-11,韦尔股份(603501.SH)：控股股东虞仁荣解质1250万股,格隆汇
2020-08-08,【数说新闻】集成电路收政策大礼包 谁能免税十年？,经济观察网
2020-08-06,电子行业动态研究：利好政策落地 集成电路拐点趋势不变,新浪
2020-08-06,中芯国际(688981)投资价值分析报告：新一轮扩产周期启动 这一次的中芯可有大不同？,光大证券
2020-08-06,电子行业事件点评：中国芯免 利好中芯,新浪
2020-08-05,集成电路财税政策解读,半导体风向标
2020-08-05,手机销量向下，摄像头需求往上！,Wind
2020-08-05,电子行业研究周报：半导体检测设备国内市场现状,新浪
2020-08-05,科技行业日报：三星取得思科与谷歌的芯片代工订单,新浪
2020-08-05,半导体行业研究：全产业链加大扶持力度 分级优惠鼓励做强,国金证券股份有限公司
2020-08-05,国务院出手：3万亿芯片板块迎超重磅利好，细分龙头全梳理,证券时报网
2020-08-05,国务院出手 3万亿芯片板块迎超重磅利好,金融界
2020-08-05,8月A股解禁规模骤减，部分个股减持压力依然较大 减持股份,Wind
2020-08-04,盛视早参：行情或再度开启 随风起舞！,新浪
2020-08-03,晚间要闻2020年8月3日星期一,Wind
2020-08-03,北向资金连续三日净卖出，外资持续减配免税龙头,Wind
2020-08-02,[加急]芯片龙头韦尔股份领衔8月超3000亿解禁潮 下周两只医药十倍股将迎考验 解禁,金融界
2020-08-01,巨浪袭来！猛涨20倍的芯片巨头解禁市值超千亿 解禁,金融界
2020-08-01,百股解禁洪峰将至 高比例解禁股曝光（名单） 解禁,新浪
2020-07-31,国产芯片巨头的手机战事,36氪
2020-07-30,科技行业日报：高通与华为达成专利和解,新浪
2020-07-30,信息科技行业动态点评：加快集成电路发展 产业链公司齐头并进,新浪
2020-07-30,芯片股大多走软，韦尔股份、中兴通讯、兆易创新、澜起科技、汇顶科技、紫光国微普跌,Wind
2020-07-29,电子行业周报：集成电路生产恢复 5G智能手机价格下探,新浪
2020-07-29,走进“芯”时代系列深度之三十一“射频PA”：射频PA革新不止 万物互联广袤无限,新浪
2020-07-29,科技行业日报：台积电获得英特尔6NM芯片订单,新浪
2020-07-28,电子元器件周报：台积电Q2业绩再次超预期增长 MINILED应用放量在即,新浪
2020-07-28,韦尔股份(603501.SH)：控股股东解除质押900万股,格隆汇
2020-07-28,芯片股普涨，韦尔股份、兆易创新、中兴通讯、澜起科技、沪硅产业-U集体走强,Wind
2020-07-28,券商首次关注5股并给予买入评级（7月28日）,Wind
2020-07-28,韦尔股份(603501)：泛模拟龙头 “功率+电源+射频+传感”协同发力,新浪
2020-07-27,芯片股表现活跃，通富微电、中国长城涨停,Wind
2020-07-26,【华西电子孙远峰团队-Q2持仓分析】Q2电子重仓配比提升，半导体配置创新高,远峰电子
2020-07-26,电子行业每周市场动态追踪：消费终端需求回暖 看好三季度机会,新浪
2020-07-26,电子元件行业周报：电子行业2020Q2基金持仓分析-板块持仓环比大增 消费电子增配明显,新浪
2020-07-24,【A股收盘综述】上证指数低收3.86%击穿3200关口，科创50跌幅达7%,Wind
2020-07-24,【A股午盘综述】上证指数半日下滑2.25%，创业板指、科创50均跌超4%,Wind
2020-07-24,芯片股多数跟随大市下滑，韦尔股份跌超3%,Wind
2020-07-23,韦尔股份(603501.SH)：控股股东虞仁荣质押750万股,格隆汇
2020-07-23,【A股收盘综述】上证指数探底回升收跌0.24%，机构抱团股涨势依旧如火如荼,Wind
2020-07-23,芯片股回调，韦尔股份、中兴通讯、兆易创新、紫光国微等纷纷走软,Wind
2020-07-22,芯片股普涨，韦尔股份、中兴通讯、中微公司、兆易创新、紫光国微等纷纷上扬,Wind
2020-07-21,科技行业日报：美国扩容实体清单 个股影响较小,新浪
2020-07-21,光学行业深度追踪系列第18期：海外疫情影响边际减弱 6月光学厂商业绩环比改善,新浪
2020-07-21,大国雄芯.消费电子系列报告(一)：AIRPODS助力TWS 智能耳机增长可期,华安证券
2020-07-21,科技行业日报：中报业绩陆续披露 关注优质个股,新浪
2020-07-21,知名基金经理二季度普遍加仓，布局消费与科技,Wind
2020-07-20,电子行业周报：天科合达冲击上市 功率半导体风起云涌,华安证券
2020-07-20,通信行业周报：华为下半年机遇挑战并存 NB-IOT产业链值得关注,华安证券
2020-07-20,电子行业周报：台积电Q2业绩超预期 关注H1业绩优异企业,新浪
2020-07-20,芯片股走势分化，韦尔股份、北京君正、卓胜微逆市大跌,Wind
2020-07-19,中远海运发展2家参股投资公司登陆资本市场,国际船舶
2020-07-18,A股“千亿俱乐部”，北京、广东各晋9家占鳌头,Wind
2020-07-17,韦尔股份(603501.SH)年报推10派0.7元 股权登记日7月23日,格隆汇
2020-07-17,芯片股局部活跃，韦尔股份、沪硅产业-U大涨超5%,Wind
2020-07-17,电子元器件行业动态点评：台积电Q2业绩再次超预期增长 三季度指引创历史新高 上调全年CAPEX,新浪
2020-07-17,证券时报头版：中芯国际刮起“情感估值”，投资者需兼顾产业规律,Wind
2020-07-16,负债17.7亿，库存15.5亿，芯片企业格科微冲刺科创板 偿债能力下降,和讯
2020-07-16,电子行业2020年中期策略：寻找疫情冲击和贸易摩擦变局下的投资机会,新浪
2020-07-16,中芯国际正式登陆A股，532亿融资额刷新科创板记录,Wind
2020-07-15,【异动股】3D摄像头板块下挫，韦尔股份(603501-CN)跌7.09%,财华社
2020-07-14,电子元器件周报：需求复苏刺激行业重拾增长节奏 业绩向好预演财报季行情,新浪
2020-07-14,芯片股整体低迷，韦尔股份、兆易创新逆市上涨,Wind
2020-07-13,手机/半导体概念股市值TOP20：立讯精密4190亿元独领风骚！,搜狐
2020-07-13,电子行业周报：半导体行业再迎春风 5G手机出货占比提升,新浪
2020-07-13,半导体板块持续拉升，隆基股份、长电科技、三安光电大涨,Wind
2020-07-13,芯片股走升分化，韦尔股份、中微公司、兆易创新、澜起科技、汇顶科技逆市下跌,Wind
2020-07-11,电子元器件行业动态点评：台积电6月营收再创历史新高 预热半导体板块上半年业绩行情,新浪
2020-07-10,圣邦股份：国内模拟IC芯片龙头 未来拥有巨大的国产替代空间,证券之星
2020-07-10,A股首家芯片公司正式突破2000亿元市值大关！,搜狐
2020-07-09,科技行业日报：国内首款中国芯DDR4内存条大规模量产,新浪
2020-07-09,中国股市：未来十年，是科技的时代！板块龙头、全球以及国内第一,腾讯网
2020-07-09,半导体概念股延续强势，紫光国微、韦尔股份、兆易创新大涨,Wind
2020-07-08,科技行业日报：半年报业绩陆续出炉 优质个股涌现,新浪
2020-07-08,中芯国际登陆科创板 IPO影子股大涨,证券时报
2020-07-07,10万股东半日躺赚120万，A股巨无霸疯涨！,证券时报
2020-07-07,韦尔股份(603501.SH)：控股股东虞仁荣解除质押500万股,格隆汇
2020-07-07,深度*行业*电子行业周点评：SEMI预测晶圆厂设备支出温和复苏 2021年有望创纪录,新浪
2020-07-07,10万股东半日躺赚120万 贵州茅台市值破2.1万亿,证券时报
2020-07-07,中芯国际A股今日申购，半导体概念股猛涨,Wind
2020-07-07,每日理财观察：股票ETF单日成交额创历史第三高，爆款基金再现,Wind
2020-07-07,陆家嘴财经早餐2020年7月7日星期二,Wind
2020-07-06,科技行业日报：中芯国际将申购 利好半导体设备与材料,新浪
2020-07-06,暴涨21%，千亿芯片龙头创历史新高，A股概念股名单来了，机构扎堆推荐个股曝光,搜狐
2020-07-06,金融街下午茶2020年7月6日星期一,Wind
2020-07-06,电子行业点评：旺季来临 看好三季度表现,新浪
2020-07-06,中芯国际股价一个月翻番，芯片股共襄盛宴,Wind
2020-07-06,融资客和北向资金齐加仓 韦尔股份股价创新高,证券时报网
2020-07-06,韦尔股份新高背后：融资客和北向资金齐加仓,证券时报网
2020-07-06,“意念”涨停？13只中芯国际影子股名单来了！,中证报
2020-07-06,中芯国际确定27.46元发行价，7月7日打新！大基金获配35亿元,Wind
2020-07-06,多家上市公司间接参与中芯国际战略投资,Wind
2020-07-06,紫光国微(002049)：中国特种集成电路平台型王者,光大证券
2020-07-06,陆家嘴财经早餐2020年7月6日星期一,Wind
2020-07-05,晚间公告热点追踪：芯片龙头中芯国际下周二申购,新浪
2020-07-05,晚间重要公告2020年7月5日星期日,Wind
2020-07-05,【华西电子孙远峰团队】韦尔股份*系列一张图⑤-持续推荐,远峰电子
2020-07-05,中芯国际7月7日申购，A股多家上市公司参股,Wind
2020-07-05,韦尔股份：参股基金认购中芯国际科创板首发股票,Wind
2020-07-05,中芯国际7月7日科创板打新：发行价27.46元，战投认购一半,Wind
2020-07-04,中芯国际科创板IPO募资或达450亿，战投将认购50%份额,证券时报
2020-07-03,最新！中国民营芯片设计TOP 10出炉,Ofweek
2020-07-03,本周800亿资金加仓A股，漂亮50王者归来,Wind
2020-07-03,【行情】半导体芯片大幅分化，斯达半导、富瀚微、圣邦股份、芯源微、韦尔股份等跌逾5%,金十数据
2020-07-03,芯片板块出现调整，韦尔股份、中微公司、兆易创新、卓胜微普跌,Wind
2020-07-02,2020年电子行业中期策略：指标公司盈利强劲 半导体行业景气度仍可期,新浪
2020-07-02,电子行业中报展望专题：电子行业2020年中报业绩展望,新浪
2020-07-02,科技行业日报：中芯国际将开启申购 国产替代逻辑长存,新浪
2020-07-01,电子行业2020年中报业绩展望：电子行业中报展望专题,新浪
2020-07-01,北向资金上半年狂赚1600亿，买了这些股（附名单）,中证报
2020-06-29,40股获券商买入评级 中金黄金目标涨幅达48.33%,Wind
2020-06-28,本周8家上市公司发布可转债预案，融资总规模达170.82亿元,Wind
2020-06-26,MLCC代理商商络电子创业板上市申请获受理,搜狐
2020-06-24,紫光集团入选福布斯中国最具创新力企业榜TOP50,工业新闻网
2020-06-24,历史首次！交易所紧急预警：5只A股将被外资买爆,中国基金报
2020-06-24,上市公司正负面新闻2020年6月24日星期三,Wind
2020-06-23,电子行业2020年下半年投资策略：一个世界两套系统 创新重启加速替代,光大证券
2020-06-23,晚间重要公告2020年6月23日星期二,Wind
2020-06-23,芯片第一股诞生！千亿国芯企业登顶，成就身家500亿芯片首富,搜狐
2020-06-23,韦尔股份：控股股东一致行动人及董事拟减持股份 拟减持股份,e公司
2020-06-23,韦尔股份(603501.SH)：控股股东一致行动人、董事、高管拟减持不超283.005万股 拟减持股份,格隆汇
2020-06-23,韦尔股份：控股股东一致行动人合计拟减持不超过总股本0.3277% 拟减持股份,Wind
2020-06-23,韦尔股份拟募资30亿，加速进击CIS！,国际电子商情
2020-06-23,韦尔股份(603501)：公司拟公开发行可转换公司债券 持续加码布局CIS 领域,广发证券
2020-06-23,中银证券：半导体产业持续推进 建议关注韦尔股份等,证券时报网
2020-06-23,韦尔股份：光学创新不停息，CIS领军者加速进击,证券时报网
2020-06-22,机构看好这些半导体产业股票,第一财经
2020-06-22,电子设备行业专题研究：新技术及新应用出现 CIS市场有望持续成长,新浪
2020-06-22,上市公司正负面新闻2020年6月22日星期一,Wind
2020-06-22,中泰金工可转债发行跟踪周报(0621),ZTQuant
2020-06-20,中国民营芯片设计企业Top10：韦尔股份第一，市值1590亿,搜狐
2020-06-20,上市公司正负面新闻2020年6月20日星期六,Wind
2020-06-19,本周13家上市公司发布可转债预案，融资总规模达249.60亿元,Wind
2020-06-19,晚间重要公告2020年6月19日星期五,Wind
2020-06-19,股指周评：强者恒强还是强弩之末？,新浪
2020-06-19,韦尔股份拟公开发行可转债募资不超30亿元 用于CMOS图像传感器产品升级等项目,发布易
2020-06-19,韦尔股份：拟发行可转债募集资金不超30亿元,证券时报网
2020-06-19,韦尔股份(603501.SH)拟公开发行不超30亿元可转债,格隆汇
2020-06-19,韦尔股份：拟发行不超过30亿元可转债用于晶圆测试生产线,Wind
2020-06-19,快讯：半导体板块午后拉升 韦尔股份、大唐电信涨5%,新浪
2020-06-19,半导体板块拉升，韦尔股份、大唐电信、闻泰科技、汇顶科技、兆易创新等集体上扬,Wind
2020-06-18,科技行业日报：160亿元第三代半导体产业项目落户长沙,新浪
2020-06-18,中国芯片设计10强民营企业出炉：韦尔股份、汇顶科技、兆易创新列前三,金融界
2020-06-18,【早安新时代】晨会早读：2020/06/18：今日关注韦尔股份、中文在线,新时代证券研究
2020-06-17,40股今日获机构买入评级 8股上涨空间超20%,证券时报网
2020-06-17,韦尔股份(603501.SH)：控股股东虞仁荣解除质押500万股,格隆汇
2020-06-17,千亿芯片巨头暴涨 外资扫货这些芯片股,证券时报
2020-06-16,卓胜微、韦尔股份盘中跳水压制芯片板块,Wind
2020-06-15,3205家上市公司一季度研发投入榜：中石油投入近40亿，韦尔股份同比增速超12倍,零壹财经
2020-06-12,半导体板块领跌大市，三安光电、韦尔股份等跌超4%,Wind
2020-06-11,芯片板块几乎回吐日内2%升幅，卓胜微、韦尔股份均跌2%左右,Wind
2020-06-10,韦尔股份：控股股东虞仁荣500万股解除质押,每日经济新闻
2020-06-10,韦尔股份：变更财务顾问主办人,Wind
2020-06-09,半导体板块午后延续升势，卓胜微、韦尔股份、南大光电等均大涨,Wind
2020-06-08,电子行业周报：景气度复苏 关注电子板块低位布局机遇,新浪
2020-06-04,A股最新动向：2大主力资金同一天发力,Wind
2020-06-03,大国雄芯.光学系列报告(一)：手机模组逆势增长景气延续,华安证券
2020-06-03,富时罗素：富时中国A50等指数季度审核变更6月22日生效,Wind
