publishedAt,title,description
2020-11-18,"海通证券：交易商协会对公司及子公司启动自律调查，公司将积极配合自律调查的相关工作，严格执行交易商协会《关于进一步加强债务融资工具发行业务规范有关事项的通知》的有关要求，并及时履行信息披露义务
关联方问题","海通证券：交易商协会对公司及子公司启动自律调查，公司将积极配合自律调查的相关工作，严格执行交易商协会《关于进一步加强债务融资工具发行业务规范有关事项的通知》的有关要求，并及时履行信息披露义务
关联方问题"
2020-11-18,交易商协会对海通证券及其相关子公司启动自律调查 关联方问题,交易商协会对海通证券及其相关子公司启动自律调查 关联方问题
2020-11-18,涉嫌为永煤债违规发行提供帮助 海通证券遭交易商协会自律调查 金融监管处罚,涉嫌为永煤债违规发行提供帮助 海通证券遭交易商协会自律调查 金融监管处罚
2020-11-18,德恒上海律师事务所关于上海之江生物科技股份有限公司首次公开发行股票并在科创板上市战略投资者核查事项的法律意见,德恒上海律师事务所关于上海之江生物科技股份有限公司首次公开发行股票并在科创板上市战略投资者核查事项的法律意见
2020-11-18,A股融资融券日报：两融余额增加26.05亿元（11月17日）,A股融资融券日报：两融余额增加26.05亿元（11月17日）
2020-11-18,港股异动︱首程控股(00697)涨近8% 获海通证券看高目标价至2.88-3.36港元及“优于大市”评级,港股异动︱首程控股(00697)涨近8% 获海通证券看高目标价至2.88-3.36港元及“优于大市”评级
2020-11-18,创业板上市委：果麦文化等三家公司IPO及普利制药发行可转债事项定于11月25日上会,创业板上市委：果麦文化等三家公司IPO及普利制药发行可转债事项定于11月25日上会
2020-11-18,多家券商回应涨薪传闻：未收到通知，投行部可能涨,多家券商回应涨薪传闻：未收到通知，投行部可能涨
2020-11-18,【行情】港股券商板块普涨，光大证券涨5.7%，中信建投证券涨3.5%，招商证券涨2.54%，海通证券、中金均涨超1.5%,【行情】港股券商板块普涨，光大证券涨5.7%，中信建投证券涨3.5%，招商证券涨2.54%，海通证券、中金均涨超1.5%
2020-11-18,涉永煤债券违约事件 交易商协会对海通证券启动自律调查 未按时兑付本息,涉永煤债券违约事件 交易商协会对海通证券启动自律调查 未按时兑付本息
2020-11-18,11月18日深市创业板活跃股公开信息,11月18日深市创业板活跃股公开信息
2020-11-18,海通证券及子公司涉嫌为永煤控股违规发行债券提供帮助交易商协会启动自律调查 金融监管处罚,海通证券及子公司涉嫌为永煤控股违规发行债券提供帮助交易商协会启动自律调查 金融监管处罚
2020-11-18,海通证券(600837.SH)：中期息拟10派2.8元 股权登记日11月26日,海通证券(600837.SH)：中期息拟10派2.8元 股权登记日11月26日
2020-11-18,海通证券(06837.HK)将于11月27日派发A股每股现金红利0.28元,海通证券(06837.HK)将于11月27日派发A股每股现金红利0.28元
2020-11-18,海通证券(06837)11月27日A股每股派现金红利0.28元,海通证券(06837)11月27日A股每股派现金红利0.28元
2020-11-18,海通证券被市场交易商协会启动自律调查公司内部正开会紧急应对,海通证券被市场交易商协会启动自律调查公司内部正开会紧急应对
2020-11-19,陷多起诉讼！安徽三联集团实控人涉家族股权纠纷“罗生门” 关联方问题,陷多起诉讼！安徽三联集团实控人涉家族股权纠纷“罗生门” 关联方问题
2020-11-19,全体涨薪30%、应届生工资3.8万？多家券商回应,全体涨薪30%、应届生工资3.8万？多家券商回应
2020-11-19,又见消费疯狂！单车热席卷A股，百年老牌一字涨停！,又见消费疯狂！单车热席卷A股，百年老牌一字涨停！
2020-11-19,午评：恒指低开低走跌0.57% 科技、券商股联手砸盘海通证券H股跌5.43%,午评：恒指低开低走跌0.57% 科技、券商股联手砸盘海通证券H股跌5.43%
2020-11-19,午间公告2020年11月19日星期四,午间公告2020年11月19日星期四
2020-11-19,同益股份回复申请向特定对象发行股份审核问询函：项目实施不存在重大不确定性 问询,同益股份回复申请向特定对象发行股份审核问询函：项目实施不存在重大不确定性 问询
2020-11-19,交易商协会：涉嫌永城煤电违规发行债券，海通证券遭调查 金融监管处罚,交易商协会：涉嫌永城煤电违规发行债券，海通证券遭调查 金融监管处罚
2020-11-19,券商刚要起飞就面临最大黑天鹅海通证券竟替整个债券市场背了锅？,券商刚要起飞就面临最大黑天鹅海通证券竟替整个债券市场背了锅？
2020-11-19,投行要涨薪？回应来了,投行要涨薪？回应来了
2020-11-19,港股收盘：百胜中国、安踏创历史新高 国泰航空本周迄今累计上涨约20%,港股收盘：百胜中国、安踏创历史新高 国泰航空本周迄今累计上涨约20%
2020-11-19,净利润已超去年全年！135家券商前三季度大赚1327亿元，承销保荐业务收入同比增超70%，自营收入占比稳居首位,净利润已超去年全年！135家券商前三季度大赚1327亿元，承销保荐业务收入同比增超70%，自营收入占比稳居首位
2020-11-19,头部券商集体全面涨薪会是真的吗？投行丰年或催动薪资水涨船高,头部券商集体全面涨薪会是真的吗？投行丰年或催动薪资水涨船高
2020-11-19,永煤违约事件再发酵，兴业银行等多家相关中介机构被调查 违约失信,永煤违约事件再发酵，兴业银行等多家相关中介机构被调查 违约失信
2020-11-19,海通证券遭自律调查 涉嫌为违规发行永煤债提供帮助 金融监管处罚,海通证券遭自律调查 涉嫌为违规发行永煤债提供帮助 金融监管处罚
2020-11-19,永煤违约连环爆！海通被查祸起结构化发债？监管层重拳出击遏制“自融” 违约失信,永煤违约连环爆！海通被查祸起结构化发债？监管层重拳出击遏制“自融” 违约失信
2020-11-19,永煤债主承、评级、会计都有问题？多家中介机构被启动自律调查 其他违规处罚,永煤债主承、评级、会计都有问题？多家中介机构被启动自律调查 其他违规处罚
2020-11-19,多家银行、评级机构被查 永煤债违约冲击波袭来 违约失信,多家银行、评级机构被查 永煤债违约冲击波袭来 违约失信
2020-11-19,连环炸！265亿豫能化及永煤债券或交叉违约！ 交叉条款违约,连环炸！265亿豫能化及永煤债券或交叉违约！ 交叉条款违约
2020-11-19,永煤违约风波再起！交易商协会将对兴业、光大银行等中介机构启动自律调查 违约失信,永煤违约风波再起！交易商协会将对兴业、光大银行等中介机构启动自律调查 违约失信
2020-11-19,“20永煤SCP003”构成实质性违约后续：涉嫌操纵市场 海通证券被自律调查 未按时兑付本息,“20永煤SCP003”构成实质性违约后续：涉嫌操纵市场 海通证券被自律调查 未按时兑付本息
2020-11-19,债券违约冲击波！更多机构遭调查，数百亿债券现交叉违约风险 交叉条款违约,债券违约冲击波！更多机构遭调查，数百亿债券现交叉违约风险 交叉条款违约
2020-11-19,“踩雷”永煤债，海通证券被自律调查，AH股均大幅下挫 金融监管处罚,“踩雷”永煤债，海通证券被自律调查，AH股均大幅下挫 金融监管处罚
2020-11-19,AAA级永煤债爆雷，监管层“挨家挨户”点名调查！看专家们怎么说,AAA级永煤债爆雷，监管层“挨家挨户”点名调查！看专家们怎么说
2020-11-19,快讯：港股券商股走低，海通证券跌超5%领跌,快讯：港股券商股走低，海通证券跌超5%领跌
2020-11-19,海通证券涉永煤违约风波，被勒令启动自律调查 违约失信,海通证券涉永煤违约风波，被勒令启动自律调查 违约失信
2020-11-19,"永煤风波海通涉嫌违规卷入 信用风险由""伪国企""向""弱国企""扩散？ 其他违规处罚","永煤风波海通涉嫌违规卷入 信用风险由""伪国企""向""弱国企""扩散？ 其他违规处罚"
2020-11-19,“踩雷”永煤债 海通证券遭调查 金融监管处罚,“踩雷”永煤债 海通证券遭调查 金融监管处罚
2020-11-19,海通证券被自律调查！涉嫌为永煤集团违规发债提供帮助公司称将积极配合调查，但截至发稿，涉事具体细节尚不清晰 金融监管处罚,海通证券被自律调查！涉嫌为永煤集团违规发债提供帮助公司称将积极配合调查，但截至发稿，涉事具体细节尚不清晰 金融监管处罚
2020-11-19,交易商协会加强规范债券发行 严禁发行人“自融”,交易商协会加强规范债券发行 严禁发行人“自融”
2020-11-19,券商年内千亿元再融资“补血”，抢占融资融券业务“地盘”,券商年内千亿元再融资“补血”，抢占融资融券业务“地盘”
2020-11-19,海通証券(06837-HK)：将积极配合永煤发债事件自律调查,海通証券(06837-HK)：将积极配合永煤发债事件自律调查
2020-11-19,国债期货全线下挫，10年期国债升破3.3%，信用风险持续拖累市场｜债市综述,国债期货全线下挫，10年期国债升破3.3%，信用风险持续拖累市场｜债市综述
2020-11-19,每日财报｜海通证券接受自律调查恰恰食品减持41.78%可转债,每日财报｜海通证券接受自律调查恰恰食品减持41.78%可转债
2020-11-19,证券行业2021年度投资策略：以科创板为鉴 市场深化改革全面提升券业发展空间,证券行业2021年度投资策略：以科创板为鉴 市场深化改革全面提升券业发展空间
2020-11-19,今年最火爆的高薪行业，又要涨薪了？,今年最火爆的高薪行业，又要涨薪了？
2020-11-19,海通被查祸起结构化发债？监管层重拳出击遏制“自融” 其他违规处罚,海通被查祸起结构化发债？监管层重拳出击遏制“自融” 其他违规处罚
2020-11-19,盘前情报丨交易商协会对海通证券启动自律调查；比特币升破18000美元大关，现在还能上车吗？,盘前情报丨交易商协会对海通证券启动自律调查；比特币升破18000美元大关，现在还能上车吗？
2020-11-19,【财华社讯】券商板块杀跌海通证券(600837-CN)跌近8%,【财华社讯】券商板块杀跌海通证券(600837-CN)跌近8%
2020-11-19,券商股持续走低，海通证券跌幅扩大至7%,券商股持续走低，海通证券跌幅扩大至7%
2020-11-19,【行情】券商板块开盘杀跌，海通证券跌7%，中金公司、光大证券、国联证券纷纷下挫,【行情】券商板块开盘杀跌，海通证券跌7%，中金公司、光大证券、国联证券纷纷下挫
2020-11-19,开盘：恒指低开0.32% 海通证券涉嫌违规被查 低开3.52% 金融监管处罚,开盘：恒指低开0.32% 海通证券涉嫌违规被查 低开3.52% 金融监管处罚
2020-11-19,海通证券涉嫌帮助永城煤电违规发行债券被勒令自查 金融监管处罚,海通证券涉嫌帮助永城煤电违规发行债券被勒令自查 金融监管处罚
2020-11-19,【赢家日报】此轮周期行情有何特点？,【赢家日报】此轮周期行情有何特点？
2020-11-19,A股融资融券日报：两融余额增加19.41亿元（11月18日）,A股融资融券日报：两融余额增加19.41亿元（11月18日）
2020-11-19,史上第二稳！135家券商前三季度净赚1326亿,史上第二稳！135家券商前三季度净赚1326亿
2020-11-19,朝闻：欢聚时代遭浑水做空股价暴跌近30%；牵扯信用债违约风波海通证券被调查,朝闻：欢聚时代遭浑水做空股价暴跌近30%；牵扯信用债违约风波海通证券被调查
2020-11-19,港股盘前必读：国务院要求抓紧做好RCEP落地实施工作，美股连续两日收跌,港股盘前必读：国务院要求抓紧做好RCEP落地实施工作，美股连续两日收跌
2020-11-19,海通证券低开4.35%，交易商协会对公司及子公司启动自律调查,海通证券低开4.35%，交易商协会对公司及子公司启动自律调查
2020-11-20,A股融资融券日报：两融余额减少12.22亿元（11月19日）,A股融资融券日报：两融余额减少12.22亿元（11月19日）
2020-11-20,永煤信用债爆雷持续发酵！牵出多家券商银行！国企债务的刚兑信仰破灭！,永煤信用债爆雷持续发酵！牵出多家券商银行！国企债务的刚兑信仰破灭！
2020-11-20,水皮：【谈股论金】矛盾无处不在,水皮：【谈股论金】矛盾无处不在
2020-11-20,涉嫌违规行为 多家永煤债券中介机构被调查 其他违规处罚,涉嫌违规行为 多家永煤债券中介机构被调查 其他违规处罚
2020-11-20,永煤债中介机构被调查：兴业、光大等银行股价下挫 金融监管处罚,永煤债中介机构被调查：兴业、光大等银行股价下挫 金融监管处罚
2020-11-20,盛视早参：市场仍是存量博弈,盛视早参：市场仍是存量博弈
2020-11-20,永煤债违约再发酵 兴业银行、光大银行等机构被查,永煤债违约再发酵 兴业银行、光大银行等机构被查
2020-11-20,融资客青睐11股，华能水电买入占比高达56.79%,融资客青睐11股，华能水电买入占比高达56.79%
2020-11-20,港股盘前必读：美国三大指数集体收涨，菲律宾意外降息25个基点,港股盘前必读：美国三大指数集体收涨，菲律宾意外降息25个基点
2020-11-20,千亿国企债券违约连环爆 兴业银行、光大银行等也被调查 未按时兑付本息,千亿国企债券违约连环爆 兴业银行、光大银行等也被调查 未按时兑付本息
2020-11-20,每日理财观察：永煤债违约冲击波袭来，多家中介机构被启动自律调查,每日理财观察：永煤债违约冲击波袭来，多家中介机构被启动自律调查
2020-11-20,期市投资参考：永煤债违约进一步发酵，国内成品油年内第五次上调,期市投资参考：永煤债违约进一步发酵，国内成品油年内第五次上调
2020-11-20,兴业银行、光大银行等也被调查了！千亿国企债券违约连环爆！,兴业银行、光大银行等也被调查了！千亿国企债券违约连环爆！
2020-11-20,永煤债违约再发酵 兴业光大等多家银行被查 违约失信,永煤债违约再发酵 兴业光大等多家银行被查 违约失信
2020-11-20,头部券商薪酬机制调整悄然进行，下半年超1000位保代“上岗”,头部券商薪酬机制调整悄然进行，下半年超1000位保代“上岗”
2020-11-20,深夜重磅！千亿国企债券违约连环爆，光大、中原银行等也被调查 未按时兑付本息,深夜重磅！千亿国企债券违约连环爆，光大、中原银行等也被调查 未按时兑付本息
2020-11-20,监管再度升级 交易商协会全线调查“永煤”发债产业链,监管再度升级 交易商协会全线调查“永煤”发债产业链
2020-11-20,深夜重磅：兴业银行、光大银行等也被调查了！千亿国企债券违约连环爆！ 金融监管处罚,深夜重磅：兴业银行、光大银行等也被调查了！千亿国企债券违约连环爆！ 金融监管处罚
2020-11-20,信用债日报：市场情绪依然悲观，超六成信用债下跌,信用债日报：市场情绪依然悲观，超六成信用债下跌
2020-11-20,券商全面涨薪？投行明确涨薪30%？最新回应来了,券商全面涨薪？投行明确涨薪30%？最新回应来了
2020-11-21,海通证券涉嫌为发行人违规发行债券提供帮助 现接受自律调查 金融监管处罚,海通证券涉嫌为发行人违规发行债券提供帮助 现接受自律调查 金融监管处罚
2020-11-21,永煤违约链式反应 违约失信,永煤违约链式反应 违约失信
2020-11-22,金融委发声稳债市，打击“逃废债”不代表“保刚兑”,金融委发声稳债市，打击“逃废债”不代表“保刚兑”
2020-11-23,21深度丨猜猜永煤“不讲武德”后，海通证券哪些部门被调查了？ 金融监管处罚,21深度丨猜猜永煤“不讲武德”后，海通证券哪些部门被调查了？ 金融监管处罚
2020-11-23,涉嫌违规被调查 海通证券风波不断,涉嫌违规被调查 海通证券风波不断
2020-11-23,【犀利 看市】短期市场趋于稳定，建议均衡配置,【犀利 看市】短期市场趋于稳定，建议均衡配置
2020-11-23,*ST华仪两跌停 海通证券全资子公司为第七大流通股东,*ST华仪两跌停 海通证券全资子公司为第七大流通股东
2020-11-23,永煤债3家被查银行或存信披不充分、未作风险提示等疏漏,永煤债3家被查银行或存信披不充分、未作风险提示等疏漏
2020-11-23,华泰证券非银金融年度策略：复苏中求索 改革辟契机,华泰证券非银金融年度策略：复苏中求索 改革辟契机
2020-11-23,【异动股】海通证券(06837-HK)涨3.23%,【异动股】海通证券(06837-HK)涨3.23%
2020-11-23,非银金融行业周报：信用债违约事件波及券商 银保监会全面规范“惠民保” 未按时兑付本息,非银金融行业周报：信用债违约事件波及券商 银保监会全面规范“惠民保” 未按时兑付本息
2020-11-23,权威解读！债券违约风险如何处置？对商业银行影响几何？,权威解读！债券违约风险如何处置？对商业银行影响几何？
2020-11-23,多方位监管严控债券违约风险 商业银行受违约影响料有限 债券兑付风险警示公告,多方位监管严控债券违约风险 商业银行受违约影响料有限 债券兑付风险警示公告
2020-11-23,A股融资融券日报：两融余额减少5.84亿元（11月20日）,A股融资融券日报：两融余额减少5.84亿元（11月20日）
2020-11-24,债市惊雷15日，业内称AAA评级体系需要反思,债市惊雷15日，业内称AAA评级体系需要反思
2020-11-24,【行情】证券板块异动拉升，国联证券拉升触板，中泰证券、中国银河、海通证券、华泰证券等跟涨,【行情】证券板块异动拉升，国联证券拉升触板，中泰证券、中国银河、海通证券、华泰证券等跟涨
2020-11-24,A股融资融券日报：两融余额增加103.05亿元（11月23日）,A股融资融券日报：两融余额增加103.05亿元（11月23日）
2020-11-24,投行涨薪不是传说 新保代能力待考,投行涨薪不是传说 新保代能力待考
2020-11-24,信用债违约事件对A股影响有限 未按时兑付本息,信用债违约事件对A股影响有限 未按时兑付本息
2020-11-24,年内券商对子公司“爱恨不一”，超12家增资3家减资,年内券商对子公司“爱恨不一”，超12家增资3家减资
2020-11-25,永煤涉违法违规线索已移送证监会！1家券商+3家银行被查，监管动作频频,永煤涉违法违规线索已移送证监会！1家券商+3家银行被查，监管动作频频
2020-11-25,A股融资融券日报：两融余额增加33.66亿元（11月24日）,A股融资融券日报：两融余额增加33.66亿元（11月24日）
2020-11-25,永煤控股违约发酵！海通证券涉嫌违规被查，承销河南能化两款债券受关注 金融监管处罚,永煤控股违约发酵！海通证券涉嫌违规被查，承销河南能化两款债券受关注 金融监管处罚
2020-11-25,永煤控股违约发酵:海通涉嫌违规被查 承销河南能化两款债券受关注 其他违规处罚,永煤控股违约发酵:海通涉嫌违规被查 承销河南能化两款债券受关注 其他违规处罚
2020-11-25,招商证券获批发行不超300亿次级债，年内券商现“补血”潮,招商证券获批发行不超300亿次级债，年内券商现“补血”潮
2020-11-25,券商股能否带领A股冲关？,券商股能否带领A股冲关？
2020-11-26,上海步科自动化股份有限公司 2020年第三季度报告正文,上海步科自动化股份有限公司 2020年第三季度报告正文
2020-11-26,A股融资融券日报：两融余额减少3.16亿元（11月25日）,A股融资融券日报：两融余额减少3.16亿元（11月25日）
2020-11-26,A股午盘综述，上证指数跌0.13%，北向资金逆势净买入逾40亿元,A股午盘综述，上证指数跌0.13%，北向资金逆势净买入逾40亿元
2020-11-26,券商股异动，机构：板块节前或将迎来短期躁动行情,券商股异动，机构：板块节前或将迎来短期躁动行情
2020-11-26,A股收盘综述：上证指数涨0.22%，汽车、顺周期板块回调,A股收盘综述：上证指数涨0.22%，汽车、顺周期板块回调
2020-11-27,湘财股份定向增发预案公布事项点评 | 证券行业重大事项点评【华创非银】,湘财股份定向增发预案公布事项点评 | 证券行业重大事项点评【华创非银】
2020-11-27,解密标准股票基金冠军招商行业精选那些“神操作”,解密标准股票基金冠军招商行业精选那些“神操作”
2020-11-27,智通港股通资金流向统计(T+2)|11月27日,智通港股通资金流向统计(T+2)|11月27日
2020-11-27,贵金属何时结束调整？,贵金属何时结束调整？
2020-11-27,A股融资融券日报：两融余额减少30.77亿元（11月26日）,A股融资融券日报：两融余额减少30.77亿元（11月26日）
2020-11-29,华钰矿业(601020.SH)：大股东拟被动减持股份 拟减持股份,华钰矿业(601020.SH)：大股东拟被动减持股份 拟减持股份
2020-11-29,华钰矿业：大股东或遭被动减持公司1%股份 减持股份,华钰矿业：大股东或遭被动减持公司1%股份 减持股份
2020-11-29,11月29日上市公司晚间公告速递,11月29日上市公司晚间公告速递
2020-11-29,晚间公告｜11月29日这些公告有看头,晚间公告｜11月29日这些公告有看头
2020-11-29,"晚间公告热点追踪：上机数控子公司获签逾百亿""单晶硅片""销售合同","晚间公告热点追踪：上机数控子公司获签逾百亿""单晶硅片""销售合同"
2020-11-30,涉嫌操纵市场：东海基金被调查 上半年3只债基遭巨额赎回 其他违规处罚,涉嫌操纵市场：东海基金被调查 上半年3只债基遭巨额赎回 其他违规处罚
2020-11-30,会计所也一同被查，永煤违约还有哪些疑点 违约失信,会计所也一同被查，永煤违约还有哪些疑点 违约失信
2020-11-30,突发！交易商协会再出手：这家公募基金被自律调查！发生了什么？ 其他违规处罚,突发！交易商协会再出手：这家公募基金被自律调查！发生了什么？ 其他违规处罚
2020-11-30,中电兴发(002298)：筑牢技术底座 转型开拓新赛道,中电兴发(002298)：筑牢技术底座 转型开拓新赛道
2020-11-30,因质押融资未按期赎回，华钰矿业大股东道衡投资拟遭海通证券减持1%股份 拟减持股份,因质押融资未按期赎回，华钰矿业大股东道衡投资拟遭海通证券减持1%股份 拟减持股份
2020-11-30,【异动股】海通证券(06837-HK)涨3.53%,【异动股】海通证券(06837-HK)涨3.53%
2020-11-30,卓胜微拟投建半导体产业化生产基地 多股重大利好或助力股价,卓胜微拟投建半导体产业化生产基地 多股重大利好或助力股价
2020-11-30,A股融资融券日报：两融余额减少34.75亿元（11月27日）,A股融资融券日报：两融余额减少34.75亿元（11月27日）
2020-11-30,股海导航 11月30日沪深股市公告提示,股海导航 11月30日沪深股市公告提示
2020-11-30,有矿日子也难过！海通证券强平华钰矿业?道衡投资持股市值被削,有矿日子也难过！海通证券强平华钰矿业?道衡投资持股市值被削
2020-12-01,东海基金被启动自律调查 债券型基金占总资产超过90% 其他违规处罚,东海基金被启动自律调查 债券型基金占总资产超过90% 其他违规处罚
2020-12-01,东海基金被调查隐秘之因：或涉债券结构化发行 旗下基金持有海通主承债券 其他违规处罚,东海基金被调查隐秘之因：或涉债券结构化发行 旗下基金持有海通主承债券 其他违规处罚
2020-12-01,河南惠强新材重启IPO 辅导机构更换为海通证券,河南惠强新材重启IPO 辅导机构更换为海通证券
2020-12-01,恒指冲高回落收涨0.86%，大金融、消费股领涨大市,恒指冲高回落收涨0.86%，大金融、消费股领涨大市
2020-12-01,东海基金涉嫌操纵市场遭调查 规模仅18亿基金经理3人 其他违规处罚,东海基金涉嫌操纵市场遭调查 规模仅18亿基金经理3人 其他违规处罚
2020-12-01,涉嫌操纵市场！沦为违规债务融资帮凶，东海基金被启动自律调查,涉嫌操纵市场！沦为违规债务融资帮凶，东海基金被启动自律调查
2020-12-01,【异动股】海通证券(06837-HK)涨3.9%,【异动股】海通证券(06837-HK)涨3.9%
2020-12-01,2020年IPO审核最后冲刺，一日内14家企业“赶考”,2020年IPO审核最后冲刺，一日内14家企业“赶考”
2020-12-01,消息称海通将关闭亏损的伦敦固定收益业务 亏损,消息称海通将关闭亏损的伦敦固定收益业务 亏损
