publishedAt,title,description
2021-05-18,“叶飞概念股”再度重挫，市值已蒸发170亿，80万股民受灾 连续下跌,“叶飞概念股”再度重挫，市值已蒸发170亿，80万股民受灾 连续下跌
2021-05-18,叶飞爆料算自首吗？还有谁需担责？律师解读来了,叶飞爆料算自首吗？还有谁需担责？律师解读来了
2021-05-18,机构加速调仓！“叶飞概念股”集体跌停，小票还能买吗,机构加速调仓！“叶飞概念股”集体跌停，小票还能买吗
2021-05-18,立案调查，叶飞概念股纷纷跌停，A股黑幕太惊人,立案调查，叶飞概念股纷纷跌停，A股黑幕太惊人
2021-05-18,多家券商卷入中源家居事件：天风证券、恒泰证券否认，民生证券承认自营买入！业内：或是自营投资经理个人行为！,多家券商卷入中源家居事件：天风证券、恒泰证券否认，民生证券承认自营买入！业内：或是自营投资经理个人行为！
2021-05-18,谁在坐庄？叶飞“爆料门”疑云难消,谁在坐庄？叶飞“爆料门”疑云难消
2021-05-18,大 V 叶飞爆料牵出 4 券商：股价大跌，自营和资管业务“躺枪”,大 V 叶飞爆料牵出 4 券商：股价大跌，自营和资管业务“躺枪”
2021-05-19,资金抢筹！虚拟现实迎涨停潮，产业空间几何,资金抢筹！虚拟现实迎涨停潮，产业空间几何
2021-05-19,黑色系连续重挫，顺周期行情结束了吗？,黑色系连续重挫，顺周期行情结束了吗？
2021-05-19,狂飙！A股掀起锂电风暴，医美板块也不甘落后,狂飙！A股掀起锂电风暴，医美板块也不甘落后
2021-05-19,叶飞事件引发蝴蝶效应：殃及小市值股？,叶飞事件引发蝴蝶效应：殃及小市值股？
2021-05-19,叶飞“爆料门”疑云难消：多家疑涉事券商回应 谁在坐庄？,叶飞“爆料门”疑云难消：多家疑涉事券商回应 谁在坐庄？
2021-05-19,大V喊话掀“风暴” 坐庄黑幕谁制造？,大V喊话掀“风暴” 坐庄黑幕谁制造？
2021-05-19,A股融资融券日报：两融余额增加53.49亿元（5月18日）,A股融资融券日报：两融余额增加53.49亿元（5月18日）
2021-05-20,A股融资融券日报：两融余额增加46.4亿元（5月19日）,A股融资融券日报：两融余额增加46.4亿元（5月19日）
2021-05-20,天风证券：虚拟现实VRAR板块大热 产业链发展迎来爆发期,天风证券：虚拟现实VRAR板块大热 产业链发展迎来爆发期
2021-05-20,缴税高峰来袭，央行又是100亿逆回购！有何玄机？,缴税高峰来袭，央行又是100亿逆回购！有何玄机？
2021-05-20,天风证券与桂林银行开展全面战略合作,天风证券与桂林银行开展全面战略合作
2021-05-20,18个月10倍涨幅、市场份额近3成，雅迪控股能否成为“电单车里的特斯拉”？,18个月10倍涨幅、市场份额近3成，雅迪控股能否成为“电单车里的特斯拉”？
2021-05-20,伪市值管理黑幕揭开 业内人士：操作隐秘难监管,伪市值管理黑幕揭开 业内人士：操作隐秘难监管
2021-05-21,热点聚焦丨左晖离开了，贝壳能否“继续做难而正确的事”？,热点聚焦丨左晖离开了，贝壳能否“继续做难而正确的事”？
2021-05-21,“举报门”下的民生证券：买入多家中小市值股票 控股股东流动性承压,“举报门”下的民生证券：买入多家中小市值股票 控股股东流动性承压
2021-05-21,天风证券(601162.SH)股东湖北省联发解除质押2.6亿股,天风证券(601162.SH)股东湖北省联发解除质押2.6亿股
2021-05-21,"蹊跷：离职1个月后 叶飞""爆料门""关键人物管宣以恒泰名义调研山河智能","蹊跷：离职1个月后 叶飞""爆料门""关键人物管宣以恒泰名义调研山河智能"
2021-05-21,天风证券(601162.SH)：湖北省联发解除质押2.59亿股,天风证券(601162.SH)：湖北省联发解除质押2.59亿股
2021-05-22,宁德时代连续2日爆出大动作！行业格局或迎来变动,宁德时代连续2日爆出大动作！行业格局或迎来变动
2021-05-22,IIGF新闻 | 中央财经大学党委书记何秀超一行到天风证券交流座谈,IIGF新闻 | 中央财经大学党委书记何秀超一行到天风证券交流座谈
2021-05-23,叶飞“爆料门”关键人物管宣蹊跷离职 以恒泰证券名义参与山河智能调研,叶飞“爆料门”关键人物管宣蹊跷离职 以恒泰证券名义参与山河智能调研
2021-05-23,没有“明天”的新华基金，翟晨曦如何捡起遍地迷你基金？,没有“明天”的新华基金，翟晨曦如何捡起遍地迷你基金？
2021-05-24,449份中报预告近六成预喜，174只业绩双增股扎堆三行业,449份中报预告近六成预喜，174只业绩双增股扎堆三行业
2021-05-24,华为声明后，1300亿巨头被砸跌停！机构怎么看？,华为声明后，1300亿巨头被砸跌停！机构怎么看？
2021-05-24,天风证券：维持海底捞(06862)“买入”评级 股权奖励计划为未来十年发展打下坚实基础,天风证券：维持海底捞(06862)“买入”评级 股权奖励计划为未来十年发展打下坚实基础
2021-05-24,买周期股是不是刀口舔血？卖方研究隔空开怼,买周期股是不是刀口舔血？卖方研究隔空开怼
2021-05-24,“举报门”下的天风证券：刚交易过中源家居 巨额募资与盈利不匹配 诉讼纠纷,“举报门”下的天风证券：刚交易过中源家居 巨额募资与盈利不匹配 诉讼纠纷
2021-05-24,【天风海外｜周市场】港股通持续净流入；择机布局科技互联网公司,【天风海外｜周市场】港股通持续净流入；择机布局科技互联网公司
2021-05-24,准备好！迎接行情更震荡的一周,准备好！迎接行情更震荡的一周
2021-05-24,卷入“市值管理”风波 涉事券商撇清关系,卷入“市值管理”风波 涉事券商撇清关系
2021-05-24,“动力电池一哥”突放大招，钠离子电池概念股异军突起,“动力电池一哥”突放大招，钠离子电池概念股异军突起
2021-05-25,行业高质量发展可期，券商股受资金青睐,行业高质量发展可期，券商股受资金青睐
2021-05-25,纸浆价格持续上涨，造纸行业头部集中加速,纸浆价格持续上涨，造纸行业头部集中加速
2021-05-26,天风证券：完成工商变更登记及换发营业执照 业务变化,天风证券：完成工商变更登记及换发营业执照 业务变化
2021-05-26,天风国际Equity Focus——半导体行业研究周报,天风国际Equity Focus——半导体行业研究周报
2021-05-26,传播链再延长，广州一家三口感染！疫苗板块怎么走,传播链再延长，广州一家三口感染！疫苗板块怎么走
2021-05-26,A股午盘综述：上证指数涨0.29%，创业板指跌逾1%,A股午盘综述：上证指数涨0.29%，创业板指跌逾1%
2021-05-26,天风证券盘中快速上涨,天风证券盘中快速上涨
2021-05-26,非银金融早间造好 券商建议持续关注,非银金融早间造好 券商建议持续关注
2021-05-26,券商股持续发力，天风证券新晋涨停,券商股持续发力，天风证券新晋涨停
2021-05-26,平治信息(300571.SZ)接待天风证券等13家机构调研,平治信息(300571.SZ)接待天风证券等13家机构调研
2021-05-26,赵晓光：规则、满足感和虚拟现实｜“头号世界”天风证券VR/AR 产业高峰论坛,赵晓光：规则、满足感和虚拟现实｜“头号世界”天风证券VR/AR 产业高峰论坛
2021-05-26,半年报业绩行情前瞻：近六成公司预喜百余家净利翻番，机构扎堆调研,半年报业绩行情前瞻：近六成公司预喜百余家净利翻番，机构扎堆调研
2021-05-26,跨境理财通试点在即，银行摩拳擦掌备战,跨境理财通试点在即，银行摩拳擦掌备战
2021-05-26,天风证券（601162.SH）首板,天风证券（601162.SH）首板
2021-05-27,5月大类资产配置策略（天风宏观宋雪涛）,5月大类资产配置策略（天风宏观宋雪涛）
2021-05-27,又一券商大动作增资，百亿量级注册资本券商增至8家，重资本业务拼资本实力，近一年12家券商增资近200亿,又一券商大动作增资，百亿量级注册资本券商增至8家，重资本业务拼资本实力，近一年12家券商增资近200亿
2021-05-28,券商板块要“王者归来”？业绩向好叠加估值见底，高景气度下看好长期价值,券商板块要“王者归来”？业绩向好叠加估值见底，高景气度下看好长期价值
2021-05-28,超级风口要来？龙头股爆发，这些股估值低+净利连增,超级风口要来？龙头股爆发，这些股估值低+净利连增
2021-05-28,A股收盘综述：上证指数止步四连阳，锂电池概念爆发,A股收盘综述：上证指数止步四连阳，锂电池概念爆发
2021-05-28,天风国际Equity Focus——迈为：进军HJT,天风国际Equity Focus——迈为：进军HJT
2021-05-29,政策利好频发，券商股持续估值修复,政策利好频发，券商股持续估值修复
2021-05-31,湖北区域股市周报：总市值涨533亿 4244万融资买入高德红外,湖北区域股市周报：总市值涨533亿 4244万融资买入高德红外
2021-05-31,宋雪涛：汇率双边市,宋雪涛：汇率双边市
2021-05-31,【中证协优秀课题】分布式技术加速证券公司全面风险管理体系建设研究,【中证协优秀课题】分布式技术加速证券公司全面风险管理体系建设研究
2021-05-31,天风证券：数据中心行业迎来政策利好，重点关注产业上下游相关受益标的,天风证券：数据中心行业迎来政策利好，重点关注产业上下游相关受益标的
2021-05-31,最早喊出“沪指挑战四千点”的机构，又有新观点,最早喊出“沪指挑战四千点”的机构，又有新观点
2021-05-31,十大券商：做多窗口继续！存量博弈向增量行情演进,十大券商：做多窗口继续！存量博弈向增量行情演进
2021-05-31,天风证券：“18国轩绿色债02”持有人会议审议通过提前兑付议案,天风证券：“18国轩绿色债02”持有人会议审议通过提前兑付议案
2021-06-01,今年人民币不会单边走强,今年人民币不会单边走强
2021-06-01,天风证券(601162.SH)撤销2家证券营业部,天风证券(601162.SH)撤销2家证券营业部
2021-06-01,天风证券：撤销深圳益田路证券营业部及合肥创新大道证券营业部,天风证券：撤销深圳益田路证券营业部及合肥创新大道证券营业部
2021-06-01,可转债日报：中证转债指数收创近六年新高，转债走势多跟随正股,可转债日报：中证转债指数收创近六年新高，转债走势多跟随正股
2021-06-01,【天风证券 X 新消费智库】百页深度报告解析--新消费时代的投资机会在哪？,【天风证券 X 新消费智库】百页深度报告解析--新消费时代的投资机会在哪？
2021-06-01,【天风地产】5月销售量价齐升但增速放缓，龙头房企分化明显—5月百强房企销售点评,【天风地产】5月销售量价齐升但增速放缓，龙头房企分化明显—5月百强房企销售点评
2021-06-02,方盛制药(603998.SH)股东方锦程所持197.51万股因质押违约被动减持 股票质押异常,方盛制药(603998.SH)股东方锦程所持197.51万股因质押违约被动减持 股票质押异常
2021-06-02,股、债双跌，上升趋势有变？3张图一看详情,股、债双跌，上升趋势有变？3张图一看详情
2021-06-02,三个月股价翻倍！创下历史新高的特步国际有何亮点？,三个月股价翻倍！创下历史新高的特步国际有何亮点？
2021-06-02,新华基金：“去明天系”风暴,新华基金：“去明天系”风暴
2021-06-03,供需改善焦炭6月价格将回调,供需改善焦炭6月价格将回调
2021-06-03,又一个百亿级市场规模将出现，哪些A股公司已入局？,又一个百亿级市场规模将出现，哪些A股公司已入局？
2021-06-03,券商定增出现缩水困局，行情卷土重来或带来定增良机,券商定增出现缩水困局，行情卷土重来或带来定增良机
2021-06-04,白酒“造富潮”！2400多员工，平均每人大赚300多万,白酒“造富潮”！2400多员工，平均每人大赚300多万
2021-06-04,四日连涨26%，机构连连看好！特步又挂上“碳中和”概念？,四日连涨26%，机构连连看好！特步又挂上“碳中和”概念？
2021-06-04,追查A股坐庄内幕,追查A股坐庄内幕
2021-06-04,招保万金恒大等龙头地产股持续下跌，行业融资收紧了？,招保万金恒大等龙头地产股持续下跌，行业融资收紧了？
2021-06-05,近期券商研报力推这些股票，最高有144%上涨空间,近期券商研报力推这些股票，最高有144%上涨空间
2021-06-06,天风证券首予依依股份买入评级：优质客户&稳供应链造就宠物护理第一股，拓品类拓区域畅享成长市场红利，目标价104元,天风证券首予依依股份买入评级：优质客户&稳供应链造就宠物护理第一股，拓品类拓区域畅享成长市场红利，目标价104元
2021-06-06,天风证券维持新大正买入评级：重点中心城市计划持续突破，人才吸引绑定到位订单加速落地,天风证券维持新大正买入评级：重点中心城市计划持续突破，人才吸引绑定到位订单加速落地
2021-06-07,超4700亿元！解禁规模刷新年内纪录，宁德时代占大头,超4700亿元！解禁规模刷新年内纪录，宁德时代占大头
2021-06-07,北向资金连续8周净流入，今年以来净买入额已超去年全年,北向资金连续8周净流入，今年以来净买入额已超去年全年
2021-06-07,第五批药品集采启动，注射剂成主角,第五批药品集采启动，注射剂成主角
2021-06-07,年内峰值！4100亿元限售解禁来了，如何影响市场？,年内峰值！4100亿元限售解禁来了，如何影响市场？
2021-06-07,【十大券商一周策略】全球资金流动时钟正流向股市,【十大券商一周策略】全球资金流动时钟正流向股市
2021-06-07,解盘：科技股强势，半导体、操作系统、自主可控略涨,解盘：科技股强势，半导体、操作系统、自主可控略涨
2021-06-07,茅台迎来2大利好，全球最大中国股票基金再出手,茅台迎来2大利好，全球最大中国股票基金再出手
2021-06-07,3600点上方谁是新龙头？,3600点上方谁是新龙头？
2021-06-07,民生证券的多事之秋：丑闻暴露内控问题 内忧外患变化重重,民生证券的多事之秋：丑闻暴露内控问题 内忧外患变化重重
2021-06-07,超4100亿巨量解禁压顶，宁德时代股价大跌万亿市值失守 解禁,超4100亿巨量解禁压顶，宁德时代股价大跌万亿市值失守 解禁
2021-06-07,天风国际Equity Focus——南侨食品首盖,天风国际Equity Focus——南侨食品首盖
2021-06-08,白酒概念大幅回调 军工板块获机构看好 保持板块轮动逢低布局,白酒概念大幅回调 军工板块获机构看好 保持板块轮动逢低布局
2021-06-08,白酒股突现翻脸式跌停！药茅、油茅大跌，基金经理晒学历,白酒股突现翻脸式跌停！药茅、油茅大跌，基金经理晒学历
2021-06-08,打脸来得太快，天风证券在“山顶”唱多白酒？,打脸来得太快，天风证券在“山顶”唱多白酒？
2021-06-08,酱香科技“朝圣”大会来了，白酒还香吗？,酱香科技“朝圣”大会来了，白酒还香吗？
2021-06-09,高瓴套现零食巨头近3亿，还要减持9亿！影响有多大,高瓴套现零食巨头近3亿，还要减持9亿！影响有多大
2021-06-09,高瓴参股的合煦智远基金正被中原证券拿下控股权 控股或参股公募已成券商“新估值”,高瓴参股的合煦智远基金正被中原证券拿下控股权 控股或参股公募已成券商“新估值”
2021-06-10,高瓴参股的这家公募，正被中原证券拿下控股权,高瓴参股的这家公募，正被中原证券拿下控股权
2021-06-10,高瓴、高毅罕见联手！抢筹定增，公募基金也出手了,高瓴、高毅罕见联手！抢筹定增，公募基金也出手了
2021-06-10,天风国际Equity Focus——通策医疗深度,天风国际Equity Focus——通策医疗深度
2021-06-10,A股总市值增8000亿，却有投资者赚指数不赚钱？,A股总市值增8000亿，却有投资者赚指数不赚钱？
2021-06-10,1000万人已更新，鸿蒙引爆A股！有公司涨300%,1000万人已更新，鸿蒙引爆A股！有公司涨300%
2021-06-11,优然牧业：奶源争夺进行时，原奶龙头优势尽显！【天风新兴产业|深度研究】,优然牧业：奶源争夺进行时，原奶龙头优势尽显！【天风新兴产业|深度研究】
2021-06-11,上市银行分红火热进行中！银行股是否具备配置价值？,上市银行分红火热进行中！银行股是否具备配置价值？
2021-06-11,浙江板块大爆发！3000亿白酒股闪崩，发生了什么？,浙江板块大爆发！3000亿白酒股闪崩，发生了什么？
2021-06-11,权重股走强，创业板指大涨,权重股走强，创业板指大涨
2021-06-11,天风国际Equity Focus——航发预付订单拟增,天风国际Equity Focus——航发预付订单拟增
2021-06-12,美国三大股指小幅收涨，新股BOSS直聘大涨95%,美国三大股指小幅收涨，新股BOSS直聘大涨95%
2021-06-12,欧美主要股指普遍收涨，标普500指数收盘价创新高,欧美主要股指普遍收涨，标普500指数收盘价创新高
2021-06-12,固定收益统计周报：短期利率有走高压力，央行调整投放概率在提高！,固定收益统计周报：短期利率有走高压力，央行调整投放概率在提高！
2021-06-13,这类基金发行创9年新高，今年最高暴赚超59%,这类基金发行创9年新高，今年最高暴赚超59%
2021-06-14,【天风｜财富管理】三大能力与三分天下——大财富管理行业的现状与未来,【天风｜财富管理】三大能力与三分天下——大财富管理行业的现状与未来
2021-06-15,两户必中一签！200亿元巨无霸今日启动发行,两户必中一签！200亿元巨无霸今日启动发行
2021-06-15,天风国际Equity Focus——强生控股重组获批,天风国际Equity Focus——强生控股重组获批
2021-06-15,解禁日大涨！这只券商股打破“魔咒”，为啥？,解禁日大涨！这只券商股打破“魔咒”，为啥？
2021-06-16,天风国际Equity Focus——一周研报集锦,天风国际Equity Focus——一周研报集锦
2021-06-16,不及4月一半，房企5月信用债发行规模大幅下降,不及4月一半，房企5月信用债发行规模大幅下降
2021-06-17,中一签可赚1辆奔驰！疯狂新股连拉14个涨停，靠卖饮料真能值千亿市值？,中一签可赚1辆奔驰！疯狂新股连拉14个涨停，靠卖饮料真能值千亿市值？
2021-06-17,天风证券：爱尔眼科（300015.SZ）全球最大的眼健康集团，目标价104.59元，维持“买入”评级,天风证券：爱尔眼科（300015.SZ）全球最大的眼健康集团，目标价104.59元，维持“买入”评级
2021-06-17,这些原因致猪价超跌，明年5元猪价将成大概率事件,这些原因致猪价超跌，明年5元猪价将成大概率事件
2021-06-17,反弹来了？北向资金净买入超30亿，加仓这些板块,反弹来了？北向资金净买入超30亿，加仓这些板块
2021-06-17,天风国际Equity Focus——BOSS直聘首盖,天风国际Equity Focus——BOSS直聘首盖
2021-06-17,半导体满屏涨停，除了缺芯还有一利好已提前释放,半导体满屏涨停，除了缺芯还有一利好已提前释放
2021-06-18,可转债日报：转债行情回暖，小康转债大涨超16%创历史新高,可转债日报：转债行情回暖，小康转债大涨超16%创历史新高
2021-06-18,天风证券新增洪琳、刘全胜两人为公司副总裁,天风证券新增洪琳、刘全胜两人为公司副总裁
2021-06-18,501家上市公司中报业绩预告出炉！预喜率超六成，两大行业领跑,501家上市公司中报业绩预告出炉！预喜率超六成，两大行业领跑
2021-06-18,天风国际Equity Focus——铜箔板块投资机会,天风国际Equity Focus——铜箔板块投资机会
2021-06-18,罕见！5家机构砸11亿抢筹，东鹏饮料还能火多久,罕见！5家机构砸11亿抢筹，东鹏饮料还能火多久
2021-06-18,“二选一”后首个“618” 机构调研称天猫仍是品牌核心阵地,“二选一”后首个“618” 机构调研称天猫仍是品牌核心阵地
2021-06-18,券商晨会精华：市场暂无全面风险注意中报兑现节点,券商晨会精华：市场暂无全面风险注意中报兑现节点
2021-06-18,天风证券：伴随中报预告，建议兑现部分反弹较多的品种,天风证券：伴随中报预告，建议兑现部分反弹较多的品种
2021-06-19,券业38项指标排名出炉，投资能力分化显著,券业38项指标排名出炉，投资能力分化显著
2021-06-19,中证协发布去年证券公司社会责任履行情况统计,中证协发布去年证券公司社会责任履行情况统计
2021-06-20,回购价比最新股价还高30%！这家上市公司大方给员工“送礼”,回购价比最新股价还高30%！这家上市公司大方给员工“送礼”
2021-06-20,天风证券：开辟超额收益新战场，关注上半年股价与高景气背离的行业,天风证券：开辟超额收益新战场，关注上半年股价与高景气背离的行业
2021-06-21,天泽六个月定开债增聘基金经理汪琪 吴一纯离任 基金经理离任,天泽六个月定开债增聘基金经理汪琪 吴一纯离任 基金经理离任
2021-06-21,天风证券：盈康生命（300143.SZ）海尔赋能，打造物联网肿瘤治疗康复综合生态品牌，目标价30.58元，首予“买入”评级,天风证券：盈康生命（300143.SZ）海尔赋能，打造物联网肿瘤治疗康复综合生态品牌，目标价30.58元，首予“买入”评级
2021-06-21,天风国际Equity Focus——家居板块跟踪报告,天风国际Equity Focus——家居板块跟踪报告
2021-06-21,退市规则增“红线”，市值退市7月1日起实施！避雷名单请收好,退市规则增“红线”，市值退市7月1日起实施！避雷名单请收好
2021-06-21,天风证券：联通电信共建共享开通5G基站超40万个，万物互联加速渗透,天风证券：联通电信共建共享开通5G基站超40万个，万物互联加速渗透
2021-06-21,水电联合调度增益几何？,水电联合调度增益几何？
2021-06-21,【券商聚焦】天风证券首予时代天使(06699)买入评级 目标价468港元,【券商聚焦】天风证券首予时代天使(06699)买入评级 目标价468港元
2021-06-21,天风证券：公司副总裁刘全胜主要分管经纪业务方面的工作,天风证券：公司副总裁刘全胜主要分管经纪业务方面的工作
2021-06-22,天风证券维持三只松鼠买入评级：发布21年股权激励计划及事业合伙人持股计划，定位精细化管理完善人才机制，逐步发力利润产出,天风证券维持三只松鼠买入评级：发布21年股权激励计划及事业合伙人持股计划，定位精细化管理完善人才机制，逐步发力利润产出
2021-06-22,低估值叠加景气度持续，农业板块闻风起舞,低估值叠加景气度持续，农业板块闻风起舞
2021-06-22,Weekly Equity Focus 一周研报集锦,Weekly Equity Focus 一周研报集锦
2021-06-22,明日最具爆发力六大黑马,明日最具爆发力六大黑马
2021-06-22,湖北片区深入高校开展《股东来了》知识竞赛宣讲会,湖北片区深入高校开展《股东来了》知识竞赛宣讲会
2021-06-22,券业江湖2020龙虎榜来了！营收最高是这3家,券业江湖2020龙虎榜来了！营收最高是这3家
2021-06-23,天风期货拟定向募资2.65亿元,天风期货拟定向募资2.65亿元
2021-06-23,新三板首现保代罚单 华金证券首当其冲 金融监管处罚,新三板首现保代罚单 华金证券首当其冲 金融监管处罚
2021-06-23,券商海外业务排座次：海通与中金连续四年收入占比霸榜，中信建投增速最快，券业大举发力“走出去”,券商海外业务排座次：海通与中金连续四年收入占比霸榜，中信建投增速最快，券业大举发力“走出去”
2021-06-23,最强新股一天涨14倍！李佳琦、薇娅公司也要上市？回应来了,最强新股一天涨14倍！李佳琦、薇娅公司也要上市？回应来了
2021-06-23,湖北上市公司高管年薪：最高过千万 最低几千元,湖北上市公司高管年薪：最高过千万 最低几千元
2021-06-23,拓展产业触角，天风期货第一大股东、控股股东或将发生变动 控制人变化,拓展产业触角，天风期货第一大股东、控股股东或将发生变动 控制人变化
2021-06-23,屡见券商定增大幅缩水，究竟是谁拒绝“买单”？都有一个重要原因：主要股东均未参与,屡见券商定增大幅缩水，究竟是谁拒绝“买单”？都有一个重要原因：主要股东均未参与
2021-06-24,美国三大股指高开，礼来涨超8%,美国三大股指高开，礼来涨超8%
2021-06-24,[路演]天风证券：经营正常 各项业务发展良好,[路演]天风证券：经营正常 各项业务发展良好
2021-06-24,乳业上游龙头优然牧业港股上市，卖方目标价达12.5港元较现价翻倍,乳业上游龙头优然牧业港股上市，卖方目标价达12.5港元较现价翻倍
