publishedAt,title,description
2020-11-06,"天风证券现3笔大宗交易 共成交19,239.05万元","天风证券现3笔大宗交易 共成交19,239.05万元"
2020-11-06,天风证券(601162.SH)：当代科技减持完毕累计减持4449.84万股 减持股份,天风证券(601162.SH)：当代科技减持完毕累计减持4449.84万股 减持股份
2020-11-06,4800亿市值白马跳水！8成创业板股下跌，发生了什么,4800亿市值白马跳水！8成创业板股下跌，发生了什么
2020-11-06,无锡梁溪区金融招商推介会暨天风天睿智联产业基金成立仪式举行,无锡梁溪区金融招商推介会暨天风天睿智联产业基金成立仪式举行
2020-11-06,金麒麟奖揭晓：天风研究12个团队进入前三,金麒麟奖揭晓：天风研究12个团队进入前三
2020-11-06,天风证券获金鼎奖年度新锐投行等3项大奖,天风证券获金鼎奖年度新锐投行等3项大奖
2020-11-06,天风证券：低估值银行板块有望否极泰来，未来一年估值有望上行,天风证券：低估值银行板块有望否极泰来，未来一年估值有望上行
2020-11-06,高德信精选层小IPO通过辅导验收，财务数据符合标准一,高德信精选层小IPO通过辅导验收，财务数据符合标准一
2020-11-06,天风证券：坚持混合所有制发展，与资本市场休戚与共,天风证券：坚持混合所有制发展，与资本市场休戚与共
2020-11-08,下周操盘攻略：重磅宏观数据将公布，“双11”快递高峰期将至,下周操盘攻略：重磅宏观数据将公布，“双11”快递高峰期将至
2020-11-09,12家5G概念公司获机构调研,12家5G概念公司获机构调研
2020-11-09,科技股集体大涨，国产芯片多股涨停 机构看好这些股,科技股集体大涨，国产芯片多股涨停 机构看好这些股
2020-11-09,有色板块拉涨，金属价格全面反弹，行业有望获基金增持,有色板块拉涨，金属价格全面反弹，行业有望获基金增持
2020-11-10,工业大麻每日谈20201110【天风证券新兴产业】,工业大麻每日谈20201110【天风证券新兴产业】
2020-11-10,保险资金A股持续买、买、买,保险资金A股持续买、买、买
2020-11-10,猝不及防！万亿巨头跌去1500亿市值，腾讯小米集体重挫 连续下跌,猝不及防！万亿巨头跌去1500亿市值，腾讯小米集体重挫 连续下跌
2020-11-10,珈伟新能：股东振发能源集团拟被动减持不超过1.37%公司股份 拟减持股份,珈伟新能：股东振发能源集团拟被动减持不超过1.37%公司股份 拟减持股份
2020-11-11,A股风格大切换！顺周期品种逆势走强，北上资金提前部署,A股风格大切换！顺周期品种逆势走强，北上资金提前部署
2020-11-11,工业大麻每日谈20201111【天风证券新兴产业】,工业大麻每日谈20201111【天风证券新兴产业】
2020-11-11,天风证券翟晨曦：现在是投资中国最好的机会,天风证券翟晨曦：现在是投资中国最好的机会
2020-11-11,41股今日获机构买入评级,41股今日获机构买入评级
2020-11-11,天风证券(601162.SH)：决定撤销大连黄海西路证券营业部,天风证券(601162.SH)：决定撤销大连黄海西路证券营业部
2020-11-11,又见券商股遭清仓减持！年内已有11家预告减持 减持股份,又见券商股遭清仓减持！年内已有11家预告减持 减持股份
2020-11-11,13只基金年内收益翻倍，清一色重仓这类股,13只基金年内收益翻倍，清一色重仓这类股
2020-11-11,金桥奖聚焦资本市场改革中国证券公司助力实体经济,金桥奖聚焦资本市场改革中国证券公司助力实体经济
2020-11-11,机构调研接踵而至，银行股配置正当时,机构调研接踵而至，银行股配置正当时
2020-11-11,双十一到了，上市券商股东还在“卖卖卖”,双十一到了，上市券商股东还在“卖卖卖”
2020-11-12,年内“涨出”1个家电板块！18家白酒股总市值超4.4万亿,年内“涨出”1个家电板块！18家白酒股总市值超4.4万亿
2020-11-12,国内商品期货收盘涨跌不一，橡胶涨逾3%,国内商品期货收盘涨跌不一，橡胶涨逾3%
2020-11-12,多股年内翻倍，股价迭创历史新高，白酒股为何稳如泰山？,多股年内翻倍，股价迭创历史新高，白酒股为何稳如泰山？
2020-11-12,天风证券：低估值且基本面改善的银行板块未来一年有望明显跑赢大盘（附股）,天风证券：低估值且基本面改善的银行板块未来一年有望明显跑赢大盘（附股）
2020-11-12,芯片巨头三季度业绩暴增逾168%，芯片股行情还将继续？,芯片巨头三季度业绩暴增逾168%，芯片股行情还将继续？
2020-11-12,天风证券：短期看好顺周期板块的估值修复 如有色、金融板块等,天风证券：短期看好顺周期板块的估值修复 如有色、金融板块等
2020-11-12,港股科网股打85折，A股风格大切换！发生了什么,港股科网股打85折，A股风格大切换！发生了什么
2020-11-12,折价8%！近3500万股恒泰证券股权再度拍卖，这次能如愿脱手吗？ 资产查封,折价8%！近3500万股恒泰证券股权再度拍卖，这次能如愿脱手吗？ 资产查封
2020-11-13,5股翻倍，白酒后市机会在哪？券商透露两大选股法宝,5股翻倍，白酒后市机会在哪？券商透露两大选股法宝
2020-11-13,研报“撂倒”白酒板块！这个顺周期细分品种却再度走强,研报“撂倒”白酒板块！这个顺周期细分品种却再度走强
2020-11-14,20万亿险资大松绑，影响几何？,20万亿险资大松绑，影响几何？
2020-11-14,四季度以来机构密集调研，13家苹果产业链公司,四季度以来机构密集调研，13家苹果产业链公司
2020-11-14,独家|长安投资或让渡国融证券控制权 意向接盘方青岛国信已入场尽调,独家|长安投资或让渡国融证券控制权 意向接盘方青岛国信已入场尽调
2020-11-15,券商今年以来募资超千亿 券商疯狂“补血” 为哪般,券商今年以来募资超千亿 券商疯狂“补血” 为哪般
2020-11-16,注入金融活水92.6亿元 天风证券入选扶贫案例50佳,注入金融活水92.6亿元 天风证券入选扶贫案例50佳
2020-11-16,天风证券入选中国企业扶贫优秀案例综合50佳,天风证券入选中国企业扶贫优秀案例综合50佳
2020-11-16,在岸人民币兑美元16:30收报6.577，较上一交易日升值374基点,在岸人民币兑美元16:30收报6.577，较上一交易日升值374基点
2020-11-16,天风赵晓光：现在是布局消费电子行业的好时机，明年将有爆发式增长,天风赵晓光：现在是布局消费电子行业的好时机，明年将有爆发式增长
2020-11-16,全球最大自贸区诞生！对A股有何影响？RCEP最纯正概念股曝光,全球最大自贸区诞生！对A股有何影响？RCEP最纯正概念股曝光
2020-11-16,有色金属价格上涨，企业盈利有望抬升,有色金属价格上涨，企业盈利有望抬升
2020-11-16,联手华为，联手阿里…“生态”正成券商发力金科关键词，联合成立创新实验室、金科子公司，各自收效如何,联手华为，联手阿里…“生态”正成券商发力金科关键词，联合成立创新实验室、金科子公司，各自收效如何
2020-11-16,券业喜迎“大年” 券商密集“进补”,券业喜迎“大年” 券商密集“进补”
2020-11-17,三成上市券商年内遭重要股东减持，已“落地”1.72亿股 减持股份,三成上市券商年内遭重要股东减持，已“落地”1.72亿股 减持股份
2020-11-17,中国首富换人！农夫山泉创始人超越马云、马化腾,中国首富换人！农夫山泉创始人超越马云、马化腾
2020-11-17,11月17日深市创业板活跃股公开信息,11月17日深市创业板活跃股公开信息
2020-11-18,工业大麻每日谈20201118【天风证券新兴产业】,工业大麻每日谈20201118【天风证券新兴产业】
2020-11-18,集运市场再现“一船难求一箱难求”，料航运公司四季度业绩大增,集运市场再现“一船难求一箱难求”，料航运公司四季度业绩大增
2020-11-18,11月18日深市创业板活跃股公开信息,11月18日深市创业板活跃股公开信息
2020-11-19,券商年内千亿元再融资“补血”，抢占融资融券业务“地盘”,券商年内千亿元再融资“补血”，抢占融资融券业务“地盘”
2020-11-19,海通被查祸起结构化发债？监管层重拳出击遏制“自融” 其他违规处罚,海通被查祸起结构化发债？监管层重拳出击遏制“自融” 其他违规处罚
2020-11-19,这些冷门股，分析师很青睐！,这些冷门股，分析师很青睐！
2020-11-19,这些冷门股获分析师青睐，百倍市盈率仍被机构追捧,这些冷门股获分析师青睐，百倍市盈率仍被机构追捧
2020-11-19,A股收盘综述：上证指数涨0.47%，创业板指涨近1%,A股收盘综述：上证指数涨0.47%，创业板指涨近1%
2020-11-19,【行情】券商板块异动，国盛金控直线封板，东方财富、招商证券、浙商证券、天风证券跟涨,【行情】券商板块异动，国盛金控直线封板，东方财富、招商证券、浙商证券、天风证券跟涨
2020-11-19,A股午盘综述：上证指数涨0.11%，大消费板块回暖,A股午盘综述：上证指数涨0.11%，大消费板块回暖
2020-11-19,“踩雷”永煤债，海通证券被自律调查，AH股均大幅下挫 金融监管处罚,“踩雷”永煤债，海通证券被自律调查，AH股均大幅下挫 金融监管处罚
2020-11-19,西藏珠峰(600338.SH)：中环技拟被动减持不超200万股 拟减持股份,西藏珠峰(600338.SH)：中环技拟被动减持不超200万股 拟减持股份
2020-11-20,陷业绩与赎回双重压力，多只债基清盘,陷业绩与赎回双重压力，多只债基清盘
2020-11-20,A股午盘综述：上证指数涨0.1%，创业板指涨0.57%,A股午盘综述：上证指数涨0.1%，创业板指涨0.57%
2020-11-20,A股收盘综述：上证指数录得三连升，汽车股掀涨停潮,A股收盘综述：上证指数录得三连升，汽车股掀涨停潮
2020-11-20,工业大麻每日谈20201120【天风证券新兴产业】,工业大麻每日谈20201120【天风证券新兴产业】
2020-11-20,天风证券：公司涉及保证合同纠纷 诉讼纠纷,天风证券：公司涉及保证合同纠纷 诉讼纠纷
2020-11-20,头部券商薪酬机制调整悄然进行，下半年超1000位保代“上岗”,头部券商薪酬机制调整悄然进行，下半年超1000位保代“上岗”
2020-11-21,永煤违约链式反应 违约失信,永煤违约链式反应 违约失信
2020-11-23,天风证券：“17天风02”完成较债券金额1.87亿元,天风证券：“17天风02”完成较债券金额1.87亿元
2020-11-23,A股重回3400点！周期股大爆发，外资扫货30亿,A股重回3400点！周期股大爆发，外资扫货30亿
2020-11-24,债市惊雷15日，业内称AAA评级体系需要反思,债市惊雷15日，业内称AAA评级体系需要反思
2020-11-25,债基失利：11只发行失败，72只被迫清盘,债基失利：11只发行失败，72只被迫清盘
2020-11-25,2个月股价暴涨155%！板块全跌，这只最贵ST却创出新高,2个月股价暴涨155%！板块全跌，这只最贵ST却创出新高
2020-11-25,宜宾市商业银行获五粮液增持天风证券全身而退,宜宾市商业银行获五粮液增持天风证券全身而退
2020-11-25,京东数科发布JT2客户端、移动端 以数字技术提升资管行业附加值,京东数科发布JT2客户端、移动端 以数字技术提升资管行业附加值
2020-11-25,市场结构性特征显著 关注三类低估值消费股,市场结构性特征显著 关注三类低估值消费股
2020-11-26,A股午盘综述，上证指数跌0.13%，北向资金逆势净买入逾40亿元,A股午盘综述，上证指数跌0.13%，北向资金逆势净买入逾40亿元
2020-11-26,中科磁业拟A股上市，天风证券受聘担任辅导机构,中科磁业拟A股上市，天风证券受聘担任辅导机构
2020-11-26,A股收盘综述：上证指数涨0.22%，汽车、顺周期板块回调,A股收盘综述：上证指数涨0.22%，汽车、顺周期板块回调
2020-11-26,天风证券：未出售宜宾商行股权，不存在被中金收购情况,天风证券：未出售宜宾商行股权，不存在被中金收购情况
2020-11-26,天风证券：未出售所持有的宜宾商行股权,天风证券：未出售所持有的宜宾商行股权
2020-11-26,月度策略报告会 | 岁末效应渐浓 关注周期复苏,月度策略报告会 | 岁末效应渐浓 关注周期复苏
2020-11-27,"天风证券现1笔大宗交易 共成交9,910.20万元","天风证券现1笔大宗交易 共成交9,910.20万元"
2020-11-27,火爆依旧，4图看清可转债今年收益和最新估值分布,火爆依旧，4图看清可转债今年收益和最新估值分布
2020-11-27,港股异动︱北控城市资源(03718)涨超8%创历史新高 获天风证券唱好 目标价3.1港元,港股异动︱北控城市资源(03718)涨超8%创历史新高 获天风证券唱好 目标价3.1港元
2020-11-27,天风证券：顺周期与传统行业风格可能持续至明年一季报,天风证券：顺周期与传统行业风格可能持续至明年一季报
2020-11-27,均胜电子缘何出售均胜群英51％股权 天风证券详细解读 资产异常,均胜电子缘何出售均胜群英51％股权 天风证券详细解读 资产异常
2020-11-28,天风证券副总裁、研究所所长赵晓光：未来科技投资两大主线，移动互联网红利和精准数据,天风证券副总裁、研究所所长赵晓光：未来科技投资两大主线，移动互联网红利和精准数据
2020-11-28,天风证券赵晓光：未来科技投资两大主线，移动互联网红利和精准数据,天风证券赵晓光：未来科技投资两大主线，移动互联网红利和精准数据
2020-11-29,又见带量采购！医药股4个月跌去30%，未来还香吗？,又见带量采购！医药股4个月跌去30%，未来还香吗？
2020-11-29,北向资金明年可“扫货”科创板 更多增量资金在途,北向资金明年可“扫货”科创板 更多增量资金在途
2020-11-29,下周操盘攻略：重磅数据来袭，10只新股别错过,下周操盘攻略：重磅数据来袭，10只新股别错过
2020-11-30,一个字，懵！银行股满屏都是长上影；午盘砸板，这只股给章盟主挖了一个“坑”？,一个字，懵！银行股满屏都是长上影；午盘砸板，这只股给章盟主挖了一个“坑”？
2020-11-30,牛人重仓：德清骏扬、高毅资产“潜伏”这只股，会是“一场游戏一场梦”吗？,牛人重仓：德清骏扬、高毅资产“潜伏”这只股，会是“一场游戏一场梦”吗？
2020-11-30,强制赎回一剑封喉，308元龙蟠转债赎回价格100.32元，转债高溢价土崩瓦解,强制赎回一剑封喉，308元龙蟠转债赎回价格100.32元，转债高溢价土崩瓦解
2020-11-30,11月30日深市创业板活跃股公开信息,11月30日深市创业板活跃股公开信息
2020-11-30,沪指有望挑战年内新高！灵魂拷问来了：你在默默数钱还是在悄悄抹泪？,沪指有望挑战年内新高！灵魂拷问来了：你在默默数钱还是在悄悄抹泪？
2020-11-30,资金持续注入科创板 未来钱从哪里来？居民存款和外资或成重要增量,资金持续注入科创板 未来钱从哪里来？居民存款和外资或成重要增量
2020-11-30,大葱价格创4年半新高，生姜同比涨幅达125%，这些股票不淡定了,大葱价格创4年半新高，生姜同比涨幅达125%，这些股票不淡定了
2020-12-01,半天87亿元，北向资金猛烈扫货！金融证券股再度爆发,半天87亿元，北向资金猛烈扫货！金融证券股再度爆发
2020-12-01,天风证券(601162.SH)：武汉商贸减持完毕 累计减持1%股份 减持股份,天风证券(601162.SH)：武汉商贸减持完毕 累计减持1%股份 减持股份
2020-12-01,天风证券：武汉商贸减持1%股份，减持计划实施完毕 拟减持股份,天风证券：武汉商贸减持1%股份，减持计划实施完毕 拟减持股份
2020-12-01,11月金股组合盈利1.33% 12月荐股名单出炉,11月金股组合盈利1.33% 12月荐股名单出炉
2020-12-01,工业大麻每日谈20201201【天风证券新兴产业】,工业大麻每日谈20201201【天风证券新兴产业】
2020-12-02,有券商喊话本月沪指有望冲击4000点。中国平安、兴业银行被8家券商力荐！,有券商喊话本月沪指有望冲击4000点。中国平安、兴业银行被8家券商力荐！
2020-12-02,A股投资者热情高涨：券商喊话本月沪指冲击4000点 金股全名单,A股投资者热情高涨：券商喊话本月沪指冲击4000点 金股全名单
2020-12-02,业绩回升！重卡销量八连涨，行业高景气持续,业绩回升！重卡销量八连涨，行业高景气持续
2020-12-02,中国债券市场金融债发行日程一览(12月2日),中国债券市场金融债发行日程一览(12月2日)
2020-12-02,【行情】券商板块拉升，国联证券大涨9%，长城证券、华创阳安、天风证券、中国银河跟涨,【行情】券商板块拉升，国联证券大涨9%，长城证券、华创阳安、天风证券、中国银河跟涨
2020-12-02,11月以来近700只个股获券商买入评级，机构看好顺周期及成长板块,11月以来近700只个股获券商买入评级，机构看好顺周期及成长板块
2020-12-02,越跌越买，资金看好科创50ETF长配价值,越跌越买，资金看好科创50ETF长配价值
2020-12-02,冲刺精选层折戟后遭立案调查，新三板昔日明星沦为“仙股” 其他违规处罚,冲刺精选层折戟后遭立案调查，新三板昔日明星沦为“仙股” 其他违规处罚
2020-12-02,11月以来近700只个股获券商买入评级 机构看好顺周期及成长板块,11月以来近700只个股获券商买入评级 机构看好顺周期及成长板块
2020-12-02,11月近700只个股获券商买入评级 机构看好低估值顺周期,11月近700只个股获券商买入评级 机构看好低估值顺周期
2020-12-02,天风证券大股东减持6665.96万股，套现约4.04亿元 减持股份,天风证券大股东减持6665.96万股，套现约4.04亿元 减持股份
2020-12-03,龙头股6天5个板，大牛市行情开始了？,龙头股6天5个板，大牛市行情开始了？
2020-12-03,A股收盘综述：上证指数跌0.21%，创业板指涨超1%,A股收盘综述：上证指数跌0.21%，创业板指涨超1%
2020-12-03,A股午盘综述：大小指数分化，创业板指涨超1%,A股午盘综述：大小指数分化，创业板指涨超1%
2020-12-03,“地震”的不止光大！券商首席上演离职魔幻大剧！有机构15万月薪挖人,“地震”的不止光大！券商首席上演离职魔幻大剧！有机构15万月薪挖人
2020-12-03,【行情】证券板块异动拉升，国盛金控涨冲击涨停，天风证券、西部证券、广发证券、太平洋等跟涨,【行情】证券板块异动拉升，国盛金控涨冲击涨停，天风证券、西部证券、广发证券、太平洋等跟涨
2020-12-03,数千亿市值的小米、比亚迪同时大跌，都因一件事？,数千亿市值的小米、比亚迪同时大跌，都因一件事？
2020-12-03,11月份券商集合理财规模环比降超八成，“固收+FOF”产品布局提上日程,11月份券商集合理财规模环比降超八成，“固收+FOF”产品布局提上日程
2020-12-03,券商股拉升，国盛金控率先涨停,券商股拉升，国盛金控率先涨停
2020-12-04,天风证券：拟聘任郭胜北为副总裁,天风证券：拟聘任郭胜北为副总裁
2020-12-04,天风证券：湖北省联发已累计减持8171.45万股 占总股本1.23% 减持股份,天风证券：湖北省联发已累计减持8171.45万股 占总股本1.23% 减持股份
2020-12-04,天风证券(601162.SH)：湖北省联发已累计减持8171.4488万股 减持股份,天风证券(601162.SH)：湖北省联发已累计减持8171.4488万股 减持股份
2020-12-04,天风证券：当年累计新增借款占上年末净资产比例为57.81% 大额借贷担保,天风证券：当年累计新增借款占上年末净资产比例为57.81% 大额借贷担保
2020-12-04,天风证券：湖北省联发减持1.23%公司股份 减持股份,天风证券：湖北省联发减持1.23%公司股份 减持股份
2020-12-04,国盛金控飙涨67.23%后“休整”，北向资金、机构资金疯狂买入,国盛金控飙涨67.23%后“休整”，北向资金、机构资金疯狂买入
2020-12-04,12月金股测评| 4只金股疑似被游资盯上，上榜常客已开启跳水姿态,12月金股测评| 4只金股疑似被游资盯上，上榜常客已开启跳水姿态
2020-12-04,12月金股测评丨当游资遇上金股，它们将摩擦出什么火花？,12月金股测评丨当游资遇上金股，它们将摩擦出什么火花？
2020-12-04,银行还有空间！花旗加入看多,银行还有空间！花旗加入看多
2020-12-04,杠杆资金的双刃剑！12月3日融资余额环比增长及减少最多的个股一览,杠杆资金的双刃剑！12月3日融资余额环比增长及减少最多的个股一览
2020-12-04,6天拿下4个涨停板，券商股为何成为游资“新战场”？,6天拿下4个涨停板，券商股为何成为游资“新战场”？
2020-12-04,融资客青睐7股，江河集团买入占比高达42.01%,融资客青睐7股，江河集团买入占比高达42.01%
2020-12-04,信用债危机影响显现：部分公司评级被调降，债券发行失败或取消创新高！,信用债危机影响显现：部分公司评级被调降，债券发行失败或取消创新高！
2020-12-06,券商承销规模超9万亿,券商承销规模超9万亿
2020-12-06,2953亿元的市场规模，A股公司忙“抢滩”,2953亿元的市场规模，A股公司忙“抢滩”
2020-12-07,沃森生物转让HPV疫苗资产遭深交所问询，投资者要求更换董事长 问询,沃森生物转让HPV疫苗资产遭深交所问询，投资者要求更换董事长 问询
2020-12-07,机构“点名”茅台新高还在后面，白酒、食品与旅游“头部公司”酝酿跨年机会,机构“点名”茅台新高还在后面，白酒、食品与旅游“头部公司”酝酿跨年机会
2020-12-08,融资客上周加仓逾160亿元，顺周期板块受宠,融资客上周加仓逾160亿元，顺周期板块受宠
2020-12-08,贵州茅台突破1850元再创新高，A股“喝酒行情”爆发丨牛熊眼,贵州茅台突破1850元再创新高，A股“喝酒行情”爆发丨牛熊眼
2020-12-08,5分钟天堂到地狱！“妖股”集体阵亡，但这些股票上演“稳稳的幸福”,5分钟天堂到地狱！“妖股”集体阵亡，但这些股票上演“稳稳的幸福”
2020-12-08,一笔单引发少数信用债大跌，企业风险or资金操作不当需辨别,一笔单引发少数信用债大跌，企业风险or资金操作不当需辨别
2020-12-08,机构预测：11月份CPI同比上涨0.04%,机构预测：11月份CPI同比上涨0.04%
2020-12-09,查漏补缺双十二，能否收获A股年底回血包？,查漏补缺双十二，能否收获A股年底回血包？
2020-12-09,上市券商分支机构年内加减法：裁撤51家获批新设35家，加速财富管理转型,上市券商分支机构年内加减法：裁撤51家获批新设35家，加速财富管理转型
2020-12-09,A股午盘综述：上证指数涨0.06%，创业板指跌0.32%,A股午盘综述：上证指数涨0.06%，创业板指跌0.32%
2020-12-11,光伏企业密集扩产，10股获北上资金加仓,光伏企业密集扩产，10股获北上资金加仓
2020-12-11,解盘：A股高开低走，半导体、传媒、稀土领跌,解盘：A股高开低走，半导体、传媒、稀土领跌
2020-12-11,天风证券：当代文体减持计划已实施完毕 拟减持股份,天风证券：当代文体减持计划已实施完毕 拟减持股份
2020-12-11,天风证券(601162.SH)：当代文体减持完毕 累计减持1472.48万股 减持股份,天风证券(601162.SH)：当代文体减持完毕 累计减持1472.48万股 减持股份
2020-12-12,智能制造厂商有望进一步扩大市占率 实现产业链扩张,智能制造厂商有望进一步扩大市占率 实现产业链扩张
2020-12-12,中金所召开董事会交易委员会和风险委员会年度工作会议,中金所召开董事会交易委员会和风险委员会年度工作会议
2020-12-13,西藏珠峰(600338.SH)：天风证券已累计减持中环技所持公司股份124.76万股 减持股份,西藏珠峰(600338.SH)：天风证券已累计减持中环技所持公司股份124.76万股 减持股份
2020-12-14,今年来已达3244亿元，券商债券融资净额同比翻番,今年来已达3244亿元，券商债券融资净额同比翻番
2020-12-14,以专业为本 追梦资管大时代——专访新华基金联席董事长翟晨曦,以专业为本 追梦资管大时代——专访新华基金联席董事长翟晨曦
2020-12-14,刚刚，美团大跌，阿里腾讯也惊了!A股小伙伴火速“降温” 连续下跌,刚刚，美团大跌，阿里腾讯也惊了!A股小伙伴火速“降温” 连续下跌
2020-12-14,34股今日获机构买入评级,34股今日获机构买入评级
2020-12-15,12月15日深市创业板活跃股公开信息,12月15日深市创业板活跃股公开信息
2020-12-15,天风证券：白酒企业新五规划勇攀高峰，持续推荐白酒啤酒板块,天风证券：白酒企业新五规划勇攀高峰，持续推荐白酒啤酒板块
