publishedAt,title,description
2018-01-01,又一家券商冲刺IPO，多家上市公司持股,又一家券商冲刺IPO，多家上市公司持股
2018-01-02,蓝筹股风云再起，两市喜迎开门红,蓝筹股风云再起，两市喜迎开门红
2018-01-02,第六届证券期货科学技术奖初审结果公示公告,第六届证券期货科学技术奖初审结果公示公告
2018-01-04,一季度煤价料持续高位年报行情或提前启动(受益股),一季度煤价料持续高位年报行情或提前启动(受益股)
2018-01-04,新三板公司转板“开门红”，已转板企业2017年表现亮眼,新三板公司转板“开门红”，已转板企业2017年表现亮眼
2018-01-08,【天风Morning Call】晨会集萃20180108,【天风Morning Call】晨会集萃20180108
2018-01-08,【天风交运姜明团队】周报（1.02-1.07）：票价改革远超预期，航空主升浪在即,【天风交运姜明团队】周报（1.02-1.07）：票价改革远超预期，航空主升浪在即
2018-01-09,一财研选｜新产能置换办法出台，不可忽视的去产能标的值得关注！,一财研选｜新产能置换办法出台，不可忽视的去产能标的值得关注！
2018-01-10,财富管理︱基金公司新排名出炉，行业大变局刚刚开始,财富管理︱基金公司新排名出炉，行业大变局刚刚开始
2018-01-10,百家券商2017经纪业务排位出炉：谁是前十霸主？,百家券商2017经纪业务排位出炉：谁是前十霸主？
2018-01-11,金融机构上市潮涌，2018或迎12家银行、8家券商IPO,金融机构上市潮涌，2018或迎12家银行、8家券商IPO
2018-01-15,一财研选｜政策利好、油价上涨哪家强，航空板块行情将何去何从？,一财研选｜政策利好、油价上涨哪家强，航空板块行情将何去何从？
2018-01-15,【天风Morning Call】晨会集萃20180115,【天风Morning Call】晨会集萃20180115
2018-01-15,贵州茅台首破万亿后震荡，A股“万亿市值俱乐部”将达6家,贵州茅台首破万亿后震荡，A股“万亿市值俱乐部”将达6家
2018-01-16,【天风Morning Call】晨会集萃20180116,【天风Morning Call】晨会集萃20180116
2018-01-17,【天风Morning Call】晨会集萃20180117,【天风Morning Call】晨会集萃20180117
2018-01-18,一财研选｜利空释放、供需健康，这个板块已无大幅下跌可能！,一财研选｜利空释放、供需健康，这个板块已无大幅下跌可能！
2018-01-21,一财研选｜低线城市消费开始崛起，零售行业有望重整旗鼓！,一财研选｜低线城市消费开始崛起，零售行业有望重整旗鼓！
2018-01-22,一财研选｜苹果又一产品将随时发售，这个行业将迎来大未来！,一财研选｜苹果又一产品将随时发售，这个行业将迎来大未来！
2018-01-23,【天风交运姜明】航空见闻系列二：深入拆分！详解燃油附加费征收机制及影响,【天风交运姜明】航空见闻系列二：深入拆分！详解燃油附加费征收机制及影响
2018-01-23,贝斯达IPO悬念：应收应付剪刀差成吞噬现金流黑洞 内控机制捉襟见肘,贝斯达IPO悬念：应收应付剪刀差成吞噬现金流黑洞 内控机制捉襟见肘
2018-01-24,“飞到云端”又“跌入凡尘” 可转债经历了怎样的一年？,“飞到云端”又“跌入凡尘” 可转债经历了怎样的一年？
2018-01-26,【天风交运姜明】航空见闻系列之一：油价上涨，为何仍要推荐航空？,【天风交运姜明】航空见闻系列之一：油价上涨，为何仍要推荐航空？
2018-01-27,证监会“重拳”出击一类股或将遭受重创,证监会“重拳”出击一类股或将遭受重创
2018-01-30,一财研选｜阿里腾讯巨资参与万达私有化，“新零售”站上行业风口！,一财研选｜阿里腾讯巨资参与万达私有化，“新零售”站上行业风口！
2018-01-31,天风证券：股债市场存在比价关系,天风证券：股债市场存在比价关系
2018-02-01,天风证券：2月资金面先紧后松,天风证券：2月资金面先紧后松
2018-02-03,中信建投证券冲刺A股IPO，或成第十一家A+H券商,中信建投证券冲刺A股IPO，或成第十一家A+H券商
2018-02-07,一财研选｜国家坚定推进，大幅调整的这个板块将现买入良机！,一财研选｜国家坚定推进，大幅调整的这个板块将现买入良机！
2018-02-08,五粮液股价跌24%贵州茅台跌14% 中泰证券在山顶唱多,五粮液股价跌24%贵州茅台跌14% 中泰证券在山顶唱多
2018-02-08,天风证券与中关村大数据产业联盟签署战略合作协,天风证券与中关村大数据产业联盟签署战略合作协
2018-02-09,上证50三日跌逾7%，避险资金去哪里？,上证50三日跌逾7%，避险资金去哪里？
2018-02-09,ABS券商黑马样本： 德邦、阿里联盟松动 天风、开源排名“火箭上升”,ABS券商黑马样本： 德邦、阿里联盟松动 天风、开源排名“火箭上升”
2018-02-11,【天风交运姜明团队】周报（2.05-2.11）：春运迎出行高峰，坚定配置航空铁路,【天风交运姜明团队】周报（2.05-2.11）：春运迎出行高峰，坚定配置航空铁路
2018-02-13,一财研选｜北斗组网全球覆盖加速，应用驱动产业进入黄金期！,一财研选｜北斗组网全球覆盖加速，应用驱动产业进入黄金期！
2018-02-13,创业板指发力飙升3.49%，三大数据解读创蓝筹上涨逻辑,创业板指发力飙升3.49%，三大数据解读创蓝筹上涨逻辑
2018-02-23,天风证券：持续创新 以精准扶贫拍卖会推动贫困地区发展,天风证券：持续创新 以精准扶贫拍卖会推动贫困地区发展
2018-02-25,【天风交运姜明团队】周报（2.19-2.25）：民航春运发送旅客增14.9%，航空铁路继续坚定配置,【天风交运姜明团队】周报（2.19-2.25）：民航春运发送旅客增14.9%，航空铁路继续坚定配置
2018-02-26,多地掀自贸港申建热 概念股“涨声一片”,多地掀自贸港申建热 概念股“涨声一片”
2018-02-27,交通运输概念股有哪些:春运民航发送旅客增14.6% 航空铁路继续坚,交通运输概念股有哪些:春运民航发送旅客增14.6% 航空铁路继续坚
2018-03-04,【天风交运姜明团队】周报（2.26-3.04）：集运价格大幅回调，看好区域及改革主题,【天风交运姜明团队】周报（2.26-3.04）：集运价格大幅回调，看好区域及改革主题
2018-03-07,百家券商经纪业务新局初定！华泰中信广发前三,百家券商经纪业务新局初定！华泰中信广发前三
2018-03-07,春节返乡调研：4200份问卷为中产消费者画像,春节返乡调研：4200份问卷为中产消费者画像
2018-03-08,天风证券&中关村大数据产业联盟举办的2018年度数字产业论坛昨日召开,天风证券&中关村大数据产业联盟举办的2018年度数字产业论坛昨日召开
2018-03-10,粤港澳大湾区规划纲要编制基本完成 地产+基建行业将受益,粤港澳大湾区规划纲要编制基本完成 地产+基建行业将受益
2018-03-10,粤港澳大湾区规划纲要编制基本完成 地产+基建迎生机,粤港澳大湾区规划纲要编制基本完成 地产+基建迎生机
2018-03-11,“粤港澳大湾区”规划纲要编制基本完成 概念股迎生机,“粤港澳大湾区”规划纲要编制基本完成 概念股迎生机
2018-03-11,【天风策略】结构性通胀环境下，哪些领域会涨价？,【天风策略】结构性通胀环境下，哪些领域会涨价？
2018-03-12,重量级引援！新财富“三连冠”董广阳跳槽华创或任研究所所长，中小券商导演分析师“求贤季”开镜！,重量级引援！新财富“三连冠”董广阳跳槽华创或任研究所所长，中小券商导演分析师“求贤季”开镜！
2018-03-13,"惊爆!继马化腾马云之后,王健林强势涉足区块链","惊爆!继马化腾马云之后,王健林强势涉足区块链"
2018-03-14,南京证券顺利过会 券商IPO进程加快,南京证券顺利过会 券商IPO进程加快
2018-03-14,A股情报局：新能源汽车带来的确定机会,A股情报局：新能源汽车带来的确定机会
2018-03-14,【天风策略】业绩的“三个分化”及景气向上的细分领域,【天风策略】业绩的“三个分化”及景气向上的细分领域
2018-03-16,分析师变局： 大平台离职严重 中小券商正在崛起,分析师变局： 大平台离职严重 中小券商正在崛起
2018-03-18,A股全周持续调整 避险情绪下高分红股引关注,A股全周持续调整 避险情绪下高分红股引关注
2018-03-18,【天风交运姜明团队】周报（3.12-3.18）：1-2月快递量增长31.2%，继续强调航空、铁路板块机会,【天风交运姜明团队】周报（3.12-3.18）：1-2月快递量增长31.2%，继续强调航空、铁路板块机会
2018-03-20,【天风策略】轨交申报规划条件变化的启示,【天风策略】轨交申报规划条件变化的启示
2018-03-20,300上市公司加入分红大军 “分红乱象”也跟着来了,300上市公司加入分红大军 “分红乱象”也跟着来了
2018-03-21,上市公司分红积极 仍有问题需注意,上市公司分红积极 仍有问题需注意
2018-03-22,2家过会6家排队 券商IPO进程料加快,2家过会6家排队 券商IPO进程料加快
2018-03-25,【天风交运姜明团队】周报（3.19-3.25）：回避贸易摩擦风险，布局航空铁路和快递,【天风交运姜明团队】周报（3.19-3.25）：回避贸易摩擦风险，布局航空铁路和快递
2018-03-28,刻度信息持续经营能力存在重大不确定性,刻度信息持续经营能力存在重大不确定性
2018-03-28,天风证券帮扶贫困县“房县县域经济创新发展板块”启动,天风证券帮扶贫困县“房县县域经济创新发展板块”启动
2018-04-01,券商大洗牌！血战9万亿最优质资源，长江佣金第二，天风 “涨疯”，多家老牌掉队（全名单）,券商大洗牌！血战9万亿最优质资源，长江佣金第二，天风 “涨疯”，多家老牌掉队（全名单）
2018-04-30,周四首发上市企业3家：两家不存在控股股东和实控人,周四首发上市企业3家：两家不存在控股股东和实控人
2018-05-02,【天风机械】三一重工：超预期！Q1 净利润同比翻番，资产负债表全面修复，轻装上阵18业绩可期,【天风机械】三一重工：超预期！Q1 净利润同比翻番，资产负债表全面修复，轻装上阵18业绩可期
2018-05-02,发审委明日将审核三家公司IPO，均来自武汉,发审委明日将审核三家公司IPO，均来自武汉
2018-05-03,天风证券过会券商背后隐藏的影子股不尽相同,天风证券过会券商背后隐藏的影子股不尽相同
2018-05-03,天风证券过会 今年以来过会券商已达5家,天风证券过会 今年以来过会券商已达5家
2018-05-03,公告精选：星湖科技股东拟清仓减持14.72%股份；惠而浦连续两年年报涉嫌虚假记载，被立案调查,公告精选：星湖科技股东拟清仓减持14.72%股份；惠而浦连续两年年报涉嫌虚假记载，被立案调查
2018-05-03,公告精选：天风证券IPO过会人福医药持股13.4% 惠而浦被立案调查,公告精选：天风证券IPO过会人福医药持股13.4% 惠而浦被立案调查
2018-05-03,中金网0503晚间公告汇总：人福医药参股公司天风证券IPO过会,中金网0503晚间公告汇总：人福医药参股公司天风证券IPO过会
2018-05-03,第十七届发审委2018年第70次会议审核结果公告,第十七届发审委2018年第70次会议审核结果公告
2018-05-03,晚间重要公告2018年5月3日星期四,晚间重要公告2018年5月3日星期四
2018-05-03,天风证券等三公司今日IPO全部成功过会,天风证券等三公司今日IPO全部成功过会
2018-05-03,5月3日上市公司晚间公告速递,5月3日上市公司晚间公告速递
2018-05-03,人福医药：天风证券IPO过会 公司持股13.4%,人福医药：天风证券IPO过会 公司持股13.4%
2018-05-03,天风证券今日上会 A股市场或又添上市券商,天风证券今日上会 A股市场或又添上市券商
2018-05-03,湖北一天内三企业通过IPO审核,湖北一天内三企业通过IPO审核
2018-05-03,天风证券等三家企业首发过会,天风证券等三家企业首发过会
2018-05-04,IPO发审会“武汉专场”三炮齐鸣,IPO发审会“武汉专场”三炮齐鸣
2018-05-04,5月首次发审会通过率100% 天风证券成今年第五家过会券商,5月首次发审会通过率100% 天风证券成今年第五家过会券商
2018-05-04,天风证券IPO过会上市券商再添新军,天风证券IPO过会上市券商再添新军
2018-05-04,旅界简讯 | 棕榈股份签下30亿PPP大单 卓锐科技B轮融资过亿,旅界简讯 | 棕榈股份签下30亿PPP大单 卓锐科技B轮融资过亿
2018-05-04,证监会公告审核结果 湖北武汉光谷3家企业IPO同一天过会,证监会公告审核结果 湖北武汉光谷3家企业IPO同一天过会
2018-05-04,A股头条:ST指数创3年新低 天风证券等三公司首发过会,A股头条:ST指数创3年新低 天风证券等三公司首发过会
2018-05-04,一天内湖北3家企业过会 湖北境内A股上市企业将达101家,一天内湖北3家企业过会 湖北境内A股上市企业将达101家
2018-05-04,操盘必读：5月4日证券市场要闻,操盘必读：5月4日证券市场要闻
2018-05-07,天风证券过会 银丰棉花成了最大的“集邮党”,天风证券过会 银丰棉花成了最大的“集邮党”
2018-05-08,武汉专场满堂彩，医药专场三过一，新股发审偶尔也来个专场模式？,武汉专场满堂彩，医药专场三过一，新股发审偶尔也来个专场模式？
2018-05-08,券商IPO迎来小高潮,券商IPO迎来小高潮
2018-05-09,*ST中安：天风证券召集“16中安消”持有人会议,*ST中安：天风证券召集“16中安消”持有人会议
2018-05-10,关于召开中安消股份有限公司2016年公开发行公司债券2018年第二次债券持有人会议的通知,关于召开中安消股份有限公司2016年公开发行公司债券2018年第二次债券持有人会议的通知
2018-05-13,【天风交运姜明团队】周报（5.07-5.13）：BDI反弹创18年新高，7月1日禁止不合规车辆运输车通行,【天风交运姜明团队】周报（5.07-5.13）：BDI反弹创18年新高，7月1日禁止不合规车辆运输车通行
2018-05-28,关于核准天风证券股份有限公司首次公开发行股票的批复,关于核准天风证券股份有限公司首次公开发行股票的批复
2018-06-05,一财研选｜智能手机产业边际转好，布局高稳定性标的机遇显现！,一财研选｜智能手机产业边际转好，布局高稳定性标的机遇显现！
2018-06-10,解禁后流通股数量（万股）,解禁后流通股数量（万股）
2018-06-22,又一家券商系公募基金获批，还有华林证券正在申请公募牌照,又一家券商系公募基金获批，还有华林证券正在申请公募牌照
2018-06-24,三特索道被告涉4起诉讼 持有天风证券股权被法院冻结,三特索道被告涉4起诉讼 持有天风证券股权被法院冻结
2018-07-12,“蛇吞象”收购招商局港口 深赤湾A复牌股价走低,“蛇吞象”收购招商局港口 深赤湾A复牌股价走低
2018-07-16,福建证监局关于2018年辖区证券分支机构现场检查随机抽查结果的通报,福建证监局关于2018年辖区证券分支机构现场检查随机抽查结果的通报
2018-07-23,【天风策略】公募基金中报概览,【天风策略】公募基金中报概览
2018-07-27,中国证监会公布2018年证券公司分类结果,中国证监会公布2018年证券公司分类结果
2018-07-30,中国证监会公布2018年证券公司分类结果,中国证监会公布2018年证券公司分类结果
2018-07-31,拼多多遭各路人马秋后算账 涉嫌假冒品牌销量占63%,拼多多遭各路人马秋后算账 涉嫌假冒品牌销量占63%
2018-08-09,这牛吹大了！拟IPO公司称账上有7000万，主办券商一查仅83万,这牛吹大了！拟IPO公司称账上有7000万，主办券商一查仅83万
2018-09-07,等了45天迈瑞医疗终拿IPO批文 募资或缩水超3成,等了45天迈瑞医疗终拿IPO批文 募资或缩水超3成
2018-09-07,晚间要闻2018年9月7日星期五,晚间要闻2018年9月7日星期五
2018-09-07,证监会：天风证券、迈瑞生物IPO获批 筹资总金额不超过69亿元,证监会：天风证券、迈瑞生物IPO获批 筹资总金额不超过69亿元
2018-09-07,迈瑞医疗和天风证券获IPO批文 合计筹资总额不超69亿元,迈瑞医疗和天风证券获IPO批文 合计筹资总额不超69亿元
2018-09-07,证监会核发天风证券、迈瑞医疗2家企业IPO批文，拟筹资不超过69亿元,证监会核发天风证券、迈瑞医疗2家企业IPO批文，拟筹资不超过69亿元
2018-09-08,迈瑞医疗市值或超千亿 冲A股医疗器械和创业板双一哥,迈瑞医疗市值或超千亿 冲A股医疗器械和创业板双一哥
2018-09-10,天风证券获IPO批文 A股第33家上市券商“呼之欲出”,天风证券获IPO批文 A股第33家上市券商“呼之欲出”
2018-09-10,戴维斯双击累计超额7.36%【天风金工吴先兴团队】,戴维斯双击累计超额7.36%【天风金工吴先兴团队】
2018-09-10,人福医药：参股公司天风证券IPO申请获核准 公司持股13.4%,人福医药：参股公司天风证券IPO申请获核准 公司持股13.4%
2018-09-10,9月10日上市公司晚间公告速递,9月10日上市公司晚间公告速递
2018-09-10,10日晚公告精选丨粤宏远A获第一大股东广东宏远集团三度举牌,10日晚公告精选丨粤宏远A获第一大股东广东宏远集团三度举牌
2018-09-10,天风证券IPO申请获核准 尚有3家拟上市券商排队审核,天风证券IPO申请获核准 尚有3家拟上市券商排队审核
2018-09-11,上市队伍再扩容 券商急补资本金,上市队伍再扩容 券商急补资本金
2018-09-11,A股将迎第33家上市券商 发行价或再创券商股新低,A股将迎第33家上市券商 发行价或再创券商股新低
2018-09-11,601162中签率 601162配号 天风证券601162什么时候上市,601162中签率 601162配号 天风证券601162什么时候上市
2018-09-11,次新导航（第36期）：证监会核发新股2家，迈瑞医疗建议关注,次新导航（第36期）：证监会核发新股2家，迈瑞医疗建议关注
2018-09-13,天风证券即将成为第33家上市券商,天风证券即将成为第33家上市券商
2018-09-13,天风证券IPO招股书：预计10月9日发行 拟挂牌上交所,天风证券IPO招股书：预计10月9日发行 拟挂牌上交所
2018-09-18,定价0.76PB的天风被迫延迟，长城证券会破净发行吗,定价0.76PB的天风被迫延迟，长城证券会破净发行吗
2018-09-18,天风证券获IPO批文 募集资金将向服务实体经济倾斜,天风证券获IPO批文 募集资金将向服务实体经济倾斜
2018-09-18,天风证券获IPO批文营收净利逐年下滑 盈利能力下降,天风证券获IPO批文营收净利逐年下滑 盈利能力下降
2018-09-18,长城证券招股启动 中小券商密集上市,长城证券招股启动 中小券商密集上市
2018-09-19,当代明诚签非公开发行股票协议 关联交易涉天风证券,当代明诚签非公开发行股票协议 关联交易涉天风证券
2018-09-25,长城证券推迟IPO发行至10月17日 定价6.31元,长城证券推迟IPO发行至10月17日 定价6.31元
2018-09-25,“一”字板数量骤降 炒新降温,“一”字板数量骤降 炒新降温
2018-09-27,发行市盈率成绊脚石 长城证券申购无奈推迟,发行市盈率成绊脚石 长城证券申购无奈推迟
2018-09-27,天风证券：原定于9月18日进行的申购将推迟至10月9日,天风证券：原定于9月18日进行的申购将推迟至10月9日
2018-10-08,最低价券商股天风证券周二申购 发行市盈率为22.86倍,最低价券商股天风证券周二申购 发行市盈率为22.86倍
2018-10-08,天风证券601162新股申购中签率和中签号查询,天风证券601162新股申购中签率和中签号查询
2018-10-08,天风证券9日打新“贴地”发行 业务“激进”引关注,天风证券9日打新“贴地”发行 业务“激进”引关注
2018-10-09,[快讯]新股申购结果：天风证券公布中签率,[快讯]新股申购结果：天风证券公布中签率
2018-10-09,天风证券：中签率0.2462%,天风证券：中签率0.2462%
2018-10-09,天风证券：服务实体经济与客户“共生共荣”,天风证券：服务实体经济与客户“共生共荣”
2018-10-09,780162天风证券中签率查询 601162中签率是多少？,780162天风证券中签率查询 601162中签率是多少？
2018-10-09,【提示】史上发行价格最低的券商股天风证券今日申购,【提示】史上发行价格最低的券商股天风证券今日申购
2018-10-09,1.79元超低价打新！黑马券商要来了，就在今天申购,1.79元超低价打新！黑马券商要来了，就在今天申购
2018-10-09,史上发行价格最低的券商股今日申购！天风证券1股只要1.79元,史上发行价格最低的券商股今日申购！天风证券1股只要1.79元
2018-10-09,天风证券10月9日申购指南 顶格申购需配市值155万,天风证券10月9日申购指南 顶格申购需配市值155万
2018-10-09,史上最低价券商股天风证券来了 但周四这只医药新股收益更可观,史上最低价券商股天风证券来了 但周四这只医药新股收益更可观
2018-10-10,中弘股份再次进入保牌倒计时——道达早评,中弘股份再次进入保牌倒计时——道达早评
2018-10-10,天风证券首发中签率公布 发行股份60%由网下回拨至网上,天风证券首发中签率公布 发行股份60%由网下回拨至网上
2018-10-10,兑奖了！天风证券中签号出炉,兑奖了！天风证券中签号出炉
2018-10-10,天风证券中签结果出炉 中签号码共有46.6万个,天风证券中签结果出炉 中签号码共有46.6万个
2018-10-10,10月11日 昂利康申购，天风证券缴款,10月11日 昂利康申购，天风证券缴款
2018-10-11,天风证券780162中签号出炉 中签号共46.6万个,天风证券780162中签号出炉 中签号共46.6万个
2018-10-11,"天风证券中签号码共有466,200个 每个号码只能认购1000股","天风证券中签号码共有466,200个 每个号码只能认购1000股"
2018-10-11,昂利康申购 天风证券公布中签号缴款,昂利康申购 天风证券公布中签号缴款
2018-10-11,昂利康制药上市时间 股票代码申购指南涨停板预测,昂利康制药上市时间 股票代码申购指南涨停板预测
2018-10-12,天风证券601162什么时候上市？天风证券上市时间一览,天风证券601162什么时候上市？天风证券上市时间一览
2018-10-12,迟迟未获批文 华林证券分类评级降级引关注,迟迟未获批文 华林证券分类评级降级引关注
2018-10-17,年内第5只上市券商股来了 今日打新长城证券每签有望获利7600元,年内第5只上市券商股来了 今日打新长城证券每签有望获利7600元
2018-10-19,人福医药:参股公司天风证券上市 公司持有12.06%股份,人福医药:参股公司天风证券上市 公司持有12.06%股份
2018-10-19,沪深上市公司18年10月19日晚间上市公司重要公告,沪深上市公司18年10月19日晚间上市公司重要公告
2018-10-19,公告精选：海康威视前三季度净利润74亿元， 同比增20.2%；王忠磊拟减持华谊兄弟375万股,公告精选：海康威视前三季度净利润74亿元， 同比增20.2%；王忠磊拟减持华谊兄弟375万股
2018-10-19,10月19日A股龙虎榜揭秘，机构抢筹这7股,10月19日A股龙虎榜揭秘，机构抢筹这7股
2018-10-19,天风证券10月19日登陆上交所 市场化架构孕育“超快速”发展,天风证券10月19日登陆上交所 市场化架构孕育“超快速”发展
2018-10-19,天风证券今日登陆上交所主板，成为湖北第二家上市券商,天风证券今日登陆上交所主板，成为湖北第二家上市券商
2018-10-19,新股发行与上市一览（10月19日）,新股发行与上市一览（10月19日）
2018-10-19,人福医药：天风证券上市 公司持股12.06%,人福医药：天风证券上市 公司持股12.06%
2018-10-19,天风证券：上市募资提升服务实体经济能力,天风证券：上市募资提升服务实体经济能力
2018-10-19,天风证券今日上市 总发行466200000股,天风证券今日上市 总发行466200000股
2018-10-22,涨停板解密：券商股罕见全部涨停！（10月22日）,涨停板解密：券商股罕见全部涨停！（10月22日）
2018-10-22,天风证券与吉林省金融办签协议 3年为吉林500亿相关项目提供服务,天风证券与吉林省金融办签协议 3年为吉林500亿相关项目提供服务
2018-10-24,券商百亿资管计划涉11家券商 名单包含十大券商及天风证券,券商百亿资管计划涉11家券商 名单包含十大券商及天风证券
2018-10-26,天风证券龙虎榜数据（10月26日）,天风证券龙虎榜数据（10月26日）
2018-10-26,小券商上市遇暖风 长城证券首日如期涨停,小券商上市遇暖风 长城证券首日如期涨停
2018-10-30,【天风策略】三季度保险、社保持仓跟踪,【天风策略】三季度保险、社保持仓跟踪
2018-11-02,天风证券龙虎榜数据（11月2日）,天风证券龙虎榜数据（11月2日）
