publishedAt,title,description
2019-12-25,公告精选：茅台集团拟无偿划转贵州茅台4%股份至省国资运营公司；威唐工业股东拟减持不超2%股份,公告精选：茅台集团拟无偿划转贵州茅台4%股份至省国资运营公司；威唐工业股东拟减持不超2%股份
2019-12-25,三六零子公司联合中标2.5亿元EPC总承包项目,三六零子公司联合中标2.5亿元EPC总承包项目
2019-12-25,三六零(601360.SH)联合体中标2.51亿元天津市网络安全协同创新产业基地项目,三六零(601360.SH)联合体中标2.51亿元天津市网络安全协同创新产业基地项目
2019-12-25,三六零：全资子公司中标天津市EPC总承包项目,三六零：全资子公司中标天津市EPC总承包项目
2019-12-25,三六零：联合中标2.51亿元政企安全业务项目,三六零：联合中标2.51亿元政企安全业务项目
2019-12-26,网络安全板块午后异动 三六零涨停,网络安全板块午后异动 三六零涨停
2019-12-26,360中标天津网络安全项目 助力安全生态特区建设,360中标天津网络安全项目 助力安全生态特区建设
2019-12-26,三六零中标2.51亿元天津项目,三六零中标2.51亿元天津项目
2019-12-26,【广证恒生教育】建桥教育通过港股上市聆讯，立思辰拟剥离三六零教育聚焦大语文,【广证恒生教育】建桥教育通过港股上市聆讯，立思辰拟剥离三六零教育聚焦大语文
2019-12-26,三六零中标2.51亿天津项目 刷新政企业务订单纪录,三六零中标2.51亿天津项目 刷新政企业务订单纪录
2019-12-26,最新公告透露利好 15只个股有望爆发（12.26）,最新公告透露利好 15只个股有望爆发（12.26）
2019-12-26,A股异动 | 三六零涨逾6% 中标2.51亿元EPC总承包项目,A股异动 | 三六零涨逾6% 中标2.51亿元EPC总承包项目
2019-12-26,早报：前10月全国减税降费近2万亿 283公司业绩预喜,早报：前10月全国减税降费近2万亿 283公司业绩预喜
2019-12-30,三六零(601360.SH)：奇安信37.31亿元股权转让款已全部收讫 资产异常,三六零(601360.SH)：奇安信37.31亿元股权转让款已全部收讫 资产异常
2019-12-30,三六零：转让所持奇安信股权的股权转让款已全部收讫，共计37.3亿元 资产异常,三六零：转让所持奇安信股权的股权转让款已全部收讫，共计37.3亿元 资产异常
2020-01-02,360“数字之星”评选结果出炉 老周饭局1月7日八大平台同步直播,360“数字之星”评选结果出炉 老周饭局1月7日八大平台同步直播
2020-01-03,2.51亿中标！刷新A股政企项目纪录，三六零深化“大安全”生态,2.51亿中标！刷新A股政企项目纪录，三六零深化“大安全”生态
2020-01-07,熊猫直播：成也资本，败也资本,熊猫直播：成也资本，败也资本
2020-01-07,谁杀死了熊猫互娱,谁杀死了熊猫互娱
2020-01-08,周鸿祎回应发放“免裁券”：自编黑段子 纯属开玩笑,周鸿祎回应发放“免裁券”：自编黑段子 纯属开玩笑
2020-01-08,360大裁员？周鸿祎晒免裁券 公司回应：只是幽默 员工变动,360大裁员？周鸿祎晒免裁券 公司回应：只是幽默 员工变动
2020-01-08,"周鸿祎设""免裁券""预示裁员?360:无裁员计划只是幽默 员工变动","周鸿祎设""免裁券""预示裁员?360:无裁员计划只是幽默 员工变动"
2020-01-08,周鸿祎回应免裁券：我编的自黑段子，很多人当真了,周鸿祎回应免裁券：我编的自黑段子，很多人当真了
2020-01-08,"年会特等奖是一张""免裁券"" 回应:是幽默 无裁员计划","年会特等奖是一张""免裁券"" 回应:是幽默 无裁员计划"
2020-01-08,三六零回应“免裁券”：没有裁员计划,三六零回应“免裁券”：没有裁员计划
2020-01-08,三六零今日大宗交易成交10.50万股，成交价23.76元溢价0.0%,三六零今日大宗交易成交10.50万股，成交价23.76元溢价0.0%
2020-01-08,三六零现1笔大宗交易 共成交249.48万元,三六零现1笔大宗交易 共成交249.48万元
2020-01-09,搜狐迟到一次罚款500 360送免裁券 中国互联网行业发展现状调查,搜狐迟到一次罚款500 360送免裁券 中国互联网行业发展现状调查
2020-01-09,央视网评：“免裁卡”也保不住你的饭碗,央视网评：“免裁卡”也保不住你的饭碗
2020-01-09,午报 | 微信将发力短内容方向；360公司回应“免裁劵”,午报 | 微信将发力短内容方向；360公司回应“免裁劵”
2020-01-10,互联网巨头“反贪风云”进行时,互联网巨头“反贪风云”进行时
2020-01-10,互联网公司年终奖图鉴,互联网公司年终奖图鉴
2020-01-12,土豪公司福利比拼：陌陌人手一部iPhone11 有老板堆上亿现金发红包,土豪公司福利比拼：陌陌人手一部iPhone11 有老板堆上亿现金发红包
2020-01-13,360集团：守护5G时代网络安全,360集团：守护5G时代网络安全
2020-01-16,三六零(601360.SH)与易华录签署框架合作协议 进一步扩大数据安全及云服务业务规模,三六零(601360.SH)与易华录签署框架合作协议 进一步扩大数据安全及云服务业务规模
2020-01-16,红宇新材拟收购铂睿智恒75%股权，2年亏损或被暂停上市 亏损,红宇新材拟收购铂睿智恒75%股权，2年亏损或被暂停上市 亏损
2020-01-16,公告精选：两市首份年报出炉，安靠智电拟10转3派5；孙飘扬卸任恒瑞医药董事长,公告精选：两市首份年报出炉，安靠智电拟10转3派5；孙飘扬卸任恒瑞医药董事长
2020-01-16,公告精选：两市首份年报出炉，安靠智电拟10转3派5；易华录与三六零签署框架合作协议,公告精选：两市首份年报出炉，安靠智电拟10转3派5；易华录与三六零签署框架合作协议
2020-01-17,“一年10倍”股诞生，它坐上神坛，背后有什么秘密？,“一年10倍”股诞生，它坐上神坛，背后有什么秘密？
2020-01-22,三六零(601360.SH)2019年度扣非净利润预增0.04%至11%,三六零(601360.SH)2019年度扣非净利润预增0.04%至11%
2020-01-22,三六零2019年度净利润预计同比增长至少62%,三六零2019年度净利润预计同比增长至少62%
2020-01-22,三六零：2019年净利预增62%至79%,三六零：2019年净利预增62%至79%
2020-01-22,三六零去年净利预计同比大幅增长,三六零去年净利预计同比大幅增长
2020-01-22,三六零2019年度净利润预计同比大幅增长 预计增幅约62%-79%，扣非后净利润预计最大增幅达11%,三六零2019年度净利润预计同比大幅增长 预计增幅约62%-79%，扣非后净利润预计最大增幅达11%
2020-01-22,三六零：预2019年净利57.1-63.1亿 同比增长62%-79%,三六零：预2019年净利57.1-63.1亿 同比增长62%-79%
2020-01-22,三六零：2019年净利预增62%-79%,三六零：2019年净利预增62%-79%
2020-01-22,三六零：预计2019年净利同比增长62%至79%,三六零：预计2019年净利同比增长62%至79%
2020-01-23,聚焦大安全战略三六零年报预增62%至79%,聚焦大安全战略三六零年报预增62%至79%
2020-01-23,三六零：预计2019年净利润同比增长62%-79%,三六零：预计2019年净利润同比增长62%-79%
2020-01-26,周鸿祎：面对自然灾难不能袖手旁观 要支持抗病防疫,周鸿祎：面对自然灾难不能袖手旁观 要支持抗病防疫
2020-01-26,周鸿祎：360捐赠1500万元医疗物资，将持续购货送湖北,周鸿祎：360捐赠1500万元医疗物资，将持续购货送湖北
2020-01-26,周鸿祎：360只能查杀网络电脑病毒，但面对自然灾难不袖手旁观,周鸿祎：360只能查杀网络电脑病毒，但面对自然灾难不袖手旁观
2020-01-28,WG捐款1000万美元由360执行 周鸿祎：专款专用,WG捐款1000万美元由360执行 周鸿祎：专款专用
2020-01-28,Wargaming捐赠1000万美元助力中国防疫 360负责执行,Wargaming捐赠1000万美元助力中国防疫 360负责执行
2020-02-04,软件信息行业发展态势好，网络安全、医疗信息化受关注,软件信息行业发展态势好，网络安全、医疗信息化受关注
2020-02-05,周鸿祎：已筹集近1亿资金，一定要把这些钱变成物资送到一线,周鸿祎：已筹集近1亿资金，一定要把这些钱变成物资送到一线
2020-02-05,360发布全员信表示：已开启在家办公 做好长期战斗的准备,360发布全员信表示：已开启在家办公 做好长期战斗的准备
2020-02-05,周鸿祎发布全员信:做最坏的打算 往最好的结果去争取,周鸿祎发布全员信:做最坏的打算 往最好的结果去争取
2020-02-05,360公益基金会累计筹集近1亿元物资驰援湖北,360公益基金会累计筹集近1亿元物资驰援湖北
2020-02-05,周鸿祎发布全员信：国家有难人民有灾，我们要尽可能的去帮助,周鸿祎发布全员信：国家有难人民有灾，我们要尽可能的去帮助
2020-02-06,360公益基金会：在美欧亚多国寻购 发送医疗物资超百批,360公益基金会：在美欧亚多国寻购 发送医疗物资超百批
2020-02-10,360紧急驰援疫区：深入湖北13个地级行政区 援助72家医院,360紧急驰援疫区：深入湖北13个地级行政区 援助72家医院
2020-02-11,周鸿祎全员信：360发起“百城战疫”活动,周鸿祎全员信：360发起“百城战疫”活动
2020-02-12,三六零否认申请贷款，美团不予置评,三六零否认申请贷款，美团不予置评
2020-02-12,估值230亿！奇安信要来科创板，辅导前360清空全部股权中国电子入股,估值230亿！奇安信要来科创板，辅导前360清空全部股权中国电子入股
2020-02-13,双管发力 360推出整套在家办公安全解决方案,双管发力 360推出整套在家办公安全解决方案
2020-02-14,一夜飙升83% “区块链第一股”火了 六股热,一夜飙升83% “区块链第一股”火了 六股热
2020-02-16,"网络安全,下一个“十年”饭碗稳了？","网络安全,下一个“十年”饭碗稳了？"
2020-02-18,360抗疫联盟项目正式上线 阿里云、京东等加入,360抗疫联盟项目正式上线 阿里云、京东等加入
2020-02-20,7000亿板块迎大事件！最具影响力的行业盛会来袭，千亿公司领衔出征，这些概念股机构看好,7000亿板块迎大事件！最具影响力的行业盛会来袭，千亿公司领衔出征，这些概念股机构看好
2020-02-21,互联网公司驰援后续：落到实处 用到急处,互联网公司驰援后续：落到实处 用到急处
2020-02-22,下周964亿市值限售股解禁，环比增加150.93% 解禁,下周964亿市值限售股解禁，环比增加150.93% 解禁
2020-02-23,战“疫”·我们在行动 | 和疫情赛跑，时间就是生命——360抗击疫情进行时,战“疫”·我们在行动 | 和疫情赛跑，时间就是生命——360抗击疫情进行时
2020-02-23,国泰君安中小盘·伐谋周报【LPR再降息，推荐产业信息化主线，新增推荐科达利】,国泰君安中小盘·伐谋周报【LPR再降息，推荐产业信息化主线，新增推荐科达利】
2020-02-23,下周影响市场重要资讯前瞻,下周影响市场重要资讯前瞻
2020-02-23,A股周一见 | 站上3000之后，下周机会在哪？,A股周一见 | 站上3000之后，下周机会在哪？
2020-02-24,三六零：7.03亿股定增限售股2月27日上市流通 解禁,三六零：7.03亿股定增限售股2月27日上市流通 解禁
2020-02-26,中信国安：计划择机出售三六零部分解禁股票 解禁,中信国安：计划择机出售三六零部分解禁股票 解禁
2020-02-27,机构评级榜：14股上涨空间超20%,机构评级榜：14股上涨空间超20%
2020-02-27,解禁来袭！1600亿巨头惨遭跌停，73万股民受伤,解禁来袭！1600亿巨头惨遭跌停，73万股民受伤
2020-02-28,道达投资手记：警惕限售股解禁 后市关注两方面,道达投资手记：警惕限售股解禁 后市关注两方面
2020-02-28,134股获杠杆资金大手笔加仓,134股获杠杆资金大手笔加仓
2020-03-01,360专家诠释人机结合布局网络安全未来,360专家诠释人机结合布局网络安全未来
2020-03-02,"三六零现1笔大宗交易 共成交2,056.00万元","三六零现1笔大宗交易 共成交2,056.00万元"
2020-03-03,【粤开富瑞《扬帆一号》】组合投资策略 外围市场和北上资金是重要风向标,【粤开富瑞《扬帆一号》】组合投资策略 外围市场和北上资金是重要风向标
2020-03-03,360与龙芯中科强强联合，安全大脑赋能最强“中国芯”,360与龙芯中科强强联合，安全大脑赋能最强“中国芯”
2020-03-03,三六零：9232万股限售股将于3月9日上市流通 解禁,三六零：9232万股限售股将于3月9日上市流通 解禁
2020-03-05,三六零现1笔大宗交易 共成交806.00万元,三六零现1笔大宗交易 共成交806.00万元
2020-03-06,三六零：百亿级定增获证监会审核通过,三六零：百亿级定增获证监会审核通过
2020-03-06,下周452亿市值限售股解禁，环比增加117.51% 解禁,下周452亿市值限售股解禁，环比增加117.51% 解禁
2020-03-06,三六零：非公开发行A股股票申请获得证监会审核通过,三六零：非公开发行A股股票申请获得证监会审核通过
2020-03-06,三六零：非公开发行A股获证监会审批 尚未接到书面文件,三六零：非公开发行A股获证监会审批 尚未接到书面文件
2020-03-06,证监会：抗“疫”发审两不误，坚持新股发行常态化,证监会：抗“疫”发审两不误，坚持新股发行常态化
2020-03-07,上市公司正负面新闻2020年3月7日星期六,上市公司正负面新闻2020年3月7日星期六
2020-03-09,"三六零现3笔大宗交易 共成交1,524.59万元","三六零现3笔大宗交易 共成交1,524.59万元"
2020-03-13,三六零与华为深度合作 共建鲲鹏大生态,三六零与华为深度合作 共建鲲鹏大生态
2020-03-13,三六零宣布旗下产品与华为鲲鹏完成兼容性认证,三六零宣布旗下产品与华为鲲鹏完成兼容性认证
2020-03-13,"周鸿祎""云出席""发布会：回国后自行隔离，身体无恙","周鸿祎""云出席""发布会：回国后自行隔离，身体无恙"
2020-03-13,360深度联运《坦克世界》《战舰世界》 将主导推动全球内容同步,360深度联运《坦克世界》《战舰世界》 将主导推动全球内容同步
2020-03-14,质押盘风险测压预告丨三六零：质押市值超千亿居首，前十大股东质押率98.07%,质押盘风险测压预告丨三六零：质押市值超千亿居首，前十大股东质押率98.07%
2020-03-15,南方责任投资计划测压ESG指标：发布《A股质押盘风险报告书》,南方责任投资计划测压ESG指标：发布《A股质押盘风险报告书》
2020-03-17,"三六零现8笔大宗交易 共成交15,633.73万元","三六零现8笔大宗交易 共成交15,633.73万元"
2020-03-19,三六零现1笔大宗交易 共成交345.08万元,三六零现1笔大宗交易 共成交345.08万元
2020-03-20,三六零与中国汽研达成战略合作,三六零与中国汽研达成战略合作
2020-03-25,"三六零现4笔大宗交易 共成交1,337.60万元","三六零现4笔大宗交易 共成交1,337.60万元"
2020-03-27,壁虎诺言筹下嫁360互助 周鸿祎摘桃子奇步天下,壁虎诺言筹下嫁360互助 周鸿祎摘桃子奇步天下
2020-03-27,免裁券也不灵？360被曝开始“裁员”，比例达15%到20% 员工变动,免裁券也不灵？360被曝开始“裁员”，比例达15%到20% 员工变动
2020-03-28,360否认裁员20%：没有相关计划，正大力招聘,360否认裁员20%：没有相关计划，正大力招聘
2020-03-28,360否认裁员超15%传闻：常规考核优化，新招聘的人更多,360否认裁员超15%传闻：常规考核优化，新招聘的人更多
2020-03-29,360否认裁员15%：正采用社招、校招大力招聘,360否认裁员15%：正采用社招、校招大力招聘
2020-03-30,360、小米陷裁员风波：互联网公司不能只想自身而不顾员工利益 业务变化,360、小米陷裁员风波：互联网公司不能只想自身而不顾员工利益 业务变化
2020-04-02,"三六零现5笔大宗交易 共成交1,632.00万元","三六零现5笔大宗交易 共成交1,632.00万元"
2020-04-08,"三六零现2笔大宗交易 共成交1,550.33万元","三六零现2笔大宗交易 共成交1,550.33万元"
2020-04-08,上海证券市场大宗交易公开信息(2020-04-08),上海证券市场大宗交易公开信息(2020-04-08)
2020-04-09,中概股陷危机，周鸿祎、李开复、包凡教你如何“反猎杀”,中概股陷危机，周鸿祎、李开复、包凡教你如何“反猎杀”
2020-04-16,上市公司急忙定增“解渴”3月预案数创近4年新高,上市公司急忙定增“解渴”3月预案数创近4年新高
2020-04-16,一张图片，数字货币嗨了！“聪明钱”又成大赢家？,一张图片，数字货币嗨了！“聪明钱”又成大赢家？
2020-04-20,北京奇虎信息技术有限公司注册资本增至100万元,北京奇虎信息技术有限公司注册资本增至100万元
2020-04-20,对话360金融CEO吴海生：保守估计公司仍有20倍空间待挖掘,对话360金融CEO吴海生：保守估计公司仍有20倍空间待挖掘
2020-04-20,三六零首席安全官杜跃进：安全是大数据产业发展的前提,三六零首席安全官杜跃进：安全是大数据产业发展的前提
2020-04-20,三六零现1笔大宗交易 共成交619.15万元,三六零现1笔大宗交易 共成交619.15万元
2020-04-21,三六零：非公开发行A股股票获证监会核准批复,三六零：非公开发行A股股票获证监会核准批复
2020-04-21,晚间重要公告2020年4月21日星期二,晚间重要公告2020年4月21日星期二
2020-04-21,三六零(601360.SH)获核准非公开发行不超13.5281亿股新股,三六零(601360.SH)获核准非公开发行不超13.5281亿股新股
2020-04-21,周鸿祎卸任360金融董事长？回应称上市前已变更主体 董监高成员变化,周鸿祎卸任360金融董事长？回应称上市前已变更主体 董监高成员变化
2020-04-21,三六零获核准非公开发行不超过13.5亿股A股,三六零获核准非公开发行不超过13.5亿股A股
2020-04-23,三六零2019年净利增69% 发力政企安全等“大安全”领域,三六零2019年净利增69% 发力政企安全等“大安全”领域
2020-04-23,三六零净利同比大涨69% 累计超额12.86亿元完成业绩承诺,三六零净利同比大涨69% 累计超额12.86亿元完成业绩承诺
2020-04-23,晚间要闻2020年4月23日星期四,晚间要闻2020年4月23日星期四
2020-04-23,三六零发布2019年财报 同比增长69.19%,三六零发布2019年财报 同比增长69.19%
2020-04-23,三六零发布2019年年报：营收128.41亿，净利润59.80亿,三六零发布2019年年报：营收128.41亿，净利润59.80亿
2020-04-23,三六零：2019年净利59.80亿元 同比增长69.19％,三六零：2019年净利59.80亿元 同比增长69.19％
2020-04-23,三六零大宗交易成交514.08万元,三六零大宗交易成交514.08万元
2020-04-23,三六零2019年净利大涨近七成 累计超额12.86亿元完成业绩承诺,三六零2019年净利大涨近七成 累计超额12.86亿元完成业绩承诺
2020-04-23,三六零：2019年净利59.8亿元 同比增69%,三六零：2019年净利59.8亿元 同比增69%
2020-04-23,三六零(601360.SH)一季度实现营收22.5亿元净利达3.599亿元,三六零(601360.SH)一季度实现营收22.5亿元净利达3.599亿元
2020-04-23,三六零：2019年净利同比增长69.19%,三六零：2019年净利同比增长69.19%
2020-04-23,三六零：2019年全年实现净利润59.8亿 拟10派0.53元,三六零：2019年全年实现净利润59.8亿 拟10派0.53元
2020-04-23,三六零：2019年净利润同比增长69.19%,三六零：2019年净利润同比增长69.19%
2020-04-23,三六零：2019年净利润同比增长69.19%，拟10派0.53元,三六零：2019年净利润同比增长69.19%，拟10派0.53元
2020-04-23,A股共发生49宗大宗交易成交6.07亿元（4月23日）,A股共发生49宗大宗交易成交6.07亿元（4月23日）
2020-04-23,三六零现1笔大宗交易 共成交514.08万元,三六零现1笔大宗交易 共成交514.08万元
2020-04-23,360收购亿方云，曲线进军云计算细分市场,360收购亿方云，曲线进军云计算细分市场
2020-04-23,三六零(601360.SH)2019年度净利升69.19%至59.80亿元 拟10派0.53元,三六零(601360.SH)2019年度净利升69.19%至59.80亿元 拟10派0.53元
2020-04-24,"三六零营收再超百亿 开启""收费模式""进入军政企领域","三六零营收再超百亿 开启""收费模式""进入军政企领域"
2020-04-24,三六零2019年净利润59.80亿元，同比增长69.19%,三六零2019年净利润59.80亿元，同比增长69.19%
2020-04-24,三六零：2019年实现净利近60亿元 连续三年超额完成业绩承诺,三六零：2019年实现净利近60亿元 连续三年超额完成业绩承诺
2020-04-24,犀牛财经早报：黑石集团Q1亏损10.7亿美元 瑞幸咖啡独董只剩3人,犀牛财经早报：黑石集团Q1亏损10.7亿美元 瑞幸咖啡独董只剩3人
2020-04-26,2019年净利润增长69% 三六零“政企业务”成绩首亮相,2019年净利润增长69% 三六零“政企业务”成绩首亮相
2020-04-27,三六零去年营收128亿净利占比近半 月活用户超5亿居行业之首,三六零去年营收128亿净利占比近半 月活用户超5亿居行业之首
2020-04-27,身负近29亿元对赌，360分家后的第一年不容易,身负近29亿元对赌，360分家后的第一年不容易
2020-04-29,三六零营收再超百亿 政企安全大有可为,三六零营收再超百亿 政企安全大有可为
2020-05-02,安信国际│美股私有化专题一：中概股私有化核心要点,安信国际│美股私有化专题一：中概股私有化核心要点
2020-05-07,三六零现1笔大宗交易 共成交836.50万元,三六零现1笔大宗交易 共成交836.50万元
2020-05-08,下周两市745亿市值限售股解禁 解禁,下周两市745亿市值限售股解禁 解禁
2020-05-10,下周影响市场重要资讯前瞻,下周影响市场重要资讯前瞻
2020-05-11,周鸿祎：我挣的钱有点庸俗 但用处一点不俗,周鸿祎：我挣的钱有点庸俗 但用处一点不俗
2020-05-12,奇安信科创板递表：拟募集45亿元，尚未完全消除360烙印,奇安信科创板递表：拟募集45亿元，尚未完全消除360烙印
2020-05-13,晚间重要公告2020年5月13日星期三,晚间重要公告2020年5月13日星期三
2020-05-13,"三六零现1笔大宗交易 共成交5,023.76万元","三六零现1笔大宗交易 共成交5,023.76万元"
2020-05-13,奇安信冲刺科创板，齐向东将在资本市场正面PK周鸿祎,奇安信冲刺科创板，齐向东将在资本市场正面PK周鸿祎
2020-05-13,360安全大脑再下一城 2.5亿中标青岛网络安全产业基地项目,360安全大脑再下一城 2.5亿中标青岛网络安全产业基地项目
2020-05-13,计算机行业发明专利申请量排行榜前三：浪潮信息、三六零、紫光股份,计算机行业发明专利申请量排行榜前三：浪潮信息、三六零、紫光股份
2020-05-14,"三六零现2笔大宗交易 共成交9,499.70万元","三六零现2笔大宗交易 共成交9,499.70万元"
2020-05-14,三六零现2笔大宗交易 合计成交550.75万股,三六零现2笔大宗交易 合计成交550.75万股
2020-05-14,10家公司公告有看点 大资金或已提前进场,10家公司公告有看点 大资金或已提前进场
2020-05-14,A股共发生104宗大宗交易成交57.35亿元（5月14日）,A股共发生104宗大宗交易成交57.35亿元（5月14日）
2020-05-14,全国政协委员周鸿祎的履职四“本”经,全国政协委员周鸿祎的履职四“本”经
2020-05-15,三六零与中国信通院战略合作 布局5G等八大领域数字安全,三六零与中国信通院战略合作 布局5G等八大领域数字安全
2020-05-15,三六零与中国信通院战略合作 八大合作布局新基建安全,三六零与中国信通院战略合作 八大合作布局新基建安全
2020-05-15,三六零与中国信息通信研究院达成战略合作，将围绕区块链等展开研究,三六零与中国信息通信研究院达成战略合作，将围绕区块链等展开研究
2020-05-15,全国政协委员周鸿祎的履职四“本”经,全国政协委员周鸿祎的履职四“本”经
2020-05-15,三六零与中国信通院战略合作，布局新基建安全,三六零与中国信通院战略合作，布局新基建安全
2020-05-17,全国政协委员周鸿祎：立足专业领域服务网络安全,全国政协委员周鸿祎：立足专业领域服务网络安全
2020-05-18,奇安信勇闯IPO 风险颇多且关联交易频发,奇安信勇闯IPO 风险颇多且关联交易频发
2020-05-18,奇安信勇闯ipo，风险颇多且关联交易频发,奇安信勇闯ipo，风险颇多且关联交易频发
2020-05-19,三六零与科大讯飞强强联合，“AI+安全”赋能六大领域,三六零与科大讯飞强强联合，“AI+安全”赋能六大领域
2020-05-19,三六零与科大讯飞战略合作 携手共建安全智慧城市,三六零与科大讯飞战略合作 携手共建安全智慧城市
2020-05-19,三六零：与科大讯飞签署协议 拟围绕人工智能等六大领域达成全面战略合作,三六零：与科大讯飞签署协议 拟围绕人工智能等六大领域达成全面战略合作
2020-05-19,工具型软件行业深度报告：价值从何处来 转型该何处去,工具型软件行业深度报告：价值从何处来 转型该何处去
