publishedAt,title,description
2021-05-11,快讯 | 360董事长首次回应造车：雷军鼓励我造车 要用产品思路去造车,快讯 | 360董事长首次回应造车：雷军鼓励我造车 要用产品思路去造车
2021-05-11,周鸿祎回应造车：不会做豪车 做老百姓担负得起的高性价比汽车,周鸿祎回应造车：不会做豪车 做老百姓担负得起的高性价比汽车
2021-05-11,360官宣造车周鸿祎：多亏雷军这句话,360官宣造车周鸿祎：多亏雷军这句话
2021-05-11,360牵手哪吒造车 哪吒4万台整车下线,360牵手哪吒造车 哪吒4万台整车下线
2021-05-11,三六零现1笔大宗交易 共成交405.90万元,三六零现1笔大宗交易 共成交405.90万元
2021-05-11,周鸿祎：雷军变相鼓励我造车 造车说简单也简单,周鸿祎：雷军变相鼓励我造车 造车说简单也简单
2021-05-12,三六零现1笔大宗交易 共成交385.60万元,三六零现1笔大宗交易 共成交385.60万元
2021-05-12,周鸿祎称360造的车10万元左右：人机交互和百万豪车无差别,周鸿祎称360造的车10万元左右：人机交互和百万豪车无差别
2021-05-12,互联网厂商疯狂涌入汽车赛道 是真造车还是“造泡沫”,互联网厂商疯狂涌入汽车赛道 是真造车还是“造泡沫”
2021-05-12,王禁：为什么资本市场不看好360“造车”？,王禁：为什么资本市场不看好360“造车”？
2021-05-12,哪吒、360，谁是谁的救兵？,哪吒、360，谁是谁的救兵？
2021-05-12,市值蒸发3000亿：利好仍不敌解禁 三六零牵手哪吒不灵 解禁,市值蒸发3000亿：利好仍不敌解禁 三六零牵手哪吒不灵 解禁
2021-05-12,周鸿祎继续担任三六零(601360.SH)董事长兼总经理,周鸿祎继续担任三六零(601360.SH)董事长兼总经理
2021-05-12,2分钟读财报|360联手哪吒造车 周鸿祎坦言没有更好的选择,2分钟读财报|360联手哪吒造车 周鸿祎坦言没有更好的选择
2021-05-12,周鸿祎称360造的车10万元：不是为了造豪车,周鸿祎称360造的车10万元：不是为了造豪车
2021-05-12,大跌82%，市值蒸发逾3400亿，科技龙头再创新低！大消费板块牛股频现，能否持续跑赢大盘？ 连续下跌,大跌82%，市值蒸发逾3400亿，科技龙头再创新低！大消费板块牛股频现，能否持续跑赢大盘？ 连续下跌
2021-05-12,三六零今日大宗交易成交32万股，成交价12.05元折价0.99%,三六零今日大宗交易成交32万股，成交价12.05元折价0.99%
2021-05-12,不安天命的周鸿祎要造车，“人活着就得不停折腾”,不安天命的周鸿祎要造车，“人活着就得不停折腾”
2021-05-12,挑战年销5万辆，今年要登陆科创板，这家造车新势力也选择与互联网公司组CP,挑战年销5万辆，今年要登陆科创板，这家造车新势力也选择与互联网公司组CP
2021-05-12,华为又点火！6亿资金封死涨停，千亿造车龙头3天两板,华为又点火！6亿资金封死涨停，千亿造车龙头3天两板
2021-05-12,“潜伏者”周鸿祎：战投哪吒却不亲自造车 甘当“产品经理”,“潜伏者”周鸿祎：战投哪吒却不亲自造车 甘当“产品经理”
2021-05-12,高挂“为人民造车”，周鸿祎称互联网造车泡沫不是太多，而是太少,高挂“为人民造车”，周鸿祎称互联网造车泡沫不是太多，而是太少
2021-05-12,大公司早报 | 满帮集团赴美上市估值300亿美元 360将推10万元智能汽车,大公司早报 | 满帮集团赴美上市估值300亿美元 360将推10万元智能汽车
2021-05-12,公司快讯|特斯拉中国4月销量环比下跌27%，360周鸿祎首次回应造车传闻，Soul递交招股书赴美上市 盈利能力下降,公司快讯|特斯拉中国4月销量环比下跌27%，360周鸿祎首次回应造车传闻，Soul递交招股书赴美上市 盈利能力下降
2021-05-12,雷军能干，我也能！又一互联网巨头官宣造车,雷军能干，我也能！又一互联网巨头官宣造车
2021-05-12,360正式官宣造车，联手哪吒汽车,360正式官宣造车，联手哪吒汽车
2021-05-12,又一互联网巨头官宣：与哪吒联手造车！周鸿祎：我命由我不由天,又一互联网巨头官宣：与哪吒联手造车！周鸿祎：我命由我不由天
2021-05-12,360“造车”意在科技平权 不能错失第四次工业革命,360“造车”意在科技平权 不能错失第四次工业革命
2021-05-12,拟造定价10万元的智能汽车 360要联合哪吒“闹海”,拟造定价10万元的智能汽车 360要联合哪吒“闹海”
2021-05-13,美国燃油管道遭勒索攻击“扼喉”，360周鸿祎呼吁正视网络战,美国燃油管道遭勒索攻击“扼喉”，360周鸿祎呼吁正视网络战
2021-05-13,360周鸿祎：造车受雷军鼓舞，互联网造车泡沫还不够大,360周鸿祎：造车受雷军鼓舞，互联网造车泡沫还不够大
2021-05-13,三六零现1笔大宗交易 共成交370.24万元,三六零现1笔大宗交易 共成交370.24万元
2021-05-13,汽车日报：360联手哪吒“为人民造车”,汽车日报：360联手哪吒“为人民造车”
2021-05-13,网络战“掐断”美国燃油管道动脉，360周鸿祎谈打造关键基础设施安全基座,网络战“掐断”美国燃油管道动脉，360周鸿祎谈打造关键基础设施安全基座
2021-05-13,360宣布造车，“持枪者”回来了？,360宣布造车，“持枪者”回来了？
2021-05-13,市场反响一家不如一家，网企造车已经泛滥 | 市场观察,市场反响一家不如一家，网企造车已经泛滥 | 市场观察
2021-05-13,日立、江南嘉捷等电梯企业因维保单位质量与信用评价较差 被上海市市场监管局点名 其他违规处罚,日立、江南嘉捷等电梯企业因维保单位质量与信用评价较差 被上海市市场监管局点名 其他违规处罚
2021-05-13,借壳上市3年股价暴跌80% 360联手哪吒汽车能否“闹海”？ 连续下跌,借壳上市3年股价暴跌80% 360联手哪吒汽车能否“闹海”？ 连续下跌
2021-05-13,“人民”想念的周鸿祎，要为人民造车了,“人民”想念的周鸿祎，要为人民造车了
2021-05-13,360哪吒合作造车！罗永浩点赞周鸿祎：生命不息 折腾不止,360哪吒合作造车！罗永浩点赞周鸿祎：生命不息 折腾不止
2021-05-13,360确定领投哪吒汽车D轮融资，周鸿祎：今天互联网造车公司不是多了，而是太少了,360确定领投哪吒汽车D轮融资，周鸿祎：今天互联网造车公司不是多了，而是太少了
2021-05-13,“互联网下半场就是和传统企业结合”360宣布“造车” 战略投资哪吒将成第二大股东,“互联网下半场就是和传统企业结合”360宣布“造车” 战略投资哪吒将成第二大股东
2021-05-13,网信办出手，汽车数据安全管理即将“有规可依”,网信办出手，汽车数据安全管理即将“有规可依”
2021-05-14,人口系列1：无法避免的人力成本上涨,人口系列1：无法避免的人力成本上涨
2021-05-14,10万元左右！周鸿祎：人民想念我 要为人民造好车,10万元左右！周鸿祎：人民想念我 要为人民造好车
2021-05-14,汽车需要杀毒软件吗？360进军汽车行业,汽车需要杀毒软件吗？360进军汽车行业
2021-05-14,吴迎秋：周鸿祎和他的360能给哪吒汽车带来什么？,吴迎秋：周鸿祎和他的360能给哪吒汽车带来什么？
2021-05-14,下周解禁：三六零、晶科科技解禁数量超10亿股 两公司股价已较高点大幅下跌 解禁,下周解禁：三六零、晶科科技解禁数量超10亿股 两公司股价已较高点大幅下跌 解禁
2021-05-14,下周808亿市值限售股解禁，环比减少49.03% 解禁,下周808亿市值限售股解禁，环比减少49.03% 解禁
2021-05-16,龙头股砸出深坑!李迅雷:5月慢慢变红基金:不会乱卖,龙头股砸出深坑!李迅雷:5月慢慢变红基金:不会乱卖
2021-05-16,下周影响市场重要资讯前瞻,下周影响市场重要资讯前瞻
2021-05-16,三六零220多亿元限售股明天解禁，周鸿祎等定增浮盈52%,三六零220多亿元限售股明天解禁，周鸿祎等定增浮盈52%
2021-05-16,下周这些股票解禁压力大：三六零220亿限售股解禁 周鸿祎等定增浮盈52% 解禁,下周这些股票解禁压力大：三六零220亿限售股解禁 周鸿祎等定增浮盈52% 解禁
2021-05-16,下周关注丨4月经济数据及70城房价将公布，这些投资机会最靠谱,下周关注丨4月经济数据及70城房价将公布，这些投资机会最靠谱
2021-05-16,下周操盘攻略：疫情反复，疫苗热度不减,下周操盘攻略：疫情反复，疫苗热度不减
2021-05-16,下周股市3大看点水皮:置之死地而后生,下周股市3大看点水皮:置之死地而后生
2021-05-16,800亿解禁来袭，多只热门概念股在列，超七成解禁股业绩亮眼 解禁,800亿解禁来袭，多只热门概念股在列，超七成解禁股业绩亮眼 解禁
2021-05-16,三六零220多亿元限售股明天解禁！周鸿祎等定增浮盈52%；下周这些股票解禁压力大（附名单） 解禁,三六零220多亿元限售股明天解禁！周鸿祎等定增浮盈52%；下周这些股票解禁压力大（附名单） 解禁
2021-05-16,盖世周报 | 传特斯拉暂停扩建上海工厂；360携手哪吒造车,盖世周报 | 传特斯拉暂停扩建上海工厂；360携手哪吒造车
2021-05-17,周鸿祎牵手哪吒，360能否再次腾飞？,周鸿祎牵手哪吒，360能否再次腾飞？
2021-05-17,"一号位周报|马斯克停用比特币遭讽/雷军鼓励周鸿祎造车/双""芯""限制小鹏Q2产能","一号位周报|马斯克停用比特币遭讽/雷军鼓励周鸿祎造车/双""芯""限制小鹏Q2产能"
2021-05-17,维权事件会导致特斯拉销量大减吗？ 盈利能力下降,维权事件会导致特斯拉销量大减吗？ 盈利能力下降
2021-05-17,汽车行业周报：4月乘用车批售同比增速继续回升 360官宣与哪吒汽车合作造车,汽车行业周报：4月乘用车批售同比增速继续回升 360官宣与哪吒汽车合作造车
2021-05-17,A股早报2021年5月17日星期一,A股早报2021年5月17日星期一
2021-05-17,Wind风控日报2021年5月17日星期一,Wind风控日报2021年5月17日星期一
2021-05-17,陆家嘴财经早餐2021年5月17日星期一,陆家嘴财经早餐2021年5月17日星期一
2021-05-18,计算机应用行业：央行数字货币“十问”,计算机应用行业：央行数字货币“十问”
2021-05-18,深度分析！造车行业热闹非凡 华为、百度、小米 互联网企业造车哪家强？,深度分析！造车行业热闹非凡 华为、百度、小米 互联网企业造车哪家强？
2021-05-18,金城银行或受战略转型影响 去年业绩下滑资产规模缩水50亿 规模大幅缩水,金城银行或受战略转型影响 去年业绩下滑资产规模缩水50亿 规模大幅缩水
2021-05-18,复盘2020年大数据，计算机行业逆境坚挺！2021年Q1表现显示大趋势正成型,复盘2020年大数据，计算机行业逆境坚挺！2021年Q1表现显示大趋势正成型
2021-05-19,周鸿祎：中国颠覆未来汽车工业,周鸿祎：中国颠覆未来汽车工业
2021-05-19,[路演]三六零：对政企安全集团增资不超过50亿,[路演]三六零：对政企安全集团增资不超过50亿
2021-05-19,360政企安全集团召开首次全员大会 周鸿祎开启加速键,360政企安全集团召开首次全员大会 周鸿祎开启加速键
2021-05-19,哪吒汽车成立新能源汽车制造公司 注册资本10亿元,哪吒汽车成立新能源汽车制造公司 注册资本10亿元
2021-05-19,三六零盘中快速上涨,三六零盘中快速上涨
2021-05-19,三六零今日大宗交易成交800万股，成交价12.19元溢价0.0%,三六零今日大宗交易成交800万股，成交价12.19元溢价0.0%
2021-05-19,同样是跨界造车，咋待遇差别那么大？,同样是跨界造车，咋待遇差别那么大？
2021-05-20,80后张一鸣、黄铮佛系归隐了，60后劳模雷军、70后周鸿祎继续冲！,80后张一鸣、黄铮佛系归隐了，60后劳模雷军、70后周鸿祎继续冲！
2021-05-20,周鸿祎：未来衡量豪车的标准不是马力，而是算力,周鸿祎：未来衡量豪车的标准不是马力，而是算力
2021-05-20,360周鸿祎：以安全大脑护航未来20年智能网联汽车产业发展,360周鸿祎：以安全大脑护航未来20年智能网联汽车产业发展
2021-05-20,周鸿祎：汽车的网络安全和物理安全，因数字化变得密不可分,周鸿祎：汽车的网络安全和物理安全，因数字化变得密不可分
2021-05-20,三六零周鸿祎：车企联合造车助推公共安全,三六零周鸿祎：车企联合造车助推公共安全
2021-05-21,汽车日报：特斯拉又遭维权！车主称停车时突然加速撞墙 孩子4颗门牙被撞掉,汽车日报：特斯拉又遭维权！车主称停车时突然加速撞墙 孩子4颗门牙被撞掉
2021-05-21,WIC世界智能大会|周鸿祎：车企联合造车助推“安全平权”,WIC世界智能大会|周鸿祎：车企联合造车助推“安全平权”
2021-05-21,智能新时代正向我们大步走来,智能新时代正向我们大步走来
2021-05-22,三六零19亿限售股大解禁：市场在担心什么 解禁,三六零19亿限售股大解禁：市场在担心什么 解禁
2021-05-23,联手哪吒“为人民造车”，产品经理周鸿祎做了哪些功课,联手哪吒“为人民造车”，产品经理周鸿祎做了哪些功课
2021-05-24,大股东背景温树海空降金城银行履新行长,大股东背景温树海空降金城银行履新行长
2021-05-24,17家民营银行业绩出炉：11家净利正增长，2家不良率下降,17家民营银行业绩出炉：11家净利正增长，2家不良率下降
2021-05-24,研究车圈琐事不如搞个曹县户口？,研究车圈琐事不如搞个曹县户口？
2021-05-24,360、哪吒联姻“以小搏大” 一场30亿的造车杠杆追击,360、哪吒联姻“以小搏大” 一场30亿的造车杠杆追击
2021-05-24,空缺3年多，360数科原副总裁温树海出任天津金城银行行长,空缺3年多，360数科原副总裁温树海出任天津金城银行行长
2021-05-24,360以汽车安全入局造车 携手哪吒汽车能否实现1+1>2？,360以汽车安全入局造车 携手哪吒汽车能否实现1+1>2？
2021-05-25,老周造的车，是辆安全的车,老周造的车，是辆安全的车
2021-05-25,企业观｜原360数科副总裁任新行长 天津金城银行的零售业务迎来转机？,企业观｜原360数科副总裁任新行长 天津金城银行的零售业务迎来转机？
2021-05-25,观察｜去年来5家民营银行迎新行长，2家4年不到换3位行长,观察｜去年来5家民营银行迎新行长，2家4年不到换3位行长
2021-05-26,周鸿祎：2020年一年360公司接到并处理3800多起勒索软件攻击事件,周鸿祎：2020年一年360公司接到并处理3800多起勒索软件攻击事件
2021-05-26,三六零今日大宗交易成交40万股，成交价11.36元折价7.19%,三六零今日大宗交易成交40万股，成交价11.36元折价7.19%
2021-05-26,三六零现1笔大宗交易 共成交454.40万元,三六零现1笔大宗交易 共成交454.40万元
2021-05-26,贵阳经开区与三六零战略合作，将落地360城市安全运营总部,贵阳经开区与三六零战略合作，将落地360城市安全运营总部
2021-05-26,贵阳经开区与三六零战略合作 将落地360城市安全运营总部,贵阳经开区与三六零战略合作 将落地360城市安全运营总部
2021-05-26,勒索攻击导致损失超300亿美元 周鸿祎数博会出招护航数字经济,勒索攻击导致损失超300亿美元 周鸿祎数博会出招护航数字经济
2021-05-27,三六零今日大宗交易成交161万股，成交价11.32元折价9.0%,三六零今日大宗交易成交161万股，成交价11.32元折价9.0%
2021-05-27,"三六零现3笔大宗交易 共成交1,822.52万元","三六零现3笔大宗交易 共成交1,822.52万元"
2021-05-28,三六零5月27日现3笔大宗交易,三六零5月27日现3笔大宗交易
2021-05-28,又添三家！江苏“千亿俱乐部”创纪录，下一批扩容会是谁？,又添三家！江苏“千亿俱乐部”创纪录，下一批扩容会是谁？
2021-05-31,消息称，360已开启汽车业务招聘，智能汽车定位10万元左右,消息称，360已开启汽车业务招聘，智能汽车定位10万元左右
2021-05-31,传360已开启汽车业务招聘 内推奖金池高达数十万,传360已开启汽车业务招聘 内推奖金池高达数十万
2021-05-31,360造车新进展：组建汽车团队 涉及智能驾驶和感知融合等,360造车新进展：组建汽车团队 涉及智能驾驶和感知融合等
2021-06-01,鸿蒙重磅发布会“明日见”，这些上市公司已宣布加入“朋友圈”,鸿蒙重磅发布会“明日见”，这些上市公司已宣布加入“朋友圈”
2021-06-01,驱动晚报：快手集中下架非主流手机品牌 惠州契贝科技将鸿蒙商标权转让于华为,驱动晚报：快手集中下架非主流手机品牌 惠州契贝科技将鸿蒙商标权转让于华为
2021-06-01,以安全大脑护航智能网联汽车产业发展,以安全大脑护航智能网联汽车产业发展
2021-06-02,A股资本地图天津篇：62家公司上市，市值逾1.2万亿，近七成为细分领域龙头,A股资本地图天津篇：62家公司上市，市值逾1.2万亿，近七成为细分领域龙头
2021-06-03,数万亿市场规模，它是智能手机后最强风口 这些巨头又重金杀入，能否弯道超车？,数万亿市场规模，它是智能手机后最强风口 这些巨头又重金杀入，能否弯道超车？
2021-06-03,造车新势力第一梯队生变，哪吒挤掉理想闯进前三,造车新势力第一梯队生变，哪吒挤掉理想闯进前三
2021-06-04,资本追逐 智能汽车企业解锁四大突围路径,资本追逐 智能汽车企业解锁四大突围路径
2021-06-04,人才“抢夺”正式开始，360造车提速,人才“抢夺”正式开始，360造车提速
2021-06-04,澳10000员工因勒索攻击被迫休假 360助力打造安全防护体系,澳10000员工因勒索攻击被迫休假 360助力打造安全防护体系
2021-06-05,360押宝哪吒汽车造车，“落后者”与“二梯队”凭何逆袭？,360押宝哪吒汽车造车，“落后者”与“二梯队”凭何逆袭？
2021-06-07,E周看点丨哪吒5月销量超理想进前三；360汽车团队薪酬待遇全面放开,E周看点丨哪吒5月销量超理想进前三；360汽车团队薪酬待遇全面放开
2021-06-07,互联网应急中心预测今年APT重点攻击目标 周鸿祎呼吁加强联动防护,互联网应急中心预测今年APT重点攻击目标 周鸿祎呼吁加强联动防护
2021-06-08,哪吒干翻理想，昙花一现还是常驻前三？,哪吒干翻理想，昙花一现还是常驻前三？
2021-06-09,造车VS不造车，互联网科技公司泾渭分明的选择背后,造车VS不造车，互联网科技公司泾渭分明的选择背后
2021-06-09,三六零牵手宜兴政府 打造城市安全大脑运营中心,三六零牵手宜兴政府 打造城市安全大脑运营中心
2021-06-10,【行情】国产软件板块午后掀涨停潮，三六零、润和软件等10余股涨停，诚迈科技、浪潮软件、超图软件、久其软件等跟涨,【行情】国产软件板块午后掀涨停潮，三六零、润和软件等10余股涨停，诚迈科技、浪潮软件、超图软件、久其软件等跟涨
2021-06-10,A股收盘综述：上证指数涨0.54%，宁德时代再创新高、软件股批量涨停,A股收盘综述：上证指数涨0.54%，宁德时代再创新高、软件股批量涨停
2021-06-10,三六零荣获工信部“人工智能产业创新揭榜优胜单位”,三六零荣获工信部“人工智能产业创新揭榜优胜单位”
2021-06-10,三六零今日大宗交易成交250万股，成交价11.19元折价14.51%,三六零今日大宗交易成交250万股，成交价11.19元折价14.51%
2021-06-10,"三六零现16笔大宗交易 共成交7,759.08万元","三六零现16笔大宗交易 共成交7,759.08万元"
2021-06-10,三六零：股东上海冠鹰减持约5142万股 减持股份,三六零：股东上海冠鹰减持约5142万股 减持股份
2021-06-10,三六零(601360.SH)控股股东一致行动人减持比例达0.72% 减持数过半 减持股份,三六零(601360.SH)控股股东一致行动人减持比例达0.72% 减持数过半 减持股份
2021-06-10,三六零：控股股东及一致行动人减持公司0.72%股份 减持股份,三六零：控股股东及一致行动人减持公司0.72%股份 减持股份
2021-06-10,三六零现16笔大宗交易均为折价成交,三六零现16笔大宗交易均为折价成交
2021-06-10,三六零午后涨停，主力净流入近5亿元,三六零午后涨停，主力净流入近5亿元
2021-06-11,深度*行业*计算机行业：一图梳理鸿蒙产业链标的,深度*行业*计算机行业：一图梳理鸿蒙产业链标的
2021-06-11,万亿电池茅再创新高！月涨300％鸿蒙龙头继续大涨,万亿电池茅再创新高！月涨300％鸿蒙龙头继续大涨
2021-06-15,TCL 李东生回应造车：TCL 不会造车，但会抓住风口,TCL 李东生回应造车：TCL 不会造车，但会抓住风口
2021-06-15,巨头造车风口：雷军豪赌，李书福质疑，周鸿祎李东生“不造车”,巨头造车风口：雷军豪赌，李书福质疑，周鸿祎李东生“不造车”
2021-06-16,三六零(601360.SH)董秘赵路明增持完成累计耗资2000.17万元增持157.407万股,三六零(601360.SH)董秘赵路明增持完成累计耗资2000.17万元增持157.407万股
2021-06-16,三六零：董事会秘书赵路明累计增持157万股，增持计划完成,三六零：董事会秘书赵路明累计增持157万股，增持计划完成
2021-06-16,三六零：全资子公司北京鸿腾智能科技有限公司项目中标,三六零：全资子公司北京鸿腾智能科技有限公司项目中标
2021-06-16,晚间重要公告2021年6月16日星期三,晚间重要公告2021年6月16日星期三
2021-06-16,三六零(601360.SH)董事会秘书赵路明完成增持 合计增持157.41万股,三六零(601360.SH)董事会秘书赵路明完成增持 合计增持157.41万股
2021-06-16,三六零：中标2.36亿元项目,三六零：中标2.36亿元项目
2021-06-16,三六零现1笔大宗交易 共成交202.30万元,三六零现1笔大宗交易 共成交202.30万元
2021-06-16,三六零今日大宗交易成交17.50万股，成交价11.56元折价7.22%,三六零今日大宗交易成交17.50万股，成交价11.56元折价7.22%
2021-06-16,三六零(601360.SH)联合中标郑州高新区“网络安全基础设施群”相关项目,三六零(601360.SH)联合中标郑州高新区“网络安全基础设施群”相关项目
2021-06-17,上市公司正负面新闻2021年6月17日星期四,上市公司正负面新闻2021年6月17日星期四
2021-06-17,哪吒汽车回应“360只是精神股东”言论：对相关恶意诋毁及造谣行为保留追责权,哪吒汽车回应“360只是精神股东”言论：对相关恶意诋毁及造谣行为保留追责权
2021-06-17,互联网企业的造车“狂想曲”：都想成为风口上的猪,互联网企业的造车“狂想曲”：都想成为风口上的猪
2021-06-17,三六零：控股股东股东奇信志成及一致行动人上海冠鹰减持计划实施完毕，期间减持公司股份约7145万股,三六零：控股股东股东奇信志成及一致行动人上海冠鹰减持计划实施完毕，期间减持公司股份约7145万股
2021-06-17,三六零(601360.SH)控股股东及一致行动人已累计减持1%股份 完成减持计划 拟减持股份,三六零(601360.SH)控股股东及一致行动人已累计减持1%股份 完成减持计划 拟减持股份
2021-06-17,三六零：控股股东的一致行动人累计减持7145.36万股 减持股份,三六零：控股股东的一致行动人累计减持7145.36万股 减持股份
2021-06-18,360牵手哪吒汽车，周鸿祎：欢迎各位大拿加入,360牵手哪吒汽车，周鸿祎：欢迎各位大拿加入
2021-06-20,【民生计算机|周观点】医保建设有望从法律层面强化，行业景气度提升可期,【民生计算机|周观点】医保建设有望从法律层面强化，行业景气度提升可期
2021-06-21,三六零(601360.SH)实控人周鸿祎及一致行动人合计持股比例降至58.7%,三六零(601360.SH)实控人周鸿祎及一致行动人合计持股比例降至58.7%
2021-06-21,数字城市建设促网安市场加速扩容360中标数亿元项目大单,数字城市建设促网安市场加速扩容360中标数亿元项目大单
2021-06-21,"三六零现1笔大宗交易 共成交36,834.95万元","三六零现1笔大宗交易 共成交36,834.95万元"
2021-06-21,三六零今日大宗交易成交3391.80万股，成交价10.86元折价10.4%,三六零今日大宗交易成交3391.80万股，成交价10.86元折价10.4%
2021-06-21,三六零：控股股东、实控人及一致行动人持股比例被动稀释3.4%及减持股份1.6% 减持股份,三六零：控股股东、实控人及一致行动人持股比例被动稀释3.4%及减持股份1.6% 减持股份
2021-06-22,A股早报2021年6月22日星期二,A股早报2021年6月22日星期二
2021-06-23,机遇留给有准备者：网络安全业务领军者奇安信成长历程,机遇留给有准备者：网络安全业务领军者奇安信成长历程
2021-06-24,“618”消费里的“隐形冠军” 360智能硬件增长引发资本圈关注,“618”消费里的“隐形冠军” 360智能硬件增长引发资本圈关注
