publishedAt,title,description
2018-03-15,三六零控股股东奇信志成所持股份全部质押,三六零控股股东奇信志成所持股份全部质押
2018-03-15,360大股东将所有持股质押给招商银行5年：市值1591亿,360大股东将所有持股质押给招商银行5年：市值1591亿
2018-03-15,【晚报】李彦宏谈无人车：以后吃着火锅上高速；蓝色光标作出回应,【晚报】李彦宏谈无人车：以后吃着火锅上高速；蓝色光标作出回应
2018-03-15,晚间重要公告2018年3月15日星期四,晚间重要公告2018年3月15日星期四
2018-03-15,三六零：控股股东近33亿股公司股份已全部质押给招商银行,三六零：控股股东近33亿股公司股份已全部质押给招商银行
2018-03-15,360控股股东质押100%持股，还款有保障无需担心,360控股股东质押100%持股，还款有保障无需担心
2018-03-15,360宣布控股股东按约定质押约33亿股 市值1590亿,360宣布控股股东按约定质押约33亿股 市值1590亿
2018-03-15,三六零：控股股东奇信志成持有股票100%质押,三六零：控股股东奇信志成持有股票100%质押
2018-03-15,360控股股东将全部股份质押给招商银行,360控股股东将全部股份质押给招商银行
2018-03-15,三六零：控股股东奇信志成质押公司32.97亿股,三六零：控股股东奇信志成质押公司32.97亿股
2018-03-15,三六零：奇信志成持有股票100%质押,三六零：奇信志成持有股票100%质押
2018-03-16,【中证盘前播报】乐视网今复牌，无引入投资者增资方案及意向；三六零控股股东质押100%其所持股票；寒锐钴业创新高，三名股东拟减持,【中证盘前播报】乐视网今复牌，无引入投资者增资方案及意向；三六零控股股东质押100%其所持股票；寒锐钴业创新高，三名股东拟减持
2018-03-16,360大股东将所有持股质押给招商银行5年：市值约1590亿,360大股东将所有持股质押给招商银行5年：市值约1590亿
2018-03-16,股权质押新规落地一周： 规模压缩业务难做,股权质押新规落地一周： 规模压缩业务难做
2018-03-16,三六零股东奇信志成质押公司32.97亿股,三六零股东奇信志成质押公司32.97亿股
2018-03-19,三六零回应传言：本次质押并不涉及任何新增贷款,三六零回应传言：本次质押并不涉及任何新增贷款
2018-03-19,公告精选：岭南股份拟高送转；奥拓电子等公司预计首季业绩大增,公告精选：岭南股份拟高送转；奥拓电子等公司预计首季业绩大增
2018-03-19,三六零回应“股东质押借款600亿”：此次质押并非新增事项,三六零回应“股东质押借款600亿”：此次质押并非新增事项
2018-03-19,360回A遭质疑后蒸发千亿市值 周鸿祎被炮轰“割韭菜”？,360回A遭质疑后蒸发千亿市值 周鸿祎被炮轰“割韭菜”？
2018-03-19,三六零回应“360股东质押借款600亿”报道：不涉及新增贷款,三六零回应“360股东质押借款600亿”报道：不涉及新增贷款
2018-03-19,投中：2月共完成198起并购案例 环比减少逾三成,投中：2月共完成198起并购案例 环比减少逾三成
2018-03-19,三六零:本次质押是控股股东对私有化贷款的继续履行,三六零:本次质押是控股股东对私有化贷款的继续履行
2018-03-20,叶檀：2015杠杆牛 2018独角兽牛 扒开牛皮看一看 无非48块中石油,叶檀：2015杠杆牛 2018独角兽牛 扒开牛皮看一看 无非48块中石油
2018-03-21,质押贷款600亿元属乌龙 360董秘称不存在割韭菜可能,质押贷款600亿元属乌龙 360董秘称不存在割韭菜可能
2018-03-21,360市值蒸发了1358亿,360市值蒸发了1358亿
2018-03-21,智能手机陷红利真空；九大手机品牌快应用能否对抗小程序,智能手机陷红利真空；九大手机品牌快应用能否对抗小程序
2018-03-21,扒一扒“360质押600亿”是怎么乌龙出来的,扒一扒“360质押600亿”是怎么乌龙出来的
2018-03-21,【财通策略】详解CDR：CDR是“独角兽”回归A股最适宜方式,【财通策略】详解CDR：CDR是“独角兽”回归A股最适宜方式
2018-03-21,三六零午后直线攀升,三六零午后直线攀升
2018-03-21,快讯:三六零涨逾6% 此前公告称相关借款不涉新增贷款,快讯:三六零涨逾6% 此前公告称相关借款不涉新增贷款
2018-03-21,【评论】频频发声示爱A股，王小川这是要回来“割韭菜”？,【评论】频频发声示爱A股，王小川这是要回来“割韭菜”？
2018-03-21,水皮谈360：人民夹道欢迎你 你却挥刀向人民,水皮谈360：人民夹道欢迎你 你却挥刀向人民
2018-03-23,"三六零破位跌停：大型顶部确立 ""价值回归""之路开启","三六零破位跌停：大型顶部确立 ""价值回归""之路开启"
2018-03-23,跌停板解密：利空袭击A股，多行业现跌停潮！（3月23日）,跌停板解密：利空袭击A股，多行业现跌停潮！（3月23日）
2018-03-23,乐视网、三六零午后触及跌停,乐视网、三六零午后触及跌停
2018-03-23,【解盘论市】千山鸟飞绝，万径人踪灭,【解盘论市】千山鸟飞绝，万径人踪灭
2018-03-23,三六零午后触及跌停，目前跌9.81%,三六零午后触及跌停，目前跌9.81%
2018-03-23,三六零午前逼近跌停,三六零午前逼近跌停
2018-03-23,三六零跌逾6%，市值跌破3000亿元,三六零跌逾6%，市值跌破3000亿元
2018-03-23,*ST紫学卖壳天山铝业 借壳上市再起波澜？,*ST紫学卖壳天山铝业 借壳上市再起波澜？
2018-03-23,三六零午后跌停，总市值不足3000亿元,三六零午后跌停，总市值不足3000亿元
2018-03-24,“独角兽”回归仍处论证阶段 CDR落地需解决三大问题,“独角兽”回归仍处论证阶段 CDR落地需解决三大问题
2018-03-26,媒体：板块回调现绩优白马布局良机 荐2股,媒体：板块回调现绩优白马布局良机 荐2股
2018-03-28,新经济企业IPO大年，A股市场加速改革,新经济企业IPO大年，A股市场加速改革
2018-03-28,部分拟IPO企业担心被否主动撤回IPO申请,部分拟IPO企业担心被否主动撤回IPO申请
2018-03-28,"继江南嘉捷,又一“中国芯片龙头”借壳上市,股民说: 股市就印钞机","继江南嘉捷,又一“中国芯片龙头”借壳上市,股民说: 股市就印钞机"
2018-03-29,小步快走 谨防独角兽变“毒角兽”,小步快走 谨防独角兽变“毒角兽”
2018-03-30,三六零突现大笔买盘 直线拉涨超6%,三六零突现大笔买盘 直线拉涨超6%
2018-03-30,三六零盘中直线拉升,三六零盘中直线拉升
2018-03-31,2018年一季度A股市值全景：2/3公司市值缩水，10家公司市值翻倍,2018年一季度A股市值全景：2/3公司市值缩水，10家公司市值翻倍
2018-04-01,身价千亿的周鸿祎发朋友圈：我的人生竟如此失败,身价千亿的周鸿祎发朋友圈：我的人生竟如此失败
2018-04-01,红衣教主周鸿祎慨叹挫败怀疑人生，到底遇到啥事儿？,红衣教主周鸿祎慨叹挫败怀疑人生，到底遇到啥事儿？
2018-04-01,图说最新中国上市公司市值500强：哪些公司入榜了？（名单）,图说最新中国上市公司市值500强：哪些公司入榜了？（名单）
2018-04-03,三六零2017年净利近34亿 多家公司发布年报,三六零2017年净利近34亿 多家公司发布年报
2018-04-03,三六零回A亮出首份“成绩单” 去年净利大增80%超业绩承诺5.5亿,三六零回A亮出首份“成绩单” 去年净利大增80%超业绩承诺5.5亿
2018-04-03,三六零净利润33亿市盈率近80倍 八大看点不容错过,三六零净利润33亿市盈率近80倍 八大看点不容错过
2018-04-03,晚间重要公告2018年4月3日星期二,晚间重要公告2018年4月3日星期二
2018-04-03,三六零净利润大增80%超业绩承诺5.5亿元,三六零净利润大增80%超业绩承诺5.5亿元
2018-04-03,三六零2017年财报：营收122亿元，净利润同比增长80%,三六零2017年财报：营收122亿元，净利润同比增长80%
2018-04-03,三六零2017年营收122.38亿 净利同比增长80.15%,三六零2017年营收122.38亿 净利同比增长80.15%
2018-04-03,三六零净利同比增长80.15% 多家公司公布业绩,三六零净利同比增长80.15% 多家公司公布业绩
2018-04-03,创始人韩猛斥资逾10亿增持股票，二三四五股价能否回归?,创始人韩猛斥资逾10亿增持股票，二三四五股价能否回归?
2018-04-03,三六零：2017年净利润33.72亿元，同比增长80.15%,三六零：2017年净利润33.72亿元，同比增长80.15%
2018-04-03,360去年净利33.72亿元，导航、游戏、搜索仍为主要来源 | 钛快讯,360去年净利33.72亿元，导航、游戏、搜索仍为主要来源 | 钛快讯
2018-04-03,三六零：2017年实现净利33.72亿 同比增长80.15%,三六零：2017年实现净利33.72亿 同比增长80.15%
2018-04-03,三六零：2017年净利近34亿元 同比增8成,三六零：2017年净利近34亿元 同比增8成
2018-04-03,一线丨三六零发布年报：去年营收122亿元，游戏业务营收下滑35%,一线丨三六零发布年报：去年营收122亿元，游戏业务营收下滑35%
2018-04-04,股价坠落，三六零能否撑住2800亿估值？,股价坠落，三六零能否撑住2800亿估值？
2018-04-04,三六零年报公布27.5亿的净利润能否支撑起2800亿的市值？,三六零年报公布27.5亿的净利润能否支撑起2800亿的市值？
2018-04-04,三六零交出业绩答卷 去年营收净利双双增长,三六零交出业绩答卷 去年营收净利双双增长
2018-04-04,三六零早盘冲击涨停,三六零早盘冲击涨停
2018-04-04,三六零发布年报 2017年净利润近34亿元,三六零发布年报 2017年净利润近34亿元
2018-04-04,晨讯 | 摩拜全资出售给美团 A、B轮投资人及创始团队离场；中移动开通全球首个5G系统站点,晨讯 | 摩拜全资出售给美团 A、B轮投资人及创始团队离场；中移动开通全球首个5G系统站点
2018-04-04,传媒行业日报：文旅部严查棋牌、官场游戏,传媒行业日报：文旅部严查棋牌、官场游戏
2018-04-04,360回A后首份年报：净利润增80％ 超业绩承诺5.5亿,360回A后首份年报：净利润增80％ 超业绩承诺5.5亿
2018-04-04,三六零2017年净利润增逾八成 超业绩承诺5.5亿元,三六零2017年净利润增逾八成 超业绩承诺5.5亿元
2018-04-04,三六零七成收入靠广告日赚924万 员工平均薪酬38万,三六零七成收入靠广告日赚924万 员工平均薪酬38万
2018-04-04,三六零回A后首份成绩亮眼 净利增80%股价涨近9%,三六零回A后首份成绩亮眼 净利增80%股价涨近9%
2018-04-04,三六零高开逾5%，去年净利润同比大增80%,三六零高开逾5%，去年净利润同比大增80%
2018-04-05,运用“白加黑”战法 迎接“独角兽”回归,运用“白加黑”战法 迎接“独角兽”回归
2018-04-05,CDR给A股市场带来哪些利好,CDR给A股市场带来哪些利好
2018-04-06,上市公司更名记：超200家公司换了马甲 “美颜”效果已打折 新变化还有这些,上市公司更名记：超200家公司换了马甲 “美颜”效果已打折 新变化还有这些
2018-04-07,[审慎增持评级]三六零(601360)年报点评：业绩超预期 广告和智能硬件业务高增长,[审慎增持评级]三六零(601360)年报点评：业绩超预期 广告和智能硬件业务高增长
2018-04-08,研究报告显示一季度定增市场趋于理性,研究报告显示一季度定增市场趋于理性
2018-04-09,复牌跌停成标配，终止重组成股价闪崩导火索,复牌跌停成标配，终止重组成股价闪崩导火索
2018-04-10,中信国安：合计持有三六零4.2%股份,中信国安：合计持有三六零4.2%股份
2018-04-11,最新中国上市公司市值500强：海康威视、正泰、中天等多家电气企业入榜,最新中国上市公司市值500强：海康威视、正泰、中天等多家电气企业入榜
2018-04-12,运用“白加黑”战法 迎接“独角兽”回归,运用“白加黑”战法 迎接“独角兽”回归
2018-04-13,北信源“三板斧”凑利润,北信源“三板斧”凑利润
2018-04-13,CDR给A股市场带来哪些利好,CDR给A股市场带来哪些利好
2018-04-15,回归A股刚俩月，姚珏为何辞别周鸿祎？,回归A股刚俩月，姚珏为何辞别周鸿祎？
2018-04-15,三六零：姚珏因辞去副总经理兼财务负责人职务,三六零：姚珏因辞去副总经理兼财务负责人职务
2018-04-15,三六零首席财务官姚珏等两高管离职,三六零首席财务官姚珏等两高管离职
2018-04-15,360：公司CFO姚珏、副总经理廖清红因个人原因辞职,360：公司CFO姚珏、副总经理廖清红因个人原因辞职
2018-04-15,三六零：高管人员辞职,三六零：高管人员辞职
2018-04-15,三六零：财务负责人姚珏及副总经理廖清红辞职,三六零：财务负责人姚珏及副总经理廖清红辞职
2018-04-16,360 公司 CFO 及副总经理离职,360 公司 CFO 及副总经理离职
2018-04-16,数位高管相继辞别周鸿祎，离职背后有何原因？,数位高管相继辞别周鸿祎，离职背后有何原因？
2018-04-16,360姚珏等两高管离职，周鸿祎发内部信称感恩付出,360姚珏等两高管离职，周鸿祎发内部信称感恩付出
2018-04-17,网络安全概念午后快速拉升，华铭智能、任子行领衔上涨,网络安全概念午后快速拉升，华铭智能、任子行领衔上涨
2018-04-19,三六零午后直线攀升,三六零午后直线攀升
2018-04-20,北信源“三板斧”凑利润,北信源“三板斧”凑利润
2018-04-26,三六零：一季度净利4.78亿元 同比降27.57%,三六零：一季度净利4.78亿元 同比降27.57%
2018-04-26,三六零一季报净利润4.63亿元 同比增长42.34%,三六零一季报净利润4.63亿元 同比增长42.34%
2018-04-26,三六零：一季度扣非净利润4.63亿元，同比增42.34%,三六零：一季度扣非净利润4.63亿元，同比增42.34%
2018-04-26,三六零第一季度净利润4.78亿元人民币,三六零第一季度净利润4.78亿元人民币
2018-04-27,三六零2018第一季度财报 净利润同比下滑27.57%,三六零2018第一季度财报 净利润同比下滑27.57%
2018-04-27,三六零一季报净赚4.78亿元 同比降近三成,三六零一季报净赚4.78亿元 同比降近三成
2018-04-27,午报丨百度Q1营收33.3亿美元；传阿里将参与今日头条新一轮融资,午报丨百度Q1营收33.3亿美元；传阿里将参与今日头条新一轮融资
2018-05-01,沪市公司2017年业绩稳中向好 经营质量再上新台阶,沪市公司2017年业绩稳中向好 经营质量再上新台阶
2018-05-02,中概股回归 重燃境内市场并购重组热潮,中概股回归 重燃境内市场并购重组热潮
2018-05-03,三六零：一季度扣非净利润增长四成,三六零：一季度扣非净利润增长四成
2018-05-05,52亿元去向不明 “360概念股”天业股份如何被掏空？,52亿元去向不明 “360概念股”天业股份如何被掏空？
2018-05-06,从富士康到小米头部券商强势分食大块头IPO项目,从富士康到小米头部券商强势分食大块头IPO项目
2018-05-08,2017财富增长最快的中国人是他：暴增7倍,2017财富增长最快的中国人是他：暴增7倍
2018-05-08,三六零：定增方案仍在完善中，股票继续停牌,三六零：定增方案仍在完善中，股票继续停牌
2018-05-08,归乡即翻脸：三六零市值从巅峰时超4400亿减至2800亿,归乡即翻脸：三六零市值从巅峰时超4400亿减至2800亿
2018-05-08,【金工】2018年年中主要宽基指数样本股调整预测：市场流动性下降导致冲击系数普遍上升,【金工】2018年年中主要宽基指数样本股调整预测：市场流动性下降导致冲击系数普遍上升
2018-05-08,非标年报引发监管层立案调查 *ST天业及大股东百亿级债务难题待解,非标年报引发监管层立案调查 *ST天业及大股东百亿级债务难题待解
2018-05-08,[增持评级]三六零(601360)深度报告：纯正互联网标的欲从物联网获取新成长,[增持评级]三六零(601360)深度报告：纯正互联网标的欲从物联网获取新成长
2018-05-09,药明康德登陆A股CRO行业迎巨头 板块估值有望提升,药明康德登陆A股CRO行业迎巨头 板块估值有望提升
2018-05-09,解 析 | 独角兽药明康德暴力登场！苦等开板不如先看看这份CRO重要标的名单,解 析 | 独角兽药明康德暴力登场！苦等开板不如先看看这份CRO重要标的名单
2018-05-10,医药独角兽上市：3家保险公司持股药德康明,医药独角兽上市：3家保险公司持股药德康明
2018-05-10,济南高新城建驰援 三六零股权也将回购 *ST天业危局回转,济南高新城建驰援 三六零股权也将回购 *ST天业危局回转
2018-05-15,公告精选：格力集团拟要约收购长园集团20%股份；三六零拟定增募资不超108亿,公告精选：格力集团拟要约收购长园集团20%股份；三六零拟定增募资不超108亿
2018-05-15,借壳不到半年市值已缩水近2000亿！刚刚，周鸿祎抛百亿定增，要做9件大事,借壳不到半年市值已缩水近2000亿！刚刚，周鸿祎抛百亿定增，要做9件大事
2018-05-15,360拟定增108亿：主要用于安全研发中心等9个项目,360拟定增108亿：主要用于安全研发中心等9个项目
2018-05-15,周二上市公司晚间重要公告,周二上市公司晚间重要公告
2018-05-15,三六零定增募资108亿 布局“大安全”领域,三六零定增募资108亿 布局“大安全”领域
2018-05-15,108亿！360回A股3个月后宣布定增募资，投向九大项目,108亿！360回A股3个月后宣布定增募资，投向九大项目
2018-05-15,三六零拟定增108亿 全部用于“大安全”战略项目,三六零拟定增108亿 全部用于“大安全”战略项目
2018-05-15,三六零拟非公开发行股票募资拓展人工智能项目,三六零拟非公开发行股票募资拓展人工智能项目
2018-05-15,三六零：拟定增不超108亿元拓展人工智能等项目 16日复牌,三六零：拟定增不超108亿元拓展人工智能等项目 16日复牌
2018-05-15,三六零拟非公开发行A股募资不超过107.9亿元,三六零拟非公开发行A股募资不超过107.9亿元
2018-05-15,三六零拟定增募资不超108亿元 投向智能儿童生态圈等9大项目,三六零拟定增募资不超108亿元 投向智能儿童生态圈等9大项目
2018-05-15,16日停复牌：三六零拟定增募资不超108亿 16日复牌(更新中),16日停复牌：三六零拟定增募资不超108亿 16日复牌(更新中)
2018-05-15,360定增108亿挺进IOT,360定增108亿挺进IOT
2018-05-15,定增108亿 360布下一盘“大安全”大棋,定增108亿 360布下一盘“大安全”大棋
2018-05-15,三六零拟非公开发行A股募资不超过108亿元人民币,三六零拟非公开发行A股募资不超过108亿元人民币
2018-05-15,三六零拟非公开发行A股募资不超108亿元 股票复牌,三六零拟非公开发行A股募资不超108亿元 股票复牌
2018-05-15,三六零拟非公开发行A股募资不超过108亿元 16日复牌,三六零拟非公开发行A股募资不超过108亿元 16日复牌
2018-05-15,三六零：拟定增募资不超107.93亿元加码主业，明日复牌,三六零：拟定增募资不超107.93亿元加码主业，明日复牌
2018-05-15,360回A后首次定增：108亿元定增额超过去四年净利润总和，市值缩水四成,360回A后首次定增：108亿元定增额超过去四年净利润总和，市值缩水四成
2018-05-15,三六零拟非公开发行A股募资107.9亿元 股票16日复牌,三六零拟非公开发行A股募资107.9亿元 股票16日复牌
2018-05-16,停牌半个月后 三六零开盘大跌近4%,停牌半个月后 三六零开盘大跌近4%
2018-05-16,三六零拟非公开发行A股募资 华锋股份完成股价异动核查,三六零拟非公开发行A股募资 华锋股份完成股价异动核查
2018-05-16,三六零拟募资108亿元助力网络安全研发,三六零拟募资108亿元助力网络安全研发
2018-05-16,360回A后首个资本运作，募资108亿元，为了这九大项目,360回A后首个资本运作，募资108亿元，为了这九大项目
2018-05-16,三六零：网传8元定增价系误读,三六零：网传8元定增价系误读
2018-05-16,三六零拟募资不超过108亿元 募集资金主要投入大安全领域,三六零拟募资不超过108亿元 募集资金主要投入大安全领域
2018-05-16,三六零火速定增募资过百亿 复牌首日开盘大涨 |新京报财讯,三六零火速定增募资过百亿 复牌首日开盘大涨 |新京报财讯
2018-05-16,2018年以来定增市场：融资规模大幅下滑，40家公司股价跌破增发价,2018年以来定增市场：融资规模大幅下滑，40家公司股价跌破增发价
2018-05-16,三六零拟募资不超过108亿元 复牌股价低开高走大涨8%,三六零拟募资不超过108亿元 复牌股价低开高走大涨8%
2018-05-16,三六零百亿定增 酝酿已久的融资计划,三六零百亿定增 酝酿已久的融资计划
2018-05-16,三六零拟定增募资108亿元 早盘振幅超10%,三六零拟定增募资108亿元 早盘振幅超10%
2018-05-16,三六零低开4%后迅速拉升翻红，目前涨2%,三六零低开4%后迅速拉升翻红，目前涨2%
2018-05-16,快讯：沪深两市低开 三六零开盘大跌近4%,快讯：沪深两市低开 三六零开盘大跌近4%
2018-05-16,360宣布非公开募集百亿 谁会是新的入局者？,360宣布非公开募集百亿 谁会是新的入局者？
2018-05-16,5800亿投入背后：重视研发哪家强,5800亿投入背后：重视研发哪家强
2018-05-16,三六零拟定增不超过108亿,三六零拟定增不超过108亿
2018-05-16,布局多个火热领域 三六零闪电启动百亿定增,布局多个火热领域 三六零闪电启动百亿定增
2018-05-16,揭秘三六零百亿定增：一场隐忍半年的融资计划,揭秘三六零百亿定增：一场隐忍半年的融资计划
2018-05-16,三六零复牌大跌，拟定增募资108亿元用于9大项目,三六零复牌大跌，拟定增募资108亿元用于9大项目
2018-05-16,三六零拟定增募资108亿元 今日股价低开近4%,三六零拟定增募资108亿元 今日股价低开近4%
2018-05-16,三六零欲108亿元布局大安全战略 复牌股价大幅低开,三六零欲108亿元布局大安全战略 复牌股价大幅低开
2018-05-16,三六零一度冲击涨停，拟定增募资108亿元用于9大项目,三六零一度冲击涨停，拟定增募资108亿元用于9大项目
2018-05-16,沪深两市上市公司复牌一览表（5月16日）,沪深两市上市公司复牌一览表（5月16日）
2018-05-17,三六零百亿定增价待定 1879亿市值缩水引“中概股”估值争议,三六零百亿定增价待定 1879亿市值缩水引“中概股”估值争议
2018-05-17,三六零盘中小幅跳水，目前跌逾4%,三六零盘中小幅跳水，目前跌逾4%
2018-05-17,三六零股价持续走低，称网传8元定增价系误读,三六零股价持续走低，称网传8元定增价系误读
2018-05-17,三六零回应8元定增价系误读 青岛海尔遭股东KKR减持股份,三六零回应8元定增价系误读 青岛海尔遭股东KKR减持股份
2018-05-17,上交所重点规范上市公司控股股东、实际控制人行为,上交所重点规范上市公司控股股东、实际控制人行为
2018-05-17,视频丨三六零复牌第二日跌幅超5% 缩水近2000亿元,视频丨三六零复牌第二日跌幅超5% 缩水近2000亿元
2018-05-18,三六零跌7.23% 较前期高点几近腰斩,三六零跌7.23% 较前期高点几近腰斩
2018-05-18,45家新经济企业发布定增预案 募资合计达600多亿元,45家新经济企业发布定增预案 募资合计达600多亿元
2018-05-18,三六零龙虎榜数据（5月18日）,三六零龙虎榜数据（5月18日）
2018-05-18,A股虽弱“独角兽”圈钱没商量,A股虽弱“独角兽”圈钱没商量
2018-05-18,三六零定增意在做强大安全领域,三六零定增意在做强大安全领域
2018-05-18,快讯：三六零午后股价跳水逼近跌停 成交额超5亿,快讯：三六零午后股价跳水逼近跌停 成交额超5亿
2018-05-19,贺宛男：A股市场果真是圈钱场？,贺宛男：A股市场果真是圈钱场？
2018-05-21,今年以来42家上市公司遭遇定增破发,今年以来42家上市公司遭遇定增破发
2018-05-21,360定增要不要遵守再融资18个月限制的规定,360定增要不要遵守再融资18个月限制的规定
2018-05-23,三六零拟推百亿定增引争议 发力“大安全”缓市值缩水压力,三六零拟推百亿定增引争议 发力“大安全”缓市值缩水压力
2018-05-25,360上市后开打专利保护第一枪 两地连诉二三四五索赔6000万,360上市后开打专利保护第一枪 两地连诉二三四五索赔6000万
2018-05-26,刘柯:急功近利式回归A股伤不起,刘柯:急功近利式回归A股伤不起
2018-05-27,被三六零起诉并索赔6000万？二三四五回应：未收到相关法院法律文件,被三六零起诉并索赔6000万？二三四五回应：未收到相关法院法律文件
2018-05-27,被360连发6起诉讼？二三四五回应：未收到相关法院法律文件,被360连发6起诉讼？二三四五回应：未收到相关法院法律文件
2018-05-28,三六零被调入指数样本股,三六零被调入指数样本股
